AuthorID;Author;Date;Content;Attachments;Reactions;
"412323938782150658";"SHossain#0007";"30-Aug-18 11:24 AM";"search on google";"";"";
"272003866906722306";"TonyL#3577";"30-Aug-18 11:24 AM";"You can google stuff like this or hire someone (I'm about SSH). We're providing support only for Komodo products and always ready to help with questions around but not making Computer Science courses atm.";"";"";
"466061984836616192";"Shinzo Abe#9369";"30-Aug-18 11:24 AM";"can you please just tell me how to log into both vps at the same time?";"";"";
"466061984836616192";"Shinzo Abe#9369";"30-Aug-18 11:24 AM";"or do i do the process twice?";"";"";
"412323938782150658";"SHossain#0007";"30-Aug-18 11:24 AM";"search on google";"";"";
"466061984836616192";"Shinzo Abe#9369";"30-Aug-18 11:24 AM";"ok";"";"";
"466061984836616192";"Shinzo Abe#9369";"30-Aug-18 11:27 AM";"doesnt explicitly say";"";"";
"466061984836616192";"Shinzo Abe#9369";"30-Aug-18 11:27 AM";"can u just tell me this one thing please?";"";"";
"466061984836616192";"Shinzo Abe#9369";"30-Aug-18 11:27 AM";"save me like 25 minutes of search with one sentence";"";"";
"466061984836616192";"Shinzo Abe#9369";"30-Aug-18 11:28 AM";"i know how to connect to a vps now but i dont know how to connect to 2 VPS simultaneously";"";"";
"412323938782150658";"SHossain#0007";"30-Aug-18 11:28 AM";"you seem to be having issues. why do you want to try 2 at the same time when you can't complete one?";"";"";
"466061984836616192";"Shinzo Abe#9369";"30-Aug-18 11:29 AM";"i can complete one";"";"";
"466061984836616192";"Shinzo Abe#9369";"30-Aug-18 11:29 AM";"im jusdt thinking ahead";"";"";
"466061984836616192";"Shinzo Abe#9369";"30-Aug-18 11:30 AM";"do i do one by one?";"";"";
"412323938782150658";"SHossain#0007";"30-Aug-18 11:30 AM";"yes";"";"";
"466061984836616192";"Shinzo Abe#9369";"30-Aug-18 11:30 AM";"shh root@ipadresss1 then compile the code";"";"";
"466061984836616192";"Shinzo Abe#9369";"30-Aug-18 11:30 AM";"then shh root@ipaddress2 then compile the same code again?";"";"";
"466061984836616192";"Shinzo Abe#9369";"30-Aug-18 11:31 AM";"could you please explain how these 2 VPS servers will be connected?";"";"";
"466061984836616192";"Shinzo Abe#9369";"30-Aug-18 11:31 AM";"seems like im doing 2 different things that dont work together";"";"";
"272003866906722306";"TonyL#3577";"30-Aug-18 11:34 AM";"https://github.com/KomodoPlatform/komodo/wiki/Creating-New-Assetchain";"";"";
"272003866906722306";"TonyL#3577";"30-Aug-18 11:34 AM";"Then you have to follow this guide to create Assetchain for these 2 servers";"";"";
"272003866906722306";"TonyL#3577";"30-Aug-18 11:34 AM";"Start chain on first VPS, connect to it from second one";"";"";
"466061984836616192";"Shinzo Abe#9369";"30-Aug-18 11:35 AM";"https://komodoplatform.atlassian.net/wiki/plugins/servlet/mobile?contentId=104955905#content/view/104955905";"";"";
"466061984836616192";"Shinzo Abe#9369";"30-Aug-18 11:35 AM";"what about this?  it says install the dependencies";"";"";
"272003866906722306";"TonyL#3577";"30-Aug-18 11:36 AM";"It's a build stage. I guess you've already builded it.";"";"";
"272003866906722306";"TonyL#3577";"30-Aug-18 11:39 AM";"@Shinzo Abe You can find answers on most of your questions this way: https://www.google.co.th/search?q=how+to+open+multiple+terminal+windows+in+mac&oq=how+to+open+two+terminal+windows&aqs=chrome.1.69i57j0.7428j1j9&sourceid=chrome&ie=UTF-8";"";"";
"464378807420452865";"Seko#7408";"30-Aug-18 01:03 PM";"Will ETOMIC be used for etomic swaps in  future?";"";"";
"333508133060083712";"Nabob#5004";"30-Aug-18 01:11 PM";"etomic is already in use for swaps, for every btc coin to eth compatible coin swapping , marketmaker internally use etomic coins automagically @Seko";"";"👍 (1)";
"464378807420452865";"Seko#7408";"30-Aug-18 01:21 PM";"Is it necessary to buy ETOMIC to use swaps or the Etomic coins comes automatically?";"";"";
"455741312273219595";"jl777c#5810";"30-Aug-18 01:49 PM";"no, it is automatically received from faucet. mm2.0 will remove the need for it entirely";"";"Komodo (1)";
"464378807420452865";"Seko#7408";"30-Aug-18 03:29 PM";"What will happen then with the Etomic-Coins?";"";"";
"412323938782150658";"SHossain#0007";"30-Aug-18 03:33 PM";"ETOMIC doesn't have any real value apart from being used in barterDEX";"";"";
"412323938782150658";"SHossain#0007";"30-Aug-18 03:33 PM";"it is free coin";"";"";
"455741312273219595";"jl777c#5810";"30-Aug-18 03:34 PM";"the only thing ETOMIC was ever sold for was BEER (I think)";"";"";
"412323938782150658";"SHossain#0007";"30-Aug-18 03:36 PM";"yes. we did atomic swap with BEER";"";"";
"412323938782150658";"SHossain#0007";"30-Aug-18 03:36 PM";"BEER is also free 😃";"";"";
"455741312273219595";"jl777c#5810";"30-Aug-18 03:36 PM";"and good with PIZZA";"";"🍻 (2),🍕 (2)";
"455741312273219595";"jl777c#5810";"30-Aug-18 03:37 PM";"the interesting thing is that ETOMIC already has had more utility than many ERC20 projects that raised millions";"";"trollface (3)";
"464378807420452865";"Seko#7408";"30-Aug-18 03:48 PM";"And I thought I have money for free...😂";"";"";
"456226577798135808";"Deleted User#0000";"30-Aug-18 05:07 PM";"i have downloaded jumblr but its stagnated at 100%";"";"";
"456226577798135808";"Deleted User#0000";"30-Aug-18 05:07 PM";"for hours";"";"";
"456226577798135808";"Deleted User#0000";"30-Aug-18 05:07 PM";"i want to send z tx";"";"";
"456226577798135808";"Deleted User#0000";"30-Aug-18 05:07 PM";"how i do this";"";"";
"456226577798135808";"Deleted User#0000";"30-Aug-18 05:14 PM";"im so confused";"";"";
"466061984836616192";"Shinzo Abe#9369";"30-Aug-18 05:17 PM";"@TonyL hey man, so do I have to build Komodo manually on my macbook before creating asset chain on top of digital ocean VPS  servers ?";"";"";
"412323938782150658";"SHossain#0007";"30-Aug-18 05:21 PM";"@Deleted User follow this guide https://komodoplatform.atlassian.net/wiki/spaces/KPSD/pages/147292206/What+is+a+Z+Transaction";"";"";
"412323938782150658";"SHossain#0007";"30-Aug-18 05:23 PM";"@Shinzo Abe you need to build them inside VPS, not in your macbook
compile komodo https://docs.komodoplatform.com/komodo/install-Komodo-manually.html
create assetchains https://docs.komodoplatform.com/komodo/create-Komodo-Assetchain.html";"";"";
"374110995972358144";"Smedley#8094";"30-Aug-18 07:19 PM";"Hey to build a DApp using crypto conditions I would need to create my own asset chain correct?";"";"";
"455741312273219595";"jl777c#5810";"30-Aug-18 07:19 PM";"that would be the fastest way";"";"";
"369608312955731968";"Bryan_Beus#6442";"30-Aug-18 08:54 PM";"syncing KMD using Agama on ubuntu laptop, new installation";"";"";
"369608312955731968";"Bryan_Beus#6442";"30-Aug-18 08:54 PM";"it's maxing out CPU load - 97%";"";"";
"369608312955731968";"Bryan_Beus#6442";"30-Aug-18 08:54 PM";"nothing else running";"";"";
"369608312955731968";"Bryan_Beus#6442";"30-Aug-18 08:54 PM";"going to try cli";"";"";
"414128958326571008";"Hermes#6934";"30-Aug-18 09:54 PM";"it only completes till 97 %? until which block?";"";"";
"414128958326571008";"Hermes#6934";"30-Aug-18 09:55 PM";"What Ubuntu version so that I can test it also?";"";"";
"414128958326571008";"Hermes#6934";"30-Aug-18 10:03 PM";"@Bryan_Beus";"";"";
"369608312955731968";"Bryan_Beus#6442";"30-Aug-18 10:05 PM";"no, the computer is running hot";"";"";
"412323938782150658";"SHossain#0007";"30-Aug-18 10:07 PM";"@Bryan_Beus Please post a screenshot of `htop` screen from terminal";"";"";
"412323938782150658";"SHossain#0007";"30-Aug-18 10:07 PM";"`sudo apt-get install htop`";"";"";
"369608312955731968";"Bryan_Beus#6442";"30-Aug-18 10:07 PM";"yes, I used htop for it";"";"";
"369608312955731968";"Bryan_Beus#6442";"30-Aug-18 10:07 PM";"hang on";"";"";
"369608312955731968";"Bryan_Beus#6442";"30-Aug-18 10:07 PM";"I'm on the voicechat with mylo rn";"";"";
"412323938782150658";"SHossain#0007";"30-Aug-18 10:08 PM";"that can give some details of what is happening";"";"";
"369608312955731968";"Bryan_Beus#6442";"30-Aug-18 11:02 PM";"Sorry, I didn't have time to screenshot while it was running hot. Will have to take a shot another time. Thank you.";"";"";
"456226577798135808";"Deleted User#0000";"30-Aug-18 11:54 PM";"@jl777c do like BCH for the future?";"";"";
"456226577798135808";"Deleted User#0000";"30-Aug-18 11:54 PM";"ive heard you dont like bitcoin core that much and that you side side with BCH. im curious as to why";"";"";
"414128958326571008";"Hermes#6934";"30-Aug-18 11:57 PM";"Just in case there is a channel #ask-jl777";"";"";
"347922216429813760";"grewalsatinder#9653";"30-Aug-18 11:59 PM";"In my views hodl both disregarding tech differences";"";"";
"347922216429813760";"grewalsatinder#9653";"31-Aug-18 12:00 AM";"But a more of #talk-trading talk it is";"";"";
"455741312273219595";"jl777c#5810";"31-Aug-18 06:53 AM";"recent BCH antics makes me reconsider its future";"";"";
"405380797537976320";"Cryptoon#3362";"31-Aug-18 06:56 AM";"In regards to the bitmain ipo or more on the tech side of things?";"";"";
"455741312273219595";"jl777c#5810";"31-Aug-18 06:58 AM";"they talk of another fork";"";"";
"455741312273219595";"jl777c#5810";"31-Aug-18 06:58 AM";"that is nonsensical, to split a weak coin into two. like NXT splitting into 3. will not be any good from it";"";"";
"405380797537976320";"Cryptoon#3362";"31-Aug-18 06:59 AM";"Aha, thanks for clarifying, will read up on that.";"";"";
"323561113012797452";"criptobear#6402";"31-Aug-18 09:56 AM";"cannot find the last agama version download on the page https://artifacts.supernet.org/latest/agama/";"";"";
"272003866906722306";"TonyL#3577";"31-Aug-18 09:57 AM";"@criptobear  latest agama version available on this page: https://komodoplatform.com/komodo-wallets/";"";"";
"238737992758460416";"sbucks#9217";"31-Aug-18 11:29 AM";"hi guys, i am updating my 2.41 beta wallet to 2.41d kmd wallet on windows.  do i want to choose ""uninstall agama and  all of its modules""  click yes or no?";"";"";
"412323938782150658";"SHossain#0007";"31-Aug-18 11:31 AM";"Yes. And don't delete any user data or wallet.dat
it is best to backup wallet.dat before any update.";"";"";
"238737992758460416";"sbucks#9217";"31-Aug-18 11:32 AM";"i backed up my wallet as well as the whole appdata/komodo, probably over did it";"";"👍🏽 (1)";
"238737992758460416";"sbucks#9217";"31-Aug-18 11:37 AM";"lost my agama icon on desktop after install, where is the location of the executable to load agama stored?";"";"";
"397372307154403329";"yorklab#7270";"31-Aug-18 11:38 AM";"""C:\Program Files\AgamaApp\Agama.exe"" - for Windows.";"";"";
"238737992758460416";"sbucks#9217";"31-Aug-18 11:41 AM";"nothing there other than genbet, genhodl,genjumblr, genrevs, and gensupernet,.. no exe file";"";"";
"238737992758460416";"sbucks#9217";"31-Aug-18 11:45 AM";"no problem, just reinstalled it";"";"";
"397372307154403329";"yorklab#7270";"31-Aug-18 11:46 AM";"I was just going to suggest that. Glad it worked out.";"";"";
"238737992758460416";"sbucks#9217";"31-Aug-18 11:46 AM";"off to work now.  c u guys later, thanks";"";"";
"439780323497082880";"CMaurice#1685";"31-Aug-18 11:54 AM";"are the docs at readthedocs.io not updated? I ask because I like to download epubs of docs";"";"";
"345992331276713984";"Acura#2748";"31-Aug-18 01:02 PM";"Anybody know where i can find the file for the pin for Agama?";"";"";
"333508133060083712";"Nabob#5004";"31-Aug-18 01:23 PM";"@Acura  <Agama Userdata>/shepherd/pin/";"";"";
"345992331276713984";"Acura#2748";"31-Aug-18 01:27 PM";"thank you";"";"";
"344435894427582464";"Mc Tau#7499";"31-Aug-18 06:00 PM";"hi all, what does the U and the S mean, when you check a transaction in the explorer. 

It's always split up. Sometimes U and U , sometimes U and S";"";"";
"457211594137534465";"xRobeSx#5136";"31-Aug-18 06:02 PM";"I'm not positive but I think it stands for Unspent and Spent.";"";"";
"456226577798135808";"Deleted User#0000";"31-Aug-18 06:03 PM";"@SHossain once i deploy the VPS servers and connect to my first VPS IP adreess through terminal can i go ahead and run dependencies?";"";"";
"456226577798135808";"Deleted User#0000";"31-Aug-18 06:04 PM";"I am trying to launch an assett chain on KMD";"";"";
"457211594137534465";"xRobeSx#5136";"31-Aug-18 06:05 PM";"I'm not shossain but yes you can";"";"👍🏽 (1),☝🏽 (1)";
"456226577798135808";"Deleted User#0000";"31-Aug-18 06:09 PM";"dont i have to install komodo manually before that ?";"";"";
"456226577798135808";"Deleted User#0000";"31-Aug-18 06:09 PM";"https://docs.komodoplatform.com/komodo/install-Komodo-manually.html#installing-komodo-on-osx";"";"";
"456226577798135808";"Deleted User#0000";"31-Aug-18 06:09 PM";"this";"";"";
"457211594137534465";"xRobeSx#5136";"31-Aug-18 06:10 PM";"is your vps osx?";"";"";
"457211594137534465";"xRobeSx#5136";"31-Aug-18 06:10 PM";"if not then no";"";"";
"456226577798135808";"Deleted User#0000";"31-Aug-18 06:10 PM";"my vps is on digital ocean";"";"";
