AuthorID;Author;Date;Content;Attachments;Reactions;
"456226577798135808";"Deleted User#0000";"14-Jul-18 02:19 PM";"I think it would be good free publicity 😛";"";"";
"456226577798135808";"Deleted User#0000";"14-Jul-18 02:19 PM";"Any publicity is good publicity, even better if he doesnt shut down our tech";"";"";
"395274075985018880";"Regnar#6164";"14-Jul-18 02:19 PM";"I don't think we can change that. So I think this comes down to do we open ourselves up to that risk of an objective review being biased or unfavorable, and the deciding factor is the upside returns we can expect to gain from the positive review, and the downside we expose ourselves to the downside";"";"";
"395274075985018880";"Regnar#6164";"14-Jul-18 02:20 PM";"and regardless of our involvement there is the chance he comes across our DEX on his own anyway";"";"";
"397372307154403329";"yorklab#7270";"14-Jul-18 02:27 PM";"As a non-Dev, Jackson Palmer has always appeared to be objective in his talks. It would take a Dev to see through the bias. I suspect that 99% of the people that listen to him are like me, so he carries a lot of influence to his followers. I do like that he doesn't appear to shill coins, but he is still trying to make money like every one else.";"";"";
"395274075985018880";"Regnar#6164";"14-Jul-18 02:30 PM";"I think some good points have been made on the pros and cons of this, what's the consensus on seeing if we can get him to look at Komodo for either a DEX tweet, or his weekly show?";"";"";
"395274075985018880";"Regnar#6164";"14-Jul-18 02:30 PM";"I say yea";"";"";
"395274075985018880";"Regnar#6164";"14-Jul-18 02:33 PM";"He does a lot of ""what is"" videos on youtube. but hasn't done a ""what is an Atomic Swap"" video. Maybe that's where we could reach out. What is atomic swap video, we send him the github links, KMD atomic swap explanation video, and any other resources";"";"";
"395274075985018880";"Regnar#6164";"14-Jul-18 02:33 PM";"that might be better than the tweet thing";"";"";
"347922216429813760";"grewalsatinder#9653";"14-Jul-18 02:33 PM";"market to everyone. doesn't matter they favor/like/dislike.";"";"";
"347922216429813760";"grewalsatinder#9653";"14-Jul-18 02:33 PM";"sure can ask his views.";"";"";
"395274075985018880";"Regnar#6164";"14-Jul-18 02:33 PM";"https://www.youtube.com/user/jacksonpalmerbc/videos";"";"";
"347922216429813760";"grewalsatinder#9653";"14-Jul-18 02:34 PM";"I'd like him explaining Cut and Choose Method of Atomic Swap 😄";"";"";
"347922216429813760";"grewalsatinder#9653";"14-Jul-18 02:35 PM";"https://bitcointalk.org/index.php?topic=1364951.20";"";"";
"395274075985018880";"Regnar#6164";"14-Jul-18 02:40 PM";"https://github.com/KomodoPlatform/KomodoPlatform/wiki/BarterDEX-%E2%80%93-A-Practical-Native-DEX";"";"";
"395274075985018880";"Regnar#6164";"14-Jul-18 02:41 PM";"inquiries@ummjackson.com";"";"";
"395274075985018880";"Regnar#6164";"14-Jul-18 02:41 PM";"Here's his email apparently haha";"";"";
"347922216429813760";"grewalsatinder#9653";"14-Jul-18 02:41 PM";"yes, refer both.
first one is important to read before v2:
https://github.com/KomodoPlatform/KomodoPlatform/wiki/BarterDEX-%E2%80%93-A-Practical-Native-DEX
https://github.com/KomodoPlatform/KomodoPlatform/wiki/barterDEX-Whitepaper-v2";"";"";
"395274075985018880";"Regnar#6164";"14-Jul-18 02:44 PM";"hmm I know ben is away right now, so anyone with a Komodo email want to reach out to him and ask if wants to do a youtube video on atomic swaps? doesn't even have to be about KMD haha just need atomic swap info out there, and by extension we can send him KMD stuff that is about how we're doing them, and mention how we build a DEX with it etc.";"";"";
"395274075985018880";"Regnar#6164";"14-Jul-18 02:46 PM";"gotta go right now. be back later";"";"";
"430818734530101248";"KomodoWorld#8282";"14-Jul-18 03:05 PM";"https://www.reddit.com/r/CryptoCurrency/search?q=Komodo+innovative+AMA&restrict_sr=on&sort=relevance&t=all";"";"";
"430818734530101248";"KomodoWorld#8282";"14-Jul-18 03:06 PM";"upvote 👍";"";"";
"455021680935436290";"Gateway#3763";"14-Jul-18 03:09 PM";"[matrix] <n2okpride:matrix.org> Jackson palmer works on my girlfriend's team at adobe";"";"";
"455021680935436290";"Gateway#3763";"14-Jul-18 03:10 PM";"[matrix] <n2okpride:matrix.org> i could see what we can do";"";"";
"455021680935436290";"Gateway#3763";"14-Jul-18 03:11 PM";"[matrix] <n2okpride:matrix.org> it looks like he's not as anti crypto as he once was";"";"👌 (2)";
"363810960475160577";"Dr Debt#0891";"14-Jul-18 05:58 PM";"https://twitter.com/OfficialEQL/status/1018191103789498369";"";"";
"423222427192131614";"wil#2080";"14-Jul-18 09:00 PM";"@Dr Debt👌";"";"";
"303794669945618442";"PTYX#6840";"14-Jul-18 09:05 PM";"How about tipping users for joining our discord or retweeting content? That's probably more productive than getting on Kucoin";"";"";
"303794669945618442";"PTYX#6840";"14-Jul-18 09:05 PM";"We are already on larger exchanges";"";"";
"363810960475160577";"Dr Debt#0891";"14-Jul-18 09:43 PM";"Just a way we thought we could help a little bit";"";"👍 (1)";
"395274075985018880";"Regnar#6164";"15-Jul-18 12:58 AM";"Very nice cowboy";"";"";
"395274075985018880";"Regnar#6164";"15-Jul-18 01:44 AM";"https://plasma.altcoin.io";"";"";
"395274075985018880";"Regnar#6164";"15-Jul-18 01:44 AM";"thoughts?";"";"";
"303794669945618442";"PTYX#6840";"15-Jul-18 01:57 AM";"It will increase their Liquidity if it's easy enough to really launch your own exchange app";"";"";
"303794669945618442";"PTYX#6840";"15-Jul-18 01:57 AM";"You could theoretically make your own dico app with it";"";"";
"397372307154403329";"yorklab#7270";"15-Jul-18 02:06 AM";"A lot of DEX competition out there.";"";"";
"395274075985018880";"Regnar#6164";"15-Jul-18 03:55 AM";"""Our next release will include a “mass exit” mechanism which ensures you never lose your crypto assets. If we’re hacked, our servers fail, or we experience malicious behaviour, you can exit our exchange without losing a penny.""";"";"";
"395274075985018880";"Regnar#6164";"15-Jul-18 03:56 AM";"I'm not sure I like the proof of authority mechanism. sounds....bancorish";"";"";
"395274075985018880";"Regnar#6164";"15-Jul-18 03:57 AM";"however, the increase in DEX development is definitely a lot of competition.";"";"";
"395274075985018880";"Regnar#6164";"15-Jul-18 03:58 AM";"imo considering how much we place on the development and success/ease of use of hyperDEX, we should definitely make sure that it is well funded for the foreseeable future, even if it is a 3rd party.";"";"";
"324319979656708096";"chris#0517";"15-Jul-18 04:47 AM";"double down time";"";"";
"395274075985018880";"Regnar#6164";"15-Jul-18 04:53 AM";"https://twitter.com/Regnar__/status/1018357764463169537";"";"";
"395274075985018880";"Regnar#6164";"15-Jul-18 04:53 AM";"I just made some fun memes. obviously nothing official just for my personal twitter but still";"";"";
"395274075985018880";"Regnar#6164";"15-Jul-18 04:54 AM";"just going to space them out. pretty sure it's late in America";"";"";
"430818734530101248";"KomodoWorld#8282";"15-Jul-18 05:58 AM";"I've been banned from r/cryptocurrency";"";"";
"430818734530101248";"KomodoWorld#8282";"15-Jul-18 05:58 AM";"No explanation, prob too many links posted recently";"";"";
"264236295432175616";"Gordon Komodo#7477";"15-Jul-18 06:32 AM";"I got banned also , but still can upvote";"";"";
"264236295432175616";"Gordon Komodo#7477";"15-Jul-18 06:38 AM";"how bout making a bitcointalk signature about ""launching dICO on komodoplatform""? I 'll put it on, currently I am wearing the barterdex signature.";"";"";
"452374492283404288";"passcombo.com 🏴☠🍋#0622";"15-Jul-18 07:51 AM";"@PTYX  retweets can be manipulated by bots -> if any better tip retweets with followers lower limit whatever is reasonable. Joining discord could also be manipulted this way, and adds no value. Tipping might be better to people having personal blogs and writing some decent articles. But make sense only if planned -> simultaneous articles similar time , like 100 a week in different blogs, media and so on. Must be coordinated. @Dr Debt  the airdrop I would suggest to split by weight of followers, meaning calculate avg weight of retweet to measure share of this 10k USD. Will be more resonable to impact and more interesting for bigger players, for whom 10k $ is still nice money for a retweet 😃";"";"";
"452374492283404288";"passcombo.com 🏴☠🍋#0622";"15-Jul-18 07:58 AM";"This way if 5000 people with 1 follower will do retweet and 1 person with 5000 followers, the 1 person will get 5k $  and the rest will get 1$ each, which is relevant for impact and less bot/spam-prone.";"";"";
"452374492283404288";"passcombo.com 🏴☠🍋#0622";"15-Jul-18 07:58 AM";"However not sure how you will manage sending  thousands of transfers 😛";"";"";
"405380797537976320";"Cryptoon#3362";"15-Jul-18 09:49 AM";"You can also buy followers";"";"";
"363810960475160577";"Dr Debt#0891";"15-Jul-18 02:30 PM";"Our tip bot does it all in discord";"";"";
"464378807420452865";"Seko#7408";"15-Jul-18 06:51 PM";"Can you implement a German channel?";"";"";
"464378807420452865";"Seko#7408";"15-Jul-18 06:51 PM";"I miss under International the German channel...";"";"";
"405380797537976320";"Cryptoon#3362";"15-Jul-18 06:51 PM";"Ask @Audo";"";"";
"405380797537976320";"Cryptoon#3362";"15-Jul-18 06:52 PM";"@Seko";"";"";
"403137719049519106";"Audo#5667";"15-Jul-18 07:15 PM";"seems like someone created it";"";"";
"405380797537976320";"Cryptoon#3362";"15-Jul-18 08:27 PM";"🙏🏼";"";"";
"264236295432175616";"Gordon Komodo#7477";"16-Jul-18 07:40 AM";"marketing opportunity https://www.reddit.com/r/ETHLend/comments/8we2i5/eth_network_is_congested_cant_use_lend_platform/";"";"";
"264236295432175616";"Gordon Komodo#7477";"16-Jul-18 07:41 AM";"can CC do what ETHlend is doing yet? (collateral and lending on smart contract)";"";"";
"405380797537976320";"Cryptoon#3362";"16-Jul-18 08:58 AM";"Not yet I thínk";"";"";
"403137719049519106";"Audo#5667";"16-Jul-18 09:32 AM";"yup, we don't have full smart contract capabilities yet.";"";"";
"455741312273219595";"jl777c#5810";"16-Jul-18 09:42 AM";"we do but it just requires custom eval functions and a dedicated chain, so not for people who arent able to code at that level";"";"👌 (1)";
"403137719049519106";"Audo#5667";"16-Jul-18 10:01 AM";"I see

Would it be possible to make some code example? This capability was brought to us from the cryptoconditions & interoperability tech? It would fit nicely to our Komodo 5 pillar campaign.

It would be nice to highlight this with something concrete, i.e. ""how to develop X on KMD""";"";"";
"455741312273219595";"jl777c#5810";"16-Jul-18 10:02 AM";"yes, working on a demo game that has very simple rules so the work needed for the blockchain side is clear";"";"";
"403137719049519106";"Audo#5667";"16-Jul-18 10:02 AM";"awesome!";"";"";
"403137719049519106";"Audo#5667";"16-Jul-18 10:04 AM";"I have been thinking of ideas for simple games too, but they always end up becoming too complex 😄";"";"";
"455741312273219595";"jl777c#5810";"16-Jul-18 10:06 AM";"it will be a simple 2 player card vs card game. At the start two players agree to the deck used, like N cards with total value of X. The the players bet a card against the other player. higher denomination wins. Owner of the card, owns the coin value";"";"";
"455741312273219595";"jl777c#5810";"16-Jul-18 10:07 AM";"so fund cards with 1, 2, 3, ... 13 CHIPS (to represent ace high) and then each round one card is dealt by each player. at the end of the round, the results update who has what cards";"";"";
"455741312273219595";"jl777c#5810";"16-Jul-18 10:07 AM";"likely not a very exciting game, but should demonstrate the important parts";"";"";
"347922216429813760";"grewalsatinder#9653";"16-Jul-18 12:24 PM";"If given API I'm up for turning it to GUI";"";"👌 (1)";
"406182498050244638";"freakbros#9074";"16-Jul-18 12:45 PM";"We called that card game WAR";"";"";
"356887295154061312";"tese#3502";"16-Jul-18 04:24 PM";"What about using existing games like tictactoe or blackjack? I think using known games is more effective to attract ppl than creating a new one.";"";"";
"356887295154061312";"tese#3502";"16-Jul-18 04:26 PM";"In general terms, when you create something new, ppl is more critic and gets frustated early";"";"";
"356887295154061312";"tese#3502";"16-Jul-18 04:27 PM";"In the other hand, If we want to create our own games, we should have graphic designers to make the product more attractive to users";"";"";
"455741312273219595";"jl777c#5810";"16-Jul-18 04:33 PM";"the point of the first one is to be a demo for programmers";"";"👌 (1)";
"455741312273219595";"jl777c#5810";"16-Jul-18 04:33 PM";"not for getting users directly";"";"";
"356887295154061312";"tese#3502";"16-Jul-18 04:53 PM";"Sounds good :) Im not a programmer so I cant help there.";"";"";
"430818734530101248";"KomodoWorld#8282";"16-Jul-18 06:23 PM";"https://twitter.com/BlockchainKenya/status/1018921771674820615";"";"";
"430818734530101248";"KomodoWorld#8282";"16-Jul-18 06:23 PM";"@benohanlon  well done";"";"";
"235143047053180949";"Steve Lee#1967";"16-Jul-18 07:32 PM";"We've been invited to join http://afriblockchain.org .  I'm scheduling a follow-up meeting and once we finalize this agreement we will share full details with the community and public. FYI - BAK is a member of Afriblockchain";"";"💯 (4)";
"415903995547090956";"Daniel CP#2020";"16-Jul-18 09:04 PM";"New post:";"";"";
"415903995547090956";"Daniel CP#2020";"16-Jul-18 09:04 PM";"https://komodoplatform.com/kmd-coins-fiat-physical-locations/";"";"";
"395274075985018880";"Regnar#6164";"16-Jul-18 09:17 PM";"^ that's awesome";"";"";
"388092138208100356";"Buddz1993#5380";"16-Jul-18 09:18 PM";"😄";"";"";
"388092138208100356";"Buddz1993#5380";"16-Jul-18 09:19 PM";"https://twitter.com/Buddz1993/status/1018967531476996102";"";"👌 (1)";
"395274075985018880";"Regnar#6164";"16-Jul-18 09:20 PM";"How does the liquidity on netcoins work?";"";"";
"405380797537976320";"Cryptoon#3362";"16-Jul-18 09:39 PM";"Great news @Steve Lee";"";"";
"405380797537976320";"Cryptoon#3362";"16-Jul-18 09:40 PM";"And another great article @Daniel CP , on fire lately with the great content that has been released!";"";"💯 (4)";
"406179072922746882";"polycryptoblog#1173";"17-Jul-18 01:11 AM";"@Regnar  what do you mean?";"";"";
"395274075985018880";"Regnar#6164";"17-Jul-18 01:12 AM";"I haven't looked into it much, is it p2p?";"";"";
"406179072922746882";"polycryptoblog#1173";"17-Jul-18 01:13 AM";"You trade directly with the company via the trading desk.";"";"";
"406179072922746882";"polycryptoblog#1173";"17-Jul-18 01:15 AM";"You can buy voucher from a flexepin location and redeem on their website.  The trading desk is activated ,  the vouchers and virtual ATMs by the end of the month.";"";"";
"395274075985018880";"Regnar#6164";"17-Jul-18 01:16 AM";"Okay so that's what my original question was, where does the company get it's KMD to trade? they just buying from exchanges? or private individuals?";"";"";
"456226577798135808";"Deleted User#0000";"17-Jul-18 01:16 AM";"I can feel something massive brewing. Good things to come for komodo 😁:Komodo:";"";"💯 (1)";
"395274075985018880";"Regnar#6164";"17-Jul-18 01:17 AM";"agreed!";"";"";
"456226577798135808";"Deleted User#0000";"17-Jul-18 01:21 AM";"I feel like I never have enough kmd hahahhaha. Cant ever fulfill this void";"";"";
"456226577798135808";"Deleted User#0000";"17-Jul-18 01:22 AM";"Been accumulating every 2nd day for the past 6 months";"";"";
"456226577798135808";"Deleted User#0000";"17-Jul-18 01:22 AM";"Lets hope the market stays bearish for a bit more 😂";"";"😂 (1)";
