==============================================================
Guild: Komodo
Channel: cc-gateways
Topic: https://developers.komodoplatform.com
Messages: 100
Range: before 05-Dec-19 12:00 AM
==============================================================

[01-Feb-19 07:33 PM] TonyL#3577
@Mihailo For 2 of 3 deposit worked smooth, withdrawal  as well: ```#WITHDRAW (8b666f069fac22dd54a21db3f336d2b86da6815e7487a072f938b24167295865) complete signing tx (2of3) sent - f7c5f9c05665d7e679a1c920b438831948b8306f4010f1f37e5e7783f7756351
broadcast GWISBACK txid.(2325ab8bbee02e062b3d6e53ae0fd2130fa3d7ec9ed668dd0137c8c15965dbb6)
```
https://kmdexplorer.io/address/bHsrFraaJZtRTruEztx9i87x4C82hnnw6x

[01-Feb-19 07:35 PM] TonyL#3577
From which factors it depends which nodes oraclefeed sign transaction first?
From one of the nodes I get sign immediately:
```KMD ht.1210056 <- c8761200b8917184e08a898d0125f71322f85ab2b887923b27b9a39ca1fa53e864cffb0aa7e36337c912a0f1e981585d639d38dd1990d687f8b09710dd05393fa7b99666
broadcast GWISBACK txid.(2fad40690a899cc8318023e70ee28c7cdc6c6e1fcc058e6b1daec3d01b1738ad)
#WITHDRAW (8b666f069fac22dd54a21db3f336d2b86da6815e7487a072f938b24167295865) partial tx (1/2of3) sent - 2fad40690a899cc8318023e70ee28c7cdc6c6e1fcc058e6b1daec3d01b1738ad
broadcast GWISBACK txid.(cf9fc8a0d49cf1055644f09b23a400f1e7ba3dcdbb92aab26dc5325ff69447e4)
KMD ht.1210057 <- c976120079dbdef86ddd0b6824b70d688626c7196b973da2ac495e47c5e6397e469c230e5b4566b7bdfb24e2a6e641399cbaae30eddca32d6efad47b783780525a1d33b9```
On second from other two in 2 blocks:
```KMD ht.1210059 <- cb76120025f52807b0ccbf1145b8c4dd43904f97962702b6bd9a2b6936ea6dca020000002075fb7888776e13aec83c3edee466a5920b1f62dff7a90d8eee76babf766ca2
broadcast GWISBACK txid.(f7c5f9c05665d7e679a1c920b438831948b8306f4010f1f37e5e7783f7756351)
#WITHDRAW (8b666f069fac22dd54a21db3f336d2b86da6815e7487a072f938b24167295865) complete signing tx (2of3) sent - f7c5f9c05665d7e679a1c920b438831948b8306f4010f1f37e5e7783f7756351
broadcast GWISBACK txid.(2325ab8bbee02e062b3d6e53ae0fd2130fa3d7ec9ed668dd0137c8c15965dbb6)```

[01-Feb-19 07:42 PM] Mihailo#5902
No factors, random. And signing happens only when there is a KMD block to feed and there are enough utxos to publish. When not then it is waiting for new block.

[01-Feb-19 07:43 PM] Mihailo#5902
I have a very strange bug in oraclefeed, it crashes with sigabrt.

[01-Feb-19 07:52 PM] TonyL#3577
Hmm on my side it works smooth on 3 nodes for almost 200 blocks

[01-Feb-19 07:59 PM] Mihailo#5902
I think it has to do with tx created on KMD. It has two vins.

[02-Feb-19 03:12 PM] TonyL#3577
Hmm testing 3of3. ```#WITHDRAW (a7c45ae33bf477c92408c9fd55779a7afd2148ee12b2f9e50ba0b3e9637d4cbc) partial tx (3/3of3) sent - 87bd3a7bb07dbc4247e049252774070921897bf8c3c4f99158f498ad4aa36fe4```
Have all 3 signatures ~15 minutes ago but not have withdrawal itself yet

[02-Feb-19 03:12 PM] TonyL#3577
```./komodo-cli -ac_name=GWISBACK gatewayspendingwithdraws 9bb292530244876f3100810561df866b416a5dd498cd86e54293bebc4000710a KMD
{
  "coin": "KMD",
  "pending": [
    {
      "withdrawtxid": "a7c45ae33bf477c92408c9fd55779a7afd2148ee12b2f9e50ba0b3e9637d4cbc",
      "withdrawtxidaddr": "RGP9VbM1QEtwuca3XUzYSC2jTu8MYJqKwd",
      "withdrawaddr": "RELwMZDihD9n22dissX21ZrEERN9VV4qWd",
      "amount": "0.10000000",
      "confirmed_or_notarized": true,
      "number_of_signs": 3,
      "last_txid": "87bd3a7bb07dbc4247e049252774070921897bf8c3c4f99158f498ad4aa36fe4",
      "hex": "0400008085202f8901ed3770226a72f879ac28da3f5a5f963f17f05ecc0e274b7f9bbdc510e1fdd7b901000000fdfd000047304402207cf2a34f2621500c177d3c331445be82c98337acc30c28e85a59b08b3d32ed9f02202f298cf64411a3e6665d979f06330c41942b2e0d48fc1a3fa2d7e56d3845f0af0147304402204274f7c68ee800bd6b06e60e2ceee8ae4b13dd26198521557e548de8d3382185022017365b42c577d4da3bc386d96c789179d20b18e3249f239cee57be2bb01c9f9201004c69532103ec341bcf976d99c6c98636dc875c4c02e029b3e3fe5f5c4b93e413e5a18dd0cd21030651dd3b286571c3830fedd7dfa6de9a2e2bd8c2a1bf8c6f165a801ebeb3c1bd2103b895f1875391502bc96350a764bde0ab08d4e2895fa30ba4cc2e252cbe7ec5ad53aeffffffff0260489800000000001976a914378e0093b996c0a650d3046833a81f766ef1fa3488ac10270000000000001976a9144de937f017d2d10ae7050d54fc4eba28c9cb003d88ac00000000867b12000000000000000000000000"
    }
  ],
  "queueflag": 0
}
```

[02-Feb-19 03:13 PM] TonyL#3577
```"withdrawaddr": "RELwMZDihD9n22dissX21ZrEERN9VV4qWd```
But I've wanted to withdraw to other address and used other pubkey

[02-Feb-19 03:13 PM] TonyL#3577
```./komodo-cli getaccountaddress ""
RQHf9AGeQUHHVmVg1ira4eCM5StgDvxaJJ```
```./komodo-cli validateaddress RQHf9AGeQUHHVmVg1ira4eCM5StgDvxaJJ
{
  "isvalid": true,
  "address": "RQHf9AGeQUHHVmVg1ira4eCM5StgDvxaJJ",
  "scriptPubKey": "76a914a4a07a48f5a5898ad9cee26148b20d4c09624aec88ac",
  "segid": 47,
  "ismine": true,
  "iswatchonly": false,
  "isscript": false,
  "pubkey": "024000b1d670c908506bcde994e5fa36db1f19c88b2f5b8ac6261bf2881b4a2e49",
  "iscompressed": true,
  "account": ""
}
```

[02-Feb-19 03:13 PM] TonyL#3577
Used this `024000b1d670c908506bcde994e5fa36db1f19c88b2f5b8ac6261bf2881b4a2e49` one as pubkey to which I want to withdrawal

[02-Feb-19 03:19 PM] TonyL#3577
@Mihailo Ahh and `oraclefeed` crashed on all three nodes on some point
```
corrupted size vs. prev_size
double free or corruption (out)
Aborted (core dumped)```

[02-Feb-19 03:20 PM] TonyL#3577
Since it's happened for me only on 3of3 - maybe it's specific for this case. Will try it again but this time run `oraclefeed` with gdb to get a trace in case of crash

[02-Feb-19 03:20 PM] Mihailo#5902
Yep that is the bug I have also

[02-Feb-19 03:21 PM] TonyL#3577
Do you have it for 3of3 case only or for other cases as well?

[02-Feb-19 03:21 PM] TonyL#3577
If you remember for sure

[02-Feb-19 04:07 PM] Mihailo#5902
I also saw it in 3of3 but don't know if it happens somewhere else ...

{Reactions}
👌 

[02-Feb-19 04:25 PM] TonyL#3577
Crashed daemon somehow by `gatewaysbind`, trying to reproduce

[02-Feb-19 04:29 PM] TonyL#3577
For sure second time when I started with gdb it not crashed with same input :troll_compadre:

[02-Feb-19 04:32 PM] blackjok3r#3181
reminds me of teh crash with thousands of imp[ort txs in a block... days to fix 😅

{Reactions}
5684_Peepo_Goteem 

[02-Feb-19 04:48 PM] TonyL#3577

{Attachments}
https://cdn.discordapp.com/attachments/522052568466194450/541298760031010849/unknown.png

[02-Feb-19 05:02 PM] TonyL#3577
Confirmations/notarisations RPC validation is missing for gatewaysclaim:
Gateways claim generates hex
```
{'result': 'success', 'hex': 'hex'}```
But until two confirmations there is error on broadcasting:
```sendrawtransaction: 16: mandatory-script-verify-flag-failed (Script evaluated without error but finished with a false/empty top stack element) (code -26)```
After two confirmations (since it's a test mode) transaction broadcasting fine.

Not a big issue for sure - just noted

[02-Feb-19 05:13 PM] TonyL#3577
```
[7] Execute gateways withdrawal
Input your gateway bind txid: 55544ec0c943b6929190ab4a1bdb2f3a289ac013b4bbc1c6f174c8ce0b791e72
Input your external coin ticker (e.g. KMD): KMD
Input pubkey to which you want to withdraw: 024000b1d670c908506bcde994e5fa36db1f19c88b2f5b8ac6261bf2881b4a2e49
Input amount of withdrawal: 0.05
.TokensExactAmounts() vin i=1 tokenoshis=100000000
.TokensExactAmounts() vout i=0 tokenoshis=5000000
.TokensExactAmounts() vout i=1 tokenoshis=95000000
AddTokenInputs() adding input nValue=5000000
TokensValidate (t) evalcode=0xf2
..TokensExactAmounts() vin i=1 tokenoshis=100000000
..TokensExactAmounts() vout i=0 tokenoshis=5000000
..TokensExactAmounts() vout i=1 tokenoshis=95000000
TokensExactAmounts() vin i=1 tokenoshis=5000000
TokensExactAmounts() vout i=1 tokenoshis=10000000
TokenExactAmounts() found unequal token cc inputs=5000000 vs cc outputs=10000000 for txid=f608b2b40c8f1740dd121134ab7b2345015179d2ddcd34db5bd072e7bb14847b and this is not the create tx
CC Eval EVAL_TOKENS Invalid: tokens cc inputs != cc outputs spending tx 8a74ee46af8ad49e1f62b55fe696938f928424c2b0f43ed8429611722a8a9970
sendrawtransaction: 16: mandatory-script-verify-flag-failed (Script evaluated without error but finished with a false/empty top stack element) (code -26)```

[02-Feb-19 05:14 PM] TonyL#3577
This time I've deposited 0.05 KMD (in all other tests I used 0.1 KMD) and trying to withdraw:
I have tokens ```./komodo-cli -ac_name=GWISBACK tokenbalance 49be33e04bc33a542d656b95cfde567c019c94fef5ae1c6952b706d9d0b1a991
{
  "result": "success",
  "CCaddress": "RJBgB8KkmCS6fjnZCnsqKQyMWSMkAtpiTa",
  "tokenid": "49be33e04bc33a542d656b95cfde567c019c94fef5ae1c6952b706d9d0b1a991",
  "balance": 5000000
}```
Token, oracle and gateway are brand new and this deposit was a first transaction for this gateway

[02-Feb-19 05:17 PM] TonyL#3577
```./komodo-cli -ac_name=GWISBACK gatewaysinfo 55544ec0c943b6929190ab4a1bdb2f3a289ac013b4bbc1c6f174c8ce0b791e72
{
  "result": "success",
  "name": "Gateways",
  "M": 3,
  "N": 3,
  "pubkeys": [
    "030651dd3b286571c3830fedd7dfa6de9a2e2bd8c2a1bf8c6f165a801ebeb3c1bd",
    "03ec341bcf976d99c6c98636dc875c4c02e029b3e3fe5f5c4b93e413e5a18dd0cd",
    "03b895f1875391502bc96350a764bde0ab08d4e2895fa30ba4cc2e252cbe7ec5ad"
  ],
  "coin": "KMD",
  "oracletxid": "07e5706a231521362dd401e7e00775df4d4cc9c982cda7ad2759ef77532f96de",
  "taddr": 0,
  "prefix": 60,
  "prefix2": 85,
  "deposit": "bNztvdYD2S4ajtHf4VLdCzwV4WSeF19hGN",
  "tokenid": "49be33e04bc33a542d656b95cfde567c019c94fef5ae1c6952b706d9d0b1a991",
  "totalsupply": "1.00000000",
  "remaining": "0.95000000",
  "issued": "0.05000000"
}
```

[02-Feb-19 05:20 PM] TonyL#3577
Same call in cli not TUI (to get hex):
```./komodo-cli -ac_name=GWISBACK gatewayswithdraw 55544ec0c943b6929190ab4a1bdb2f3a289ac013b4bbc1c6f174c8ce0b791e72 KMD 024000b1d670c908506bcde994e5fa36db1f19c88b2f5b8ac6261bf2881b4a2e49 0.05
{
  "result": "success",
  "hex": "0400008085202f8902014ada9242f1af1e16310d0fc0bacb403628fd0ce8b9042b6048ebeac8dacf46000000004847304402205e4b8dc7d1fa9cf3dd8af3132cc091dc98dd435ecd702b0a5876a316956adb1902202ab79756184168b47dfa40bfce91f9bfbffdaae3c583b3e92968c518059f023901ffffffff70998a2a72119642d83ef4b0c22484928f9396e65fb5621f9ed48aaf46ee748a000000007b4c79a276a072a26ba067a5658021039eec2081bbe883ce2ceff764935c139ca0ba52fc87ad4b441344e521213e7d968140633cda6aeea80f43978f87edf562adde09d79149664fc254892ff6dc810ea45b6dce750025362b6dbba65b3aed5a14e77a95f77f6830bc32fa6de76a2ffe72dda100af038001f2a10001ffffffff041027000000000000302ea22c802091abda62a548f9c7f5beb19d16f01714ae3d4e526f3266fc8d347d6123f3d77b8103120c008203000401cc8096980000000000302ea22c8020bed294e15cd2e327d2f1e6bcf55e2ebe571b7bc2e672363950ca680c8b89226381032210008203000401cca006264e180900002321039eec2081bbe883ce2ceff764935c139ca0ba52fc87ad4b441344e521213e7d96ac0000000000000000996a4c96f27449be33e04bc33a542d656b95cfde567c019c94fef5ae1c6952b706d9d0b1a991012103ea9c062b9652d8eff34879b504eda0717895d27597aaeb60347d65eed96ccb4050f157721e790bcec874f1c6c1bbb413c09a283a2fdb1b4aab909192b643c9c04e5455034b4d442102554fb8a367cdb896ab6566c9f2aac62de70e5d643d2b6c19f01d65712da589db809698000000000000000000c20700000000000000000000000000"
}
```

[02-Feb-19 05:20 PM] TonyL#3577
And ```error code: -26
error message:
16: mandatory-script-verify-flag-failed (Script evaluated without error but finished with a false/empty top stack element)``` with same prints as above on broadcasting

[02-Feb-19 05:21 PM] TonyL#3577
```  "vout": [
    {
      "value": 0.00010000,
      "valueZat": 10000,
      "n": 0,
      "scriptPubKey": {
        "asm": "a22c802091abda62a548f9c7f5beb19d16f01714ae3d4e526f3266fc8d347d6123f3d77b8103120c008203000401 OP_CHECKCRYPTOCONDITION",
        "hex": "2ea22c802091abda62a548f9c7f5beb19d16f01714ae3d4e526f3266fc8d347d6123f3d77b8103120c008203000401cc",
        "reqSigs": 1,
        "type": "cryptocondition",
        "addresses": [
          "RKWpoK6vTRtq5b9qrRBodLkCzeURHeEk33"
        ]
      }
    },
    {
      "value": 0.10000000,
      "valueZat": 10000000,
      "n": 1,
      "scriptPubKey": {
        "asm": "a22c8020bed294e15cd2e327d2f1e6bcf55e2ebe571b7bc2e672363950ca680c8b89226381032210008203000401 OP_CHECKCRYPTOCONDITION",
        "hex": "2ea22c8020bed294e15cd2e327d2f1e6bcf55e2ebe571b7bc2e672363950ca680c8b89226381032210008203000401cc",
        "reqSigs": 1,
        "type": "cryptocondition",
        "addresses": [
          "RSDw91hbCKkkNct6XtPRbq389eu2xKgHUC"
        ]
      }```

[02-Feb-19 05:22 PM] TonyL#3577
By some reason vout of hex generated by gatewayswithdraw is 0.1 while I'm trying to withdraw only 0.05. This seems like a scary bug @Mihailo

[02-Feb-19 05:28 PM] TonyL#3577
I not grabbed this commit yet.: https://github.com/jl777/komodo/commit/6fc97c61e33c0d01c47d26d66acf0ec9dae8a3df  Can it affect this part?

{Embed}
https://github.com/jl777/komodo/commit/6fc97c61e33c0d01c47d26d66acf0ec9dae8a3df
Add support for dual opret with Token opret. · jl777/komodo@6fc97c6
https://avatars1.githubusercontent.com/u/39563265?s=200&v=4

[02-Feb-19 05:48 PM] Mihailo#5902
I think I have not added check for conf/notarization in any RPC, so deposit,claim and withdraw need to check it.

[02-Feb-19 05:52 PM] Mihailo#5902
This is unusual 😛 I have to reproduce it to see what is happening... Why is vout 0.1 if you entered 0.05

[02-Feb-19 05:55 PM] Mihailo#5902
@TonyL, haa found it. My bad, what a bug. I was using same variable for amount when iterating utxos so it owerwrited it 😮

[02-Feb-19 05:56 PM] TonyL#3577
Nice! Yeah, scary bug. I guess we not found it before because tested only same amounts

[02-Feb-19 05:57 PM] TonyL#3577
First time I changed amount in my tests and voila  😃

[02-Feb-19 06:21 PM] Mihailo#5902
YEp 😛

[02-Feb-19 06:22 PM] Mihailo#5902
And this part of the code I added recently so it was not actual beofre

[02-Feb-19 06:23 PM] Mihailo#5902
As we had to serialize withdraws for now because of the problem when having parallel withdraws.

[02-Feb-19 06:55 PM] Mihailo#5902
Fixed, now to trace that SIGABRT bug.

[02-Feb-19 06:59 PM] TonyL#3577
Great, hope I'll able to withdraw with fix implemented 😃

[03-Feb-19 12:31 AM] TonyL#3577
Run `oraclefeed` with gdb this time and oraclefeed crashed again in some time after 3rd signature for 3of3 case was made (payment wasn't made).
Backtraces a little bit different:
1 node
```
spentheight.2291 valuein 0.0002 vs 0.0003 error
loadfile null size.(/tmp/oraclefeed.sendrawtransaction)
error broadcasting tx on GWISBACKbroadcast GWISBACK txid.(dbd8c8d83feeba5814824afb46f990007f8a19eddb38a2ea6e8a3fae2cf056ca)
KMD ht.1211783 <- 877d1200ae347ac21a6406dcb08f33ec7852d4931b909e330cee55a314182b75dbb63e01c955497bac6cb28c9564d369f30ffe14863fc31a95ae5bebc9a88b13ca4a01cd

Program received signal SIGSEGV, Segmentation fault.
0x0000555555555360 in cJSON_Delete ()
(gdb) backtrace
#0  0x0000555555555360 in cJSON_Delete ()
#1  0x0000555555555394 in cJSON_Delete ()
#2  0x0000555555555394 in cJSON_Delete ()
#3  0x0000555555555394 in cJSON_Delete ()
#4  0x0000555555555394 in cJSON_Delete ()
#5  0x0000555555559d7d in free_json ()
#6  0x000055555555db0b in update_gatewayspending ()
#7  0x000055555555e84e in main ()```
2 node
```Program received signal SIGSEGV, Segmentation fault.
0x00007ffff76daef2 in ?? () from /lib/x86_64-linux-gnu/libc.so.6
(gdb) unexpected null pwallet in RelayWalletTransaction
(gdb) backtrace
#0  0x00007ffff76daef2 in ?? () from /lib/x86_64-linux-gnu/libc.so.6
#1  0x00007ffff76dd0fc in malloc () from /lib/x86_64-linux-gnu/libc.so.6
#2  0x0000555555555182 in cJSON_mallocstr ()
#3  0x0000555555555aa7 in parse_string ()
#4  0x0000555555556ae8 in parse_object ()
#5  0x0000555555556352 in parse_value ()
#6  0x000055555555650b in parse_array ()
#7  0x0000555555556332 in parse_value ()
#8  0x0000555555556c57 in parse_object ()
#9  0x0000555555556352 in parse_value ()
#10 0x0000555555556111 in cJSON_ParseWithOpts ()
#11 0x00005555555561a8 in cJSON_Parse ()
#12 0x000055555555ac13 in get_komodocli ()
#13 0x000055555555c4f6 in addsignature ()
#14 0x000055555555d763 in update_gatewayspending ()
#15 0x000055555555e84e in main ()```

[03-Feb-19 12:31 AM] TonyL#3577
3 node
```Program received signal SIGSEGV, Segmentation fault.
0x00005555555575ac in cJSON_GetObjectItem ()
(gdb) backtrace
#0  0x00005555555575ac in cJSON_GetObjectItem ()
#1  0x0000555555559791 in jobj ()
#2  0x000055555555c51c in addsignature ()
#3  0x000055555555d763 in update_gatewayspending ()
#4  0x000055555555e84e in main ()```

[03-Feb-19 12:34 AM] TonyL#3577
I'm almost sure that this crash happening only on withdrawal in 3of3 case (from cases which we tested) when there is all 3 signatures (but it never making KMD withdrawal transaction). 2of3 withdrawal works fine

[03-Feb-19 09:22 AM] Mihailo#5902
👍 This gives me more clues 😉

{Reactions}
👍 

[04-Feb-19 05:10 PM] Mihailo#5902
@TonyL Fixed crashing bug, also done various fixes. Make it a run on 3of3 to see how it goes. I noticed some race condition when two feed nodes want to sign tx in same time, but it works correctly there is just some print in oraclefeed about unable to broadcast tx.
https://github.com/jl777/komodo/pull/1230

{Embed}
https://github.com/jl777/komodo/pull/1230
Gateways fixes (#17) by Mixa84 · Pull Request #1230 · jl777/komodo
Oraclefeed crash fix
Wrong amount bug
Switching to LogPrint in Gateways for filtering debug output
Adding CCerror to all RPCs
https://avatars3.githubusercontent.com/u/39563265?s=400&v=4

[04-Feb-19 05:11 PM] Mihailo#5902
Reminder: Recompile komodo and oraclefeed on all nodes

[05-Feb-19 09:00 AM] Mihailo#5902
@TonyL We could also try together for example 6of6 or more... We can use all our test nodes we have to try bigger setups.

[08-Feb-19 12:49 PM] TonyL#3577
Hi @Mihailo I'll back on Monday and can go ahead with it.
I'm thinking to test it using AWS infrastructure (prebuilt snapshot with daemon and synced blockchain) to spin nodes fast + nodes preparation script with asserts which will make wallets different, setup pubkeys, import privkey from assetchain to Komodo chain and other stuff. Point is to make any nodes amount infrastructure we need fast and automate.

{Reactions}
💯 

[08-Feb-19 12:53 PM] jl777c#5810
@ca333 chainlizard spin up of gateways is a brilliant idea

{Reactions}
💯 

[08-Feb-19 12:54 PM] Mihailo#5902
@TonyL 👍 Ping me if you need anything!

{Reactions}
👌 

[08-Feb-19 12:56 PM] ca333#0118
yes this is indeed a genius idea @jl777c - added to feature list and will be implemented. thanks for the hint!

[11-Feb-19 03:40 PM] Mihailo#5902
@jl777c @TonyL Added support for other bitcoin protocol coins to be used on gateways, not just KMD. I tested it with 1of1 gateways and deposit and withdraw works. Some RPCs have changed so TUI update needed. Also there are two new RPCs to be able to get external chain address for given pubkey (needed for deposit) and to dump private key from KMD node in format of external chain so it can be imported in external chain node.
https://github.com/jl777/komodo/pull/1239

{Embed}
https://github.com/jl777/komodo/pull/1239
Multi coin support for GatewaysCC (#18) by Mixa84 · Pull Request ...
Added support for other cions
New RPC for getting address for a pubkey on external chain and for dumping private key in external chain format
https://avatars3.githubusercontent.com/u/39563265?s=400&v=4

{Reactions}
🚀 (4) 3040_kingpeepo Komodo (2) 

[11-Feb-19 03:52 PM] TonyL#3577
Great news @Mihailo ! Will wrap my head over it when finish with rogue TUI. Is there any list of actual RPC calls / args?

[11-Feb-19 03:55 PM] TonyL#3577
I've started automation a little today: 
https://gist.github.com/tonymorony/ef78e1bda31713d13fa19745eeb97622 to prepare latest FSM node (using it to make node from which making disk snapshot)
https://gist.github.com/tonymorony/b0b2128f4fa5587b9c8f48bf931f5e92 this one preparing other stuff to use node as a gateways node (not totally finished)

{Embed}
https://gist.github.com/tonymorony/ef78e1bda31713d13fa19745eeb97622
FSM node prepare
GitHub Gist: instantly share code, notes, and snippets.
https://avatars1.githubusercontent.com/u/24797699?s=400&v=4

{Embed}
https://gist.github.com/tonymorony/b0b2128f4fa5587b9c8f48bf931f5e92
Preparing node to work as gateway node
GitHub Gist: instantly share code, notes, and snippets.
https://avatars1.githubusercontent.com/u/24797699?s=400&v=4

[11-Feb-19 04:00 PM] TonyL#3577
Hmm now there is a lot of use-cases to test - different M N + different coins. So gonna automate routine for time and mental health saving 😃

{Reactions}
👍 

[11-Feb-19 04:04 PM] Mihailo#5902
I think we need to test different M and N and some of it on different coins. There should be same behaviour for some M and N combination regardless of coin as different coins have just different withdraw and deposit addresses.

{Reactions}
👌 

[16-Feb-19 07:24 AM] Mylo#8306
when you say different "coins" do you mean non-KMD ecosystem?

[16-Feb-19 12:50 PM] TonyL#3577
@Mihailo ```Some RPCs have changed so TUI update needed.``` Could you please point what changes are, so I'll update RPC calls documentation here: https://docs.google.com/spreadsheets/d/1l0dWEPcrv9zE11_TD-XrX_HIYV0VLpadCJN6hvaZERc/edit#gid=211514340 ?
```Also there are two new RPCs```
Could you please advice on these RPC names and arguments needs to be given?

{Embed}
https://docs.google.com/spreadsheets/d/1l0dWEPcrv9zE11_TD-XrX_HIYV0VLpadCJN6hvaZERc/edit
Smart Contract Test Plan
cclib Rogue

Rogue Contract
Available RPC calls,What does this Call do?,Example Test Command,Example Expected Output
cclib newgame 17 \"[,]\",Creating new game. Buy-in argument using for multiplayer games. It's forming game pot and last player standing or first who do highlan...
https://lh4.googleusercontent.com/jG0EwoRG0GKTwPpnAwZivN2UkcMWt-qr3QUTPsmy2nz8nNGRLIBXezodcKzZoKg9bFwJDQ=w1200-h630-p

[16-Feb-19 02:06 PM] Alright#0419
is someone spamming chain?

[16-Feb-19 02:07 PM] Alright#0419
http://rogue.explorer.dexstats.info/

{Embed}
http://rogue.explorer.dexstats.info/
Komodo Explorer
Komodo Insight. View detailed information on all komodo transactions and block. {{ $root.title + $root.titleDetail }}

[16-Feb-19 02:07 PM] Alright#0419
what is going on there?

[16-Feb-19 02:07 PM] Alright#0419
oh it's resyncing?

[16-Feb-19 02:08 PM] SHossain#0007
i DM'd CHMEX

[16-Feb-19 02:08 PM] SHossain#0007
seems stuck

[16-Feb-19 02:10 PM] Alright#0419
wrong channel

[16-Feb-19 02:10 PM] Alright#0419
whoops

[16-Feb-19 03:22 PM] Mihailo#5902
@TonyL Added few parameters in bind, you can see it in rpc help, and there are two new rpcs for generating external chain address for a pubkey needed for deposit, and exporting private key in format of external chain for importing it for withdrawal

[16-Feb-19 03:22 PM] Mihailo#5902
I think that is it

[26-Feb-19 11:35 PM] TonyL#3577
@Mihailo ```./komodo-cli -ac_name=GWTEST3 gatewaysbind
gatewaysbind tokenid oracletxid coin tokensupply M N pubkey(s) pubtype p2shtype wiftype [taddr]```
```
 ./komodo-cli -ac_name=GWTEST3 gatewaysbind eefa162f14584a10d651474b177ad613c71c13e7fd590b9877d1da6180866dcc d3349f94510654d69ecd8d5ee267bf851bfcddae4324774218160b0de241c185 KMD 100000000 1 1 037defd3c07a5ab2ced41d73c0d53c87b18447b50d5b89097f08f2d4de3e6948e6 60 85 188
error code: -1
error message:
JSON value is not a string as expected
```
It seems I'm doing something wrong.

Could you please provide one working example?

[26-Feb-19 11:39 PM] Alright#0419
@TonyL the last arg must be deposit address

[26-Feb-19 11:39 PM] Alright#0419
the help info makes it seem optional, but from what i can tell, it isn't

[26-Feb-19 11:39 PM] TonyL#3577
Oh it's in [] I thought it's optional

[26-Feb-19 11:39 PM] TonyL#3577
So now I can set any deposit address I want? And in case of multisignature gateway - manual multisignature address creation is needed?

[26-Feb-19 11:41 PM] TonyL#3577
```./komodo-cli -ac_name=GWTEST3 gatewaysbind eefa162f14584a10d651474b177ad613c71c13e7fd590b9877d1da6180866dcc d3349f94510654d69ecd8d5ee267bf851bfcddae4324774218160b0de241c185 KMD 100000000 1 1 037defd3c07a5ab2ced41d73c0d53c87b18447b50d5b89097f08f2d4de3e6948e6 60 85 188 R9HqJ5Q17Gt9XjKAoWpxZp6imLGXzjPNyQ
{
  "result": "error",
  "error": "Gateway bind.KMD (eefa162f14584a10d651474b177ad613c71c13e7fd590b9877d1da6180866dcc) globaladdr.RKWpoK6vTRtq5b9qrRBodLkCzeURHeEk33 totalsupply 1.00000000 != fullsupply 0.00010000"
}
```

[26-Feb-19 11:43 PM] TonyL#3577
🤔 I specified whole supply, maybe it because of changes in AssetsCC
```./komodo-cli -ac_name=GWTEST3  tokeninfo eefa162f14584a10d651474b177ad613c71c13e7fd590b9877d1da6180866dcc
{
  "result": "success",
  "tokenid": "eefa162f14584a10d651474b177ad613c71c13e7fd590b9877d1da6180866dcc",
  "owner": "037defd3c07a5ab2ced41d73c0d53c87b18447b50d5b89097f08f2d4de3e6948e6",
  "name": "KMD",
  "supply": 100000000,
  "description": "Testing"
}
```

[26-Feb-19 11:51 PM] TonyL#3577
out of curiosity adjusted input params to error message and get other error:
``` ./komodo-cli -ac_name=GWTEST3 gatewaysbind eefa162f14584a10d651474b177ad613c71c13e7fd590b9877d1da6180866dcc d3349f94510654d69ecd8d5ee267bf851bfcddae4324774218160b0de241c185 KMD 10000 1 1 037defd3c07a5ab2ced41d73c0d53c87b18447b50d5b89097f08f2d4de3e6948e6 60 85 188 R9HqJ5Q17Gt9XjKAoWpxZp6imLGXzjPNyQ
error code: -1
error message:
illegal M or N > 15 or tokensupply or invalid tokenid```

[27-Feb-19 07:44 AM] jl777c#5810
@Mihailo

[27-Feb-19 10:36 AM] Mihailo#5902
taddr should be optional... It is not deposit address

[27-Feb-19 10:36 AM] Mihailo#5902
Let me check

[27-Feb-19 11:22 AM] Mihailo#5902
Small mistake, fixed. https://github.com/jl777/komodo/pull/1289

{Embed}
https://github.com/jl777/komodo/pull/1289
Fix gatewaysbind by Mixa84 · Pull Request #1289 · jl777/komodo
https://avatars3.githubusercontent.com/u/39563265?s=400&v=4

[27-Feb-19 03:09 PM] Mihailo#5902
BTW, taddr is 2nd byte of pubtype for chains that have 2 byte pubtype

[27-Feb-19 07:27 PM] TonyL#3577
@Mihailo can call gatewaysbind without taddr now, but other issue is still here:
```./komodo-cli -ac_name=GWTEST3 gatewaysbind eefa162f14584a10d651474b177ad613c71c13e7fd590b9877d1da6180866dcc d3349f94510654d69ecd8d5ee267bf851bfcddae4324774218160b0de241c185 KMD 100000000 1 1 037defd3c07a5ab2ced41d73c0d53c87b18447b50d5b89097f08f2d4de3e6948e6 60 85 188 
{
  "result": "error",
  "error": "Gateway bind.KMD (eefa162f14584a10d651474b177ad613c71c13e7fd590b9877d1da6180866dcc) globaladdr.RKWpoK6vTRtq5b9qrRBodLkCzeURHeEk33 totalsupply 1.00000000 != fullsupply 0.00010000"
}
```

[27-Feb-19 07:31 PM] TonyL#3577
If I remember correct @dimxy changed structure of vouts for tokens, so maybe at the moment gateways searching for total supply in not correct one

[27-Feb-19 07:31 PM] TonyL#3577
```./komodo-cli -ac_name=GWTEST3  tokeninfo eefa162f14584a10d651474b177ad613c71c13e7fd590b9877d1da6180866dcc
{
  "result": "success",
  "tokenid": "eefa162f14584a10d651474b177ad613c71c13e7fd590b9877d1da6180866dcc",
  "owner": "037defd3c07a5ab2ced41d73c0d53c87b18447b50d5b89097f08f2d4de3e6948e6",
  "name": "KMD",
  "supply": 100000000,
  "description": "Testing"
}```

[27-Feb-19 07:35 PM] Mihailo#5902
Oh, didn't know that vout structure is changed....

[27-Feb-19 07:35 PM] Mihailo#5902
Can you do tokenbalance?

[27-Feb-19 07:37 PM] TonyL#3577
@Mihailo 
```./komodo-cli -ac_name=GWTEST3 tokenbalance eefa162f14584a10d651474b177ad613c71c13e7fd590b9877d1da6180866dcc
{
  "result": "success",
  "CCaddress": "RG1HL1kV6MkeSURAKcc63qVkViSR6v9mZ1",
  "tokenid": "eefa162f14584a10d651474b177ad613c71c13e7fd590b9877d1da6180866dcc",
  "balance": 100000000
}```
```

[27-Feb-19 07:38 PM] Mihailo#5902
Ok so probably it is vout order. I'll fix it for tomorrow.

{Reactions}
👍 

[27-Feb-19 07:46 PM] dimxy#2587
yes I changed the vout order for 'c' tx (to adapt it for rogue_game):
Now
vout0 - marker
vout1 - value
(previously it was in backward order)

[28-Feb-19 06:06 PM] Mihailo#5902
@TonyL I forgot this morning about gateways problem, so I fixed it now.
https://github.com/jl777/komodo/pull/1296

{Embed}
https://github.com/jl777/komodo/pull/1296
Fix token vout number for Gateways by Mixa84 · Pull Request #1296...
https://avatars3.githubusercontent.com/u/39563265?s=400&v=4

[01-Mar-19 06:28 AM] TonyL#3577
@Mihailo Succesfully binded 👍 
```./komodo-cli -ac_name=GWTEST3 gatewaysinfo 299e4644967a2ecfa5140cc73c315464d116dac901c1e200fe20577c82bd089d
{
  "result": "success",
  "name": "Gateways",
  "pubkey": "037defd3c07a5ab2ced41d73c0d53c87b18447b50d5b89097f08f2d4de3e6948e6",
  "coin": "KMD",
  "oracletxid": "d3349f94510654d69ecd8d5ee267bf851bfcddae4324774218160b0de241c185",
  "taddr": 0,
  "prefix": 60,
  "prefix2": 85,
  "deposit": "R9R6jxDbncpEjk19VL9SVPQNktmhjksjmq",
  "tokenid": "eefa162f14584a10d651474b177ad613c71c13e7fd590b9877d1da6180866dcc",
  "totalsupply": "1.00000000",
  "remaining": "0.00000000",
  "issued": "1.00000000"
}
```

{Reactions}
👏 

[04-Mar-19 05:54 AM] TonyL#3577
@Mihailo 1 of 1 deposit/withdrawal worked like a charm for me: https://gist.github.com/tonymorony/dec8d1212707d3d817b984eaca680896
Nice prints now from oraclefeed :shexy:

{Embed}
https://gist.github.com/tonymorony/dec8d1212707d3d817b984eaca680896
gateways test 1of1
GitHub Gist: instantly share code, notes, and snippets.
https://avatars1.githubusercontent.com/u/24797699?s=400&v=4

{Reactions}
👍 👏 

[05-Mar-19 05:10 PM] Mylo#8306
@TonyL are you using a test chain and then locking up some KMD onto it with a gatewayCC?

[05-Mar-19 05:10 PM] Mylo#8306
(is this the right way to describe it?)

[05-Mar-19 05:11 PM] Mihailo#5902
We were testing usually with depositing KMD on KMD chain and gateway is created on AC.

{Reactions}
➕ 

[05-Mar-19 05:12 PM] Mihailo#5902
You lock KMD on deposit address, and get KMD token on AC in the same amount.

[05-Mar-19 05:13 PM] Mylo#8306
ok thanks mihailo

{Reactions}
yassinkomodo 

[08-Mar-19 03:37 AM] TonyL#3577
https://github.com/tonymorony/komodo_cryptoconditions_tui/blob/master/scripts/kmd_1of1gw_creation.py made 1of1 gw auto-creaiton script (to use just need to copy script to src with komodod, and copy tuilib.py to src/lib/tuilib.py and set desired ac on line 7 - will make it as cli arg in next revision)
CC: @smk762 -  dracocanis ominator

{Attachments}
https://cdn.discordapp.com/attachments/522052568466194450/553421110780362754/unknown.png

{Embed}
https://github.com/tonymorony/komodo_cryptoconditions_tui/blob/master/scripts/kmd_1of1gw_creation.py
tonymorony/komodo_cryptoconditions_tui
Terminal user interfaces for Komodo CryptoConditions smart-contracts - tonymorony/komodo_cryptoconditions_tui
https://avatars1.githubusercontent.com/u/24797699?s=400&v=4

{Reactions}
yassinkomodo 👌 (3) 

[08-Mar-19 03:38 AM] TonyL#3577
It taking 2 blocks (~2 minutes) to have 1of1 GW up and running

[10-Mar-19 08:31 AM] smk762 -  dracocanis ominator#7640
@Mihailo Test log today, had issues with gatewaysbind

