AuthorID;Author;Date;Content;Attachments;Reactions;
"448777271701143562";"smk762 -  dracocanis ominator#7640";"20-Dec-18 10:29 AM";"I'm keen to extend this oracle stuff to other sensors, recon it's be a good onboarding vector to give KMD exposure within the arduino geek community. They'll tend to be more willing and capable of understanding and playing with the tech via CLI etc.";"";"游녨 (1)";
"448777271701143562";"smk762 -  dracocanis ominator#7640";"20-Dec-18 10:31 AM";"be nice to compete with IOTA too 游땎";"";"";
"408251982885945344";"actionslacks#4072";"20-Dec-18 10:31 AM";"you should submit the project to hackaday.com";"";"";
"448777271701143562";"smk762 -  dracocanis ominator#7640";"20-Dec-18 10:32 AM";"yeah, I've been coding more than writing, but its on my list of tasks";"";"";
"448777271701143562";"smk762 -  dracocanis ominator#7640";"20-Dec-18 10:32 AM";"I'm not a fan of hype marketing, and my target audience I recon would prefer a story and schematics";"";"";
"448777271701143562";"smk762 -  dracocanis ominator#7640";"20-Dec-18 10:33 AM";"I'll be writing it up on leaflet / map geek forums too";"";"";
"412482228359266328";"CrisF#3405";"20-Dec-18 10:34 AM";"If you do that I know someone who might be  made interested.
His project sounds perfect for something like this.";"";"";
"448777271701143562";"smk762 -  dracocanis ominator#7640";"20-Dec-18 10:34 AM";"yeah for sure, I""m keen to have others test sensors and dashboards";"";"";
"408251982885945344";"actionslacks#4072";"20-Dec-18 10:34 AM";"it's not really hype. you should check out some of the other projects here https://hackaday.io/?from=had&utm_source=hackaday&utm_medium=menu&utm_campaign=blog";"";"";
"448777271701143562";"smk762 -  dracocanis ominator#7640";"20-Dec-18 10:35 AM";"if they have the hardware, I'd be keen to have a chat and see what we can do to display it on browser in a format that is useful for them";"";"";
"448777271701143562";"smk762 -  dracocanis ominator#7640";"20-Dec-18 10:36 AM";"nah, hackadays not hype. I meant the ussual twitter spam link you r friends for a token and join all our social media then like me on facebook so I feel validated and then spam it to your firends so you can have another coin";"";"";
"448777271701143562";"smk762 -  dracocanis ominator#7640";"20-Dec-18 10:36 AM";"hackaday is a perfect example of what I'm much more interestd in";"";"";
"448777271701143562";"smk762 -  dracocanis ominator#7640";"20-Dec-18 10:39 AM";"overall, I dont want to make $$ reselling hardware kits. I want to create a service that is useful and attracts those who build their own stuff. If staking can pay for oracle read/write operations, there's a gppd foundation for hodlers";"";"";
"448777271701143562";"smk762 -  dracocanis ominator#7640";"20-Dec-18 10:40 AM";"beyond that, I can consult on project ideas and help make dashboards etc.";"";"";
"408251982885945344";"actionslacks#4072";"20-Dec-18 10:41 AM";"wheres the rundown on your project? seems like it merits being pinned to the channel";"";"";
"448777271701143562";"smk762 -  dracocanis ominator#7640";"20-Dec-18 10:41 AM";"basically, byo hardware, use this DLT to handle data storage, and let me know if you have ideas you're willing to fund seeing happen on how to make the front end look nice";"";"";
"448777271701143562";"smk762 -  dracocanis ominator#7640";"20-Dec-18 10:42 AM";"technically, I'm announcing this weekend so I have time to respond to feedback etc.";"";"游 (1)";
"448777271701143562";"smk762 -  dracocanis ominator#7640";"20-Dec-18 10:42 AM";"but some late night brainstorming is up at https://www.dragonhound.tech/blog/";"";"游녧 (1)";
"448777271701143562";"smk762 -  dracocanis ominator#7640";"20-Dec-18 10:44 AM";"the more use cases people request me to create dashboards for, the more adaptable the overall system gets for everyone down the line.";"";"";
"448777271701143562";"smk762 -  dracocanis ominator#7640";"20-Dec-18 10:46 AM";"Seems to be in line with core Komodo philosophy. Tools are there for those willing to pick them up, and the community helps each other find new ways to use them.";"";"";
"448777271701143562";"smk762 -  dracocanis ominator#7640";"20-Dec-18 10:47 AM";"It's close to free to use, so anyone is welcome.";"";"";
"448777271701143562";"smk762 -  dracocanis ominator#7640";"20-Dec-18 10:47 AM";"long term, token value comes from the usability of system.";"";"";
"408251982885945344";"actionslacks#4072";"20-Dec-18 10:48 AM";"nice idea and bootstrap site. I need to get some sites built before I forget how to do it. you getting some signups?";"";"";
"448777271701143562";"smk762 -  dracocanis ominator#7640";"20-Dec-18 10:49 AM";"a few, but I""ve only posted the link two or three times, well hidden in the darker corners and without pingning everyone and there dog when I do";"";"";
"448777271701143562";"smk762 -  dracocanis ominator#7640";"20-Dec-18 10:50 AM";"Site still needs some content and polish, but back end is functional. I only started writing content last night";"";"";
"408251982885945344";"actionslacks#4072";"20-Dec-18 10:52 AM";"I think it's wise not to share too much before it's ready. the concept is a really good use case for blockchain. kudos.";"";"游꽅 (4)";
"448777271701143562";"smk762 -  dracocanis ominator#7640";"20-Dec-18 10:56 AM";"thanks, it's validated the proof of concept, but a long way to go adding other sensors and  dashboards";"";"";
"448777271701143562";"smk762 -  dracocanis ominator#7640";"20-Dec-18 10:57 AM";"theres still plenty to test and see how it scales in the wild";"";"";
"232679450301431808";"blackjok3r#3181";"20-Dec-18 10:59 AM";"right now it seems that a chain with very heavy oracles txs will bog down hard... so you would need many chains, with smaller block sizes rather than one chain with large blocks... I think this must be a bug or some other issue though, as other CCs liek dice are validating very fast. Full blocks of KMDICE are maybe 1 second to validate. 500tx of oracles takes multiple seconds.";"";"";
"455741312273219595";"jl777c#5810";"20-Dec-18 11:06 AM";"please work with @Mihailo to resolve the slow oracles";"";"游댠 (1),游녧 (1)";
"448777271701143562";"smk762 -  dracocanis ominator#7640";"20-Dec-18 11:06 AM";"looping without sleep is a brutal test case";"";"";
"455741312273219595";"jl777c#5810";"20-Dec-18 11:06 AM";"it could be an ordering of tx issue";"";"";
"448777271701143562";"smk762 -  dracocanis ominator#7640";"20-Dec-18 11:09 AM";"I'd anticipated needing a cluster, and can wirte oracles to different chains for different users. probably a good way to segregate different sensor types. Some poll less frequently like soil moisture wouldnt be more than hourly. GPS is set at 5 min, but could be 5 sec if power and data transmit cost isnt an issue. If an enterprise client needed a dedicated chain (with another chain to backup for redundancy) ensuring uptime, that should be doable too.";"";"";
"232679450301431808";"blackjok3r#3181";"20-Dec-18 11:21 AM";"Ive made the mempool accept the block transactions out of order sucessfully, which sped it up no end, but the block validation is still slow comapred to a full block of KMDICE.";"";"";
"459028995024093194";"kmdkrazy#8280";"21-Dec-18 12:32 AM";"i like the word InfiNet";"";"";
"232679450301431808";"blackjok3r#3181";"21-Dec-18 01:35 AM";"Man very close call... my old S5 phone decided to crap put, screen just stopped working for no reason... very lucky to have custom recovery on it and managed to boot into it and recover the Authenticator SQLite DB .. 游땐  Nearly got locked out of staked github, because @Alright  made me put 2FA on it.";"";"游땐 (2)";
"474206298427097099";"ComputerGenie 游놊游낖游닉#7004";"21-Dec-18 02:56 AM";"@blackjok3r I'm not sure what was wrong, all I know is that the miner (running 9 threads) wouldn't stop and locked some things up
browser worked, but bash locked up, so did the electron app I was trying to run and xfce4 task manager finally came up after 2 minutes, but was so locked up that it wouldn't even show any info";"";"";
"232679450301431808";"blackjok3r#3181";"21-Dec-18 03:34 AM";"hmm ok ... this was something I attempeted to fix, all the setgenerate stuff was totally messed up by verus, when they added -mint for staking mode.";"";"";
"232679450301431808";"blackjok3r#3181";"21-Dec-18 03:35 AM";"There was a condition that the staking loop would never exit from its loop on shutdown, thats fixed on latest. But tbh I didnt really test PoW after those changes, as it didnt seem relavent. Did you try to stop it with setgenerate false, or just `cli stop` ?";"";"";
"232679450301431808";"blackjok3r#3181";"21-Dec-18 03:37 AM";"there is also every chance that by making the staking loop not lock the daemon, the mining loop could now be screwed ... and maybe the best solution fo rthis is to just do what Verus did and copy the entrie mining function so there is a seperate one for staking, although that is very slopy and hard to maintain, it would allow us to stake and PoW at the same time.";"";"";
"412482228359266328";"CrisF#3405";"21-Dec-18 06:21 AM";"@@Ignacio Figueroa (FIG) 
Do you have any more info on your project you could share (website, github etc)?";"";"";
"474206298427097099";"ComputerGenie 游놊游낖游닉#7004";"21-Dec-18 06:28 AM";"`Did you try to stop it with setgenerate false, or just cli stop ?`
Yes, I tried setting false 1st (didn't want to shut daemon down, just free up threads for a few mins) and then tried stop after - neither worked
fwiw, it was the only time it locked; worked before and since, so it's not something specific that I can duplicate";"";"";
"323462995571245057";"Bar_F1sh_Rel#0834";"21-Dec-18 08:47 AM";"Urghhhh, just restarted notary with a new pull - komodo is taking so long to start that the script is erroring out.";"";"";
"371114647052615681";"Mylo#8306";"21-Dec-18 10:09 AM";"What is error @Bar_F1sh_Rel ?";"";"";
"371114647052615681";"Mylo#8306";"21-Dec-18 10:09 AM";"~/.komodo/debug.log";"";"";
"323462995571245057";"Bar_F1sh_Rel#0834";"21-Dec-18 10:19 AM";"Ahh. No error. Just taking ages to actually load. I can use startiguanna after about 10 minutes even though the start script says komodo did not start.";"";"";
"323462995571245057";"Bar_F1sh_Rel#0834";"21-Dec-18 10:20 AM";"Mostly sat at loading blocks when I watch getinfo";"";"";
"323462995571245057";"Bar_F1sh_Rel#0834";"21-Dec-18 10:30 AM";"Took 5 minutes to ""load guts"" according to the log. @Mylo";"";"";
"412482228359266328";"CrisF#3405";"21-Dec-18 10:54 AM";"Anyone having notarizations on CFEKED & CFEKING?";"";"";
"323462995571245057";"Bar_F1sh_Rel#0834";"21-Dec-18 10:57 AM";"Ed, ING and LF over 12 hours ago.";"";"";
"412482228359266328";"CrisF#3405";"21-Dec-18 10:58 AM";"4hr on LF & 19.5 on ED & ING here";"";"";
"448777271701143562";"smk762 -  dracocanis ominator#7640";"21-Dec-18 10:58 AM";"yeah I just restarted cos no ntx int 18hrs 游땭";"";"";
"448777271701143562";"smk762 -  dracocanis ominator#7640";"21-Dec-18 10:59 AM";"commented out my cron to start, thinkning it might be causing p[robs";"";"";
"412482228359266328";"CrisF#3405";"21-Dec-18 10:59 AM";"I restarted just over 4hrs ago due to kmd utxo not splitting.";"";"";
"412482228359266328";"CrisF#3405";"21-Dec-18 11:03 AM";"My staking nodes are down atm.  Is there any mining/staking going on on the 3 chains?";"";"";
"256821039462350849";"GlorymanRTS#0512";"21-Dec-18 11:22 AM";"When is the full KMDlabs discord available?";"";"";
"448777271701143562";"smk762 -  dracocanis ominator#7640";"21-Dec-18 11:34 AM";"how'd ya mean?";"";"";
"474206298427097099";"ComputerGenie 游놊游낖游닉#7004";"21-Dec-18 11:51 AM";"unlike some people, we don't have/need a separate discord; *this is* ""the full KMDlabs discord""";"";"";
"412482228359266328";"CrisF#3405";"21-Dec-18 12:26 PM";"Hmm... a CFEK discord might be nice to have though...";"";"";
"448777271701143562";"smk762 -  dracocanis ominator#7640";"21-Dec-18 12:29 PM";"I can barely keep up with all the KMD channels lol";"";"";
"412482228359266328";"CrisF#3405";"21-Dec-18 12:32 PM";"I picture the CFEK discord to basically have all of the KMD channels, but in a single channel.";"";"游땍 (2)";
"474206298427097099";"ComputerGenie 游놊游낖游닉#7004";"21-Dec-18 12:32 PM";"`a CFEK discord might be nice to have though...`
dafuq for?";"";"";
"412482228359266328";"CrisF#3405";"21-Dec-18 12:33 PM";"Keeping track of all the CFEKs 游땔";"";"";
"474206298427097099";"ComputerGenie 游놊游낖游닉#7004";"21-Dec-18 12:33 PM";"I see just fine here";"";"";
"412482228359266328";"CrisF#3405";"21-Dec-18 12:34 PM";"haha";"";"";
"474206298427097099";"ComputerGenie 游놊游낖游닉#7004";"21-Dec-18 12:34 PM";"speaking of...";"";"";
"474206298427097099";"ComputerGenie 游놊游낖游닉#7004";"21-Dec-18 12:34 PM";"`>>>>>>>>>>> CFEK dpow_sendrawtransaction ({""result"":null,""error"":{""code"":-26,""message"":""16: mandatory-script-verify-flag-failed (Script evaluated without error but finished with a false/empty top stack element)""},""id"":""jl777""}`";"";"";
"474206298427097099";"ComputerGenie 游놊游낖游닉#7004";"21-Dec-18 12:34 PM";"I think I broke it";"";"";
"412482228359266328";"CrisF#3405";"21-Dec-18 12:37 PM";"I'm only getting notarizations on CFEK now.";"";"";
"474206298427097099";"ComputerGenie 游놊游낖游닉#7004";"21-Dec-18 12:39 PM";"```-ASSET-       -NOTR- -UTXO-  -BLOX-    -BALANCE- -LAST- -CNCT-       
KMD                      43 1149485       4.0887  2d18h     17       
CFEK            1798      0   69284 202853134.8321  2d18h     19       
CFEKED          1775      0   65678       9.7892  5d11h     20       
CFEKING         1170      0   66690       9.8608  3d21h     19       
CFEKLF          1955      0   60738       9.7679  3d23h     20 ```";"";"";
"474206298427097099";"ComputerGenie 游놊游낖游닉#7004";"21-Dec-18 12:39 PM";"202853134.8321 in 0 UTXOs :shexy:";"";"";
"412482228359266328";"CrisF#3405";"21-Dec-18 12:40 PM";"Haha";"";"";
"412482228359266328";"CrisF#3405";"21-Dec-18 12:41 PM";"Mine haven't been splitting regularly.";"";"";
"474206298427097099";"ComputerGenie 游놊游낖游닉#7004";"21-Dec-18 12:42 PM";"mine is a little borked because I was a bad NN and haven't checked in 2 days and KMD was locked up and couldn't unlock because it needed manual attention";"";"";
"412482228359266328";"CrisF#3405";"21-Dec-18 12:50 PM";"btw, that CFEK balance of yours really throws out the alignment of things.  :trollface:";"";"";
"412482228359266328";"CrisF#3405";"21-Dec-18 12:56 PM";"Thanks, I'll have a look :)
Still using your old one.";"";"";
"474206298427097099";"ComputerGenie 游놊游낖游닉#7004";"21-Dec-18 12:59 PM";"`btw, that CFEK balance of yours really throws out the alignment of things.`
maybe, someday, someone will write a script that floats as needed....";"";"";
"412482228359266328";"CrisF#3405";"21-Dec-18 01:00 PM";"Or you can spend .0021";"";"";
"474206298427097099";"ComputerGenie 游놊游낖游닉#7004";"21-Dec-18 01:00 PM";"游뱑游낗";"";"";
"412482228359266328";"CrisF#3405";"21-Dec-18 01:00 PM";"Haha, guess still needs the truncating script.";"";"";
"474206298427097099";"ComputerGenie 游놊游낖游닉#7004";"21-Dec-18 01:01 PM";"actually it needs no such thing the answer is a single word";"";"";
"474206298427097099";"ComputerGenie 游놊游낖游닉#7004";"21-Dec-18 01:01 PM";"""arrays""";"";"";
"474206298427097099";"ComputerGenie 游놊游낖游닉#7004";"21-Dec-18 01:03 PM";"make all calls async (&) ..... stick results in 6 arrays ... wait... print";"";"";
"448777271701143562";"smk762 -  dracocanis ominator#7640";"21-Dec-18 01:08 PM";"!cfek tip @LabsAssistant 9999999999999999999999999999999999999999999999999999999";"";"trollface (3)";
"474206298427097099";"ComputerGenie 游놊游낖游닉#7004";"21-Dec-18 01:08 PM";"lol";"";"";
"412482228359266328";"CrisF#3405";"21-Dec-18 01:08 PM";"游냡";"";"游눮 (1)";
"242635006516658197";"jorian#4555";"21-Dec-18 01:08 PM";"danke sehr";"";"";
"474206298427097099";"ComputerGenie 游놊游낖游닉#7004";"21-Dec-18 01:14 PM";"@blackjok3r have you left yet?";"";"";
"448777271701143562";"smk762 -  dracocanis ominator#7640";"21-Dec-18 01:22 PM";"Its friday night here, and hot enough to fry an egg on a paint can. I'd wager jok3r is cooling off with some ice cold ales 游꽄";"";"";
"474206298427097099";"ComputerGenie 游놊游낖游닉#7004";"21-Dec-18 01:23 PM";"7am here in the real world :trollface:";"";"";
"448777271701143562";"smk762 -  dracocanis ominator#7640";"21-Dec-18 01:23 PM";"you're living in the past man";"";"";
"474206298427097099";"ComputerGenie 游놊游낖游닉#7004";"21-Dec-18 01:25 PM";"I grew up in the 80s, that's a given 游땥";"";"";
"448777271701143562";"smk762 -  dracocanis ominator#7640";"21-Dec-18 01:39 PM";"I started growing up in the 80s, but I'm far from finished";"";"";
"412482228359266328";"CrisF#3405";"21-Dec-18 01:39 PM";":mullet:";"";"abusedsmily (1)";
"448777271701143562";"smk762 -  dracocanis ominator#7640";"21-Dec-18 01:39 PM";"due for a comeback 游땎";"";"";
"448777271701143562";"smk762 -  dracocanis ominator#7640";"21-Dec-18 01:41 PM";"I shave my head when its too hot, and ignore it the rest of the year. If its not hot for a few years, I become a hippy";"";"";
"448777271701143562";"smk762 -  dracocanis ominator#7640";"21-Dec-18 01:43 PM";"seeing a lot of people with short back and sides, but long front, and then waxed up so it doesnt get in their face. I dont get it. mullet is far more practical.";"";"";
"412482228359266328";"CrisF#3405";"21-Dec-18 01:44 PM";"Yeah, prevents the back of the neck from burning 游";"";"";
"412482228359266328";"CrisF#3405";"21-Dec-18 01:44 PM";"Wouldn't want to be mistaken as a redneck!";"";"";
"448777271701143562";"smk762 -  dracocanis ominator#7640";"21-Dec-18 01:45 PM";"but sunburn is red...? makes no sense.";"";"";
