AuthorID;Author;Date;Content;Attachments;Reactions;
"448777271701143562";"smk762 -  dracocanis ominator#7640";"25-Oct-18 09:26 AM";"pools open - https://media.local10.com/photo/2016/01/21/crocodile-in-pool_1453391967556_1864720_ver1.0_1280_720.jpg";"";"😂 (2)";
"448777271701143562";"smk762 -  dracocanis ominator#7640";"25-Oct-18 09:26 AM";"Still some wierdness tho";"";"";
"448777271701143562";"smk762 -  dracocanis ominator#7640";"25-Oct-18 09:27 AM";"`2018-10-25 09:21:51 [Pool]      [stkdable] (Thread 1) getblocktemplate call failed for daemon instance 0 with error {""code"":-9,""message"":""Komodo is not connected!""}
2018-10-25 09:21:51 [Pool]      [stkdable] (Thread 1) Error with getblocktemplate on creating first job, server cannot start
`";"";"";
"448777271701143562";"smk762 -  dracocanis ominator#7640";"25-Oct-18 09:28 AM";"same for dust, pixy, ded and ccp. Perc never worked cos it was too perky.";"";"";
"448777271701143562";"smk762 -  dracocanis ominator#7640";"25-Oct-18 09:28 AM";"B1, W1 and ARB are ok.";"";"";
"448777271701143562";"smk762 -  dracocanis ominator#7640";"25-Oct-18 09:29 AM";"using `staked-cli getblocktemplate` returns same error on same coins";"";"";
"448777271701143562";"smk762 -  dracocanis ominator#7640";"25-Oct-18 09:32 AM";"other cli calls I've tried work for all chains";"";"";
"232679450301431808";"blackjok3r#3181";"25-Oct-18 09:50 AM";"https://i.imgur.com/7bgbDpN.png";"";"";
"232679450301431808";"blackjok3r#3181";"25-Oct-18 09:50 AM";"3 seperate streams each of 2MB of data repeated 11 times each";"";"";
"232679450301431808";"blackjok3r#3181";"25-Oct-18 09:50 AM";"`getdatafromblock` RPC is working just about perfectly.";"";"🚀 (3)";
"232679450301431808";"blackjok3r#3181";"25-Oct-18 09:51 AM";"you can even call it out of order on any block. The function got complicated after adding onto it for a couple of days.";"";"";
"232679450301431808";"blackjok3r#3181";"25-Oct-18 09:51 AM";"but I saved having to track things on sync...";"";"";
"232679450301431808";"blackjok3r#3181";"25-Oct-18 09:51 AM";"the 1 RPC call dos everything";"";"";
"232679450301431808";"blackjok3r#3181";"25-Oct-18 09:52 AM";"https://github.com/StakedChain/komodo/blob/streamer_recv/src/rpcblockchain.cpp#L285";"";"";
"232679450301431808";"blackjok3r#3181";"25-Oct-18 09:54 AM";"Last thing to verify is the 3 lots of data I sent are received exactly as sent... I cant see why they wont be, as early tests on the splitting algos etc all lined up and data cannot get lost in a blockchain.";"";"";
"232679450301431808";"blackjok3r#3181";"25-Oct-18 09:55 AM";"Mate just called me, hes in town for his bday so will be heading out ... 
Not aure whats up with that pool. the errors look like the RPC info is wrong maybe ?";"";"";
"232679450301431808";"blackjok3r#3181";"25-Oct-18 09:56 AM";"example output of RPC using `false` so there is no hex string:
```./komodo-cli -ac_name=TEST2 getdatafromblock 140 false
{
  ""streamid"": ""test2"",
  ""firsttxid"": ""fb0d0daa13dfb481a4018fe74137ca513eb5b2e52e0b154d66b1baee6fd7e4aa"",
  ""firstblockheight"": 137,
  ""firstseqid"": 718,
  ""lastseqid"": 956
}
```";"";"";
"232679450301431808";"blackjok3r#3181";"25-Oct-18 09:58 AM";"Guess next step here is to make a python dAPP to tie it all together so you can send a file and reassemble it back into a file as its being received via blocknotify.";"";"";
"448777271701143562";"smk762 -  dracocanis ominator#7640";"25-Oct-18 10:33 AM";"well I got 3 acs up to mine, can migrate from there as needed. will dig into the rest later";"";"";
"412482228359266328";"CrisF#3405";"25-Oct-18 12:19 PM";"Hi, all good with notarizations?  Seems I haven't been getting any for the last 10 hours and only see s others in recvmask.";"";"";
"412482228359266328";"CrisF#3405";"25-Oct-18 12:20 PM";"@Alright @blackjok3r  @smk762 -  dracocanis ominator  @CMaurice";"";"";
"412482228359266328";"CrisF#3405";"25-Oct-18 12:21 PM";"I'll re-start and see how that goes.";"";"";
"412482228359266328";"CrisF#3405";"25-Oct-18 12:39 PM";"Almost immediately after restart got o KMD and ARB notarization.";"";"";
"439780323497082880";"CMaurice#1685";"25-Oct-18 12:42 PM";"Notarizing here";"";"";
"412482228359266328";"CrisF#3405";"25-Oct-18 12:43 PM";"Thanks @CMaurice .  I've had a couple more.  re-start seems to have sorted things out.";"";"";
"439780323497082880";"CMaurice#1685";"25-Oct-18 12:45 PM";"Doesn't say to which chains on my output, out of interest which scripts are you using @CrisF ?";"";"";
"412482228359266328";"CrisF#3405";"25-Oct-18 01:12 PM";"I have a couple.  Sent in dm.";"";"";
"439780323497082880";"CMaurice#1685";"25-Oct-18 01:17 PM";"Useful, thanks";"";"👍 (1)";
"405011811511828481";"Alright#0419";"25-Oct-18 10:00 PM";"@blackjok3r I'd like to use the streamer to write full block hexs of each notarized chain to specific chain";"";"";
"405011811511828481";"Alright#0419";"25-Oct-18 10:00 PM";"this way, we won't end up in a situation where we cannot find a chain because no one has a copy of it";"";"";
"405011811511828481";"Alright#0419";"25-Oct-18 10:01 PM";"need to figure out how large that chain would get though";"";"";
"405011811511828481";"Alright#0419";"25-Oct-18 10:01 PM";"good news is that hardly anyone would need to run a node for it";"";"";
"133773904471785473";"daemonfox#6136";"26-Oct-18 12:49 AM";"Trying to catch up on all the things ive missed...";"";"";
"133773904471785473";"daemonfox#6136";"26-Oct-18 12:50 AM";"@Alright i saw you asked about a use case for a chain with on demand blocks and no rewards... I brought this up before one night";"";"";
"133773904471785473";"daemonfox#6136";"26-Oct-18 12:51 AM";"Using multiple chains to store single records sets of specfic data to a unique chain like how a database is structured in tables for certain record types.";"";"";
"133773904471785473";"daemonfox#6136";"26-Oct-18 12:51 AM";"Example is Point of Sale retail data";"";"";
"133773904471785473";"daemonfox#6136";"26-Oct-18 12:51 AM";"its transactional";"";"";
"133773904471785473";"daemonfox#6136";"26-Oct-18 12:52 AM";"One write command of multiple tables/chains of data like CUSTINFO, ITEMINFO, REQUESTEDDELIVERYDATE, ACCOUNTRECEIVABLES, PURCHASEORDERDETAILS etc etc";"";"";
"133773904471785473";"daemonfox#6136";"26-Oct-18 12:54 AM";"When our system writes a sale it touches no less than 12 MSSQL tables and then at least 8 tables in an older parent DB that maintains Accounting Ledgers";"";"";
"133773904471785473";"daemonfox#6136";"26-Oct-18 12:56 AM";"The use case would be a super lightweight hardware footprint that could be placed in every store to cache and relay the singular purchase transactions to the different chains so other services could run their own node anywhere they want and with proper keys to decrypt the data, parse it and use it for whatever other tasks or 3rd party service providers";"";"";
"133773904471785473";"daemonfox#6136";"26-Oct-18 12:56 AM";"Making it a super light weight way to replicate and distribute the data and have a guaranteed backup of that data";"";"";
"133773904471785473";"daemonfox#6136";"26-Oct-18 12:58 AM";"It would also make it super compatible to any frontend just passing the needed JSON and on demand block creation features";"";"";
"133773904471785473";"daemonfox#6136";"26-Oct-18 01:00 AM";"and this method could utilize CCs to accomplish most if not all of the work like a set of stored procedures in MSSQL.";"";"";
"232679450301431808";"blackjok3r#3181";"26-Oct-18 01:08 AM";"I think you could use the streamer for that";"";"";
"133773904471785473";"daemonfox#6136";"26-Oct-18 01:14 AM";"i dont understand the streamer stuff yet ive been gone to long...";"";"";
"133773904471785473";"daemonfox#6136";"26-Oct-18 01:14 AM";"too*";"";"";
"133773904471785473";"daemonfox#6136";"26-Oct-18 01:14 AM";"but im trying to catch up";"";"";
"232679450301431808";"blackjok3r#3181";"26-Oct-18 01:15 AM";"Basically its a chain that uses acpubkey";"";"";
"232679450301431808";"blackjok3r#3181";"26-Oct-18 01:16 AM";"And only the acpubkey can mine it";"";"";
"232679450301431808";"blackjok3r#3181";"26-Oct-18 01:16 AM";"On demand blocks";"";"";
"232679450301431808";"blackjok3r#3181";"26-Oct-18 01:16 AM";"Block time can be a low as a couple of seconds";"";"";
"232679450301431808";"blackjok3r#3181";"26-Oct-18 01:17 AM";"Can put any data as a hexsyring into it and fetch all the data per block";"";"";
"232679450301431808";"blackjok3r#3181";"26-Oct-18 01:17 AM";"Pretty mad";"";"";
"405011811511828481";"Alright#0419";"26-Oct-18 01:18 AM";"@blackjok3r what do you think of a streamer chain that saves all block data from every STAKED chain";"";"🤔 (1)";
"405011811511828481";"Alright#0419";"26-Oct-18 01:18 AM";"so we don't have to worry about backing up chains after we've stopped using them";"";"";
"133773904471785473";"daemonfox#6136";"26-Oct-18 01:21 AM";"@blackjok3r ok that sounds EXACTLY like what id be looking for";"";"";
"133773904471785473";"daemonfox#6136";"26-Oct-18 01:22 AM";"the hex data can only be read in plain text by the privkey holder correct?";"";"";
"133773904471785473";"daemonfox#6136";"26-Oct-18 01:22 AM";"thats the lynch pin for this idea in my scope";"";"";
"405011811511828481";"Alright#0419";"26-Oct-18 01:22 AM";"if you encrypt it sure";"";"";
"133773904471785473";"daemonfox#6136";"26-Oct-18 01:22 AM";"keeping the data private if someone stumbles on the chains";"";"";
"405011811511828481";"Alright#0419";"26-Oct-18 01:22 AM";"not encrypted by default";"";"";
"133773904471785473";"daemonfox#6136";"26-Oct-18 01:23 AM";"ok but the option is there and in RPC calls the frontend UI can enforce it";"";"";
"133773904471785473";"daemonfox#6136";"26-Oct-18 01:24 AM";"i need to brush up on java and make a slick app UI to capture the data I know I want and see streams handles it";"";"";
"133773904471785473";"daemonfox#6136";"26-Oct-18 01:24 AM";"I have the data model";"";"";
"133773904471785473";"daemonfox#6136";"26-Oct-18 01:24 AM";"I know what I want the end result to be so its a matter of tweaking what is here";"";"";
"133773904471785473";"daemonfox#6136";"26-Oct-18 01:25 AM";"Has anyone here tried using ClearLinux for any nodes?";"";"";
"232679450301431808";"blackjok3r#3181";"26-Oct-18 01:36 AM";"OK the only issiue I see is the way that the data is saved";"";"";
"232679450301431808";"blackjok3r#3181";"26-Oct-18 01:36 AM";"its a TxBlaster that has a setable timout";"";"";
"232679450301431808";"blackjok3r#3181";"26-Oct-18 01:37 AM";"Currently you can only stream 1 file at a time using it";"";"";
"405011811511828481";"Alright#0419";"26-Oct-18 01:37 AM";"how fast can you stream data?";"";"";
"232679450301431808";"blackjok3r#3181";"26-Oct-18 01:37 AM";"2MB every couple of seconds";"";"";
"232679450301431808";"blackjok3r#3181";"26-Oct-18 01:38 AM";"maybe faster if you sent it in larger chunks";"";"";
"405011811511828481";"Alright#0419";"26-Oct-18 01:38 AM";"well that 2mb includes the block and txs";"";"";
"405011811511828481";"Alright#0419";"26-Oct-18 01:38 AM";"yes?";"";"";
"232679450301431808";"blackjok3r#3181";"26-Oct-18 01:38 AM";"No";"";"";
"232679450301431808";"blackjok3r#3181";"26-Oct-18 01:38 AM";"you send 2MB to the marketmaker";"";"";
"405011811511828481";"Alright#0419";"26-Oct-18 01:38 AM";"so why 2mb a second?";"";"";
"232679450301431808";"blackjok3r#3181";"26-Oct-18 01:38 AM";"and it floods tx";"";"";
"232679450301431808";"blackjok3r#3181";"26-Oct-18 01:38 AM";"thats just what I tried so far";"";"";
"405011811511828481";"Alright#0419";"26-Oct-18 01:38 AM";"every couple of*";"";"";
"232679450301431808";"blackjok3r#3181";"26-Oct-18 01:38 AM";"I will try 10MB a second today and see if it works";"";"";
"232679450301431808";"blackjok3r#3181";"26-Oct-18 01:39 AM";"It has a sleep, of 1s every 1s until it sees data then it sends it";"";"";
"232679450301431808";"blackjok3r#3181";"26-Oct-18 01:39 AM";"each time you send data RPC to add to queue";"";"";
"232679450301431808";"blackjok3r#3181";"26-Oct-18 01:39 AM";"as soon as its added it sends the whole lot";"";"";
"232679450301431808";"blackjok3r#3181";"26-Oct-18 01:40 AM";"But the limitation is, that you can only send 1 stream at a time";"";"";
"232679450301431808";"blackjok3r#3181";"26-Oct-18 01:40 AM";"ts single threaded";"";"";
"232679450301431808";"blackjok3r#3181";"26-Oct-18 01:40 AM";"saving each chain in real time, would simply not work";"";"";
"405011811511828481";"Alright#0419";"26-Oct-18 01:40 AM";"so if what you're streaming is larger than block size, it streams it all at once then 2mb is confirmed at a time?";"";"";
"232679450301431808";"blackjok3r#3181";"26-Oct-18 01:40 AM";"It will just stay in mempool";"";"";
"232679450301431808";"blackjok3r#3181";"26-Oct-18 01:40 AM";"each block has 241 txs";"";"";
"232679450301431808";"blackjok3r#3181";"26-Oct-18 01:41 AM";"with 8kb chunk in each";"";"";
"232679450301431808";"blackjok3r#3181";"26-Oct-18 01:41 AM";"But pulling all the txs was too slow";"";"";
"405011811511828481";"Alright#0419";"26-Oct-18 01:41 AM";"is it confirmed in order?";"";"";
"232679450301431808";"blackjok3r#3181";"26-Oct-18 01:41 AM";"So I made an rpc that connects all the data togeter in a block and returns it as 1 peice";"";"";
"232679450301431808";"blackjok3r#3181";"26-Oct-18 01:41 AM";"yes";"";"";
"232679450301431808";"blackjok3r#3181";"26-Oct-18 01:41 AM";"each tx takes the change of the last tx";"";"";
"232679450301431808";"blackjok3r#3181";"26-Oct-18 01:41 AM";"so they have to be in order";"";"";
"232679450301431808";"blackjok3r#3181";"26-Oct-18 01:41 AM";"so far nothig has been out of order";"";"";
"232679450301431808";"blackjok3r#3181";"26-Oct-18 01:42 AM";"there is an error check for that";"";"";
"232679450301431808";"blackjok3r#3181";"26-Oct-18 01:42 AM";"but its never activated so far";"";"";
