AuthorID;Author;Date;Content;Attachments;Reactions;
"375074477756645386";"ca333#0118";"31-Oct-19 09:32 PM";"we do def. include this in the refactoring and general spam-countermeasures - so even if it is being targeted we are confident to optimize the DEX system to be able to handle very high load as aforementioned by jl777";"";"";
"455741312273219595";"jl777c#5810";"31-Oct-19 09:33 PM";"if a nationstate does a petabyte/sec Ddos against all the nodes... well nothing can withstand that, but short of some sustained insane level Ddos, with graceful degradation, things would be slower but not stopped. also, when we add filtering by known pubkeys, that will filter out a lot of spam";"";"";
"455741312273219595";"jl777c#5810";"31-Oct-19 09:34 PM";"this was the first atomicDEX stress test, it wasnt able to handle the load that was a lot higher than we expected";"";"";
"429101104480124929";"jspook16#3059";"31-Oct-19 09:34 PM";"I understand, I just want to get an idea of what is expected as it progresses";"";"";
"455741312273219595";"jl777c#5810";"31-Oct-19 09:34 PM";"the key is for the load handling to continuously improve and we certainly have a lot of ideas on how to do this";"";"";
"455741312273219595";"jl777c#5810";"31-Oct-19 09:34 PM";"as things progress, this level of traffic will become easy to handle";"";"";
"455741312273219595";"jl777c#5810";"31-Oct-19 09:34 PM";"then a higher level";"";"";
"455741312273219595";"jl777c#5810";"31-Oct-19 09:35 PM";"after that, it seems it is ready for mass usage";"";"";
"429101104480124929";"jspook16#3059";"31-Oct-19 09:36 PM";"what would you consider mass usage? on par with a typical CEX?";"";"";
"455741312273219595";"jl777c#5810";"31-Oct-19 09:36 PM";"what is a typical CEX?";"";"";
"429101104480124929";"jspook16#3059";"31-Oct-19 09:36 PM";"suppose one of the more popular ones...with high usage";"";"";
"455741312273219595";"jl777c#5810";"31-Oct-19 09:37 PM";"anything other than the major top CEX level of traffic i dont see any issues with, as the trade volumes are really not that big";"";"";
"429101104480124929";"jspook16#3059";"31-Oct-19 09:37 PM";"Copy";"";"";
"455741312273219595";"jl777c#5810";"31-Oct-19 09:37 PM";"we cant have lot of small orders due to blockchain based";"";"";
"455741312273219595";"jl777c#5810";"31-Oct-19 09:37 PM";"maybe it is possible to handle binance level trades, but that is not realistic for the blockchains to support, so it seems a moot point. really the load that needs to be able to handle is whatever load the blockchains can handle";"";"";
"455741312273219595";"jl777c#5810";"31-Oct-19 09:38 PM";"and that is much less than the major CEX trade counts";"";"";
"375074477756645386";"ca333#0118";"31-Oct-19 09:39 PM";"`what would you consider mass usage?` - being able to handle loads comparable to any CEX BUT with the big diff. that we will be able to scale this up dynamically - so even if the technical limits are reached (e.g. ~65k ports ) a dynamical scaling would allow us to cover hundreds of thousands if not millions of users once the system is near perfection.";"";"";
"375074477756645386";"ca333#0118";"31-Oct-19 09:39 PM";"yes - blockchains being a limitation too - agree on that.";"";"";
"455741312273219595";"jl777c#5810";"31-Oct-19 09:39 PM";"100 swaps per second, per orderbook seems the max the blockchain side can handle";"";"";
"455741312273219595";"jl777c#5810";"31-Oct-19 09:40 PM";"that is 6000 users doing a swap per minute (5 to 10 in parallel)";"";"";
"455741312273219595";"jl777c#5810";"31-Oct-19 09:40 PM";"which actually might be a level we touched today!";"";"✅ (4)";
"455741312273219595";"jl777c#5810";"31-Oct-19 09:40 PM";"so when we can handle 6000 users doing 1 swap per minute, that handles the blockchain capacity";"";"";
"375074477756645386";"ca333#0118";"31-Oct-19 09:41 PM";"on the other hand your multichain scalability solution could even bring the tech beyond this swap limit at some point in the future";"";"";
"455741312273219595";"jl777c#5810";"31-Oct-19 09:42 PM";"yes, a cluster of fungible chains can do 100 tx/sec per chain, but we can isolate the trading of each on in a different netid";"";"";
"455741312273219595";"jl777c#5810";"31-Oct-19 09:43 PM";"which means the 6000 users doing 1 swap per minute, per fungible chain can be handled across the netids";"";"";
"545600063460868096";"fat3lvis#6079";"31-Oct-19 09:44 PM";"It seems an average trade time, or network traffic indicator would be helpful right now. As it is we are just trading blindly, not know if there is a technical issue with our swap, or if it is just network saturation";"";"";
"545600063460868096";"fat3lvis#6079";"31-Oct-19 09:47 PM";"And is order queueing handled right now? I never waited more than a few minutes today. Would a swap go through eventually or are swaps attempted beyond the network capacity just going nowhere?";"";"";
"455741312273219595";"jl777c#5810";"31-Oct-19 09:52 PM";"once the network got saturated, it is like a door that had too many people trying to use it at once. some made it through, but most were colliding with others trying to get through.";"";"";
"455741312273219595";"jl777c#5810";"31-Oct-19 09:54 PM";"we did not expect 2000 simultaneous swap attempts for this first stress test, but that is what allowed to find where things meltdown first";"";"";
"455741312273219595";"jl777c#5810";"31-Oct-19 09:54 PM";"round 2, we will do much better, but it is not easy to reproduce such high levels of activity short of doing a public stress test, so until the next one, we wont know for 100% sure if the improvements are enough";"";"";
"352577127494713345";"phm87#7395";"31-Oct-19 09:59 PM";"it is possible to reproduce with neoload but it is a huge work";"";"";
"419964976397156352";"cipi#4502";"31-Oct-19 09:59 PM";"bandwith on one of the seed nodes, last 24h";"https://cdn.discordapp.com/attachments/584762059430821909/639584311707959326/image.png";"";
"419964976397156352";"cipi#4502";"31-Oct-19 10:00 PM";"swaps should work again now 🙂";"";"";
"419964976397156352";"cipi#4502";"31-Oct-19 10:04 PM";"another seed node, same time period";"https://cdn.discordapp.com/attachments/584762059430821909/639585505708867594/image.png";"";
"412323938782150658";"SHossain#0007";"31-Oct-19 10:05 PM";"very high load when the stress test started 😮";"";"";
"417671530642931713";"Andersen#8337";"31-Oct-19 10:12 PM";"someone  spaming  ?";"";"";
"412323938782150658";"SHossain#0007";"31-Oct-19 10:12 PM";"no. that is the stress test load";"";"";
"412323938782150658";"SHossain#0007";"31-Oct-19 10:12 PM";"from 2 seed node servers";"";"";
"412323938782150658";"SHossain#0007";"31-Oct-19 10:13 PM";"at 12pm it peaked as everyone joined the stress testing to get swaps done";"";"";
"597557300663812126";"Goku#9007";"31-Oct-19 10:25 PM";"Hello,
I got a question about a possible collaboration between AtomicDex and Coinomi.
What do dev's think about for being able directly from Coinomi to initiate atomic swaps?

It would bring to the most crypto users access to this awesome technology.";"";"";
"375074477756645386";"ca333#0118";"31-Oct-19 10:32 PM";"Hi @Goku - we are usually very open for all sort of collaborations. Please contact our Chief Strategist @Steve Lee";"";"👍 (1)";
"339387797196505110";"Patrick Crypto#1546";"31-Oct-19 11:05 PM";"@ca333 ""DEX app itself is very stable - i.e. no crashs"" while I haven't had the app outright crash and close itself, I have to basically restart it every time I use it because it seems to be unable to reopen connectivity once I switch away from it. Or even just going back from the order book and trying to open it again. It will go from showing say 7-10 orders to 1 to 'create an order'";"";"";
"375074477756645386";"ca333#0118";"31-Oct-19 11:18 PM";"thank you for the info @Patrick Crypto - can you please send me more infos (operating system version, smartphone device and atomicDEX mobile version) - will investigate this and try to reproduce.";"";"";
"493770472094171146";"Stinkfist#7610";"31-Oct-19 11:25 PM";"Hi, I was unable to make any swaps, tried for hours.. one of my main issues is most of the time, including now is the Rick and Morty coins were not available to even try to make any swaps. Seems quite unfair to have a contest that people that tried to enter could not...there was one time I was able to try to make some swaps and tried about 40 different ones, but not one even really tried to go through...I know a stress test is supposed to fail, but maybe the requirements to be eligible to win the contest should not have been related to active swaps...";"";"";
"412482228359266328";"CrisF#3405";"31-Oct-19 11:26 PM";"Hi @Stinkfist, do you mean that you didn't get coins from the faucet?";"";"";
"324027943267467265";"louchristopher#4954";"31-Oct-19 11:30 PM";"I had more than 130 attempted swaps but only 2 successful swaps went through. Did we have to have 30 successful swaps for the lottery?";"";"";
"412482228359266328";"CrisF#3405";"31-Oct-19 11:34 PM";"Hi @louchristopher, I'm envious :abusedsmily: I had quite a few attempts but no luck.
I believe the final results are still been checked.  Some logs were sent in later.";"";"";
"480696889096798219";"gigamesh#3544";"31-Oct-19 11:34 PM";"@louchristopher youre good";"";"";
"480696889096798219";"gigamesh#3544";"31-Oct-19 11:35 PM";"see #official📢";"";"☝ (1)";
"324027943267467265";"louchristopher#4954";"31-Oct-19 11:35 PM";"Thank you.";"";"";
"375074477756645386";"ca333#0118";"31-Oct-19 11:35 PM";"@louchristopher no - we reduced the reqs so even if no swaps went through but you re listed in the leaderboard you do qualify. And we will also randomly honor testers that didn't make it to the leaderboard at all.";"";"";
"480696889096798219";"gigamesh#3544";"31-Oct-19 11:36 PM";"> randomly honor testers that didn't make it to the leaderboard at all";"";"";
"480696889096798219";"gigamesh#3544";"31-Oct-19 11:37 PM";"🤞";"";"";
"480696889096798219";"gigamesh#3544";"31-Oct-19 11:38 PM";"on closer inspection i cannot see any evidence of the successful swap i thought i had... was i dreaming?";"";"";
"412482228359266328";"CrisF#3405";"31-Oct-19 11:50 PM";"@louchristopher I'm seeing someone who has more than 30 on the leaderboard.  Not sure of the update status on that.  You can follow here: `https://oracle.earth/mm2_stresstest_combined_leaderboard/`";"";"";
"396335081750528002";"benzo365#8202";"01-Nov-19 12:07 AM";"Cleared all my order. None were successful. Created one just now...still stuck on matching
3d4668ed-52f7-4fe6-b402-49138871dcbb";"";"";
"493770472094171146";"Stinkfist#7610";"01-Nov-19 12:10 AM";"@CrisF I was able get the faucet, but most of the time they showed up as unconfirmed, I got them to show up maybe twice, we’ll the morty ones did the rick ones never showed up at any point";"";"";
"412482228359266328";"CrisF#3405";"01-Nov-19 12:12 AM";"Hi @benzo365 ,  I was the same.  the most recent trade I started, just after your message, got a match.";"";"";
"412482228359266328";"CrisF#3405";"01-Nov-19 12:14 AM";"@Stinkfist Good that you were able to have a chance to trade then.  What did the explorer say about the RICK?";"";"";
"480696889096798219";"gigamesh#3544";"01-Nov-19 12:16 AM";"played with Chainswap a couple days ago. iirc both parties had to be online to perform a swap. is the same true of atomic?";"";"";
"459028995024093194";"kmdkrazy#8280";"01-Nov-19 12:25 AM";"Yes";"";"";
"462404376145952779";"Artist#0765";"01-Nov-19 12:26 AM";"Well I came In top 40";"";"";
"462404376145952779";"Artist#0765";"01-Nov-19 12:26 AM";"Xd";"";"";
"386470623699795971";"花果山#5224";"01-Nov-19 12:31 AM";"I successfully exchanged 13 times. Later I saw that there were too many failures. I deleted the app and reinstalled it.";"";"";
"386470623699795971";"花果山#5224";"01-Nov-19 12:31 AM";"The statistics list data is not accurate.";"";"";
"493770472094171146";"Stinkfist#7610";"01-Nov-19 12:33 AM";"Here is the transaction for the morty still says unconfirmed 83c4bb9ff62f7bf74716c476c9995b0e5f9a93d86435fa68c3292c01f4c3df24.   And here is the rick which also still says unconfirmed c0126f8697ab711c25cbe168a948ba259cee6d07068ade92c7930c193e605545.";"";"";
"386470623699795971";"花果山#5224";"01-Nov-19 12:40 AM";"https://rick.kmd.dev/address/R9qBZ1rvyAQeU7Cxg6BkQojwRG93gy9ZRx";"";"";
"386470623699795971";"花果山#5224";"01-Nov-19 12:40 AM";"https://morty.kmd.dev/address/R9qBZ1rvyAQeU7Cxg6BkQojwRG93gy9ZRx";"";"";
"386470623699795971";"花果山#5224";"01-Nov-19 12:44 AM";"From the chain, I have not only successfully exchanged 1 time.";"";"";
"480696889096798219";"gigamesh#3544";"01-Nov-19 01:18 AM";"@Stinkfist i have one of those too. never got confirmed";"";"";
"480696889096798219";"gigamesh#3544";"01-Nov-19 01:19 AM";"even tho i did badly it was still fun";"";"";
"181629914548666377";"AkiraX#8269";"01-Nov-19 02:54 AM";"Is it over?";"";"";
"462404376145952779";"Artist#0765";"01-Nov-19 03:20 AM";"yes";"";"";
"459028995024093194";"kmdkrazy#8280";"01-Nov-19 04:51 AM";"I think I did another historical feat for a user.... I got 6 tx in 1 block yesterday - block 131791";"";"";
"379305212541927435";"joker-h#1785";"01-Nov-19 05:27 AM";"I had 1 successful swap, and it was at 18:03 , no lottery tickets for me 😭";"";"";
"457971615389581313";"Jimm B.#9993";"01-Nov-19 05:53 AM";"@joker-h the conditions have changed. Check #official";"";"";
"345992331276713984";"Acura#2748";"01-Nov-19 06:01 AM";"AtomicDex  Update for iOS released";"";"";
"406179072922746882";"polycryptoblog#1173";"01-Nov-19 06:09 AM";"Just wanted to post something I noticed , last night about 12 hours or so before the test is when I first noticed the slowness of rick and morty swaps, I switched to doing other coin demos for a bit.";"";"";
"406179072922746882";"polycryptoblog#1173";"01-Nov-19 06:10 AM";"The main difference between earlier swaps and that period was the orderbook size .";"";"";
"480696889096798219";"gigamesh#3544";"01-Nov-19 07:28 AM";"well ill post my address on the off-chance it helps me get in the pool of ""testers that didn't make it to the leaderboard at all""!";"";"";
"480696889096798219";"gigamesh#3544";"01-Nov-19 07:28 AM";"RK3Ytedp7eAt3JxbDThpQ2EAD49X5eCs1i";"";"";
"480696889096798219";"gigamesh#3544";"01-Nov-19 07:29 AM";"respect to whoever got over 30. dunno how you managed that 🙂";"";"";
"480696889096798219";"gigamesh#3544";"01-Nov-19 07:31 AM";"do the devs want our logs? ill send them on if desired";"";"";
"462404376145952779";"Artist#0765";"01-Nov-19 09:09 AM";"I made 2 succesful";"";"";
"462404376145952779";"Artist#0765";"01-Nov-19 09:09 AM";"And like 100 plus failed";"";"";
"462404376145952779";"Artist#0765";"01-Nov-19 09:09 AM";"XD";"";"";
"356887295154061312";"tese#3502";"01-Nov-19 09:10 AM";"I still dont appear in the leaderboard with more than 15 :( Lets wait to the logs review for the final results";"";"";
"462404376145952779";"Artist#0765";"01-Nov-19 09:10 AM";"Ooh";"";"";
"396750490223902721";"Umaru#8531";"01-Nov-19 09:17 AM";"how can see leaderboard?";"";"";
"420701856877248512";"Big Dog#1093";"01-Nov-19 09:23 AM";"We all should win a share";"";"";
"345992331276713984";"Acura#2748";"01-Nov-19 09:31 AM";"https://oracle.earth/mm2_stresstest_combined_leaderboard/";"";"1⃣ (1),✅ (2),🤓 (1),👌 (1)";
"405500395578720257";"RNI#2666";"01-Nov-19 09:34 AM";"tried a lot of swaps but unfortunately they all timed out";"";"";
"227616269229228034";"BoBot-BUY KMD#8821";"01-Nov-19 10:06 AM";"yea same here I tried like 40 times and no swaps went through tried to select random bids then tried to put my own ask and none went through";"";"";
"345992331276713984";"Acura#2748";"01-Nov-19 10:28 AM";"Google Trends AtomicDex";"https://cdn.discordapp.com/attachments/584762059430821909/639772793524977694/unknown.png";"👍 (3)";
"403205523433848833";"farl#9964";"01-Nov-19 10:39 AM";"https://tenor.com/view/will-ferrell-old-school-gif-5531028";"";"😅 (2),🎉 (1)";
"405380797537976320";"Cryptoon#3362";"01-Nov-19 11:47 AM";"just entered a new order with new update";"";"";
"405380797537976320";"Cryptoon#3362";"01-Nov-19 11:47 AM";"match in 10 secs";"";"";
"375074477756645386";"ca333#0118";"01-Nov-19 12:02 PM";"did you notice the halloween special @Cryptoon ?";"";"tux_scream (4)";
"405380797537976320";"Cryptoon#3362";"01-Nov-19 12:06 PM";"😏";"https://cdn.discordapp.com/attachments/584762059430821909/639797405226893332/image0.png";"";
"405380797537976320";"Cryptoon#3362";"01-Nov-19 12:06 PM";"Freddieeee";"";"";
