AuthorID;Author;Date;Content;Attachments;Reactions;
"232679450301431808";"blackjok3r#3181";"09-Nov-18 10:31 AM";"Merging all tis stuff into `mastertest` branch ... going to amek sure it builds, take some notes on how to activate and use everything and then merge it to master ... it could break everything but we are just about ready to start a new testnet. MLT is mostl likely deaded dude... wouldnt worry about it.";"";"";
"412482228359266328";"CrisF#3405";"09-Nov-18 10:32 AM";"Yeh, figured.";"";"";
"232679450301431808";"blackjok3r#3181";"09-Nov-18 10:32 AM";"Libscott fix, and CFEKED are both working perfectly for momom  so we will take libscotts sledgehammer fix";"";"👍 (1)";
"232679450301431808";"blackjok3r#3181";"09-Nov-18 10:33 AM";"That some how ended up in the dwy_mitigaton branch, due to some git funkyness .. so I will just merge it into master... its ot causing any problems, apart  from some, false possitive error messages on migrates or chain sync.";"";"";
"232679450301431808";"blackjok3r#3181";"09-Nov-18 10:34 AM";"he said that can ebe fixed mostly, by maing it look for the first momom that its normally looking for without the fix then if that fails, scanning aorund... I";"";"";
"232679450301431808";"blackjok3r#3181";"09-Nov-18 10:34 AM";"ll see if i cna work that out and put it in.";"";"👌 (1)";
"412482228359266328";"CrisF#3405";"09-Nov-18 10:35 AM";"btw, not sure if intentional but superpad is showing a bad gateway.
http://pad.supernet.org/staked_proposals";"";"";
"232679450301431808";"blackjok3r#3181";"09-Nov-18 10:35 AM";"no that should not be like that .:S";"";"";
"232679450301431808";"blackjok3r#3181";"09-Nov-18 10:35 AM";"hopefully Alright has a copy of that";"";"";
"412482228359266328";"CrisF#3405";"09-Nov-18 10:40 AM";"I have a copy of the original if needed (no comments or changes on it)";"";"👍 (1)";
"232679450301431808";"blackjok3r#3181";"09-Nov-18 11:33 AM";"LOL ... jst ran the filter on blackjok3r3 staked notary on KMD.... took about 30mins to import the private key, 46,000 txs in the wallet ... 3mins at only 10% cpu one core, to run the filter over it.... just hung for an eternity.... But at the end, left it with 170 txs in the wallet. Seems stable, even if slow ... I think that remvoing the LOCK(cs_walelt) from the erase function might speed it up a heap, but it also seems super unsafe... so not going to. Staked chains do use the erasefromwallet function at times, so removing the lock seems dangerous.";"";"";
"232679450301431808";"blackjok3r#3181";"09-Nov-18 11:35 AM";"In any casethe first time you run it, you should just send entire balance and run `clearwalletnotarisations <txid>` of the send balance to self... and it will start with a single tx in the wallet, just as if you used hte old reset methods.";"";"👌 (1)";
"412482228359266328";"CrisF#3405";"09-Nov-18 12:00 PM";"If you'd like someone else to test (risk 😋 ) it I'll give it a go.";"";"";
"232679450301431808";"blackjok3r#3181";"09-Nov-18 12:03 PM";"I am comipliing mastertest on blackjok3r notary 0 right now... if it loads all chains and runs ok and notarises... I will push it all to master. There are a few changes to the start scripts needed.. kmd needs to run with `-stakednotary=1` instead of `-notary`";"";"";
"232679450301431808";"blackjok3r#3181";"09-Nov-18 12:04 PM";"The hardest issue to solve, was that on start up, the R address's cannot be calculated... so I had to devise an entrily new way for staked notareies to activate and work. 😮";"";"👍 (1)";
"232679450301431808";"blackjok3r#3181";"09-Nov-18 12:05 PM";"Im very pleased how it worked out though ... as long as its stable and working that is.";"";"";
"232679450301431808";"blackjok3r#3181";"09-Nov-18 12:05 PM";"really hope it all works properly and I can move onto something else";"";"";
"232679450301431808";"blackjok3r#3181";"09-Nov-18 12:05 PM";"taken a whole week ol";"";"";
"412482228359266328";"CrisF#3405";"09-Nov-18 12:06 PM";"Yeah, you certainly put in some time!";"";"";
"232679450301431808";"blackjok3r#3181";"09-Nov-18 12:06 PM";"It ahd to be done at some point.... the code was totally shitty and we would have hit really stupid issues after about 10 eras";"";"";
"232679450301431808";"blackjok3r#3181";"09-Nov-18 12:07 PM";"and keeping it readable would have been impossible";"";"";
"232679450301431808";"blackjok3r#3181";"09-Nov-18 12:28 PM";"```postest@FeederNode:~/StakedNotary$ komodo-cli cleanwalletnotarisations
{
  ""total_transactons"": 2217,
  ""remaining_transactons"": 106,
  ""removed_transactions"": 2111
}
postest@FeederNode:~/StakedNotary$ ./asset-cli CFEK cleanwalletnotarisations
{
  ""total_transactons"": 617,
  ""remaining_transactons"": 20,
  ""removed_transactions"": 597
}
postest@FeederNode:~/StakedNotary$ ./asset-cli CFEKED cleanwalletnotarisations
{
  ""total_transactons"": 614,
  ""remaining_transactons"": 152,
  ""removed_transactions"": 462
}
postest@FeederNode:~/StakedNotary$ ./asset-cli CFEKING cleanwalletnotarisations
{
  ""total_transactons"": 532,
  ""remaining_transactons"": 196,
  ""removed_transactions"": 336
}
```";"";"";
"232679450301431808";"blackjok3r#3181";"09-Nov-18 12:41 PM";"Seems to be working prety welll ...";"";"";
"232679450301431808";"blackjok3r#3181";"09-Nov-18 12:42 PM";"I found a pretty bad flaw with the 0BR chains though";"";"";
"232679450301431808";"blackjok3r#3181";"09-Nov-18 12:42 PM";"I mined them all on my notary early on, and my wallet is full of 0.00000 value UTXO, cant send them, cant do anything.";"";"";
"232679450301431808";"blackjok3r#3181";"09-Nov-18 12:42 PM";"maybe I need a raw transaction 🤔";"";"";
"232679450301431808";"blackjok3r#3181";"09-Nov-18 12:43 PM";"On the streamer chain I solved this, by sending all the 0BR's to the CRYPTO777 address 😄";"";"";
"232679450301431808";"blackjok3r#3181";"09-Nov-18 12:43 PM";"might be somethign we need to look at... A random address we cna direct all 0 BR utxo's at.";"";"";
"232679450301431808";"blackjok3r#3181";"09-Nov-18 12:46 PM";"https://github.com/StakedChain/komodo/pull/43/files";"";"";
"232679450301431808";"blackjok3r#3181";"09-Nov-18 12:47 PM";"Just testing start.sh required changes... then will push that ... assetchains.json can be changed to use all branches on master too...";"";"";
"412482228359266328";"CrisF#3405";"09-Nov-18 12:51 PM";"Send them to the blaster wallet as ammo ✴ 🔫";"";"";
"232679450301431808";"blackjok3r#3181";"09-Nov-18 12:59 PM";"lol";"";"";
"232679450301431808";"blackjok3r#3181";"09-Nov-18 01:52 PM";"@LabsAssistant 
Update to StakedNotary and StakedChain/komodo 
Please do `git pull` in `~/StakedNotary ` 
And then `start.sh`
I think I fixed the start.sh getting stuck on CFEK also.  Please report if this si not the case... I had one node fail to start CFEKING, but upon a second `start.sh` it worked.";"";"";
"232679450301431808";"blackjok3r#3181";"09-Nov-18 01:53 PM";"This is a huge update ... there has to be bugs, please checkout the new getinofo on KMD and CFEK chains... MLT is likely deaded .. I didnt remove it as of yet, if its not working for you dont worry about it.";"";"";
"439780323497082880";"CMaurice#1685";"09-Nov-18 02:07 PM";"Ok, done, won't be able to check functioning until later though";"";"";
"400570483906707456";"gt#2812";"09-Nov-18 02:09 PM";"working well";"";"";
"439780323497082880";"CMaurice#1685";"09-Nov-18 02:12 PM";"5 chains up with FSM_mempooltest/komodod for MLT";"";"";
"439780323497082880";"CMaurice#1685";"09-Nov-18 02:15 PM";"Yeah, now just connections refused for MLT after start. Back later";"";"";
"232679450301431808";"blackjok3r#3181";"09-Nov-18 02:15 PM";"MLT is fooked dw about it ... probably should have removed it";"";"";
"232679450301431808";"blackjok3r#3181";"09-Nov-18 02:15 PM";"infact will do that now";"";"";
"232679450301431808";"blackjok3r#3181";"09-Nov-18 02:18 PM";"Pushed assetchains.json without MLT ... no nede tp update if you already have, unliey its working anyway.";"";"👍 (1)";
"232679450301431808";"blackjok3r#3181";"09-Nov-18 02:30 PM";"`assets-cli cleanwalletnotarisations` is working perfectly for me ... almost instant wallet reset, no down time 😄";"";"";
"412482228359266328";"CrisF#3405";"09-Nov-18 02:32 PM";"All good for me, too.";"";"";
"412482228359266328";"CrisF#3405";"09-Nov-18 02:33 PM";"Wallet already cleaned so not a lot for it to do:/";"";"";
"412482228359266328";"CrisF#3405";"09-Nov-18 02:33 PM";"Smooth   though.";"";"";
"232679450301431808";"blackjok3r#3181";"09-Nov-18 02:33 PM";"I cant beleive how good it works tbh ... although it was a head fuck to work out... Some very very strange things happened along the way I had to figure out .";"";"👺 (1)";
"400570483906707456";"gt#2812";"09-Nov-18 02:46 PM";"clean working fine";"";"🚀 (1)";
"232679450301431808";"blackjok3r#3181";"09-Nov-18 02:46 PM";"you can do it on `komodo-cli` aswell ... I will write a script to replac ethe wallet resetters at a later date.";"";"";
"232679450301431808";"blackjok3r#3181";"09-Nov-18 02:49 PM";"I guess once we know its stable and definatly causing no isues, it can be automatically called inside the daemon perodically if a node is a staked notary (which they now identify them selvs automatically, do a `getinfo` call 😉 )";"";"";
"232679450301431808";"blackjok3r#3181";"09-Nov-18 02:50 PM";"This was pretty much the last remaining thing a notary node needed for maintenance... pretty much self runnig now I think.";"";"";
"400570483906707456";"gt#2812";"09-Nov-18 03:05 PM";"oh yeah nice update on the getinfo";"";"";
"232679450301431808";"blackjok3r#3181";"09-Nov-18 03:07 PM";"That was the hardest thing I had to work out ... the getinfo display was trivial ... its the code that makes it possible that was hard ...";"";"";
"439780323497082880";"CMaurice#1685";"09-Nov-18 04:44 PM";"teehee";"";"";
"439780323497082880";"CMaurice#1685";"09-Nov-18 04:44 PM";"`komodo-cli cleanwalletnotarisations                                             │·········
{                                                                                                                │·········
  ""total_transactons"": 31791,                                                                                    │·········
  ""remaining_transactons"": 275,                                                                                  │·········
  ""removed_transactions"": 31516                                                                                  │·········
}`";"";"";
"371114647052615681";"Mylo#8306";"09-Nov-18 05:14 PM";"sent msg about pad.supernet 502-ing";"";"🙏 (1)";
"323462995571245057";"Bar_F1sh_Rel#0834";"09-Nov-18 06:08 PM";"Still  want to try running a notary - can I send a pubkey in?";"";"";
"232679450301431808";"blackjok3r#3181";"10-Nov-18 03:11 AM";"Not sure at this stage. I think I need to make new chains in a day or 2, you can send pubkey to me and I'll put it into the code if you like";"";"";
"232679450301431808";"blackjok3r#3181";"10-Nov-18 05:05 AM";"Started new migrate loops ... From CFEK->LF->ING->ED->CFEK";"";"";
"232679450301431808";"blackjok3r#3181";"10-Nov-18 05:06 AM";"10 coins per, 5000 migrates from each chain.";"";"";
"232679450301431808";"blackjok3r#3181";"10-Nov-18 05:06 AM";"If thesea re all confirmed working in about a day or 2, we can move on from testing MoMoM, and consider it fixed.";"";"";
"232679450301431808";"blackjok3r#3181";"10-Nov-18 05:07 AM";"if anyne else can do some loops as well that wil be helpful, dont do what I am doing, make sure thate all chains are on latest master, including KMD.";"";"";
"232679450301431808";"blackjok3r#3181";"10-Nov-18 05:10 AM";"Had an idea for the 0 BR problem too, we cna just make the wallet ignore utxo with 0 value...";"";"";
"232679450301431808";"blackjok3r#3181";"10-Nov-18 05:10 AM";"They exist on chain, as a coninbase, but the wallet will just ignore their existance, seems it cannot spend them anyway.";"";"";
"232679450301431808";"blackjok3r#3181";"10-Nov-18 05:50 AM";"Found one possible problem with the cleannwalletnotarisations RPC ... it may require that the wallet is reset to a single utxoo before using it more than once. ... a-team just ended up with a utxo (one that is split) that someehow got left behind after 2 calls of the RPC... I will monitor it, I dont think its an issue if the wallet starts from a single utxo... 

There was some logic I added to stop this from happening, but I can see how it cant work, if there are transacitons more than 3 txs deep saved in the wallet. 
Problem is, is that it deletes the txs that came after this tx, so then the wallet sees this tx as unspent. I didnt add logic to iterate back further than 3 txs deep for preformance reasons, but if starting from 1 utxo then splitting, notarising and running the wallet filter, it will always delete the tx it started with on each run, and should not happen.";"";"";
"232679450301431808";"blackjok3r#3181";"10-Nov-18 05:51 AM";"Just to amke sure, please dont run the filter more than once on staked notaries, until I have workied this out, you will end up unabe to split utxo and you will stop notarising.";"";"";
"370026641323327491";"ph03nix#3115";"10-Nov-18 05:54 AM";"i think this channel deserves to be in the TECHNOLOGY section";"";"";
"370026641323327491";"ph03nix#3115";"10-Nov-18 05:55 AM";"my 2 komodos...";"";"";
"232679450301431808";"blackjok3r#3181";"10-Nov-18 05:55 AM";"not so sure .... its a 3rd party project, KMD fork after all";"";"";
"232679450301431808";"blackjok3r#3181";"10-Nov-18 05:55 AM";"Although anything I make thats really good, gets a PR to KMD eventually";"";"";
"370026641323327491";"ph03nix#3115";"10-Nov-18 05:56 AM";"cool 👌";"";"";
"232679450301431808";"blackjok3r#3181";"10-Nov-18 05:57 AM";"This latest ""feature"" is hella dangerous... but if I can get it working with no problems, then notary nodes run themselvs, no mainetenace required. Much the same as running any normal master node. 😄";"";"";
"370026641323327491";"ph03nix#3115";"10-Nov-18 05:57 AM";"interesting";"";"";
"232679450301431808";"blackjok3r#3181";"10-Nov-18 05:58 AM";"I want the notary operators to focus on their real job here, and thats decideing what to notarise, and who deservs bug bounties, if they are spending time on maintenace and keepingthe node in an operational state their time might not be focued where it needs to be.";"";"🆒 (1)";
"232679450301431808";"blackjok3r#3181";"10-Nov-18 05:59 AM";"We dont want a situation, where me and Alright, choose which chains everyone should notarise, and blindly follow our orders, the notaries have the power, not us.";"";"";
"232679450301431808";"blackjok3r#3181";"10-Nov-18 06:02 AM";"With a heavliy stake based approach, its in notaries best interst financially to do what is best for the network... Effectivly there can even be multiple notary networks playing off against each other competing for chains to notarise, will be very interesting to see hwo it all pans out.";"";"coolpirate (1)";
"232679450301431808";"blackjok3r#3181";"10-Nov-18 06:03 AM";"Although each network of notaries needs a KMD notary node to fund the notarisations to KMD .... otherwise they need to purchase it at mrket value.";"";"";
"370026641323327491";"ph03nix#3115";"10-Nov-18 06:09 AM";"so, is the idea here a bunch of chains all notarizing to each other?";"";"";
"370026641323327491";"ph03nix#3115";"10-Nov-18 06:11 AM";"i've been following but i don't quite get the concept of staked";"";"";
"370026641323327491";"ph03nix#3115";"10-Nov-18 06:12 AM";"i just see a bunch of crazy innovation";"";"";
"232679450301431808";"blackjok3r#3181";"10-Nov-18 06:17 AM";"no all chains notariise to KMD";"";"";
"232679450301431808";"blackjok3r#3181";"10-Nov-18 06:17 AM";"There is one chain called STAKED";"";"";
"232679450301431808";"blackjok3r#3181";"10-Nov-18 06:17 AM";"that is 51% PoS 49% PoW";"";"";
"232679450301431808";"blackjok3r#3181";"10-Nov-18 06:17 AM";"that chain has currency STAKED coin";"";"";
"232679450301431808";"blackjok3r#3181";"10-Nov-18 06:18 AM";"A person/entity cna create their own chain, with their own smart contracts... and have staked notaries notarise that chain, it *can* and is most cases should, share the currecny STAKED";"";"";
"232679450301431808";"blackjok3r#3181";"10-Nov-18 06:19 AM";"So you purchase/mine/stake STAKED then burn some of it to create your own chain in the cluster... You cna choose not to burn any STAKED";"";"";
"232679450301431808";"blackjok3r#3181";"10-Nov-18 06:19 AM";"and just create a chain, with 0 supply, then migrate STAKED from anohter chain in the cluster to your chain and do whatever with it.";"";"";
"232679450301431808";"blackjok3r#3181";"10-Nov-18 06:19 AM";"Its to allow people to dev/test CC contracts without forcing all other chains in the cluster to have the same contracts";"";"";
"232679450301431808";"blackjok3r#3181";"10-Nov-18 06:20 AM";"and without having to create new currency for every contract ... as that is unsustaiable";"";"";
"232679450301431808";"blackjok3r#3181";"10-Nov-18 06:20 AM";"haveing millions of diffrent currenies for each contract seems a bit stupid, when we have the tech to share currency over chains with diffrent consesnus rules.";"";"";
"232679450301431808";"blackjok3r#3181";"10-Nov-18 06:21 AM";"tbh we dont even know what STAKED will end up being, our goal is to attract as many devs and smart people as possible, and create thigns people can actually use with KMD tech.";"";"👍 (3)";
"370026641323327491";"ph03nix#3115";"10-Nov-18 06:23 AM";"last sentence 👆 that's what i gathered";"";"";
"370026641323327491";"ph03nix#3115";"10-Nov-18 06:24 AM";"thank you, this helps me understand better";"";"👌 (1)";
"412482228359266328";"CrisF#3405";"10-Nov-18 06:28 AM";"I can start a migrate loop in a little while.";"";"";
"412482228359266328";"CrisF#3405";"10-Nov-18 06:29 AM";"Apart from not the same loop as yours do you have any request on what to do?";"";"";
"412482228359266328";"CrisF#3405";"10-Nov-18 06:30 AM";"@blackjok3r";"";"";
"232679450301431808";"blackjok3r#3181";"10-Nov-18 06:30 AM";"Not really so what ever you want";"";"";
"400570483906707456";"gt#2812";"10-Nov-18 06:30 AM";"where’s the loop scripts again";"";"";
"232679450301431808";"blackjok3r#3181";"10-Nov-18 06:30 AM";"Just dont send chunks of 10 ... and dont send the same chains as me ... we need to have diffrent data to collect..";"";"";
"232679450301431808";"blackjok3r#3181";"10-Nov-18 06:30 AM";"hold on i'll post mine here again in a sec";"";"";
"232679450301431808";"blackjok3r#3181";"10-Nov-18 06:30 AM";"might have changed since last time.";"";"";
