AuthorID;Author;Date;Content;Attachments;Reactions;
"405380797537976320";"Cryptoon#3362";"18-Sep-18 07:38 PM";"Why are we talking about btc?";"";"";
"405380797537976320";"Cryptoon#3362";"18-Sep-18 07:38 PM";"Its not doing anything";"";"";
"403400248879218690";"Hollowman9000#3344";"18-Sep-18 07:38 PM";"Can 6M whale dump more??";"";"";
"405380797537976320";"Cryptoon#3362";"18-Sep-18 07:39 PM";"I have some alerts and fiat loaded up on some exchanges";"";"";
"405380797537976320";"Cryptoon#3362";"18-Sep-18 07:39 PM";"Clinteastwoodmakemyday.gif";"";"";
"405380797537976320";"Cryptoon#3362";"18-Sep-18 07:40 PM";"Talking kmd offc";"";"";
"405380797537976320";"Cryptoon#3362";"18-Sep-18 07:40 PM";"Dont care about btc";"";"";
"474206298427097099";"ComputerGenie 👴🏼📢#7004";"18-Sep-18 07:40 PM";"`Why are we talking about btc?`
Because my belief that BTC shouldn't be the measure of all things doesn't matter to the world 😭";"";"";
"455741312273219595";"jl777c#5810";"18-Sep-18 07:45 PM";"6M whale seems to be buying more at these prices: http://kmd.explorer.dexstats.info/address/RD7SZpgtfrLXB32bRcckYaVmre2ByL73Pi";"";"";
"455741312273219595";"jl777c#5810";"18-Sep-18 07:45 PM";"though no transfers in last week";"";"";
"348137952624377856";"halkuon#8190";"18-Sep-18 07:53 PM";"interesting if we go sideways now for a few weeks or months that would be great";"";"";
"348137952624377856";"halkuon#8190";"18-Sep-18 07:54 PM";"hopefully 16k holds";"";"";
"405787102035574786";"Kitchen Table#2858";"18-Sep-18 08:10 PM";"I never see that whale claim bonus. Has to be up in the 100ks by now.";"";"";
"403400248879218690";"Hollowman9000#3344";"18-Sep-18 08:12 PM";"That transaction history makes me sad i never bought z9’s";"";"";
"403400248879218690";"Hollowman9000#3344";"18-Sep-18 08:12 PM";"Interest just dumped to the miners";"";"";
"405787102035574786";"Kitchen Table#2858";"18-Sep-18 08:16 PM";"I thought only exchanges made the bonus into a transaction fee. I wonder why the whale is doing it. Unless it's CZ wallet that he holds on binance.";"";"";
"403400248879218690";"Hollowman9000#3344";"18-Sep-18 08:18 PM";"125320 in interest on RD7";"";"";
"403400248879218690";"Hollowman9000#3344";"18-Sep-18 08:19 PM";"All utxo’s made before block 1000000";"";"";
"403400248879218690";"Hollowman9000#3344";"18-Sep-18 08:19 PM";"So he has awhile to claim";"";"";
"403400248879218690";"Hollowman9000#3344";"18-Sep-18 08:21 PM";"Or she";"";"";
"403400248879218690";"Hollowman9000#3344";"18-Sep-18 08:21 PM";"But let’s be honest there are no women in crypto";"";"";
"403400248879218690";"Hollowman9000#3344";"18-Sep-18 08:21 PM";"(Waits for cheapshot joke)";"";"";
"403400248879218690";"Hollowman9000#3344";"18-Sep-18 08:22 PM";":abusedsmily:";"";"";
"405787102035574786";"Kitchen Table#2858";"18-Sep-18 08:22 PM";"They are but mostly looking for the men that ""made it""";"";"";
"420119978138664961";"CHMEX#0686";"18-Sep-18 08:23 PM";"it might be the binance Cold store wallet. There are transactions form binance hot wallet to it... I guess with 300k KMD withdrawn in one transaction you need to go through the KYC process even at binance so that would speak against a whale";"";"";
"403400248879218690";"Hollowman9000#3344";"18-Sep-18 08:24 PM";"RD7 = safu?";"";"";
"405787102035574786";"Kitchen Table#2858";"18-Sep-18 08:25 PM";"Not for the people keeping their coin on the exchange. Missing out on a lot of bonus. Miners will be happy though.";"";"";
"420119978138664961";"CHMEX#0686";"18-Sep-18 08:27 PM";"just a theory I have might be wrong yes the RD7 address";"";"";
"405380797537976320";"Cryptoon#3362";"18-Sep-18 08:27 PM";"Intrest claimed shows as the tx fee in the explorer by the way";"";"";
"405380797537976320";"Cryptoon#3362";"18-Sep-18 08:27 PM";"Every time they do a transaction";"";"";
"405380797537976320";"Cryptoon#3362";"18-Sep-18 08:28 PM";"If I remember correctly it was a bug in the explorer";"";"";
"405787102035574786";"Kitchen Table#2858";"18-Sep-18 08:29 PM";"That makes sense. Still, he could be compounding the shit out of that bonus.";"";"";
"403400248879218690";"Hollowman9000#3344";"18-Sep-18 08:38 PM";"What’s an extra 6k a year";"";"";
"403400248879218690";"Hollowman9000#3344";"18-Sep-18 08:38 PM";"When you’re balling with 6M";"";"";
"301766691992371210";"Markus#5464";"18-Sep-18 09:14 PM";"Better then nothing 😄";"";"";
"420119978138664961";"CHMEX#0686";"18-Sep-18 09:14 PM";"Feedback of CMC for BTCD

Please understand that when a coin/token has no trading volume the listing will become inactive. BTCD is currently listed as active and as a result we are not making any updates to this page at this time. Please let us know when BTCD is no longer trading on supported exchanges or able to support a level of daily trading volume above zero for several days. 

So once polo is out there is still tradestatoshi";"";"";
"403400248879218690";"Hollowman9000#3344";"18-Sep-18 09:16 PM";"Is there still a chain to move coins on?";"";"";
"403400248879218690";"Hollowman9000#3344";"18-Sep-18 09:18 PM";"Where can you even download the Btcd wallet";"";"";
"405380797537976320";"Cryptoon#3362";"18-Sep-18 09:19 PM";"Chain isnt moving because jl isn’t staking iirc?";"";"";
"365245556446068747";"venne#4038";"18-Sep-18 09:37 PM";"hmm kmd price starting to look intresting to get starter positions";"";"";
"420119978138664961";"CHMEX#0686";"18-Sep-18 09:38 PM";"Btcd -55.40%";"";"";
"365245556446068747";"venne#4038";"18-Sep-18 09:39 PM";"well btcd had a nice run";"";"";
"365245556446068747";"venne#4038";"18-Sep-18 09:40 PM";"still dont understand why polo wasnt contacted to just swap to kmd tho";"";"";
"420119978138664961";"CHMEX#0686";"18-Sep-18 09:42 PM";"Thats not how c-exchanges work.";"";"";
"365245556446068747";"venne#4038";"18-Sep-18 09:45 PM";"well it was never tried";"";"";
"403400248879218690";"Hollowman9000#3344";"18-Sep-18 10:00 PM";"2.42 spv mode giving anyone problems on KMD?";"";"";
"403400248879218690";"Hollowman9000#3344";"18-Sep-18 10:00 PM";"My counterparty is threatening to send a team of door kickers in";"";"";
"403400248879218690";"Hollowman9000#3344";"18-Sep-18 10:01 PM";"If I don’t get the tx out";"";"";
"403400248879218690";"Hollowman9000#3344";"18-Sep-18 10:01 PM";"In a timely fashion";"";"";
"403400248879218690";"Hollowman9000#3344";"18-Sep-18 10:13 PM";"Spv mode gave me some bs about electrum shepherd unable to push transaction";"";"";
"403400248879218690";"Hollowman9000#3344";"18-Sep-18 10:13 PM";"Or something along those lines";"";"";
"403400248879218690";"Hollowman9000#3344";"19-Sep-18 01:06 AM";"We still have to be 100% native for barterdex?";"";"";
"406179072922746882";"polycryptoblog#1173";"19-Sep-18 01:08 AM";"@venne  they were contacted many times they refused to reply";"";"";
"403400248879218690";"Hollowman9000#3344";"19-Sep-18 01:18 AM";"Pretty sure the team beat them to death on that, @venne";"";"";
"403400248879218690";"Hollowman9000#3344";"19-Sep-18 01:18 AM";"Polo said “fuck our users”";"";"";
"403400248879218690";"Hollowman9000#3344";"19-Sep-18 01:23 AM";"http://i65.tinypic.com/sm6bdz.jpg";"";"";
"429101104480124929";"jspook16#3059";"19-Sep-18 02:32 AM";"Don't need native for bdex";"";"";
"429101104480124929";"jspook16#3059";"19-Sep-18 02:32 AM";"Well alot of the coins anyway";"";"";
"403400248879218690";"Hollowman9000#3344";"19-Sep-18 02:44 AM";"👍";"";"";
"429101104480124929";"jspook16#3059";"19-Sep-18 02:52 AM";"@Hollowman9000  how so (polo)?";"";"";
"456226577798135808";"Deleted User#0000";"19-Sep-18 05:48 AM";"Do all of you expect the crypto marketcap to grow again during the next bullrun, to the point where multiple projects are in the 5-10b marketcap again?";"";"";
"456226577798135808";"Deleted User#0000";"19-Sep-18 05:48 AM";"or was everything overpriced as fuck back then (considering the developments happening now)";"";"";
"456226577798135808";"Deleted User#0000";"19-Sep-18 05:49 AM";"I dont know whats reasonable and whats not. On one hand I was looking up normal companies, and shit like that and it seemed 200m was considered low these days and even tiny companies had higher marketcaps than that";"";"";
"456226577798135808";"Deleted User#0000";"19-Sep-18 05:49 AM";"yet I see a list of ""unicorns"" and successful companies at the 1b or less mark";"";"";
"406179072922746882";"polycryptoblog#1173";"19-Sep-18 05:52 AM";"It will grow one way or another,  when the usecases start rolling out and being refined ,  crypto will take a life of its own outside of investors";"";"";
"403585751171989507";"LocoMB#8593";"19-Sep-18 07:13 AM";"re. use cases: BARTERDEX to the rescue!
https://bitcoinexchangeguide.com/crypto-rumors-swirl-as-bitmex-seems-to-be-trading-against-its-own-customers/
centralistic antics like this will give all the more power to the DEXes! 💫";"";"";
"405380797537976320";"Cryptoon#3362";"19-Sep-18 07:22 AM";"Tbh, i dont see the fuss?";"";"";
"405380797537976320";"Cryptoon#3362";"19-Sep-18 07:22 AM";"This is just marketmaking? Doesnt have to be a negative thing";"";"";
"455741312273219595";"jl777c#5810";"19-Sep-18 07:43 AM";"if only somebody could make a decentralized bitmex";"";"🕵 (5),😄 (3),trollface (6),shexy (6),yassinkomodo (2)";
"420119978138664961";"CHMEX#0686";"19-Sep-18 07:57 AM";"Like lets say by using #cc-general";"";"😃 (3),💡 (3)";
"417671530642931713";"Andersen#8337";"19-Sep-18 08:16 AM";"jan 2015    https://pbs.twimg.com/media/DnZNI8jWsAYevMS.jpg:large";"";"😮 (3)";
"408251982885945344";"actionslacks#4072";"19-Sep-18 08:42 AM";"I think the last bull run was mass delusion. But lately it seems like the trading is just unadulterated manipulation interspersed with people strategically unloading large positions. but hey, BTCD is back up guys!";"";"";
"456226577798135808";"Deleted User#0000";"19-Sep-18 08:47 AM";"well lets hope for 1 more mass delusion";"";"";
"456226577798135808";"Deleted User#0000";"19-Sep-18 08:47 AM";":abusedsmily:";"";"";
"456226577798135808";"Deleted User#0000";"19-Sep-18 08:47 AM";"ive 6x my stack of kmd since the last bull run";"";"";
"456226577798135808";"Deleted User#0000";"19-Sep-18 08:47 AM";"bring it on 🚀";"";"";
"408251982885945344";"actionslacks#4072";"19-Sep-18 08:50 AM";"kmd's time will come sooner than later. that's all I know.";"";"";
"456226577798135808";"Deleted User#0000";"19-Sep-18 08:51 AM";"come on 10b market cap :yassinkomodo:";"";"👆 (2)";
"408251982885945344";"actionslacks#4072";"19-Sep-18 08:55 AM";"say we hit 10b marketcap...  you selling?";"";"😛 (1),🇱 (1),🇦 (1),Ⓜ (1),🇧 (1),🇴 (1),🏎 (1)";
"408251982885945344";"actionslacks#4072";"19-Sep-18 09:00 AM";"The guys that sold the top in 2013 @ $1000 probably felt pretty good for awhile too.";"";"";
"405380797537976320";"Cryptoon#3362";"19-Sep-18 09:01 AM";"If we hit 10b but with adoption still growing...";"";"";
"405380797537976320";"Cryptoon#3362";"19-Sep-18 09:01 AM";"If we hit 10b on a bubble like last year...";"";"";
"405380797537976320";"Cryptoon#3362";"19-Sep-18 09:01 AM";"It’s all relative";"";"";
"408251982885945344";"actionslacks#4072";"19-Sep-18 09:05 AM";"yeah, crypto to the masses is still a pretty abstract and difficult concept to grasp. awareness is rising, but judging by tsome of the top 20, human intelligence is still on a downward slope.";"";"";
"408251982885945344";"actionslacks#4072";"19-Sep-18 09:09 AM";"Maybe I'm a sadist, but I think we need some real crashing to get all the fluff out";"";"";
"408251982885945344";"actionslacks#4072";"19-Sep-18 09:10 AM";"hard times make strong projects";"";"";
"430818734530101248";"KomodoWorld#8282";"19-Sep-18 09:11 AM";"in 2030 the whole market won't be less than 100 trillions, counting the few that scale and survive, even if kmd is just 1% it will be 1 trillion mc";"";"";
"408251982885945344";"actionslacks#4072";"19-Sep-18 09:15 AM";"Anecdotally It would have to be to contain all the value in the current system. But the current system is pretty artificial and the real value is arbitrary at best imo.";"";"";
"408251982885945344";"actionslacks#4072";"19-Sep-18 09:19 AM";"I wonder if wars will ever be fought over crypto.";"";"";
"408251982885945344";"actionslacks#4072";"19-Sep-18 09:22 AM";"A that would need to happen is for the USA to dictate that oil be traded with crypto I guess";"";"";
"474206298427097099";"ComputerGenie 👴🏼📢#7004";"19-Sep-18 10:11 AM";"a war over currency and oil? surely that could never happen....";"";"";
"408251982885945344";"actionslacks#4072";"19-Sep-18 10:23 AM";"I think in a crypto war future all devs would have to be anonymous to survive";"";"";
"405380797537976320";"Cryptoon#3362";"19-Sep-18 11:38 AM";"https://twitter.com/davthewave/status/1042357407727247360?s=21";"";"";
"452374492283404288";"passcombo.com 🏴☠🍋#0622";"19-Sep-18 01:24 PM";"BTC sneezing, alts shitting";"";"";
"452374492283404288";"passcombo.com 🏴☠🍋#0622";"19-Sep-18 01:25 PM";"when etf ?";"";"";
"405380797537976320";"Cryptoon#3362";"19-Sep-18 01:30 PM";"23rd I think?";"";"";
"405380797537976320";"Cryptoon#3362";"19-Sep-18 01:31 PM";"https://www.google.be/amp/s/amp.reddit.com/r/CryptoCurrency/comments/98wura/upcoming_bitcoin_etf_dates/";"";"";
"405380797537976320";"Cryptoon#3362";"19-Sep-18 01:31 PM";"21st";"";"";
"405380797537976320";"Cryptoon#3362";"19-Sep-18 01:31 PM";"And 30th";"";"";
"405380797537976320";"Cryptoon#3362";"19-Sep-18 01:31 PM";"I thought van eck had the best chance of getting approved";"";"";
