AuthorID;Author;Date;Content;Attachments;Reactions;
"455741312273219595";"jl777c#5810";"24-Feb-19 06:58 PM";"there is this thing called math";"";"";
"407145234007588865";"nocturnal#2177";"24-Feb-19 06:58 PM";"which gets manipulated for good marketing soundbytes, i know";"";"";
"455741312273219595";"jl777c#5810";"24-Feb-19 06:59 PM";"The design of Dilithium is based on the ""Fiat-Shamir with Aborts"" technique of Lyubashevsky which uses rejection sampling to make lattice-based Fiat-Shamir schemes compact and secure. The scheme with the smallest signature sizes using this approach is the one of Ducas, Durmus, Lepoint, and Lyubashevsky which is based on the NTRU assumption and crucially uses Gaussian sampling for creating signatures. Because Gaussian sampling is hard to implement securely and efficiently, we opted to only use the uniform distribution. Dilithium improves on the most efficient scheme that only uses the uniform distribution, due to Bai and Galbraith, by using a new technique that shrinks the public key by more than a factor of 2. To the best of our knowledge, Dilithium has the smallest public key + signature size of any lattice-based signature scheme that only uses uniform sampling.";"";"";
"407145234007588865";"nocturnal#2177";"24-Feb-19 06:59 PM";"lol";"";"";
"407145234007588865";"nocturnal#2177";"24-Feb-19 06:59 PM";"not sure if that means anything to you";"";"";
"407145234007588865";"nocturnal#2177";"24-Feb-19 06:59 PM";"but use some common sense";"";"";
"455741312273219595";"jl777c#5810";"24-Feb-19 06:59 PM";"https://pq-crystals.org/dilithium/index.shtml";"";"";
"455741312273219595";"jl777c#5810";"24-Feb-19 07:00 PM";"important is that it means stuff to the quantum math guys at NIST";"";"";
"407145234007588865";"nocturnal#2177";"24-Feb-19 07:00 PM";"how can you know the capabilities of a quantum computer before they exost";"";"";
"407145234007588865";"nocturnal#2177";"24-Feb-19 07:00 PM";"you have to make meaningless assumptions";"";"";
"455741312273219595";"jl777c#5810";"24-Feb-19 07:00 PM";"really?";"";"";
"407145234007588865";"nocturnal#2177";"24-Feb-19 07:00 PM";"yep";"";"";
"455741312273219595";"jl777c#5810";"24-Feb-19 07:00 PM";"can you imagine a normal computer with 100TB of RAM?";"";"";
"455741312273219595";"jl777c#5810";"24-Feb-19 07:00 PM";"and what you could do with 100TB of RAM";"";"";
"407145234007588865";"nocturnal#2177";"24-Feb-19 07:01 PM";"exactly - you are assuming a random number";"";"";
"455741312273219595";"jl777c#5810";"24-Feb-19 07:01 PM";"even though you cant build such a computer";"";"";
"407145234007588865";"nocturnal#2177";"24-Feb-19 07:01 PM";"thats my point";"";"";
"455741312273219595";"jl777c#5810";"24-Feb-19 07:01 PM";"no, your assumption is that you need to have something existing to know what it can/cant do";"";"";
"407145234007588865";"nocturnal#2177";"24-Feb-19 07:01 PM";"you cant make a calcuation without anumber";"";"";
"455741312273219595";"jl777c#5810";"24-Feb-19 07:01 PM";"I disprove this";"";"";
"407145234007588865";"nocturnal#2177";"24-Feb-19 07:01 PM";"and the number is not known yet";"";"";
"407145234007588865";"nocturnal#2177";"24-Feb-19 07:01 PM";"so therefore it is meaningless";"";"";
"407145234007588865";"nocturnal#2177";"24-Feb-19 07:01 PM";"or a guess rather";"";"";
"455741312273219595";"jl777c#5810";"24-Feb-19 07:02 PM";"it is not a guess that there is no known quantum algo that solves this dilithium lattice problems";"";"";
"455741312273219595";"jl777c#5810";"24-Feb-19 07:02 PM";"while there is a proven math algo that shows that secp256k1 is solved efficiently with quantum algo";"";"";
"407145234007588865";"nocturnal#2177";"24-Feb-19 07:02 PM";"how many qbits are assumed in teh quantum computer?";"";"";
"455741312273219595";"jl777c#5810";"24-Feb-19 07:03 PM";"pretty sure the assumption is regardless of qbits";"";"";
"455741312273219595";"jl777c#5810";"24-Feb-19 07:03 PM";"it must tap into some sort of hashing like quality, which also is not having a known quantum algo to solve it";"";"";
"407145234007588865";"nocturnal#2177";"24-Feb-19 07:03 PM";"until someone finds one with a quantum computer....";"";"";
"407145234007588865";"nocturnal#2177";"24-Feb-19 07:04 PM";"how many years forward are you inagining?";"";"";
"407145234007588865";"nocturnal#2177";"24-Feb-19 07:04 PM";"in this assumption";"";"";
"407145234007588865";"nocturnal#2177";"24-Feb-19 07:04 PM";"10?";"";"";
"407145234007588865";"nocturnal#2177";"24-Feb-19 07:04 PM";"1000?";"";"";
"403400248879218690";"Hollowman9000#3344";"24-Feb-19 07:04 PM";"You argue about knowing the capabilities of a quantum computer and then demand to know how many qbits of unknown power are assumed for this determination of security";"";"";
"407145234007588865";"nocturnal#2177";"24-Feb-19 07:04 PM";"its pretty mucvh meaningly to call something quantum resistant in 2018";"";"";
"407145234007588865";"nocturnal#2177";"24-Feb-19 07:04 PM";"yes that is my point";"";"";
"407145234007588865";"nocturnal#2177";"24-Feb-19 07:04 PM";"we cant know";"";"";
"403400248879218690";"Hollowman9000#3344";"24-Feb-19 07:04 PM";"87,000,000 qbits are assumed";"";"";
"407145234007588865";"nocturnal#2177";"24-Feb-19 07:05 PM";"lol";"";"";
"405011811511828481";"Alright#0419";"24-Feb-19 07:05 PM";"Me: can you dumb this down for me?
jl: https://www.youtube.com/watch?v=Ac7G7xOG2Ag";"";"";
"407145234007588865";"nocturnal#2177";"24-Feb-19 07:05 PM";"exactly";"";"";
"407145234007588865";"nocturnal#2177";"24-Feb-19 07:05 PM";"meaningless number";"";"";
"455741312273219595";"jl777c#5810";"24-Feb-19 07:05 PM";"how many qbits does sha256 resist?";"";"";
"403400248879218690";"Hollowman9000#3344";"24-Feb-19 07:05 PM";"87";"";"";
"455741312273219595";"jl777c#5810";"24-Feb-19 07:05 PM";"it seems a meaningless question as there is no known quantum algo for reversing sha256";"";"";
"455741312273219595";"jl777c#5810";"24-Feb-19 07:06 PM";"regardless of qbits";"";"";
"403400248879218690";"Hollowman9000#3344";"24-Feb-19 07:06 PM";"*ahem*";"";"";
"407145234007588865";"nocturnal#2177";"24-Feb-19 07:06 PM";"theoretically you can map every molecule of non-dark matter in the universe with a 32 qbit quantum computer";"";"";
"407145234007588865";"nocturnal#2177";"24-Feb-19 07:06 PM";"but your telling me you cant reverse sha256...";"";"";
"455741312273219595";"jl777c#5810";"24-Feb-19 07:06 PM";"so the concept here is to make new algos without some already known way that quantum computer can solve.";"";"";
"455741312273219595";"jl777c#5810";"24-Feb-19 07:07 PM";"well maybe you can map all matter, but have it emit your gps coordinates";"";"";
"455741312273219595";"jl777c#5810";"24-Feb-19 07:07 PM";"just because you can map everything, doesnt mean you become omniscient";"";"";
"455741312273219595";"jl777c#5810";"24-Feb-19 07:07 PM";"also quantum computers have been ""10 years away"" for decades";"";"";
"407145234007588865";"nocturnal#2177";"24-Feb-19 07:07 PM";"just dont believe the hype dude 😃";"";"";
"455741312273219595";"jl777c#5810";"24-Feb-19 07:07 PM";"it is not clear how practical they will be at the more useful sizes";"";"";
"403400248879218690";"Hollowman9000#3344";"24-Feb-19 07:07 PM";"Fusion powered quantum computers";"";"";
"405011811511828481";"Alright#0419";"24-Feb-19 07:08 PM";"is this only useful in the event that sha256 is broken or are there other usecases?";"";"";
"407145234007588865";"nocturnal#2177";"24-Feb-19 07:08 PM";"quantum computers will be a lot longer than 10 years away";"";"";
"407145234007588865";"nocturnal#2177";"24-Feb-19 07:08 PM";"agree";"";"";
"407145234007588865";"nocturnal#2177";"24-Feb-19 07:08 PM";"so saying something is quantum resistent even more silly";"";"";
"455741312273219595";"jl777c#5810";"24-Feb-19 07:09 PM";"not sha256, i repeat AGAIN, there is no known quantum algo tosolve sha256 and hashing is hard to reverse";"";"";
"455741312273219595";"jl777c#5810";"24-Feb-19 07:09 PM";"it is the secp256k1 and curve25519";"";"";
"407145234007588865";"nocturnal#2177";"24-Feb-19 07:09 PM";"it means a mathematician has decided one possible scenario involving a theoretical quantum computer that doesnt exist yet, is defended against 😂";"";"";
"455741312273219595";"jl777c#5810";"24-Feb-19 07:09 PM";"all the public key crypto that has a known algo to solve it very quickly using quantum computers";"";"";
"455741312273219595";"jl777c#5810";"24-Feb-19 07:10 PM";"no, it means no mathematician has come up with a way for quantum computers to solve it";"";"";
"455741312273219595";"jl777c#5810";"24-Feb-19 07:10 PM";"which seems a lot safer than something that is known to be solved";"";"";
"407145234007588865";"nocturnal#2177";"24-Feb-19 07:10 PM";"wait wait,";"";"";
"455741312273219595";"jl777c#5810";"24-Feb-19 07:10 PM";"the logic is that it is better to use something that has no known solution, than one that does";"";"";
"407145234007588865";"nocturnal#2177";"24-Feb-19 07:10 PM";"you saying there that its NOT quantum resistant";"";"";
"455741312273219595";"jl777c#5810";"24-Feb-19 07:10 PM";"public key algos are NOT quantum resistant";"";"";
"407145234007588865";"nocturnal#2177";"24-Feb-19 07:11 PM";"you are saying it is resistant WITHPOUT quantum computing";"";"";
"407145234007588865";"nocturnal#2177";"24-Feb-19 07:11 PM";"or up till quantum computing";"";"";
"455741312273219595";"jl777c#5810";"24-Feb-19 07:11 PM";"once we get big enough quantum computers, all of the non-cold storage pubkeys will be cracked";"";"";
"455741312273219595";"jl777c#5810";"24-Feb-19 07:11 PM";"of course: https://www.electronicsweekly.com/news/business/544874-2018-12/";"";"";
"407145234007588865";"nocturnal#2177";"24-Feb-19 07:11 PM";"yes agreed";"";"";
"455741312273219595";"jl777c#5810";"24-Feb-19 07:11 PM";"it might be 50 years...";"";"";
"455741312273219595";"jl777c#5810";"24-Feb-19 07:11 PM";"it might be 10 years";"";"";
"455741312273219595";"jl777c#5810";"24-Feb-19 07:11 PM";"regardless, it is possible for it to happen";"";"";
"455741312273219595";"jl777c#5810";"24-Feb-19 07:12 PM";"and if it does, do you want something we know 100% for sure will be cracked, or something that currently there is no known quantum algo for?";"";"";
"403400248879218690";"Hollowman9000#3344";"24-Feb-19 07:12 PM";"It might be 13 years, 4 months, 9 days ago";"";"";
"407145234007588865";"nocturnal#2177";"24-Feb-19 07:12 PM";"absouletly";"";"";
"407145234007588865";"nocturnal#2177";"24-Feb-19 07:12 PM";"I take issue with the misleading term used for marketing";"";"";
"407145234007588865";"nocturnal#2177";"24-Feb-19 07:13 PM";"not the progression of technology";"";"";
"407145234007588865";"nocturnal#2177";"24-Feb-19 07:13 PM";"as fast or slow as that may be";"";"";
"455741312273219595";"jl777c#5810";"24-Feb-19 07:13 PM";"quantum resistant is the industry accepted term";"";"";
"407145234007588865";"nocturnal#2177";"24-Feb-19 07:13 PM";"i would wager a mathemetician didnt come with that term";"";"";
"407145234007588865";"nocturnal#2177";"24-Feb-19 07:13 PM";"and more to the point";"";"";
"407145234007588865";"nocturnal#2177";"24-Feb-19 07:13 PM";"industries accept terms";"";"";
"407145234007588865";"nocturnal#2177";"24-Feb-19 07:13 PM";"that sell things";"";"";
"407145234007588865";"nocturnal#2177";"24-Feb-19 07:14 PM";"and make things in the industry sound good";"";"";
"403400248879218690";"Hollowman9000#3344";"24-Feb-19 07:14 PM";"I feel your synergy bro";"";"";
"407145234007588865";"nocturnal#2177";"24-Feb-19 07:14 PM";"haha";"";"";
"455741312273219595";"jl777c#5810";"24-Feb-19 07:15 PM";"then you come up with a name for something that is qualitatively more secure against quantum computing than the existing public key crypto";"";"";
"407145234007588865";"nocturnal#2177";"24-Feb-19 07:16 PM";"once you remove the quantum claim it doesnt sound as sexy";"";"";
"407145234007588865";"nocturnal#2177";"24-Feb-19 07:16 PM";"thats what im saying";"";"";
"407145234007588865";"nocturnal#2177";"24-Feb-19 07:16 PM";"but im sure there are a many such terms";"";"";
"407145234007588865";"nocturnal#2177";"24-Feb-19 07:17 PM";"do you mean 'quantitively' more secure?";"";"";
"345992331276713984";"Acura#2748";"24-Feb-19 07:18 PM";"Piratechain not quantum Resistent because of no available CC, right ?";"";"";
"455741312273219595";"jl777c#5810";"24-Feb-19 07:20 PM";"i would say that having no known quantum algo is qualitatively better than one that is known to be solved with quantum algo";"";"";
"414518440649555970";"tolken#2655";"24-Feb-19 07:20 PM";"Shit, kmd overhyping shit again. Hey marketing; ratchet it down a few notches!";"";"";
