AuthorID;Author;Date;Content;Attachments;Reactions;
"171359889921146880";"BlackJesus#6161";"01-Jul-18 08:02 PM";"Yea, I get tired of people who always try to say mining is wasting electricity...";"";"";
"171359889921146880";"BlackJesus#6161";"01-Jul-18 08:03 PM";"Yo genie can you hop in the hangout channel I need to pick your brain";"";"";
"456490768589258753";"ComputerGenie#2331";"01-Jul-18 08:03 PM";"GPUs use more than 13x the power that the minis take";"";"";
"456490768589258753";"ComputerGenie#2331";"01-Jul-18 08:03 PM";"per hash";"";"";
"456490768589258753";"ComputerGenie#2331";"01-Jul-18 08:03 PM";"_has no mic or speakers_";"";"";
"171359889921146880";"BlackJesus#6161";"01-Jul-18 08:04 PM";"Yea my $3k miner was doing 1/5 the hashpower of my z9 mini and consuming 5x the power";"";"";
"171359889921146880";"BlackJesus#6161";"01-Jul-18 08:04 PM";"I literally increased in efficiency by a factor of 25";"";"";
"456490768589258753";"ComputerGenie#2331";"01-Jul-18 08:05 PM";"23 1080TIs (~266 watts each) put out roughly the same hash as 1 overclocked mini (~ 380 watts)";"";"";
"171359889921146880";"BlackJesus#6161";"01-Jul-18 08:07 PM";"Yea, I like komodo and the devs, because they put reason before emotional appeals. I feel like the anti-asic sentiment is based solely on selfishness of gpu miners not wanting to progress.";"";"";
"171359889921146880";"BlackJesus#6161";"01-Jul-18 08:07 PM";"Markets change if you don't adapt you will be left behind. i.e. Blockbuster";"";"";
"456490768589258753";"ComputerGenie#2331";"01-Jul-18 08:09 PM";"well, the anti-ASIC equihash sentiment is not *entirely* without merit; but the anti-ASIC part of equihash in it's original intention was flawed in concept (the main thought was the it worked because RAM is expensive)";"";"";
"366255479200153600";"Extradition90#8046";"01-Jul-18 08:12 PM";"Very good answer";"";"";
"366255479200153600";"Extradition90#8046";"01-Jul-18 08:12 PM";"I am pro gpu 125gpu";"";"";
"366255479200153600";"Extradition90#8046";"01-Jul-18 08:12 PM";"But want my first asic for komodo";"";"";
"366255479200153600";"Extradition90#8046";"01-Jul-18 08:12 PM";"And jl777 answer is smart";"";"";
"456490768589258753";"ComputerGenie#2331";"01-Jul-18 08:12 PM";"I'm pro profits and pro chain security; I'm anti-pandering to a minority demographic";"";"";
"171359889921146880";"BlackJesus#6161";"01-Jul-18 08:13 PM";"From all the discussion in mining room there will be alot of asics pointed directly at komodo.";"";"";
"366255479200153600";"Extradition90#8046";"01-Jul-18 08:13 PM";"So i think very good idea to become asic in one moment";"";"";
"456490768589258753";"ComputerGenie#2331";"01-Jul-18 08:13 PM";"""From all the discussion in mining room there will be alot of asics pointed directly at komodo.""
And that's just from my farm 😝";"";"";
"171359889921146880";"BlackJesus#6161";"01-Jul-18 08:13 PM";"polycryptoblog is buying a load as well.";"";"";
"171359889921146880";"BlackJesus#6161";"01-Jul-18 08:13 PM";"xrobesx";"";"";
"171359889921146880";"BlackJesus#6161";"01-Jul-18 08:13 PM";"theres a couple.";"";"";
"171359889921146880";"BlackJesus#6161";"01-Jul-18 08:14 PM";"I'll have my little mini farm as well.";"";"";
"366255479200153600";"Extradition90#8046";"01-Jul-18 08:14 PM";"Yes sure";"";"";
"366255479200153600";"Extradition90#8046";"01-Jul-18 08:14 PM";"Me too alone i am";"";"";
"366255479200153600";"Extradition90#8046";"01-Jul-18 08:14 PM";"I do how i can";"";"";
"171359889921146880";"BlackJesus#6161";"01-Jul-18 08:14 PM";"mining komodo is like a lottery due to orphan interest blocks.";"";"";
"366255479200153600";"Extradition90#8046";"01-Jul-18 08:14 PM";"So lets find z9 mini at good price";"";"";
"366255479200153600";"Extradition90#8046";"01-Jul-18 08:15 PM";"Why like a lottery?";"";"";
"171359889921146880";"BlackJesus#6161";"01-Jul-18 08:15 PM";"I would never play the tradtional lottery. But I will play the komodo lottery";"";"";
"171359889921146880";"BlackJesus#6161";"01-Jul-18 08:15 PM";"You're talking to a lottery winner in @ComputerGenie he hit a what 1500 komodo block of orphan interest";"";"";
"456490768589258753";"ComputerGenie#2331";"01-Jul-18 08:15 PM";"I suspect that @xRobeSx  will eventually use some of the hash to secure asset chains as well (given many of our past convos)";"";"";
"171359889921146880";"BlackJesus#6161";"01-Jul-18 08:15 PM";"when mining on supernova I was a partial recipient of a 2800 komodo block";"";"";
"456490768589258753";"ComputerGenie#2331";"01-Jul-18 08:16 PM";"""You're talking to a lottery winner in ComputerGenie he hit a what 1500 komodo block of orphan interest""
If you saw my investment, $3k isn't winning the lottery 😛";"";"";
"171359889921146880";"BlackJesus#6161";"01-Jul-18 08:16 PM";"they are lotteries though.";"";"";
"171359889921146880";"BlackJesus#6161";"01-Jul-18 08:16 PM";"2-3 months of revenue in a day.";"";"";
"171359889921146880";"BlackJesus#6161";"01-Jul-18 08:16 PM";"Or is that more akin to a bonus.";"";"";
"456490768589258753";"ComputerGenie#2331";"01-Jul-18 08:16 PM";"that barely broke me even for wires and cables 😛";"";"";
"457211594137534465";"xRobeSx#5136";"01-Jul-18 08:24 PM";"Maybe sooner if you let me join your assetchain stratum @ComputerGenie 😊";"";"";
"456490768589258753";"ComputerGenie#2331";"01-Jul-18 08:25 PM";"When it's working, you'll be one of the 1st to know";"";"";
"456490768589258753";"ComputerGenie#2331";"01-Jul-18 08:26 PM";"the decision tree is still kicking my ass";"";"";
"447113159665516564";"1TheGhostProject#3962";"01-Jul-18 08:28 PM";"https://www.crypto-coinz.net/the-dark-side-of-crypto-komodo-kmd-attacks-safe-coin-safe/";"";"";
"447113159665516564";"1TheGhostProject#3962";"01-Jul-18 08:28 PM";"Kmd is so great they attack other coins.  Kmd is a fucking joke coin.";"";"😜 (1),😱 (1)";
"447113159665516564";"1TheGhostProject#3962";"01-Jul-18 08:29 PM";"This coin is made from losers that can’t get a real career. And just wanna steak from people.  Fuck this joke coin";"";"";
"455758438144671776";"Evitor#6985";"01-Jul-18 08:34 PM";"👆 😂";"";"";
"455758438144671776";"Evitor#6985";"01-Jul-18 08:35 PM";"The only one who is a loser, is you 😉";"";"";
"120663083906629634";"Jazzy#0001";"01-Jul-18 08:35 PM";"lmao is this serious";"";"";
"120663083906629634";"Jazzy#0001";"01-Jul-18 08:35 PM";"Is this a continuation on yesterday's drama";"";"";
"120663083906629634";"Jazzy#0001";"01-Jul-18 08:35 PM";"This is hilarious";"";"";
"456562310136201238";"Tyrael#0138";"01-Jul-18 08:35 PM";"can we give him a hat ?";"";"";
"120663083906629634";"Jazzy#0001";"01-Jul-18 08:41 PM";"It's amazing this website continues to plagiarize Triple-Q's work too";"";"";
"120663083906629634";"Jazzy#0001";"01-Jul-18 08:41 PM";"I know I've seen it done on more than one occasion now";"";"";
"120663083906629634";"Jazzy#0001";"01-Jul-18 08:41 PM";"But hey they'll complain about other people's ethics all day right";"";"";
"456490768589258753";"ComputerGenie#2331";"01-Jul-18 08:43 PM";"@1TheGhostProject Never trust a ""news source"" that uses edited jpegs created by the head of marketing for the ""attacked"" party 😉";"";"";
"362700439998693376";"Khorosho#5642";"01-Jul-18 08:48 PM";"whe're the edited jpegs? looks like a default ubuntu gnome setup with default discord(shield your eyes it's white)";"";"";
"456490768589258753";"ComputerGenie#2331";"01-Jul-18 08:54 PM";"""whe're the edited jpegs?""
Follow the timestamps and look for the missing information. 😉";"";"";
"378000766994087936";"J-Mack#9626";"01-Jul-18 09:10 PM";"I like Komodo";"";"";
"378000766994087936";"J-Mack#9626";"01-Jul-18 09:10 PM";"😎";"";"";
"452374492283404288";"passcombo.com 🏴☠🍋#0622";"01-Jul-18 09:15 PM";"I wanted to write it's not worth to comment, but then I deny myself writing so, is there sth wrong with me ? 😃";"";"";
"455283678939971585";"dudezmobi#1945";"01-Jul-18 10:39 PM";"no";"";"";
"395274075985018880";"Regnar#6164";"01-Jul-18 11:32 PM";"How long are atomic swap orders live for? and what happens when I close BarterDEX after placing an order (fulfilled or not)?";"";"";
"426823107865608192";"NNoperator#3835";"01-Jul-18 11:40 PM";"they time out in four hours";"";"";
"395274075985018880";"Regnar#6164";"01-Jul-18 11:45 PM";"Is it an arbitrary time out?";"";"";
"419964976397156352";"cipi#4502";"01-Jul-18 11:48 PM";"swaps can only be done when BarterDEX is running, if you stop it, no swaps";"";"";
"395274075985018880";"Regnar#6164";"01-Jul-18 11:48 PM";"is there any resources on that aspect in particular I can read up on?";"";"";
"395274075985018880";"Regnar#6164";"01-Jul-18 11:49 PM";"to understand why swaps can't happen when its off (I assume it has something to do with private keys sending the payments etc) but why the 4 hours?";"";"";
"419964976397156352";"cipi#4502";"01-Jul-18 11:50 PM";"swaps can't happen when it's off because BarterDEX can't do transactions when it's off... if you read how atomic swaps work (eg in the whitepaper), it should become clear why it can't work";"";"";
"419964976397156352";"cipi#4502";"01-Jul-18 11:52 PM";"if you place orders in orderbook, eg with autoprice and turn off BarterDEX, this entries will disappear after some time, but it is not that important, since swaps woul not happen anyway, it is just to clear the orderbooks of offers that would not work";"";"";
"419964976397156352";"cipi#4502";"01-Jul-18 11:53 PM";"this should happen much faster then 4 hours, but i don't know what the time is";"";"";
"395274075985018880";"Regnar#6164";"01-Jul-18 11:54 PM";"Sent you a PM @cipi  Thanks for the help";"";"";
"452374492283404288";"passcombo.com 🏴☠🍋#0622";"02-Jul-18 07:32 AM";"@Regnar maybe it's same as p2p file download can't happen when it's off? 😛 My guess - no central DB as decentralized system - so you are part of it /you represent yourself -no central entity DB / must be online to work";"";"";
"354615658148790275";"sφldat#8733";"02-Jul-18 01:15 PM";"https://youtu.be/N2M1RJ4VsQ4";"";"";
"156115366983106560";"Llama#1330";"02-Jul-18 04:41 PM";"step 1. deposit onto agama
step 2. profit";"";"";
"435860757088043018";"vasa#4326";"02-Jul-18 05:41 PM";"ConsensusPedia: An Encyclopedia of 29 Consensus Algorithms.
Contains a detailed explanation of algorithms with their pros and cons and list of platforms using them. One of my best-written articles.
https://hackernoon.com/consensuspedia-an-encyclopedia-of-29-consensus-algorithms-e9c4b4b7d08f";"";"";
"455021680935436290";"Gateway#3763";"02-Jul-18 05:48 PM";"[matrix] <soldat:matrix.org> Wow nice article Vasa !";"";"";
"420119978138664961";"CHMEX#0686";"02-Jul-18 05:56 PM";"Curious to hear opinions. The article mentions 'a bit centralized' on eos. Is centralization binary or can it be a partial status?";"";"";
"456490768589258753";"ComputerGenie#2331";"02-Jul-18 06:11 PM";"`a bit` 🤣";"";"";
"455021680935436290";"Gateway#3763";"02-Jul-18 06:40 PM";"[matrix] <polycryptoblog:matrix.org> It's a spectrum ,  but eos is pretty much fully centralized.   Collusion between block producers that banned users without any justification.";"";"";
"455021680935436290";"Gateway#3763";"02-Jul-18 06:52 PM";"[matrix] <soldat:matrix.org> EOS: Entierely On Servitude";"";"";
"456490768589258753";"ComputerGenie#2331";"02-Jul-18 06:53 PM";"lol";"";"";
"171359889921146880";"BlackJesus#6161";"02-Jul-18 06:53 PM";"I like that soldat.";"";"";
"171359889921146880";"BlackJesus#6161";"02-Jul-18 06:54 PM";"EOS ""Entirely on servitude"" -Soldat";"";"";
"365714438864633856";"dukeleto#7326";"02-Jul-18 06:56 PM";"Looking for who is coordinating this stuff, sounds interesting and would like to get involved: https://www.reddit.com/r/komodoplatform/comments/8vh0er/july_updates_un_affiliated_consultancy_national/";"";"";
"456490768589258753";"ComputerGenie#2331";"02-Jul-18 06:57 PM";"lord help us, duke found a new project 😣";"";"😂 (1)";
"365714438864633856";"dukeleto#7326";"02-Jul-18 06:59 PM";"wow, they still let you hang out here @ComputerGenie ? I thought you were the new bitmain marketing team?";"";"";
"456490768589258753";"ComputerGenie#2331";"02-Jul-18 07:01 PM";"🤣";"";"";
"456490768589258753";"ComputerGenie#2331";"02-Jul-18 07:02 PM";"given that it takes 0.5 seconds to create a self-sustaining invite setup and I own a domain, no one really ""let's"" me join their discord - more like they tolerate me 😛";"";"";
"365714438864633856";"dukeleto#7326";"02-Jul-18 07:34 PM";"tolerate, that is a good word for it";"";"😘 (1)";
"235143047053180949";"Steve Lee#1967";"02-Jul-18 07:59 PM";"that'd be me @dukeleto";"";"";
"235143047053180949";"Steve Lee#1967";"02-Jul-18 08:02 PM";"";"https://cdn.discordapp.com/attachments/428673045767520260/463434352437493791/Attachment_2_Invitation_for_GBCC__26_Founding_C2_A0Ceremony_of_Consortium_of_Global_Blockchain_Organ.pdf";"";
"365225614740946965";"CryptoHuff#7952";"02-Jul-18 08:06 PM";"What's new everyone! 😄";"";"";
"387924224733347850";"[TPUX] Djith Wattignies#3171";"02-Jul-18 08:47 PM";"We have beaten japan :)";"";"";
"456490768589258753";"ComputerGenie#2331";"02-Jul-18 08:48 PM";"who is ""we"" and what did you beat them at, @[TPUX] Djith Wattignies?";"";"";
"387924224733347850";"[TPUX] Djith Wattignies#3171";"02-Jul-18 08:49 PM";"Belgium (im belgian) has beaten japan on world cup football... yes..";"";"";
"456490768589258753";"ComputerGenie#2331";"02-Jul-18 08:50 PM";"stopped giving a shit about that game when Pelé quit playing";"";"";
"387924224733347850";"[TPUX] Djith Wattignies#3171";"02-Jul-18 08:51 PM";"Pele.. that was in the 80ies or so? 😂";"";"";
"456490768589258753";"ComputerGenie#2331";"02-Jul-18 08:51 PM";"late 70s when he quit";"";"";
"387924224733347850";"[TPUX] Djith Wattignies#3171";"02-Jul-18 08:52 PM";"I wasnt born yet then 😐";"";"🤦🏿 (1)";
"365225614740946965";"CryptoHuff#7952";"02-Jul-18 11:29 PM";"🎆";"";"";
"397600985582665730";"kh4567#1136";"03-Jul-18 07:17 AM";"@[TPUX] Djith Wattignies belgium i think was rather fortunate...";"";"";
