AuthorID;Author;Date;Content;Attachments;Reactions;
"373485856650166272";"CombatWombat#0279";"13-Mar-19 03:55 AM";"did anyone get lucky and send there kmd over to huobi in time?";"";"";
"431361679121448962";"Madzi#5769";"13-Mar-19 06:04 AM";"What’s it trading at in Huobi";"";"";
"324632286366793729";"Keppie#5156";"13-Mar-19 06:17 AM";"About the same as Binance";"";"";
"340853944488165376";"Blackbeard#9921";"13-Mar-19 07:55 AM";"I missed that";"";"";
"340853944488165376";"Blackbeard#9921";"13-Mar-19 07:55 AM";"but I'm really happy for Komodo, it finally gets the attention it deserves.";"";"";
"324632286366793729";"Keppie#5156";"13-Mar-19 08:04 AM";"Ahoy Cpt Blackbeard";"";"";
"455741312273219595";"jl777c#5810";"13-Mar-19 08:22 AM";"KMD is almost at 0.1% of total cryptomarket cap. as unreliable as that is, it seems more stable than any other way to see the KMD market value as it factors out both the BTC price and the BTC market dominance factors (which are very large)
to put this in perspective, during the bull market peak KMD was at 0.15% for a bit but it has usually ranged between 0.05% and 0.1%. Since not so many follow this metric, I doubt there is any ""TA breakout"" mania at 0.1%, just a key metric from my point of view. It means that $1 out of every $1000 value in crypto is held in KMD.

The fact that this is happening at 30k sats is also very important as when KMD goes back above 100K sats, it would mean 0.3%+ of overall crypto marketcap (barring any big breakdown of BTC dominance). I think this means for this bear -> bull market phase, KMD is one of the leading alts. So for all of those that claim that KMD is not doing well outside of tech, this is a bit of perspective.";"";"🤙 (2),👍 (1)";
"405380797537976320";"Cryptoon#3362";"13-Mar-19 08:30 AM";"A couple of months ago we were at 15-16k sats, now knocking on the door of 30k";"";"💸 (1)";
"405380797537976320";"Cryptoon#3362";"13-Mar-19 08:31 AM";"Not too shabby tbh";"";"";
"455741312273219595";"jl777c#5810";"13-Mar-19 08:34 AM";"climbing the CMC ladder isnt so easy, especially with the stable coins and new projects keep arriving, yet, KMD has gone from 60+ now to 50-";"";"";
"456690797505544202";"ch6ris#5240";"13-Mar-19 08:34 AM";"The CMC ladder is a bit of a joke tbh";"";"";
"455741312273219595";"jl777c#5810";"13-Mar-19 08:35 AM";"yet, it has the most weight";"";"🏋 (2)";
"456690797505544202";"ch6ris#5240";"13-Mar-19 08:36 AM";"that is true unfortunately.  Facebook might as well acquire it.";"";"";
"456690797505544202";"ch6ris#5240";"13-Mar-19 08:39 AM";"Great work btw, getting closer to 1% of all crypto currency.";"";"";
"340853944488165376";"Blackbeard#9921";"13-Mar-19 09:01 AM";"sooner or later we will get there, it's just a question of time";"";"";
"340853944488165376";"Blackbeard#9921";"13-Mar-19 09:03 AM";"hey @Keppie";"";"";
"456690797505544202";"ch6ris#5240";"13-Mar-19 09:08 AM";"@HeyRhett 😂";"";"";
"421787503154954254";"Aron“XuanLeeeeee“Goldberg#3393";"13-Mar-19 10:12 AM";"https://twitter.com/bvanmaarseveen/status/1105772238974918656";"";"";
"383808266184163329";"DCLEITE#9813";"13-Mar-19 11:04 AM";"seems like it was just a pump and dump movement...whales having fun?";"";"";
"202999072519356416";"NutellaLicka#4241";"13-Mar-19 11:06 AM";"Or a whale acquiring, letting the dumpers dump, to then reacquire more?";"";"";
"383808266184163329";"DCLEITE#9813";"13-Mar-19 11:07 AM";"I hope so.. would be nice!";"";"";
"456690797505544202";"ch6ris#5240";"13-Mar-19 11:52 AM";"Still a lot of activity on binance.";"";"";
"354615658148790275";"sφldat#8733";"13-Mar-19 12:22 PM";"https://twitter.com/airratchet/status/1105792022051471360";"";"";
"354615658148790275";"sφldat#8733";"13-Mar-19 12:22 PM";"https://twitter.com/airratchet/status/1105794844100837376";"";"";
"354615658148790275";"sφldat#8733";"13-Mar-19 12:24 PM";"IBM 👀";"";"👍 (3),treasure (2)";
"455741312273219595";"jl777c#5810";"13-Mar-19 12:38 PM";"why not post about the oracled dog and other things we have";"";"";
"405380797537976320";"Cryptoon#3362";"13-Mar-19 12:39 PM";"dont find the website 😦";"";"";
"405380797537976320";"Cryptoon#3362";"13-Mar-19 12:39 PM";"invited her to the discord 😃";"";"";
"242635006516658197";"jorian#4555";"13-Mar-19 12:47 PM";"me too 😛";"";"";
"423176312354635779";"gcharang#6833";"13-Mar-19 12:48 PM";"this site has live oracles: http://www.oracle.earth/
this was the dog website but seems to be not current: https://www.dragonhound.tech/
@smk762 -  dracocanis ominator";"";"";
"423176312354635779";"gcharang#6833";"13-Mar-19 12:48 PM";"https://blog.komodoplatform.com/anatomy-of-an-oracle-c6c2245b0196";"";"";
"448777271701143562";"smk762 -  dracocanis ominator#7640";"13-Mar-19 01:01 PM";"drgonhound has pivoted a bit, but will return. still uses oracles, but is now being used for logictics/supply chain project dev";"";"";
"448777271701143562";"smk762 -  dracocanis ominator#7640";"13-Mar-19 01:03 PM";"once that moves to new server, dragonhound will ressurect.  Particle was asking too much for minimum buy wholesale GPS units, so I'm working on other things until I have funds to continue.";"";"";
"448777271701143562";"smk762 -  dracocanis ominator#7640";"13-Mar-19 01:04 PM";"I've found alternative GPS device methods tho, so might be sooner than that 😉";"";"";
"448777271701143562";"smk762 -  dracocanis ominator#7640";"13-Mar-19 01:05 PM";"oracle.earth is best demo at the moment of oracle tech working for anyone wanting to test it. read/write/create.";"";"";
"448777271701143562";"smk762 -  dracocanis ominator#7640";"13-Mar-19 01:05 PM";"graphs show it reading to visualise.";"";"";
"405380797537976320";"Cryptoon#3362";"13-Mar-19 01:07 PM";"shared above links as well 😃";"";"labs (1),yassinkomodo (2)";
"369562056027799562";"Mr. HashEm#3357";"13-Mar-19 04:24 PM";"Admins can put Komodo events on coinmarketcal";"";"";
"369562056027799562";"Mr. HashEm#3357";"13-Mar-19 04:24 PM";"It's a calendar for upcoming events of coins";"";"";
"369562056027799562";"Mr. HashEm#3357";"13-Mar-19 04:25 PM";"I saw Komodo has nothing on the site.";"";"";
"374651156149829642";"AlexLibertas#3449";"13-Mar-19 05:12 PM";"Hi all. I've just released an article with Bitcoin Benny about RedFOX Labs and Komodo tech being the key to mass adoption";"";"";
"374651156149829642";"AlexLibertas#3449";"13-Mar-19 05:12 PM";"give this some love on twitter";"";"";
"374651156149829642";"AlexLibertas#3449";"13-Mar-19 05:12 PM";"https://twitter.com/alexlibertas2/status/1105878449577701377";"";"";
"402562688254738432";"Yassin#3685";"13-Mar-19 05:22 PM";"https://twitter.com/IndeNodes/status/1105881706412888065";"";"";
"402562688254738432";"Yassin#3685";"13-Mar-19 05:22 PM";"🙌";"";"";
"398189630182260746";"Alecandro#1179";"13-Mar-19 06:27 PM";"Does anyone know or anyone here have any cool desktop wallpapers for KMD??";"";"";
"436515643760705546";"Deltazulu#2710";"13-Mar-19 06:32 PM";"i have this one:";"";"";
"436515643760705546";"Deltazulu#2710";"13-Mar-19 06:32 PM";"mom ^^";"";"";
"436515643760705546";"Deltazulu#2710";"13-Mar-19 06:35 PM";"i dont find the file anymore ^^";"";"";
"436515643760705546";"Deltazulu#2710";"13-Mar-19 06:37 PM";"it was from senda i think";"";"";
"436515643760705546";"Deltazulu#2710";"13-Mar-19 07:01 PM";"here you find some: https://steemit.com/@supersenda";"";"";
"436515643760705546";"Deltazulu#2710";"13-Mar-19 07:01 PM";"and here: https://twitter.com/thesupersenda";"";"";
"342751827068059650";"Tek#5253";"13-Mar-19 10:21 PM";"this doesn't work for me";"";"";
"342751827068059650";"Tek#5253";"13-Mar-19 10:21 PM";"https://www.atomicexplorer.com/#/interest-calc";"";"";
"342751827068059650";"Tek#5253";"13-Mar-19 10:21 PM";"doest load";"";"";
"342751827068059650";"Tek#5253";"13-Mar-19 10:22 PM";"white blank screen";"";"";
"402210705476026368";"bishop#9773";"13-Mar-19 10:43 PM";"because you are using an old link";"";"";
"402210705476026368";"bishop#9773";"13-Mar-19 10:43 PM";"it's not called interest, it's called rewards";"";"";
"397372307154403329";"yorklab#7270";"13-Mar-19 10:47 PM";"It's very slow loading.";"";"";
"264236295432175616";"Gordon Komodo#7477";"13-Mar-19 10:52 PM";"use this one https://dexstats.info/rewards.php";"";"";
"278565047113089025";"Strob#3417";"14-Mar-19 04:26 AM";"The idea of linking blockchain and gaming is getting lots of hype and hope, Ripple will shell out 100 millions on it: http://fortune.com/2019/03/12/ripple-forte-blockchain-games/";"";"";
"398189630182260746";"Alecandro#1179";"14-Mar-19 04:56 AM";"I hope Komodo can really set itself apart in this regard. I know we’ve got some good things going so far with blockchain games and whatnot. I hope we can bring real world gaming companies into the mix to work with KMD and really try to be a market leader";"";"";
"427867553784922113";"FishyGuts#5085";"14-Mar-19 05:10 AM";"Scalability. 
Decentralized nature.  Devs will make more % on KMD games.";"";"";
"427867553784922113";"FishyGuts#5085";"14-Mar-19 05:10 AM";"Ripple doesn’t know what they want to be.  Them trying to make a game division after trying to get banks to use them is an indication to me that they have no direction.";"";"";
"398189630182260746";"Alecandro#1179";"14-Mar-19 06:05 AM";"Yep I agree there";"";"";
"455741312273219595";"jl777c#5810";"14-Mar-19 07:17 AM";"komodo has had no direction from the start. being decentralized it should grow into all areas";"";"";
"455741312273219595";"jl777c#5810";"14-Mar-19 07:19 AM";"komodo makes the core tech that allows others to blockchain whatever they can think to blockchain, just make sure you are using it when it makes sense to. blockchain allows to have strangers on the internet be able to transact monetary value without trusting anybody else. so it does apply in a lot of areas.";"";"👌 (3)";
"398189630182260746";"Alecandro#1179";"14-Mar-19 07:28 AM";"💯";"";"";
"408251982885945344";"actionslacks#4072";"14-Mar-19 07:51 AM";"To be able to out innovate a behemoth like ripple and bring a better product to market faster would be a pretty large coup for the project.";"";"";
"354615658148790275";"sφldat#8733";"14-Mar-19 01:21 PM";"https://twitter.com/airratchet/status/1106146732147118080?s=19";"";"👌 (10),👆 (4),🐙 (3),shexy (1)";
"427867553784922113";"FishyGuts#5085";"14-Mar-19 03:39 PM";"https://twitter.com/piratechain/status/1106217874295648257?s=21";"";"";
"342751827068059650";"Tek#5253";"14-Mar-19 03:50 PM";"interesting";"";"";
"476023446481141760";"_RN03xx_#0689";"14-Mar-19 03:55 PM";"Stellar wasn't mentioned but she said ""Yes! We plan to launch project related to a new type of investments. I think platform will be Komodo. Amazing futures under our requirements. 😊""";"";"";
"342751827068059650";"Tek#5253";"14-Mar-19 03:55 PM";"I am collecting for moon.";"";"";
"476023446481141760";"_RN03xx_#0689";"14-Mar-19 03:57 PM";"I am not selling a single KMD until we reach ETH current price";"";"";
"397372307154403329";"yorklab#7270";"14-Mar-19 04:01 PM";"@FishyGuts I want to say that's a stretch, but seeing who Lydia Schafer works for, what she does, and that she's a big Komodo fan; that does make it interesting.";"";"";
"340853944488165376";"Blackbeard#9921";"14-Mar-19 04:04 PM";"interesting theory @FishyGuts";"";"";
"455741312273219595";"jl777c#5810";"14-Mar-19 04:06 PM";"since KMD isnt forcing people to pay fees, it becomes much more attractive to just use KMD than make your own. even just the small dPoW cost will have many many chains, some from large companies.

 I see many thinking that it is better to charge high fees and that ETH gas model is perfect. But from last years BTC fee market and cryptokitties, we all saw what happens when the fees get too high. you just stop using it. Making a CC design without any gas required, this is a big reduction in barrier to entry. During the adoption phase is NOT the time to increase the costs for adoption, even if it might boost the marketcap in the short term. komodo aims for maximizing long term adoption and for open source how can you even enforce fees anyway?";"";"👍 (5),👌 (3)";
"340853944488165376";"Blackbeard#9921";"14-Mar-19 04:18 PM";"the gas model is flawed imo";"";"";
"298254263157522435";"Draeth#3300";"14-Mar-19 05:41 PM";"The kmd coin is available for pre-order now! https://physicalcryptocoins.com/product/komodo-coin/";"";"👍 (1)";
"427867553784922113";"FishyGuts#5085";"14-Mar-19 05:47 PM";"https://tenor.com/view/take-my-money-spongebob-roll-of-cash-gif-10382686";"";"";
"474137082965786634";"Neubema#7133";"14-Mar-19 06:37 PM";"how is the emission of arrr ?";"";"";
"474137082965786634";"Neubema#7133";"14-Mar-19 06:37 PM";"is there a dedicated arrr channel ?";"";"";
"397372307154403329";"yorklab#7270";"14-Mar-19 06:46 PM";"https://discord.gg/V6P6KB";"";"";
"427867553784922113";"FishyGuts#5085";"14-Mar-19 06:49 PM";"Whoa almost 2500! 💪🏴☠️";"";"";
"430772336472621056";"D3b0#9761";"14-Mar-19 07:11 PM";"https://www.reddit.com/r/nanocurrency/comments/ak4cdr/china_center_for_information_and_industry/";"";"";
"143629520971366400";"hastrup#8742";"14-Mar-19 09:32 PM";"Is this a competitor to KMD Dex?";"";"";
"143629520971366400";"hastrup#8742";"14-Mar-19 09:32 PM";"https://efin.cx/?rc=NUL2T";"";"";
"264236295432175616";"Gordon Komodo#7477";"14-Mar-19 10:57 PM";"nope, not a competitor, it could be future partner";"";"";
"375074477756645386";"ca333#0118";"15-Mar-19 12:22 AM";"nice @Draeth - thank you!";"";"";
"235143047053180949";"Steve Lee#1967";"15-Mar-19 01:10 AM";"@hastrup That would require them to have working atomic swaps. Looks like it is still a roadmap item for them.";"";"🔥 (2)";
"397372307154403329";"yorklab#7270";"15-Mar-19 01:16 AM";"This is new:
https://www.equicex.com/2019/03/15/komodo-virtual-bitcoin-card/";"";"";
"427867553784922113";"FishyGuts#5085";"15-Mar-19 03:59 AM";"Does anyone know who Maeler is?   I want some KMD pins. 👍";"";"";
"405011811511828481";"Alright#0419";"15-Mar-19 04:07 AM";"https://cryptopins.info/product/kmd/";"";"";
"427867553784922113";"FishyGuts#5085";"15-Mar-19 04:21 AM";"Yeah.   Hook it up.  It's not who you thought at first.   The search continues.";"";"";
"143629520971366400";"hastrup#8742";"15-Mar-19 04:50 AM";"@Steve Lee thx for the answer 👍";"";"";
"436632473867124736";"bubu#1031";"15-Mar-19 06:57 AM";"good morning friends";"";"👋🏽 (1),🌞 (1)";
"371114647052615681";"Mylo#8306";"15-Mar-19 07:24 AM";"https://www.komodo-cakeshop.com/shop/

New cakes added to the cakeshop!   It is not a real cakeshop, just a demo of komodo technology including a self-install blockchain appliance (in dev, instructions on github)";"";"";
"508277543498022923";"Crabby Paddy#6239";"15-Mar-19 07:36 AM";"I just bought the almond cake and sent 19kmd";"";"";
"508277543498022923";"Crabby Paddy#6239";"15-Mar-19 07:36 AM";"I better receive my baked goodies :2561_feelsevilman:";"";"";
