AuthorID;Author;Date;Content;Attachments;Reactions;
"364836172750389249";"cryptopleb#8063";"16-Mar-19 08:19 AM";"If i go to media and internet search i find barterdex p2p exchange";"";"";
"364836172750389249";"cryptopleb#8063";"16-Mar-19 08:20 AM";"But not even work and top 100 crypto";"";"";
"242635006516658197";"jorian#4555";"16-Mar-19 08:20 AM";"the dex is just 1 part of the platform";"";"";
"364836172750389249";"cryptopleb#8063";"16-Mar-19 08:20 AM";"Very upset";"";"";
"242635006516658197";"jorian#4555";"16-Mar-19 08:20 AM";"i can understand, but this is new tech";"";"";
"242635006516658197";"jorian#4555";"16-Mar-19 08:20 AM";"don't expect it to work instantly";"";"";
"364836172750389249";"cryptopleb#8063";"16-Mar-19 08:20 AM";"But Bancor work and other";"";"";
"364836172750389249";"cryptopleb#8063";"16-Mar-19 08:21 AM";"I even try Blocknet after and work too";"";"";
"364836172750389249";"cryptopleb#8063";"16-Mar-19 08:21 AM";"But i want to build app between dex";"";"";
"242635006516658197";"jorian#4555";"16-Mar-19 08:21 AM";"With Bancor, every transaction is executed directly against a smart contract";"";"";
"242635006516658197";"jorian#4555";"16-Mar-19 08:21 AM";"that's not a dex like barterdex";"";"";
"364836172750389249";"cryptopleb#8063";"16-Mar-19 08:21 AM";"Correct";"";"";
"455741312273219595";"jl777c#5810";"16-Mar-19 08:21 AM";"the barterDEX works, but you need to set up all the nodes properly";"";"";
"364836172750389249";"cryptopleb#8063";"16-Mar-19 08:21 AM";"But ETH side it is ok for now";"";"";
"423176312354635779";"gcharang#6833";"16-Mar-19 08:22 AM";"> If i go to media and internet search i find barterdex p2p exchange

Even now if you can stomach CLI trades can be done very easily";"";"";
"455741312273219595";"jl777c#5810";"16-Mar-19 08:22 AM";"during the transition, we are not maintaining the various nodes";"";"";
"455741312273219595";"jl777c#5810";"16-Mar-19 08:22 AM";"it is not end user ready via GUI";"";"";
"364836172750389249";"cryptopleb#8063";"16-Mar-19 08:22 AM";"Who are we?";"";"";
"455741312273219595";"jl777c#5810";"16-Mar-19 08:22 AM";"who are you?";"";"";
"364836172750389249";"cryptopleb#8063";"16-Mar-19 08:22 AM";"I want to use node";"";"";
"364836172750389249";"cryptopleb#8063";"16-Mar-19 08:22 AM";"Not electrum";"";"";
"455741312273219595";"jl777c#5810";"16-Mar-19 08:22 AM";"then use a node";"";"";
"455741312273219595";"jl777c#5810";"16-Mar-19 08:23 AM";"but you need to set up your own barterDEX network for now as we are transitionioning to mm2";"";"";
"364836172750389249";"cryptopleb#8063";"16-Mar-19 08:23 AM";"So i need more than 2 trader?";"";"";
"455741312273219595";"jl777c#5810";"16-Mar-19 08:23 AM";"all the code is there to do this, but it is not for end users";"";"";
"364836172750389249";"cryptopleb#8063";"16-Mar-19 08:24 AM";"This is trouble:";"";"";
"364836172750389249";"cryptopleb#8063";"16-Mar-19 08:24 AM";"Who broadcast order";"";"";
"455741312273219595";"jl777c#5810";"16-Mar-19 08:25 AM";"do you understand what it means that the service is not available right now?";"";"";
"455741312273219595";"jl777c#5810";"16-Mar-19 08:25 AM";"if you want it available you need to setup the entire system";"";"";
"364836172750389249";"cryptopleb#8063";"16-Mar-19 08:25 AM";"Yes";"";"";
"455741312273219595";"jl777c#5810";"16-Mar-19 08:25 AM";"it needs to be done via cli";"";"";
"364836172750389249";"cryptopleb#8063";"16-Mar-19 08:25 AM";"But how to setup for order broadcast";"";"";
"455741312273219595";"jl777c#5810";"16-Mar-19 08:25 AM";"LP node, seed node and client node";"";"";
"455741312273219595";"jl777c#5810";"16-Mar-19 08:25 AM";"it all works just fine if things are setup";"";"";
"455741312273219595";"jl777c#5810";"16-Mar-19 08:26 AM";"if it is not setup, it wont work";"";"";
"455741312273219595";"jl777c#5810";"16-Mar-19 08:26 AM";"so far, you are the only one to complain that it is not running";"";"";
"364836172750389249";"cryptopleb#8063";"16-Mar-19 08:27 AM";"I find way to do things to help my user";"";"";
"364836172750389249";"cryptopleb#8063";"16-Mar-19 08:27 AM";"And we need full DX";"";"";
"364836172750389249";"cryptopleb#8063";"16-Mar-19 08:27 AM";"But what is this stuff you talk about";"";"";
"455741312273219595";"jl777c#5810";"16-Mar-19 08:27 AM";"who is ""we""";"";"";
"364836172750389249";"cryptopleb#8063";"16-Mar-19 08:27 AM";"We is my team";"";"";
"455741312273219595";"jl777c#5810";"16-Mar-19 08:28 AM";"which team is this?";"";"";
"364836172750389249";"cryptopleb#8063";"16-Mar-19 08:28 AM";"We are private investor group seeking DEX 😃";"";"";
"455741312273219595";"jl777c#5810";"16-Mar-19 08:28 AM";"so you are resistance or safetrade?";"";"";
"364836172750389249";"cryptopleb#8063";"16-Mar-19 08:28 AM";"No";"";"";
"364836172750389249";"cryptopleb#8063";"16-Mar-19 08:29 AM";"We are looking for safe DX no kyc to make big otc orders";"";"";
"455741312273219595";"jl777c#5810";"16-Mar-19 08:30 AM";"using cli would be the way, but wait for mm2. it is in testing now and we are transitioning to it. mm1 is deprecated";"";"";
"364836172750389249";"cryptopleb#8063";"16-Mar-19 08:31 AM";"Before side chat i ask question about broadcast and maintain of order";"";"";
"364836172750389249";"cryptopleb#8063";"16-Mar-19 08:32 AM";"I need to know who handle.  I thought i handle this";"";"";
"364836172750389249";"cryptopleb#8063";"16-Mar-19 08:32 AM";"With full node";"";"";
"364836172750389249";"cryptopleb#8063";"16-Mar-19 08:32 AM";"And p2p";"";"";
"364836172750389249";"cryptopleb#8063";"16-Mar-19 08:32 AM";"BNB chain have validator server for this";"";"";
"364836172750389249";"cryptopleb#8063";"16-Mar-19 08:33 AM";"Centralized though";"";"";
"423176312354635779";"gcharang#6833";"16-Mar-19 08:34 AM";"> LP node, seed node and client node

seed node: creates the network (can be done by anyone; even yourself)
LP node: seller
 client node: buyer

these are in the old dex; I am not sure how it is done in the new DEX but P2P is fundamental";"";"";
"242635006516658197";"jorian#4555";"16-Mar-19 08:34 AM";"also bittorrent DHT. it is really p2p";"";"";
"242635006516658197";"jorian#4555";"16-Mar-19 08:34 AM";"#dev-tradebots is a channel to check and ask";"";"";
"364836172750389249";"cryptopleb#8063";"16-Mar-19 08:35 AM";"So who broadcast order though";"";"";
"242635006516658197";"jorian#4555";"16-Mar-19 08:35 AM";"you do";"";"";
"364836172750389249";"cryptopleb#8063";"16-Mar-19 08:35 AM";"Ok";"";"";
"242635006516658197";"jorian#4555";"16-Mar-19 08:35 AM";"or, your node, specifically";"";"";
"427867553784922113";"FishyGuts#5085";"16-Mar-19 08:35 AM";"Anyone else impressed and happy that Cryptopleb wants to ensure his full node, security and decentralization?";"";"";
"242635006516658197";"jorian#4555";"16-Mar-19 08:35 AM";"yes 👍";"";"";
"364836172750389249";"cryptopleb#8063";"16-Mar-19 08:35 AM";"So i get to broadcast";"";"";
"427867553784922113";"FishyGuts#5085";"16-Mar-19 08:35 AM";"Rare to see it seems.";"";"";
"423176312354635779";"gcharang#6833";"16-Mar-19 08:35 AM";"and other nodes in the network help you by re-broadcasting it";"";"";
"364836172750389249";"cryptopleb#8063";"16-Mar-19 08:35 AM";"But it seem that just not working now";"";"";
"364836172750389249";"cryptopleb#8063";"16-Mar-19 08:35 AM";"Can i add peer to receive?";"";"";
"427867553784922113";"FishyGuts#5085";"16-Mar-19 08:36 AM";"Pleb, you may be a little early.   MarketMaker 2 will make you happy I bet.";"";"";
"364836172750389249";"cryptopleb#8063";"16-Mar-19 08:36 AM";"It make me so aggravating no receive";"";"";
"364836172750389249";"cryptopleb#8063";"16-Mar-19 08:36 AM";"SO aggravating 😃";"";"";
"427867553784922113";"FishyGuts#5085";"16-Mar-19 08:36 AM";"!kmdtip @cryptopleb 9.99";"";"";
"499325474128920597";"KMD TipBot#0077";"16-Mar-19 08:36 AM";"";"";"";
"364836172750389249";"cryptopleb#8063";"16-Mar-19 08:36 AM";"I cannot explain more than this vent now 😊";"";"";
"423176312354635779";"gcharang#6833";"16-Mar-19 08:36 AM";"https://docs.komodoplatform.com/barterDEX/setup-FR-full-relay-node-barterDEX.html#what-is-a-full-relay-fr-node";"";"";
"423176312354635779";"gcharang#6833";"16-Mar-19 08:37 AM";"There are solutions in development that make all this very easy and straightforward
So if you can, please wait for mm2 release";"";"";
"364836172750389249";"cryptopleb#8063";"16-Mar-19 08:38 AM";"@FishyGuts thank you for tip 😃  We need full node for insure client security 😃";"";"";
"364836172750389249";"cryptopleb#8063";"16-Mar-19 08:38 AM";"Can barter dex code be easy integration into blocknet?";"";"";
"364836172750389249";"cryptopleb#8063";"16-Mar-19 08:39 AM";"There was another who try full node validate but cannot think right now";"";"";
"364836172750389249";"cryptopleb#8063";"16-Mar-19 08:40 AM";"I want to create application that will take multi dex in 1 spot";"";"";
"364836172750389249";"cryptopleb#8063";"16-Mar-19 08:40 AM";"Everyone win 😃";"";"";
"423176312354635779";"gcharang#6833";"16-Mar-19 08:40 AM";"Does blocknet use pure atomic swaps or use an on-chain dex?";"";"";
"364836172750389249";"cryptopleb#8063";"16-Mar-19 08:40 AM";"They only use chain for tx print to blockchain";"";"";
"364836172750389249";"cryptopleb#8063";"16-Mar-19 08:40 AM";"So pure in swap yes";"";"";
"455741312273219595";"jl777c#5810";"16-Mar-19 08:41 AM";"contact @cipi who is expert on low level barterdex";"";"";
"455741312273219595";"jl777c#5810";"16-Mar-19 08:41 AM";"but you need to do cli";"";"";
"455741312273219595";"jl777c#5810";"16-Mar-19 08:41 AM";"not GUI";"";"";
"364836172750389249";"cryptopleb#8063";"16-Mar-19 08:41 AM";"I can do CLI but normals cant 😃";"";"";
"364836172750389249";"cryptopleb#8063";"16-Mar-19 08:42 AM";"I feel apologize now, sometime i get so aggravate that boom";"";"";
"423176312354635779";"gcharang#6833";"16-Mar-19 08:42 AM";"If you want to understand the internals ask cipi; for normals they can use mm2 when it is released";"";"";
"364836172750389249";"cryptopleb#8063";"16-Mar-19 08:42 AM";"But it sound like i can check back later";"";"";
"364836172750389249";"cryptopleb#8063";"16-Mar-19 08:42 AM";"I would like to talk to cipi yes";"";"";
"364836172750389249";"cryptopleb#8063";"16-Mar-19 08:44 AM";"So with update: client handle order broadcast";"";"";
"364836172750389249";"cryptopleb#8063";"16-Mar-19 08:46 AM";"Smart address check full node validate on blockchain";"";"";
"364836172750389249";"cryptopleb#8063";"16-Mar-19 08:46 AM";"To know where blockchain data";"";"";
"364836172750389249";"cryptopleb#8063";"16-Mar-19 08:46 AM";"Since smartaddress import into wallet";"";"";
"455741312273219595";"jl777c#5810";"16-Mar-19 08:46 AM";"yes, fullnode only was how it was originally, SPV mode was added later";"";"";
"364836172750389249";"cryptopleb#8063";"16-Mar-19 08:46 AM";"Yes";"";"";
"364836172750389249";"cryptopleb#8063";"16-Mar-19 08:46 AM";"And that is last part";"";"";
"364836172750389249";"cryptopleb#8063";"16-Mar-19 08:47 AM";"SPV node is electrum?";"";"";
"455741312273219595";"jl777c#5810";"16-Mar-19 08:47 AM";"yes";"";"";
