AuthorID;Author;Date;Content;Attachments;Reactions;
"352577127494713345";"phm87#7395";"28-Apr-19 03:41 PM";"I don't know if LN guys replied sorry";"";"";
"352577127494713345";"phm87#7395";"28-Apr-19 03:44 PM";"but the dust problem and fee problem is discussed regularly on LN chats/forums, I agree that these are problems, actual problems.";"";"";
"352577127494713345";"phm87#7395";"28-Apr-19 03:44 PM";"Back to CHIPS : without routing and hops, I will have way less problems 😃";"";"";
"352577127494713345";"phm87#7395";"28-Apr-19 03:46 PM";"and more liberty to set fees to avoid to be stuck";"";"";
"455741312273219595";"jl777c#5810";"28-Apr-19 03:46 PM";"yes, and if LN is only in demand when BTC txfees are high, and that breaks LN by making it require trust...";"";"";
"455741312273219595";"jl777c#5810";"28-Apr-19 03:46 PM";"it seems as scalable as ETH";"";"";
"352577127494713345";"phm87#7395";"28-Apr-19 03:48 PM";"at the end of the article, they wrote 
```Rizun’s paper notes that the issue adds unneeded friction from layer one to layer two by “forcing complex and poorly-understood work-arounds to the L2 protocol.”```
I cannot agree more with the end of the sentence : few solutions that were explained (on LN chats/forums) were not realistic. Poorly understood work around is also a risk that these work arounds are performed by paid services (exchanges ?) because too complex for users";"";"";
"455741312273219595";"jl777c#5810";"28-Apr-19 03:49 PM";"reminds me of juggling chainsaws while skating around in circles";"";"😄 (1)";
"455741312273219595";"jl777c#5810";"28-Apr-19 03:49 PM";"nothing prevents you from doing it right, but nothin guarantees you will either";"";"";
"352577127494713345";"phm87#7395";"28-Apr-19 03:58 PM";"lol, thank you for the discussion";"";"";
"427867553784922113";"FishyGuts#5085";"28-Apr-19 04:30 PM";"@dukeleto do I even waste my time posting this on twitter?

*FYI, articles like this and other recent ones by he same author are why the @PirateChain team is not doing the @ProofOfReview process we won the voting on.‬

‪We don’t expect a fair and unbiased review.‬

‪As evidenced, this researchers facts and data dissection is often sub-par*";"";"";
"427867553784922113";"FishyGuts#5085";"28-Apr-19 04:31 PM";"Same dude who called Ben O a wage cuck because he couldn’t or wouldn’t answer bens simple questions.";"";"";
"249256116150730753";"PHBA2061#2530";"28-Apr-19 04:32 PM";"*Proof of Review* 😖";"";"";
"349903748539351042";"allbits#5898";"28-Apr-19 05:09 PM";"reminds me of juggling chainsaws while skating around in circles";"";"";
"349903748539351042";"allbits#5898";"28-Apr-19 05:09 PM";"Is there a cc for that?";"";"";
"474206298427097099";"ComputerGenie 👴🏼📢#7004";"28-Apr-19 05:15 PM";"Tuesday";"";"";
"412323938782150658";"SHossain#0007";"28-Apr-19 05:17 PM";"42";"";"👁 (1)";
"504735704543395853";"mrlynch#5735";"28-Apr-19 07:08 PM";"43 i win haha";"";"";
"504735704543395853";"mrlynch#5735";"28-Apr-19 07:15 PM";"if anyone has any doubts on who to vote for
https://notarystats.info/testnet.php?period=all
:3040_kingpeepo:";"";"";
"301766691992371210";"Markus#5464";"28-Apr-19 07:37 PM";"Good job @mrlynch";"";"🙏 (1)";
"519214559215747072";"m_maria_a#0348";"28-Apr-19 09:16 PM";"hi, i wanted to write an extended essay for my math course about mathematics behind secure hashing algorithm, can you recommend me where should i start and also what parts of math i need to master in order to understand sha? I only learned about this type of cryptography recently";"";"";
"448777271701143562";"smk762 -  dracocanis ominator#7640";"28-Apr-19 10:25 PM";"https://en.wikipedia.org/wiki/SHA-2#Pseudocode";"";"🍴 (1)";
"482773501435052032";"Exile13#4458";"29-Apr-19 03:44 AM";"mmm smells like hash";"";"";
"365714438864633856";"dukeleto#7326";"29-Apr-19 07:23 AM";"@m_maria_a this is one of the best overviews of all cryptographic hash functions that I know: https://valerieaurora.org/hash.html";"";"rum (1)";
"482773501435052032";"Exile13#4458";"29-Apr-19 09:42 AM";"`[3] Google spent 6500 CPU years and 110 GPU years to convince everyone we need to stop using SHA-1 for security critical applications. Also because it was cool.` LOL";"";"";
"365714438864633856";"dukeleto#7326";"29-Apr-19 09:56 AM";"yes, that was SHAttered: http://shattered.it/";"";"";
"365714438864633856";"dukeleto#7326";"29-Apr-19 09:56 AM";"Quite the big deal when it came out. That is the main reason why Git is migrating to SHA256";"";"";
"365714438864633856";"dukeleto#7326";"29-Apr-19 09:57 AM";"Git is not vulnerable to the exact SHAttered attack, but it sure does not make them sleep well at night";"";"";
"249256116150730753";"PHBA2061#2530";"29-Apr-19 09:57 AM";"`Non-expert (""slashdotter"") reaction`  😂";"";"😛 (1)";
"365714438864633856";"dukeleto#7326";"29-Apr-19 10:04 AM";"That made me laugh, too";"";"";
"456717614098415616";"GuilouGuilouOTE#1930";"29-Apr-19 10:12 AM";"Hello everyone,
Someone would have an opinion on the Blokcnet XRouter?
Although I read their recent publications, I still can not understand the purpose of the project and all seems really approximate.
Do you know what can actually be achieved with this router?
If indeed what is in question is relevant, could not the CCs also achieve this?

Finally, to return to their ""DEX"", we agree that there is a nuance to be made compared to Barterdex and MM2 coming because of the use of proxy token with BlockDX?";"";"";
"242635006516658197";"jorian#4555";"29-Apr-19 10:26 AM";"iirc, BlockDX didn't use a proxy token";"";"";
"405380797537976320";"Cryptoon#3362";"29-Apr-19 10:27 AM";"I thought they did for the xrouter stuff they were going to use for liquidity";"";"";
"405380797537976320";"Cryptoon#3362";"29-Apr-19 10:27 AM";"Also remembered them already announcing xrouter like end of 2017 early 2018 or so?";"";"";
"455741312273219595";"jl777c#5810";"29-Apr-19 10:35 AM";"i dont understand how xrouter can be made without changing each coin daemon code. maybe they have a way of securing data from other chains, or maybe the masternodes are just to be trusted";"";"";
"456013288208203777";"jeezy#3408";"29-Apr-19 11:06 AM";"https://twitter.com/TeamChainstrike/status/1122777458921623552";"";"";
"456013288208203777";"jeezy#3408";"29-Apr-19 11:06 AM";"https://twitter.com/TeamChainstrike/status/1122818782429315073";"";"😍 (3),🙏 (8),😘 (1),shexy (4)";
"456013288208203777";"jeezy#3408";"29-Apr-19 11:07 AM";"good work @TwilightPunkster K64  and @Deleted User  - keep it up!";"";"😀 (3),😊 (1),shexy (1)";
"283395529449406464";"TwilightPunkster K64#7533";"29-Apr-19 11:09 AM";"@jeezy ❤ and congrats @Community Contributor 🤘";"";"";
"456226577798135808";"Deleted User#0000";"29-Apr-19 11:10 AM";"thanks a lot @jeezy , it will help a lot !";"";"";
"365714438864633856";"dukeleto#7326";"29-Apr-19 11:24 AM";"@TwilightPunkster K64 @Deleted User Team Chainstrike believes in your projects, and that both projects have vast positive influence inside + outside the KMD community";"";"❤ (3),🎵 (4)";
"365714438864633856";"dukeleto#7326";"29-Apr-19 11:24 AM";"we are glad we can help along this exciting new projects";"";"😍 (3)";
"301766691992371210";"Markus#5464";"29-Apr-19 12:34 PM";"Where is the best place to learn basics when it comes to anything blockchain related and eventually end up building smart contracts on KMD platform?";"";"";
"455741312273219595";"jl777c#5810";"29-Apr-19 12:39 PM";"#kmdlabs";"";"labs (5),🔥 (1),🤔 (1)";
"405011811511828481";"Alright#0419";"29-Apr-19 03:42 PM";"@jl777c isn't blocknet router very similar to what basilisk was?";"";"";
"405011811511828481";"Alright#0419";"29-Apr-19 03:42 PM";"basically allows you to do rpc commands on different chains via BLOCK MNs";"";"";
"405011811511828481";"Alright#0419";"29-Apr-19 03:43 PM";"so you issue a command on blocknet router network that says ""give me getinfo from LTC""";"";"";
"405011811511828481";"Alright#0419";"29-Apr-19 03:43 PM";"and it does";"";"";
"405011811511828481";"Alright#0419";"29-Apr-19 03:43 PM";"via BLOCK MNs running LTC";"";"";
"455741312273219595";"jl777c#5810";"29-Apr-19 03:43 PM";"i guess it is, but it relied on NN to have some trust in the results";"";"";
"455741312273219595";"jl777c#5810";"29-Apr-19 03:43 PM";"trusting random MN is a different thing";"";"";
"455741312273219595";"jl777c#5810";"29-Apr-19 03:44 PM";"also, any dapp can just issue calls to SPV servers";"";"";
"474206298427097099";"ComputerGenie 👴🏼📢#7004";"30-Apr-19 05:02 AM";"https://www.americascardroom.eu/komodo-cryptocurrency/";"";"🤔 (2)";
"474206298427097099";"ComputerGenie 👴🏼📢#7004";"30-Apr-19 05:03 AM";"interesting place to find such an article";"";"";
"272003866906722306";"TonyL#3577";"30-Apr-19 05:33 AM";"Oh I played in this room before. Are they accepting Komodo directly as deposit option?";"";"";
"272003866906722306";"TonyL#3577";"30-Apr-19 05:34 AM";"https://www.americascardroom.eu/cryptocurrency/ looks like so 🔥";"";"";
"420119978138664961";"CHMEX#0686";"30-Apr-19 05:34 AM";"and BTCD";"";"";
"456013288208203777";"jeezy#3408";"30-Apr-19 05:37 AM";"and NXT";"";"";
"365714438864633856";"dukeleto#7326";"30-Apr-19 02:28 PM";"https://twitter.com/dukeleto/status/1123231214658367490";"";"👍 (2)";
"519214559215747072";"m_maria_a#0348";"30-Apr-19 02:37 PM";"question about sha family: why those logical functions where chosen for hashing and not any others? I mean why for example  there is f(i, B, C, D) = (B and C) or ((not B) and D) used for 0>= i >=19 in sha1 and not any other values of i or any other function? Or why there is shift 5 to the right in the sha2? or even how do i choose first 5 H for sha1 algorithm?";"";"";
"519214559215747072";"m_maria_a#0348";"30-Apr-19 02:38 PM";"i cannot find any detailed explanation in the internet";"";"";
"365714438864633856";"dukeleto#7326";"30-Apr-19 02:43 PM";"@m_maria_a you will most likely need to read the academic papers that describe the algorithms";"";"";
"365714438864633856";"dukeleto#7326";"30-Apr-19 02:44 PM";"@m_maria_a every value is extremely important and changing one value could make everything break";"";"";
"365714438864633856";"dukeleto#7326";"30-Apr-19 02:45 PM";"@m_maria_a maybe this intro article will help: https://pdfs.semanticscholar.org/0177/00ba0459185e3670d3317d54f137c4fef8b6.pdf";"";"";
"365714438864633856";"dukeleto#7326";"30-Apr-19 02:45 PM";"which compares MD5 and SHA1";"";"";
"365714438864633856";"dukeleto#7326";"30-Apr-19 02:45 PM";"SHA1 was made to replace MD5. MD5 replaced MD4,3,2,1,0......";"";"";
"365714438864633856";"dukeleto#7326";"30-Apr-19 02:45 PM";"SHA2 and SHA3 replace SHA1";"";"";
"519214559215747072";"m_maria_a#0348";"30-Apr-19 02:45 PM";"i found some academic papers however they do not really explain the source of choosing those algorithms, thank you very much for the link";"";"";
"365714438864633856";"dukeleto#7326";"30-Apr-19 02:46 PM";"the algorithms are chosen such that they are very hard to attack";"";"";
"365714438864633856";"dukeleto#7326";"30-Apr-19 02:46 PM";"the numbers/constants are discovered via experimentation, optimized to make attacks the least efficient";"";"";
"365714438864633856";"dukeleto#7326";"30-Apr-19 02:47 PM";"very few people in the world can come up with new secure cryptographic hash functions";"";"";
"519214559215747072";"m_maria_a#0348";"30-Apr-19 02:47 PM";"i know the general idea and the hierarchy of the algorithms as well as some more advanced mathematical tools used in them however the understanding of them do not really help me in understanding why thy not any other where chosen. However, as i am very new to the topic most of it is still dark matter for me";"";"";
"365714438864633856";"dukeleto#7326";"30-Apr-19 02:48 PM";"@m_maria_a it's trivial to ""backdoor"" an algorithm by changing a few constants, governments do this";"";"";
"365714438864633856";"dukeleto#7326";"30-Apr-19 02:48 PM";"@m_maria_a are you asking why a certain constant was chosen in 1 algorithm, or why certain algorithms are chosen over others?";"";"";
"519214559215747072";"m_maria_a#0348";"30-Apr-19 02:49 PM";"why a certain constant was chosen in an algorithm";"";"";
"365714438864633856";"dukeleto#7326";"30-Apr-19 02:49 PM";"This is the best known proven government backdoor in a crypto library: https://en.wikipedia.org/wiki/Dual_EC_DRBG";"";"";
"365714438864633856";"dukeleto#7326";"30-Apr-19 02:49 PM";"@m_maria_a it was chosen to maximize attack cost, is the most general answer";"";"";
"365714438864633856";"dukeleto#7326";"30-Apr-19 02:49 PM";"@m_maria_a which level of math background do you have, may I ask?";"";"";
"519214559215747072";"m_maria_a#0348";"30-Apr-19 02:50 PM";"but is there any explanation available why it was the best option in decreasing  the potential attack of the hackers?";"";"";
"365714438864633856";"dukeleto#7326";"30-Apr-19 02:50 PM";"https://en.wikipedia.org/wiki/Differential_cryptanalysis";"";"";
"519214559215747072";"m_maria_a#0348";"30-Apr-19 02:50 PM";"i take mathematics hl in ib diploma programme";"";"";
"365714438864633856";"dukeleto#7326";"30-Apr-19 02:51 PM";"@m_maria_a have you done calculus yet?";"";"";
"519214559215747072";"m_maria_a#0348";"30-Apr-19 02:51 PM";"yes";"";"";
"365714438864633856";"dukeleto#7326";"30-Apr-19 02:51 PM";"math classes that people take are very different in different countries";"";"";
"365714438864633856";"dukeleto#7326";"30-Apr-19 02:52 PM";"@m_maria_a read about Differential cryptanalysis above, you will understand some if you have calculus knowledge. Might need to learn a bit more about differentials but you are well on the way";"";"";
"365714438864633856";"dukeleto#7326";"30-Apr-19 02:52 PM";"all new algorithms are put thru attack scenarios, and optimized";"";"";
"365714438864633856";"dukeleto#7326";"30-Apr-19 02:52 PM";"just like blockchains, at least the good ones";"";"";
"519214559215747072";"m_maria_a#0348";"30-Apr-19 02:53 PM";"@dukeleto  first of all thank you very much for your insights, my computer battery is running low now and i dont have my charger with me, can i maybe ask you some more question in the evening on priv? after reading the files and links you send me";"";"";
"365714438864633856";"dukeleto#7326";"30-Apr-19 02:54 PM";"@m_maria_a sure, feel free to DM, or mention me in #dev-students";"";"";
"519214559215747072";"m_maria_a#0348";"30-Apr-19 02:55 PM";"thanks 😃";"";"";
"365714438864633856";"dukeleto#7326";"30-Apr-19 02:55 PM";"happy to teach the next generation, to pay back the people that mentored me 😅";"";"👏 (3)";
"452374492283404288";"passcombo.com 🏴☠🍋#0622";"30-Apr-19 03:30 PM";"like and share: https://www.reddit.com/r/CryptoCurrency/comments/bj4ncu/chips_decentralized_poker_protocol/?";"";"";
"398189630182260746";"Alecandro#1179";"30-Apr-19 04:08 PM";"We need to get Elon Musk to look at Komodo and blow his amazing mind at how much it can do compared to ETH lol";"";"";
"398189630182260746";"Alecandro#1179";"30-Apr-19 04:09 PM";"@jl777c use your super powers and dazzle him with KMD tech";"";"";
"398189630182260746";"Alecandro#1179";"30-Apr-19 04:09 PM";"Hit em with a little razzle dazzle";"";"";
"249256116150730753";"PHBA2061#2530";"30-Apr-19 04:20 PM";"not now, we need to accumulate more KMD first 😛";"";"";
"398189630182260746";"Alecandro#1179";"30-Apr-19 05:02 PM";"Lol truuuu";"";"";
"466679763491225600";"joe2x4#5987";"30-Apr-19 05:47 PM";"'''The Razzle Dazzle is a glorious sex act that takes some planning, but the juice is worth the squeeze. First, you must buy glitter, find a crown royal pouch (the one with the drawstring), and find some rope.''' 🤣";"";"";
"466679763491225600";"joe2x4#5987";"30-Apr-19 05:49 PM";"https://www.urbandictionary.com/define.php?term=razzle%20dazzle";"";"";
"466679763491225600";"joe2x4#5987";"30-Apr-19 05:49 PM";"#4";"";"";
