AuthorID;Author;Date;Content;Attachments;Reactions;
"451135737996378115";"done1987#1698";"27-Oct-19 11:10 AM";"Could there be a bug that a swap is not executed fully? Had 7777 of Rick and 7777 Morty. Now Rick is almost none and Morty did not increase.";"";"";
"231533083818590211";"Oszy#5734";"27-Oct-19 12:21 PM";"well what does your swap status say?";"";"";
"231533083818590211";"Oszy#5734";"27-Oct-19 12:21 PM";"it takes time, how long ago was it?";"";"";
"231533083818590211";"Oszy#5734";"27-Oct-19 12:23 PM";"in case it fails you will be refunded in 4 hours";"";"";
"231533083818590211";"Oszy#5734";"27-Oct-19 12:23 PM";"please read my message above yours, pretty much explains it";"";"";
"375074477756645386";"ca333#0118";"27-Oct-19 12:24 PM";"here we released AtomicDEX mobile 0.2.5 - this version fixes a maker order bug (https://discordapp.com/channels/412898016371015680/584762059430821909/637781973343010827) and is already available for android - iOS pending approval (~24h).";"";"👍 (6),🔥 (3),🚀 (1),KMD (4)";
"301766691992371210";"Markus#5464";"27-Oct-19 12:25 PM";"@ca333 when will atomicdex be released in      the app store instead of having to use testflight on ios?";"";"";
"231533083818590211";"Oszy#5734";"27-Oct-19 12:26 PM";"When it's out of beta 😛";"";"👍 (1),✅ (1)";
"375074477756645386";"ca333#0118";"27-Oct-19 12:33 PM";"@Markus after the beta - using testflight means a controlled testing environment and many essential and important runtime infos.";"";"👍 (1)";
"345992331276713984";"Acura#2748";"27-Oct-19 12:37 PM";"Shouldn't the Dex Asset be added to the current release? can't find it";"";"";
"375074477756645386";"ca333#0118";"27-Oct-19 12:42 PM";"@Acura it will be in the next release - this was just a hotfix release to address the bug report above.";"";"";
"345992331276713984";"Acura#2748";"27-Oct-19 12:42 PM";"Ahh ok - thanks for calrify";"";"👍 (1)";
"451135737996378115";"done1987#1698";"27-Oct-19 01:16 PM";"@Oszy  thanks for the quick reply. It has been refunded now 🙂";"";"👍 (1)";
"426823107865608192";"NNoperator#3835";"27-Oct-19 04:01 PM";"to trade Ethereum do we need to have all 9 million+ TXs  synced, or can we receive ETH and start right away?";"";"⏲ (1)";
"429101104480124929";"jspook16#3059";"27-Oct-19 04:26 PM";"Right away";"";"";
"405380797537976320";"Cryptoon#3362";"27-Oct-19 05:43 PM";"New ios build available";"";"";
"414363456712474626";"JvdP#8992";"27-Oct-19 05:50 PM";"@NNoperator, just like with the other coins you don't have to sync the entire blockchain, you can pretty much start playing rightaway. My phone would be really sad if it had to store all those blockchains...";"";"";
"414363456712474626";"JvdP#8992";"27-Oct-19 05:51 PM";"Oh, wait, @jspook16 already answered that one. Just when I thought I was being useful... 😄";"";"";
"378944945030955010";"Zombie259#6134";"27-Oct-19 05:55 PM";"What about the fees to swap ETH?";"";"";
"231533083818590211";"Oszy#5734";"27-Oct-19 06:29 PM";"what about it?";"";"";
"378944945030955010";"Zombie259#6134";"27-Oct-19 06:36 PM";"How much is the fee to swap 1 ETH to KMD?";"";"";
"405380797537976320";"Cryptoon#3362";"27-Oct-19 06:37 PM";"1/777 is the dexfee";"";"";
"405380797537976320";"Cryptoon#3362";"27-Oct-19 06:37 PM";"And normal gas fee to transfer eth to the new addy?";"";"";
"405380797537976320";"Cryptoon#3362";"27-Oct-19 06:37 PM";"Not sure how high gas fees are atm";"";"";
"378944945030955010";"Zombie259#6134";"27-Oct-19 06:38 PM";"@Cryptoon  Thx";"";"";
"476167358872944641";"mobipoi#5774";"27-Oct-19 06:53 PM";"Would be nice to see live orders before depositing tokens , as when you tap the select coin button it says you have no funds also  more use of the news tab will be.great, such as the news of the stress test";"";"";
"476167358872944641";"mobipoi#5774";"27-Oct-19 06:54 PM";"That a great way to engage user's who dont use discord Twitter telegram  etc also less hassle";"";"";
"476167358872944641";"mobipoi#5774";"27-Oct-19 06:56 PM";"There is my feedback otherwise just waiting kmd assets to be listed so trading on that can starts";"";"💯 (1)";
"231533083818590211";"Oszy#5734";"27-Oct-19 06:58 PM";"@mobipoi unofficial, but you can have a look at the orders here beforehand: https://www.oracle.earth/mm2_orderbook/";"";"";
"476167358872944641";"mobipoi#5774";"27-Oct-19 07:00 PM";"I am aware thanks but would be more convenient using the app";"";"✅ (2)";
"231533083818590211";"Oszy#5734";"27-Oct-19 07:26 PM";"@mobipoi https://github.com/KomodoPlatform/atomicDEX/issues/87 already submitted, if you have any more ideas / request, please open a github issue, messages are getting lost here sometimes.";"";"🍀 (1)";
"476167358872944641";"mobipoi#5774";"27-Oct-19 08:17 PM";"Ok thanks";"";"";
"592562993263542292";"Bernardo94#7153";"27-Oct-19 11:24 PM";"Hello, I need help, I have atomic dex on my smartphone, but for days I try to enter and the screen only comes out in black, what should I do?";"";"";
"231533083818590211";"Oszy#5734";"27-Oct-19 11:24 PM";"@Bernardo94 uninstall the app and install again, have your seed backed up, you'll have to enter it again.";"";"👍 (1)";
"554868095135514626";"ubhillutd#3274";"28-Oct-19 01:30 AM";"This was dumb in my part, but I have the same problem as bernardo94. I may have misplaced my passphrase. I updated the app and all I get is a black screen. I'm worried if I uninstall and reinstall, I will lose whatever little coins I have on the app. Please advise.";"";"";
"133773904471785473";"daemonfox#6136";"28-Oct-19 01:35 AM";"I see the update listed in play store and applied t. Works fine Google Pixel latest Android 10.";"";"";
"133773904471785473";"daemonfox#6136";"28-Oct-19 01:41 AM";"orderbooks werent showing at first but I see orders now";"";"";
"375074477756645386";"ca333#0118";"28-Oct-19 01:48 AM";"@Bernardo94 delete the application and reinstall it as previously advised - that will resolve the ""black screen issue"" and also prevent it from reoccurring in the future. FYI This is a backwards compatibility problem caused when you have not done a clean install after upgrading from a pre 0.2.1 to a > 0.2.1 version. 

@ubhillutd contact our support team - they can guide you through the process of manually installing the old version (downgrading) and keeping the application data to hopefully extract your old seed. PLEASE back your seed up the next time as advised in the account setup.";"";"";
"554868095135514626";"ubhillutd#3274";"28-Oct-19 01:52 AM";"I've contacted support. Will do. Sorry for the inconvenience. You guys rock!";"";"👍 (2)";
"601037633619099648";"GitHub#0000";"28-Oct-19 07:16 AM";"";"";"";
"601037633619099648";"GitHub#0000";"28-Oct-19 07:16 AM";"";"";"KMD (2)";
"143629520971366400";"hastrup#8742";"28-Oct-19 10:16 AM";"Is atomicdex app open source?";"";"";
"405380797537976320";"Cryptoon#3362";"28-Oct-19 10:27 AM";"App no, mm2.0 yes";"";"✅ (1)";
"405380797537976320";"Cryptoon#3362";"28-Oct-19 10:27 AM";"*I think*";"";"";
"375074477756645386";"ca333#0118";"28-Oct-19 10:33 AM";"correct - the AtomicDEX Core is open-source https://github.com/komodoplatform/atomicDEX-API";"";"";
"143629520971366400";"hastrup#8742";"28-Oct-19 10:33 AM";"Will the app be open source a some point?";"";"";
"375074477756645386";"ca333#0118";"28-Oct-19 10:41 AM";"yes";"";"";
"143629520971366400";"hastrup#8742";"28-Oct-19 10:43 AM";"👍";"";"";
"303794669945618442";"PTYX#6840";"28-Oct-19 11:49 AM";"I think it should stay closed source until the team recovers the funds they invested in making it.";"";"";
"303794669945618442";"PTYX#6840";"28-Oct-19 11:49 AM";"Once you open source it, forget revenue.";"";"";
"303794669945618442";"PTYX#6840";"28-Oct-19 11:51 AM";"Dexfees aren't significant enough to give it away for free. At least not with the current volume. Licensing is the way to go.";"";"";
"405380797537976320";"Cryptoon#3362";"28-Oct-19 12:10 PM";"@PTYX makes a good point 🙂";"";"";
"345992331276713984";"Acura#2748";"28-Oct-19 12:28 PM";"I don't like much as a Dex Hodler. (Forget revenue 😬)";"";"";
"345992331276713984";"Acura#2748";"28-Oct-19 12:29 PM";"But maybe I don't have enough understanding for these things either.";"";"";
"303794669945618442";"PTYX#6840";"28-Oct-19 12:31 PM";"@Acura as a dex holder you get revenue from anyone using the dex";"";"";
"303794669945618442";"PTYX#6840";"28-Oct-19 12:32 PM";"Komodo being able to license their premium software doesn't affect you, in fact it benefits you. Without funds development would stall and there would be no incentive for users to use the DEX and hence, no dexfees for dex hodlers.";"";"";
"303794669945618442";"PTYX#6840";"28-Oct-19 12:32 PM";"I'm confused why people think that free equals good. It's almost the opposite without a proper business model.";"";"";
"345992331276713984";"Acura#2748";"28-Oct-19 12:33 PM";"Ok - thanks for the explanation";"";"👍 (1)";
"591555923533758484";"alperC#7758";"28-Oct-19 02:33 PM";"Who is going to participate in the stress test here on Oct 31 ? 😎";"";"🖖 (8),KMD (4),👆 (1),labs (3)";
"231533083818590211";"Oszy#5734";"28-Oct-19 02:41 PM";"🙋";"";"👌 (1)";
"328995143371718656";"t0sma#0368";"28-Oct-19 03:08 PM";"Me";"";"";
"231533083818590211";"Oszy#5734";"28-Oct-19 03:09 PM";"🐍 is getting ready 😄";"";"";
"301766691992371210";"Markus#5464";"28-Oct-19 03:18 PM";"is it possible to use atomic dex api with python?";"";"";
"301766691992371210";"Markus#5464";"28-Oct-19 03:19 PM";"im very new at things like that trying to learn something useful 😄";"";"";
"231533083818590211";"Oszy#5734";"28-Oct-19 03:19 PM";"https://github.com/smk762/pytomicDEX";"";"👍 (1)";
"231533083818590211";"Oszy#5734";"28-Oct-19 03:20 PM";"You can use it with anything you want";"";"";
"501936634040811531";"Crypto Baggins#5441";"28-Oct-19 04:12 PM";"👈This guy  @alperC";"";"👀 (1)";
"448777271701143562";"smk762 -  dracocanis ominator#7640";"28-Oct-19 04:32 PM";"stress test should be mobile only I think, but feel free to give pytomic a test run or fork it and add some cool new features 😉";"";"";
"354615658148790275";"sφldat#8733";"28-Oct-19 05:18 PM";"🙋";"";"";
"591555923533758484";"alperC#7758";"28-Oct-19 08:28 PM";"Are you on team RICK or on team MORTY? 👀 

https://twitter.com/KomodoPlatform/status/1188913557871706112?s=20";"";"😅 (1),👌 (2)";
"375074477756645386";"ca333#0118";"28-Oct-19 10:06 PM";"Prof. Sanchez it is 🙂";"";"";
"406179072922746882";"polycryptoblog#1173";"28-Oct-19 10:43 PM";"";"https://cdn.discordapp.com/attachments/584762059430821909/638508251587018769/image0.jpg";"😂 (2),🥒 (1)";
"375074477756645386";"ca333#0118";"28-Oct-19 10:45 PM";"😂 cool pickle rick costume";"";"";
"405380797537976320";"Cryptoon#3362";"28-Oct-19 10:55 PM";"Solenya!!!";"";"";
"303794669945618442";"PTYX#6840";"29-Oct-19 02:10 AM";"I'm Pickle rick!";"";"";
"403137719049519106";"Audo#5667";"29-Oct-19 07:26 AM";"I must admit that I have never watched Rick&Morty but perhaps during the stress test I'll watch one or two episodes while making swaps";"";"";
"354615658148790275";"sφldat#8733";"29-Oct-19 08:13 AM";"Ahah good idea @Audo you may become a new fan";"";"";
"231533083818590211";"Oszy#5734";"29-Oct-19 08:27 AM";"Just in time for the new season 😎";"";"";
"406179072922746882";"polycryptoblog#1173";"29-Oct-19 09:25 AM";"Bug Report: Samsung Note 9 , infinite stuck on ‘cannot load Eth ‘ can’t load other coins , labs was doing the same";"";"";
"231533083818590211";"Oszy#5734";"29-Oct-19 09:26 AM";"sounds like connection issue, wifi or 4g?";"";"";
"406179072922746882";"polycryptoblog#1173";"29-Oct-19 09:26 AM";"My iPhone had no issue same connection";"";"";
"231533083818590211";"Oszy#5734";"29-Oct-19 09:28 AM";"That's different, we had an issue before where everything was fine on Android, and coins wouldn't load on iOS.  It was an ISP issue in certain geo locations.
That's why I was trying to get more information 😉";"";"";
"375074477756645386";"ca333#0118";"29-Oct-19 09:52 AM";"@polycryptoblog please provide logs (Settings->Share Log File)";"";"";
"418126508650135553";"ѕℓιм#1031";"29-Oct-19 01:23 PM";"is there a Windows version out yet or just mobile?";"";"";
"231533083818590211";"Oszy#5734";"29-Oct-19 01:39 PM";"mobile only now";"";"";
"418126508650135553";"ѕℓιм#1031";"29-Oct-19 02:07 PM";"okay thanks";"";"";
"418126508650135553";"ѕℓιм#1031";"29-Oct-19 02:17 PM";"well I updated it and now it just opens to a black screen";"";"";
"272003866906722306";"TonyL#3577";"29-Oct-19 02:19 PM";"There is a problem with update from specific old versions because of DB rework. Please delete the app and install again (before deletion ensure you control the seed phrase)";"";"";
"418126508650135553";"ѕℓιм#1031";"29-Oct-19 02:20 PM";"got it thank you";"";"👍 (1)";
"403205523433848833";"farl#9964";"29-Oct-19 03:04 PM";"Face ID on my iPhone is a bit bugy when login to iOS Atomicdex";"";"";
"403205523433848833";"farl#9964";"29-Oct-19 03:05 PM";"Especialy when returning to the open app from switching to another app. Keeps checking, but no result and sometimes twice check";"";"";
"231533083818590211";"Oszy#5734";"29-Oct-19 04:44 PM";"Touch ID does that too";"";"";
"418126508650135553";"ѕℓιм#1031";"29-Oct-19 05:19 PM";"it seems to be working well on Android";"";"";
"601037633619099648";"GitHub#0000";"29-Oct-19 05:48 PM";"";"";"";
"601037633619099648";"GitHub#0000";"29-Oct-19 05:58 PM";"";"";"";
"601037633619099648";"GitHub#0000";"29-Oct-19 06:34 PM";"";"";"";
"531774469241438209";"kmd.dex#8716";"29-Oct-19 08:21 PM";"i cannot send screenshots here ?";"";"";
"531774469241438209";"kmd.dex#8716";"29-Oct-19 08:22 PM";"i getcan error on  atomicDex";"";"";
"448777271701143562";"smk762 -  dracocanis ominator#7640";"29-Oct-19 08:24 PM";"use someting like imgur, and post link";"";"";
"531774469241438209";"kmd.dex#8716";"29-Oct-19 08:24 PM";"sp how about tje twst from 31oktober";"";"";
