AuthorID;Author;Date;Content;Attachments;Reactions;
"405011811511828481";"Alright#0419";"20-Mar-19 07:33 PM";"where are you getting 4% from?";"";"";
"482716107925356555";"DmanXX#2257";"21-Mar-19 02:17 PM";"From my calculations";"";"";
"482716107925356555";"DmanXX#2257";"21-Mar-19 02:18 PM";"How much kmd should I get every month from 10,000 KMD?";"";"";
"456690797505544202";"ch6ris#5240";"21-Mar-19 02:19 PM";"5.1% 😋";"";"";
"482716107925356555";"DmanXX#2257";"21-Mar-19 02:19 PM";"Exactly which is 510kmd";"";"";
"456690797505544202";"ch6ris#5240";"21-Mar-19 02:20 PM";"Yeah it's 5.1% pa on average. lots of variables.";"";"";
"465223258803798026";"LeshAft9#0083";"21-Mar-19 02:22 PM";"DmanXX are you using the atomicwallet Ledger KMD Reward Claim webpage? if so, they take 5% of your reward to support their development";"";"";
"465223258803798026";"LeshAft9#0083";"21-Mar-19 02:22 PM";"oh sorry I see you're using Agama";"";"";
"482716107925356555";"DmanXX#2257";"21-Mar-19 02:22 PM";"No I’m using Agama Mac OS 0.3.4";"";"";
"482716107925356555";"DmanXX#2257";"21-Mar-19 02:23 PM";"It’s no big deal it’s few kmd just want to find out how it’s calculated";"";"";
"456690797505544202";"ch6ris#5240";"21-Mar-19 02:23 PM";"i.e maybe you claim once a week, locktime needs to be set for 1 hour before rewards start accruing. you could end up with 50 hours over the year without rewards accruing.";"";"";
"482716107925356555";"DmanXX#2257";"21-Mar-19 02:24 PM";"I’m claiming every month";"";"";
"456690797505544202";"ch6ris#5240";"21-Mar-19 02:25 PM";"at the exact moment in time they stop accruing? I don't know much. But my math shows its pretty damn close to 5%. I have seen very minor variables.";"";"";
"420119978138664961";"CHMEX#0686";"21-Mar-19 02:25 PM";"";"https://cdn.discordapp.com/attachments/429676282196787200/558295199822905344/unknown.png";"";
"482716107925356555";"DmanXX#2257";"21-Mar-19 02:25 PM";"Also I’m using kmd calc";"";"";
"482716107925356555";"DmanXX#2257";"21-Mar-19 02:26 PM";"Yeap that one";"";"";
"482716107925356555";"DmanXX#2257";"21-Mar-19 02:26 PM";"But I’m getting less from Agama";"";"🤔 (1)";
"420119978138664961";"CHMEX#0686";"21-Mar-19 02:27 PM";"what is your address? maybe you have a lot of small utxo which do not accrue";"";"";
"482716107925356555";"DmanXX#2257";"21-Mar-19 02:27 PM";"No I send it to my self whole amount";"";"";
"420119978138664961";"CHMEX#0686";"21-Mar-19 02:28 PM";"ok";"";"";
"456690797505544202";"ch6ris#5240";"21-Mar-19 02:28 PM";"Well when you claim it should create one utxo plus another for the rewards.";"";"";
"482716107925356555";"DmanXX#2257";"21-Mar-19 02:28 PM";"Yes";"";"";
"482716107925356555";"DmanXX#2257";"21-Mar-19 02:28 PM";"I have large amount plus smaller one";"";"";
"456690797505544202";"ch6ris#5240";"21-Mar-19 02:28 PM";"workaround is send the transaction to yourself twice.";"";"";
"482716107925356555";"DmanXX#2257";"21-Mar-19 02:30 PM";"The thing is that kmd atomic calculator is showing completely different amount from what I am getting in Agama";"";"";
"482716107925356555";"DmanXX#2257";"21-Mar-19 02:30 PM";"It could be a glitch";"";"";
"456690797505544202";"ch6ris#5240";"21-Mar-19 02:32 PM";"I doubt it. It isn't perfect. The change to claiming once a month was only made recently. You would need 12 months of perfectly timed claims to really see the full picture.";"";"";
"482716107925356555";"DmanXX#2257";"21-Mar-19 02:32 PM";"https://www.atomicexplorer.com/#/rewards-calc";"";"";
"482716107925356555";"DmanXX#2257";"21-Mar-19 02:33 PM";"That’s what I’m using";"";"";
"482716107925356555";"DmanXX#2257";"21-Mar-19 02:34 PM";"Not really in that calculator you have option to see how much you going to get first month";"";"";
"456690797505544202";"ch6ris#5240";"21-Mar-19 02:34 PM";"it went from claiming once every 12 months to once a month. which theoretically increased the possible rewards by .1%";"";"";
"482716107925356555";"DmanXX#2257";"21-Mar-19 02:35 PM";"And my payout is smaller by few kmd";"";"";
"456690797505544202";"ch6ris#5240";"21-Mar-19 02:36 PM";"Someone more experienced could chime in, I have seen no problem on my end they are not always perfect but I assume it will average out over the year.";"";"";
"482716107925356555";"DmanXX#2257";"21-Mar-19 02:36 PM";"Can any of the developers look into it?";"";"";
"456690797505544202";"ch6ris#5240";"21-Mar-19 02:38 PM";"I honestly don't think there's a problem. @CHMEX ^^^";"";"";
"420119978138664961";"CHMEX#0686";"21-Mar-19 02:40 PM";"ok I will have a look tonight (EU) with a seed that needs to be spend anyways";"";"";
"482716107925356555";"DmanXX#2257";"21-Mar-19 02:41 PM";"Cool let me know if you need anything from me";"";"";
"456690797505544202";"ch6ris#5240";"21-Mar-19 02:42 PM";"`APR rate: 5.111%

Expenses not included in calculation: 0.0012 KMD in transaction fees, 12 hour(s) gap period when no rewards are accrued.

Your actual amounts will be less than what is presented in the table.

Q: What will happen to my KMD rewards after 1 year period is passed.

A: It will stop accruing and remain fixed until it is claimed.`";"";"";
"482716107925356555";"DmanXX#2257";"21-Mar-19 02:43 PM";"Yes I understand but It wouldn’t be few KMD";"";"";
"403229823834521616";"pbca26#5430";"21-Mar-19 02:59 PM";"5% per year not per month!
have a look at monthly breakdown on atomicexplorer's rewards calc and compare to your actual claimed rewards";"";"👍 (1)";
"456690797505544202";"ch6ris#5240";"21-Mar-19 03:05 PM";"`Changes to KMD rewards past block height 1 000 000:

    new KMD coins are rewarded to users when they make transactions
    total rate is ~5.1% per year if done monthly or more often
    you stop getting rewards if you haven't used Komodo network for one month (coins haven't moved in one month)
    new changes don't affect rewards accrued under old rules`";"";"";
"519737019228749824";"Viro Major#1266";"22-Mar-19 09:19 PM";"Hi, has Horizen been integrated to BarterDEX or is planned to be ?";"";"";
"519737019228749824";"Viro Major#1266";"23-Mar-19 11:11 AM";"Who’s in charge of coins’ integration to BarterDEX plz ?";"";"";
"420119978138664961";"CHMEX#0686";"23-Mar-19 11:15 AM";"cipi";"";"";
"519737019228749824";"Viro Major#1266";"23-Mar-19 12:48 PM";"@cipi#4502 hi. could you comment if Horizen could be supported by BarterDEX ? Thanks in advance";"";"";
"420119978138664961";"CHMEX#0686";"23-Mar-19 02:09 PM";"@cipi ^";"";"";
"419964976397156352";"cipi#4502";"23-Mar-19 07:10 PM";"tried ZEN and it didn't work... `op-checkblockatheight-needed` was the error and i think it had something to do with a replay protection they had implemented";"";"";
"519737019228749824";"Viro Major#1266";"24-Mar-19 12:02 AM";"ok thx, too bad..";"";"";
"288941564263268353";"Don King#8901";"26-Mar-19 10:18 AM";"Is there a kmd block explorer that shows ALL transaction history? The ones I have seen only show last 10 tx";"";"";
"420119978138664961";"CHMEX#0686";"26-Mar-19 10:23 AM";"https://kmd.explorer.dexstats.info/address/";"";"";
"420119978138664961";"CHMEX#0686";"26-Mar-19 10:23 AM";"It shoudl not matter but maybe you are on a mobile device?";"";"";
"420119978138664961";"CHMEX#0686";"26-Mar-19 10:24 AM";"On a browser just scroll down and it loads the next 10";"";"";
"288941564263268353";"Don King#8901";"26-Mar-19 10:42 AM";"I'm using chrome on Windows 10, for some reason it doesn't load the next 10. Can I add something to the url to get all tx?";"";"";
"420119978138664961";"CHMEX#0686";"26-Mar-19 10:45 AM";"that is strange
https://www.kmdexplorer.io/address/RF4HiVeuYpaznRPs7fkRAKKYqT5tuxQQTL
has 29k trx scroling down I can see at least 100
( same setup as you )";"";"";
"420119978138664961";"CHMEX#0686";"26-Mar-19 10:45 AM";"maybe some JS disabled?";"";"";
"288941564263268353";"Don King#8901";"26-Mar-19 10:46 AM";"I will try another browser, very weird ...";"";"";
"420119978138664961";"CHMEX#0686";"26-Mar-19 10:46 AM";"send me your address";"";"";
"405011811511828481";"Alright#0419";"26-Mar-19 10:47 AM";"if all else fails https://kmdexplorer.io/insight-api-komodo/addr/RF4HiVeuYpaznRPs7fkRAKKYqT5tuxQQTL";"";"";
"288941564263268353";"Don King#8901";"26-Mar-19 10:51 AM";"Wow, is that full tx history?";"";"";
"420119978138664961";"CHMEX#0686";"26-Mar-19 10:54 AM";"yes but only the first 1000 I think";"";"";
"420119978138664961";"CHMEX#0686";"26-Mar-19 10:54 AM";"https://www.kmdexplorer.io/insight-api-komodo/txs?address=RF4HiVeuYpaznRPs7fkRAKKYqT5tuxQQTL&pageNum=0";"";"";
"420119978138664961";"CHMEX#0686";"26-Mar-19 10:54 AM";"and increment PageNum +1 still you are done";"";"";
"288941564263268353";"Don King#8901";"26-Mar-19 11:00 AM";"I couldn't get agama csv export to work either, always gets an error. I think my PC needs a kick lol";"";"";
"288941564263268353";"Don King#8901";"26-Mar-19 11:05 AM";"It works in IE but not chrome or Firefox ,  weird ... doing taxes yuck lol";"";"";
"420119978138664961";"CHMEX#0686";"26-Mar-19 11:06 AM";"good luck!";"";"";
"288941564263268353";"Don King#8901";"26-Mar-19 11:10 AM";"Thanks, glad I'm not a big trader, have to record every crypto:crypto trade as a CGT event, totally insane way to do it, but that's how the man wants it done";"";"";
"420119978138664961";"CHMEX#0686";"26-Mar-19 11:11 AM";"I can imagine";"";"";
"288941564263268353";"Don King#8901";"26-Mar-19 11:13 AM";"Would be so much easier if I could get the agama csv export to work, doing each tx by hand is gonna take me ages";"";"";
"288941564263268353";"Don King#8901";"26-Mar-19 11:13 AM";"Maybe I install komodo QT, it has nice easy tx export probably like most other wallets";"";"";
"405011811511828481";"Alright#0419";"26-Mar-19 11:15 AM";"@Don King are you using the latest version of Agama?";"";"";
"405011811511828481";"Alright#0419";"26-Mar-19 11:15 AM";"believe that bug was fixed";"";"";
"288941564263268353";"Don King#8901";"26-Mar-19 11:18 AM";"V0.3.4-beta";"";"";
"405011811511828481";"Alright#0419";"26-Mar-19 11:18 AM";"what happens when you click the export button?";"";"";
"288941564263268353";"Don King#8901";"26-Mar-19 11:20 AM";"It sits there saying 'generating csv' but the file never gets created, then eventually an error message appears in bottom RH corner. Tried adjusting the settings for how many tx but even with only 50 tx it never works";"";"";
"288941564263268353";"Don King#8901";"26-Mar-19 11:21 AM";"Can you do csv on cli ?";"";"";
"448777271701143562";"smk762 -  dracocanis ominator#7640";"26-Mar-19 12:19 PM";"lite mode or native?";"";"";
"448777271701143562";"smk762 -  dracocanis ominator#7640";"26-Mar-19 12:19 PM";"I think lite might timeout if too many tx, you'd have more luck in native";"";"";
"448777271701143562";"smk762 -  dracocanis ominator#7640";"26-Mar-19 12:23 PM";"`komodo-cli listtransactions` would also work, but you'll have to parse the json";"";"";
"448777271701143562";"smk762 -  dracocanis ominator#7640";"26-Mar-19 12:27 PM";"`komodo-cli listreceivedbyaddress`";"";"";
"288941564263268353";"Don King#8901";"26-Mar-19 12:32 PM";"Thanks! I was using life mode, but downloading native now";"";"";
"423176312354635779";"gcharang#6833";"26-Mar-19 12:47 PM";"https://support.komodoplatform.com/support/solutions/articles/29000024495-export-private-key-wif-from-a-wallet-seed-or-pin-password
https://support.komodoplatform.com/support/solutions/articles/29000024488-import-seed-phrase-or-private-key-in-agama-native-mode
@Don King the above guides are useful for you";"";"";
"288941564263268353";"Don King#8901";"26-Mar-19 12:56 PM";"Thanks!";"";"";
"303794669945618442";"PTYX#6840";"26-Mar-19 03:57 PM";"https://gizmodo.com/a-dark-day-copyright-law-that-threatens-the-internet-a-1833570802";"";"";
"409990217047474176";"Abdulkadir YILMAZ#4684";"27-Mar-19 11:15 AM";"is it possible to install komodo on a raspberry pi 3?";"";"";
"409990217047474176";"Abdulkadir YILMAZ#4684";"27-Mar-19 11:15 AM";"first i tried to install ubuntu 18.04.2 server arm64 bit edition on raspberry pi 3 preinstalled http://cdimage.ubuntu.com/releases/18.04.2/release/  then  i tried to install komodo manually from this site  https://docs.komodoplatform.com/komodo/install-Komodo-manually.html
Index of /releases/18.04.2/release
CD images for Ubuntu 18.04.2 LTS (Bionic Beaver)
but installing dependancy packages i got error from g++-multilib
i ignored that and continued other steps in installing komodo step from ./zcutil/fetch-params.sh code i got compile error";"";"";
"412594906692059148";"tonystark2099#9565";"31-Mar-19 04:30 PM";"i am playing around with komodo-cli. wondering which commands i need to use to figure out how much dividends i have and how i can claim them...i used help command however there are no obvious command for this...thanks in advance";"";"";
"455741312273219595";"jl777c#5810";"31-Mar-19 04:43 PM";"getbalance";"";"";
"455741312273219595";"jl777c#5810";"31-Mar-19 04:44 PM";"sendtoaddress balance - 0.0001 <dest>";"";"";
"455741312273219595";"jl777c#5810";"31-Mar-19 04:44 PM";"where dest can be any address you control, but simplest if it is the passphrase based address as you know you have a backup";"";"";
"455741312273219595";"jl777c#5810";"31-Mar-19 04:44 PM";"then the change will be the claimed rewards";"";"";
"455741312273219595";"jl777c#5810";"31-Mar-19 04:45 PM";"getinfo will show the approx amount that is available to claim";"";"👌 (1)";
"393476021065744384";"D2D privacyalternatives.com#5667";"31-Mar-19 07:07 PM";"I saw a preview posted a few weeks ago about a new easy to use Komodo UI to create your own blockchain and tokens on the Komodo Platform, similar to the ones Ravencoin and Waves have. Any idea when it will be ready?";"";"";
"405380797537976320";"Cryptoon#3362";"31-Mar-19 07:31 PM";"@ca333 can answer chainlizard questions I think";"";"🦎 (1)";
"375074477756645386";"ca333#0118";"31-Mar-19 11:06 PM";"@D2D privacyalternatives.com - public beta is coming this year and more information about this BaaS with codename Chainlizard is available with the next rebrand update.";"";"🦎 (5)";
"393476021065744384";"D2D privacyalternatives.com#5667";"01-Apr-19 04:21 AM";"@ca333  Ah yes that's the name, Chainlizard. 
Looking forward to it, thanks";"";"👍 (1)";
"97039940700864512";"gets#8925";"01-Apr-19 05:49 PM";"Hi, I recently appiled to have Veil listed on Barterdex, is there any way to see the status of that?";"";"";
"393476021065744384";"D2D privacyalternatives.com#5667";"01-Apr-19 10:24 PM";"Some time ago I asked here if here at Komodo you were going to also create a stable coin with privacy features, but I don't think there was much interest in this. I just realised that there's one called Lumini now being created with MimbleWimble, just thought it might be of interest in case your plans change:
https://stableunit.org/";"";"";
"448777271701143562";"smk762 -  dracocanis ominator#7640";"02-Apr-19 02:08 AM";"@gets the tech under the hood for barterdex is undergoing a massive revamp, so you'll need to wait for next release. Here is info for adding coins btw - https://github.com/KomodoPlatform/Agama/wiki/Add-a-Bitcoin-Compatible-coin-to-Agama-Desktop";"";"";
"303794669945618442";"PTYX#6840";"03-Apr-19 04:13 PM";"I would like to remind everyone that if you have funds on your ledger and you want to participate in the voting starting from April 14th, you can use Magnum wallet to vote: https://twitter.com/Magnum_Wallet/status/1112636938102689793";"";"";
"465223258803798026";"LeshAft9#0083";"03-Apr-19 04:58 PM";"Does Magnum support confirming your address on the device? last time I tried with one of their other ""supported"" coins it didn't seem to have any way to do that operation";"";"";
