AuthorID;Author;Date;Content;Attachments;Reactions;
"412323938782150658";"SHossain#0007";"20-Jun-18 07:10 PM";"https://github.com/DeckerSU/KomodoOcean/releases";"";"👍 (4)";
"412323938782150658";"SHossain#0007";"20-Jun-18 07:10 PM";"Pinned a message.";"";"";
"414128958326571008";"Hermes#6934";"20-Jun-18 10:09 PM";"😎";"";"";
"414128958326571008";"Hermes#6934";"20-Jun-18 10:09 PM";"nice";"";"";
"345544724167524352";"Decker#3767";"28-Jun-18 12:25 AM";"small survey ... how do you think, how many people used our `komodo-qt` in everyday life? question related to upcoming changes since 1.000.000 block ... currently komodo-qt didn't have needed changes in sources for monthly interest claim support and few other things. we didn't see much interest from the community to this wallet. so, the main question is - should we continue to support it? if nobody uses it, should we continue to work on it?";"";"";
"456490768589258753";"ComputerGenie#2331";"28-Jun-18 12:36 AM";"Unless Agama is planed to eventually have advanced features, I think the qt wallet is highly necessary; however, I could just be biased because I use it daily";"";"";
"456490768589258753";"ComputerGenie#2331";"28-Jun-18 12:38 AM";"As to the 2nd part, community interest could have to do with presentation. 99% of the time all people hear is Agama. Granted, it's a flagship product, but I don't think most people even know there is a qt wallet";"";"👍 (1)";
"242635006516658197";"jorian#4555";"28-Jun-18 09:53 AM";"never used it, but i think QT is underpromoted on KMD platform since Agama is the wallet to rule them all";"";"";
"242635006516658197";"jorian#4555";"28-Jun-18 09:54 AM";"once on the KMD platform, chances are you want an asset or two, and that will want you to go to Agama";"";"";
"456490768589258753";"ComputerGenie#2331";"28-Jun-18 11:29 AM";"""since Agama is the wallet to rule them all""
Until Agama has any real coin features, I'll continue to not use it.
imo, Agama is the granny wallet and QT is the wallet for people that actually use currency.";"";"";
"412323938782150658";"SHossain#0007";"28-Jun-18 11:33 AM";"@ComputerGenie you are in the right channel 😛";"";"";
"456490768589258753";"ComputerGenie#2331";"28-Jun-18 11:33 AM";"I do that every now and then";"";"Komodo (1)";
"242635006516658197";"jorian#4555";"28-Jun-18 12:08 PM";"well i can use a currency using Agama";"";"";
"242635006516658197";"jorian#4555";"28-Jun-18 12:08 PM";"define use";"";"";
"456490768589258753";"ComputerGenie#2331";"28-Jun-18 12:24 PM";"maybe ""use"" is too strong of a word and I should have said ""maintain personal control of""?
Unless I've just missed something, Agama lacks :
the ability to send multiple payments at once 
the ability to control fee expenses
any way to manage UTXOs manually
and
any way to even know what UTXOs you have.
Specifically, to the last bit, Agama is like cramming all of your money in your pocket, buying a coffee, and then shoving all of your money at the cashier and saying ""here, you sort it out and give me back whatever change you decide I should have.""";"";"";
"242635006516658197";"jorian#4555";"28-Jun-18 12:29 PM";"good analogy, i think you're right. but it's the easy solution what most people want. If you buy a 23.49$ coffee and all you have are lots of quarters and dimes, then most people are lazy as fuck and rather shove it, yes.";"";"";
"242635006516658197";"jorian#4555";"28-Jun-18 12:29 PM";"the cashier is a computer after all";"";"";
"456490768589258753";"ComputerGenie#2331";"28-Jun-18 12:32 PM";"OK, the flip side to that is:
If you want to spend 9 KMD and you have UTXOs of 10, 10, 3, 3, 3, 3, 3, 3, and 0.0001 then agama will bust up your reward 10 and leave you with 10,  3, 3, 3, 3, 3, 3, 0.9999, and 0.0001";"";"";
"456490768589258753";"ComputerGenie#2331";"28-Jun-18 12:32 PM";"because, bitcoin 😦";"";"";
"242635006516658197";"jorian#4555";"28-Jun-18 12:33 PM";"yeah, who cares. :troll:";"";"";
"242635006516658197";"jorian#4555";"28-Jun-18 12:33 PM";"but anyways, you use QT, i think most of the advanced users use the CLI";"";"";
"242635006516658197";"jorian#4555";"28-Jun-18 12:34 PM";"and in that way, Agama is really the granny solution";"";"";
"242635006516658197";"jorian#4555";"28-Jun-18 12:34 PM";"and that's not bad";"";"";
"456490768589258753";"ComputerGenie#2331";"28-Jun-18 12:34 PM";"I'm not saying Agama's not a good product or that it's not good for many folks; I'm just saying that I think QT has a place and there are a lot more folks like me out there (that perhaps haven't even come to Komodo yet)";"";"";
"242635006516658197";"jorian#4555";"28-Jun-18 12:34 PM";"if you want more control, you need to do a little more";"";"";
"456490768589258753";"ComputerGenie#2331";"28-Jun-18 12:36 PM";"""but anyways, you use QT, i think most of the advanced users use the CLI""
tbh, I use QT on my win box only and cli on nix boxes";"";"";
"345544724167524352";"Decker#3767";"28-Jun-18 02:26 PM";"What about me - i'm using QT on both platforms: WIndows and Ubuntu, it's very convenient ... and Coin Control Features are ""unique"". I can simply select an utxo from which i want to send coins. Agama doesn't allow this, and from cli - this is a problem too. Because no utxo field in `sendtoaddress` or other cli commands. In CLI i just can do `lockunspent` to prevent few utxos from being spended. But i can't select an utxo from which i wish to spend from CLI ... and this is not comfortable.";"";"💯 (2)";
"303794669945618442";"PTYX#6840";"28-Jun-18 02:27 PM";"I like QT coin control";"";"";
"456490768589258753";"ComputerGenie#2331";"28-Jun-18 02:27 PM";"Seems you answered your own question there; yes, we need it 😛";"";"";
"345544724167524352";"Decker#3767";"28-Jun-18 02:27 PM";"But Qt have other problems ... if you have 20000 utxo with 0.0001 KMD in your wallet - GUI will hang for a couple of minutes to display it )";"";"";
"345544724167524352";"Decker#3767";"28-Jun-18 02:28 PM";"That's why it's not recommended to use wallet.dat with very high number of utxos with Qt.";"";"";
"345544724167524352";"Decker#3767";"28-Jun-18 02:29 PM";"Btw, today i invited @Ocean in this chat ...";"";"";
"456490768589258753";"ComputerGenie#2331";"28-Jun-18 02:30 PM";"The hang and lack of multi-select are negatives, but the hang is more inherent in the core than the GUI (I think)";"";"";
"456490768589258753";"ComputerGenie#2331";"28-Jun-18 02:31 PM";"alternatively, don't mine 20k blocks before you consolidate 😛";"";"";
"403229823834521616";"pbca26#5430";"01-Jul-18 04:44 PM";"mos of the features you desire are not needed for regular users
if we loose one computergenie  to qt wallet and gain more average joes in agama i say that's a solid win
no one in sane mind is going to work through numbers to save on some dust fee amounts as well as messing with individual utxos
people wanted a somewhat grama friendly product so here you have it
i like qt wallets for their speed and advanced features for hardcore folks";"";"";
"456490768589258753";"ComputerGenie#2331";"01-Jul-18 04:46 PM";"Yes, @pbca26, because what sane person would want to send out 2+ payments at once rather than paying double tx fees 🤦🏿";"";"";
"403229823834521616";"pbca26#5430";"01-Jul-18 04:46 PM";"how many people need to send 2 or more payments?";"";"";
"456490768589258753";"ComputerGenie#2331";"01-Jul-18 04:47 PM";"When a crypto is actually used as a currency: many";"";"";
"456490768589258753";"ComputerGenie#2331";"01-Jul-18 04:48 PM";"I get going for mass appeal; I don't get the notion of ""fek real use cases we love Granny""";"";"";
"403229823834521616";"pbca26#5430";"01-Jul-18 04:49 PM";"well most folks want grandma friendly
they don't need coinage control or mass payments
anyhow all these features are on my todo list but they come last on it";"";"";
"456490768589258753";"ComputerGenie#2331";"01-Jul-18 04:50 PM";"If you were paying your monthly bills and had fees asigned to amount of payments, would you opt for paying extra fees and making extra payments or opt for less fees and only having to make 1 payment?";"";"";
"403229823834521616";"pbca26#5430";"01-Jul-18 04:50 PM";"are you paying your monthly bills in kmd?";"";"";
"456490768589258753";"ComputerGenie#2331";"01-Jul-18 04:50 PM";"the hope is someday";"";"";
"403229823834521616";"pbca26#5430";"01-Jul-18 04:51 PM";"lol";"";"";
"456490768589258753";"ComputerGenie#2331";"01-Jul-18 04:51 PM";"if we're not in crypto to use is as a currency, then wtf are we doing";"";"";
"403229823834521616";"pbca26#5430";"01-Jul-18 04:51 PM";"when the day finally comes i'll add it";"";"";
"456490768589258753";"ComputerGenie#2331";"01-Jul-18 04:52 PM";"keep in mind that this fee argument is coming from a guy that makes his living off of fees 😉";"";"";
"456490768589258753";"ComputerGenie#2331";"01-Jul-18 04:52 PM";"professionally, I hope no one ever pays less fees
personally, I find limiting options to be limiting";"";"";
"403229823834521616";"pbca26#5430";"01-Jul-18 04:54 PM";"for your own good :)
not w/o a reason";"";"";
"456490768589258753";"ComputerGenie#2331";"01-Jul-18 04:54 PM";"""Limiting your options for your own good""
Didn't they try that in 1940s Germany?";"";"";
"403229823834521616";"pbca26#5430";"01-Jul-18 04:56 PM";"lets not succumb into history/politics discussion
your consideration is noted";"";"";
"456490768589258753";"ComputerGenie#2331";"01-Jul-18 04:58 PM";"That was more sarcasm than political, but my point is that while I can see keeping Agama as a flagship product, I think that making it the sole focus is a horrible idea
By extension, it's the same as abandoning BarterDEX and only promoting HyperDEX";"";"";
"456490768589258753";"ComputerGenie#2331";"01-Jul-18 05:01 PM";"If marketing is pushing Komodo as an ""end-to-end blockchain technology provider"", it's counter to that to say that apps with extended features are ""insane""";"";"";
"403229823834521616";"pbca26#5430";"01-Jul-18 05:03 PM";"all products deserve focus
but i'm not sure how agama is related to any pr
there's no pr and never was, random tweets and posts don't make it marketing";"";"";
"456490768589258753";"ComputerGenie#2331";"01-Jul-18 05:04 PM";"scroll through the marketing channel (or most any of them) and count the team references to ""Agama"" and count the total references by everyone (not counting me) for ""QT"" or ""Ocean""";"";"";
"456490768589258753";"ComputerGenie#2331";"01-Jul-18 05:05 PM";"🎵 ""...seems like they forgot about Dre...."" 🎵";"";"";
"456490768589258753";"ComputerGenie#2331";"01-Jul-18 05:12 PM";"In fact, if you read #komodo-team  from yesterday and don't get the sense that Audo is all about pr for Agama (where wallets are concerned), then I'll never speak of wallets again";"";"";
"303794669945618442";"PTYX#6840";"01-Jul-18 05:29 PM";"I don't see why we can have the best of both worlds and have QT for the technically inclined and Agama as a user friendly wallet";"";"";
"456490768589258753";"ComputerGenie#2331";"01-Jul-18 05:31 PM";"that's what I'm saying";"";"";
"456490768589258753";"ComputerGenie#2331";"01-Jul-18 05:35 PM";"or even add an overlay for the raws to Agama and have it all in one
While I love the technical aspects of Ocean being 1 of only 2 equihash QT wallets, if Agama had actual currency features then this would be a different conversation";"";"";
"456490768589258753";"ComputerGenie#2331";"01-Jul-18 05:37 PM";"It's hard to be an ""end-to-end blockchain technology provider"" and cut out promotion of a given _x_ feature of tech";"";"";
"456490768589258753";"ComputerGenie#2331";"01-Jul-18 05:40 PM";"And, while it's technically, grammatically true that ""Agama doesn't get pr"", it's 99.9999999% the only option offered or discussed and I'd literally bet some KMD that about the same percentage of users don't even know that Ocean exists";"";"";
"303794669945618442";"PTYX#6840";"01-Jul-18 05:45 PM";"Does coin control work in spv?";"";"";
"456490768589258753";"ComputerGenie#2331";"01-Jul-18 05:53 PM";"same as in native: raw transactions (like mm uses)";"";"";
"456490768589258753";"ComputerGenie#2331";"01-Jul-18 05:55 PM";"and to step into my condescending shoes for a moment:
Not counting electron, what tech is in Agama besides a webpage and a bit of ajax?";"";"";
"303794669945618442";"PTYX#6840";"01-Jul-18 07:08 PM";"Your feature request is added to the wishlist. If it's so simple then make the changes and PR. If not, then we wait for the person who tackles the feature wishlist by priority.";"";"";
"456490768589258753";"ComputerGenie#2331";"01-Jul-18 07:15 PM";"""If it's so simple then make the changes and PR.""
The flip side to that is:
""Why would I spend time coding a feature that already exists in a hugely over-looked, and under-promoted, app already?""";"";"";
"456490768589258753";"ComputerGenie#2331";"01-Jul-18 07:16 PM";"combined with:
""If I didn't suck at graphic design, I likely would have done so long before the Ocean wallet existed""";"";"";
"457211594137534465";"xRobeSx#5136";"01-Jul-18 08:28 PM";"I have to add in, there are tons of people that have experience with QT wallets, so it would be nice to have that experience available with KMD. I use Komodo-Ocean-QT on one machine, so I would like to see it continue if possible @Decker 😊👏";"";"";
"455741312273219595";"jl777c#5810";"02-Jul-18 06:14 AM";"QT wallet is a critical component";"";"";
"171359889921146880";"BlackJesus#6161";"03-Jul-18 01:54 AM";"Will qt ever be added here https://komodoplatform.com/komodo-wallets/. It would be nice to see it included next to agama.";"";"";
"171359889921146880";"BlackJesus#6161";"03-Jul-18 01:54 AM";"Perhaps Komodo 2.0 website?";"";"";
"456490768589258753";"ComputerGenie#2331";"03-Jul-18 01:56 AM";"@pbca26 ☝🏿 That's a perfect example of what I was talking about; the absence of any mention of QT wallet is de facto pr *for* Agama";"";"";
"456490768589258753";"ComputerGenie#2331";"03-Jul-18 01:57 AM";"even if not overt";"";"";
"456490768589258753";"ComputerGenie#2331";"03-Jul-18 02:01 AM";"https://komodoplatform.atlassian.net/wiki/spaces/KPSD/pages/1179709/Wallets
`Wallets`
Agama ☑
blocnation dICO wallet ☑
Monaize  ☑ 
QT 🚫";"";"";
"456490768589258753";"ComputerGenie#2331";"03-Jul-18 02:03 AM";"There may not be direct pr for Agama, but QT falls under whatever the antithesis of pr is 😖";"";"";
"371114647052615681";"Mylo#8306";"03-Jul-18 03:36 AM";"Noted the absence of QT wallet on website.  Thank you for highlighting.";"";"";
"371114647052615681";"Mylo#8306";"03-Jul-18 03:41 AM";"Added to https://komodoplatform.atlassian.net/wiki/spaces/KPSD/pages/1179709/Wallets";"";"";
"345544724167524352";"Decker#3767";"03-Jul-18 03:58 AM";"@Mylo fix `Main project` link on https://github.com/ip-gpu/KomodoOcean please. Releases link can be leave as is.";"";"";
"371114647052615681";"Mylo#8306";"03-Jul-18 04:02 AM";"Fixed.  Thank you";"";"";
"371114647052615681";"Mylo#8306";"03-Jul-18 04:03 AM";"The missing from KMD site has been raised - i said ""at latest v2.0 website"" and the task has been added to the board by Steve - so it's known at the highest level 😃";"";"";
"371114647052615681";"Mylo#8306";"03-Jul-18 04:04 AM";"@Steve Lee in case you want some references for Ocean's relevance, scroll up 😄";"";"";
"345544724167524352";"Decker#3767";"03-Jul-18 04:05 AM";"We will try to update current version of Komodo-Qt to latest codebase (mean `master` of komodod) till half of July. Me or Ocean will inform community about a progress here.";"";"";
"345544724167524352";"Decker#3767";"03-Jul-18 04:06 AM";"Nice to hear that our work is important for community.";"";"👌 (1),Komodo (3)";
"455741312273219595";"jl777c#5810";"03-Jul-18 05:20 AM";"I am delaying updating master for now. but beta will become master prior to height 1000000";"";"";
"345544724167524352";"Decker#3767";"03-Jul-18 05:40 AM";"ohhh ... this will be too hard, i think, to import all current beta changes to komodo-qt ... `komodo-qt` and  `komodod` is **unmergable**, so, updating komodo-qt it not just `git merge` ... it's a hard work to analyze every (!) commit for compatability with komodo-qt. if you just merge `beta` komodod into `master` - i think we don't have time to import all changes. because currently, as i remember, don't contain anything about new assetchains keys and other things. also, as i remember, dev and beta branches have some changes in library usage ... it seems to me it will like a pain ...";"";"";
"345544724167524352";"Decker#3767";"03-Jul-18 05:42 AM";"importing in komodo-qt current commits from master - is a one work, but if master will be merged with beta - it's a totally different and more harder work.";"";"";
"455741312273219595";"jl777c#5810";"03-Jul-18 06:00 AM";"ok, then make the version compatible with master for now. that should work for KMD, just wont work with the new CC enabled chains or chains using new ac options";"";"";
"345544724167524352";"Decker#3767";"03-Jul-18 06:21 AM";"yes, this was initial plan ... make `komodo-qt` compatible with current master.";"";"";
"171359889921146880";"BlackJesus#6161";"03-Jul-18 04:24 PM";"@Decker do you think it would be possible to take the komodo ocean QT and implement the same fix BCH had for ledger through our QT as they did for electron cash";"";"";
"171359889921146880";"BlackJesus#6161";"03-Jul-18 04:24 PM";"https://www.reddit.com/r/btc/comments/7o4lzr/electron_cash_will_support_the_ledger_wallet_in/";"";"";
"171359889921146880";"BlackJesus#6161";"03-Jul-18 04:26 PM";"whelp nvm that's an spv wallet";"";"";
"303794669945618442";"PTYX#6840";"03-Jul-18 04:31 PM";"I've been writing with Fyookball to negotiate an electron Komodo wallet. They are now integrating ledger and I think it's worth pursuing a pure fork.";"";"";
"303794669945618442";"PTYX#6840";"03-Jul-18 04:31 PM";"He is open to collaboration.";"";"";
"303794669945618442";"PTYX#6840";"03-Jul-18 04:38 PM";"It would probably be easier to take the BTCP electrum wallet, fork it to Komodo and then apply the ledger changes to the wallet if it doesn't break anything.";"";"💯 (2)";
"303794669945618442";"PTYX#6840";"03-Jul-18 04:38 PM";"https://github.com/ChainZilla/electrum-btcp";"";"";
"345544724167524352";"Decker#3767";"03-Jul-18 07:24 PM";"@BlackJesus Komodo-Qt is a *native* wallet, there is no electrum servers support or ledger support planned.";"";"";
"171359889921146880";"BlackJesus#6161";"04-Jul-18 02:09 AM";"Yea I realised that after the fact lol";"";"";
"403229823834521616";"pbca26#5430";"04-Jul-18 09:26 AM";"aren't there any C spv wallets that you can merge into qt @Decker?
electrum is written in python if i'm not mistaken";"";"";
"456490768589258753";"ComputerGenie#2331";"04-Jul-18 09:30 AM";"why would you want an SPV node GUI?";"";"";
