AuthorID;Author;Date;Content;Attachments;Reactions;
"455741312273219595";"jl777c#5810";"18-Nov-19 10:42 AM";"yes, at first it wont be much, but if we get significant deposits, it could be important to be properly supported";"";"";
"424224648889106444";"Mihailo#5902";"18-Nov-19 10:42 AM";"So I remeber that you need to move the funds at least once a month in order to be able to claim rewards.";"";"";
"455741312273219595";"jl777c#5810";"18-Nov-19 10:43 AM";"after one month, the rewards stop increasing for a specific utxo";"";"";
"424224648889106444";"Mihailo#5902";"18-Nov-19 10:43 AM";"YEs";"";"";
"424224648889106444";"Mihailo#5902";"18-Nov-19 10:43 AM";"That I meant";"";"";
"455741312273219595";"jl777c#5810";"18-Nov-19 10:43 AM";"so not claiming monthly, loses rewards";"";"";
"455741312273219595";"jl777c#5810";"18-Nov-19 10:43 AM";"but you can claim more often, just not so often to have txfees dominate";"";"";
"424224648889106444";"Mihailo#5902";"18-Nov-19 10:43 AM";"Right";"";"";
"455741312273219595";"jl777c#5810";"18-Nov-19 10:44 AM";"i think it is complex enough, the withdraw process. maybe the rewards claiming is done totally separately";"";"";
"424224648889106444";"Mihailo#5902";"18-Nov-19 10:44 AM";"So we need to watch about two things. One is to be able to claim rewards (so I have to check that locktime thing) and the other that utxos are not over 30 days old";"";"";
"455741312273219595";"jl777c#5810";"18-Nov-19 10:44 AM";"of course, if a claim is being done, the withdraw cant be done";"";"";
"455741312273219595";"jl777c#5810";"18-Nov-19 10:44 AM";"for withdraws, you want to make sure the utxo is less than an hour old. that way you lose no rewards";"";"";
"424224648889106444";"Mihailo#5902";"18-Nov-19 10:45 AM";"Hmmm";"";"";
"424224648889106444";"Mihailo#5902";"18-Nov-19 10:45 AM";"""if a claim is being done, the withdraw cant be done"", you mean at that moment or after?";"";"";
"455741312273219595";"jl777c#5810";"18-Nov-19 10:48 AM";"utxo used for a claim, cant also be in a withdraw";"";"";
"455741312273219595";"jl777c#5810";"18-Nov-19 10:48 AM";"of course, after the claim is done, it can be used for withdraw";"";"";
"424224648889106444";"Mihailo#5902";"18-Nov-19 10:48 AM";"Ok";"";"";
"455741312273219595";"jl777c#5810";"18-Nov-19 10:49 AM";"so maybe there is a mutually exclusive mode for the msig signers, periods where they are doing claims and separately doing withdraws";"";"";
"455741312273219595";"jl777c#5810";"18-Nov-19 10:49 AM";"this is a non-consensus thing, but still important part of the system";"";"";
"424224648889106444";"Mihailo#5902";"18-Nov-19 10:50 AM";"Yes, we can set some short period when they are claiming rewards and in that period withdraws won't work. But if I understand correct that period can be short. Just tx to claim rewards and move utxo to new one?";"";"";
"424224648889106444";"Mihailo#5902";"18-Nov-19 10:50 AM";"I'm not too much familiar with reward system";"";"";
"455741312273219595";"jl777c#5810";"18-Nov-19 10:51 AM";"yes, it can just be something done once per hour to check to see if any rewards should be claimed";"";"";
"455741312273219595";"jl777c#5810";"18-Nov-19 10:51 AM";"there is no actual rewards system";"";"";
"455741312273219595";"jl777c#5810";"18-Nov-19 10:51 AM";"it is just blockchain rules";"";"";
"455741312273219595";"jl777c#5810";"18-Nov-19 10:51 AM";"you spend a utxo that is over an hour old and more than 10 KMD and has locktime set, then you can spend more than the utxo value";"";"";
"455741312273219595";"jl777c#5810";"18-Nov-19 10:51 AM";"the value increases at 5% rate, but stops growing after a month";"";"";
"455741312273219595";"jl777c#5810";"18-Nov-19 10:51 AM";"THAT is the entire ""system""";"";"";
"455741312273219595";"jl777c#5810";"18-Nov-19 10:52 AM";"people then are motivated to spend monthly or more frequently to collect the rewards, but it is fully up to each address owner";"";"";
"424224648889106444";"Mihailo#5902";"18-Nov-19 10:52 AM";"BTW, I saw that default for createrawtransaction is locktime set to 0. So this means that txs created with that RPC by default can't get rewards, so you must set locktime?";"";"";
"455741312273219595";"jl777c#5810";"18-Nov-19 10:53 AM";"if locktime isnt sent, it wont be eligible";"";"";
"455741312273219595";"jl777c#5810";"18-Nov-19 10:53 AM";"set it to 6 minutes in the past, should work well";"";"";
"455741312273219595";"jl777c#5810";"18-Nov-19 10:54 AM";"you can sum the amount of interest you can claim, from the listunspent output";"";"";
"424224648889106444";"Mihailo#5902";"18-Nov-19 10:54 AM";"So some dapps that are using createrawtransaction and not setting locktime cannot take rewards. I mean there are probably someone that doesn't know they can use this.";"";"";
"455741312273219595";"jl777c#5810";"18-Nov-19 10:54 AM";"just increase the total you are spending by the sum of interest fields";"";"";
"455741312273219595";"jl777c#5810";"18-Nov-19 10:55 AM";"if you are using createrawtransaction, it is assumed you know what you are doing";"";"";
"455741312273219595";"jl777c#5810";"18-Nov-19 10:56 AM";"we cant be claiming rewards hourly as that resets the counter, and there is not interest for the first hour";"";"";
"455741312273219595";"jl777c#5810";"18-Nov-19 10:56 AM";"maybe it should be that if doing a withdraw requires using utxo with significant amounts of rewards accrued, the msig signers would do a rewards claim first";"";"";
"424224648889106444";"Mihailo#5902";"18-Nov-19 10:56 AM";"And what locktime is default for sendtoaddress?";"";"";
"455741312273219595";"jl777c#5810";"18-Nov-19 10:56 AM";"i think 777 seconds in the past";"";"";
"455741312273219595";"jl777c#5810";"18-Nov-19 10:57 AM";"so the check for accrued interest becomes part of the withdraw process";"";"";
"455741312273219595";"jl777c#5810";"18-Nov-19 10:57 AM";"and after 3 weeks, can have some background claiming process";"";"";
"424224648889106444";"Mihailo#5902";"18-Nov-19 10:58 AM";"BTW, claiming reward can also be part of withdraw? You spend the utxo by giving the amount to user and adding the interest to vins and having change back to deposit address?";"";"";
"455741312273219595";"jl777c#5810";"18-Nov-19 10:58 AM";"it could, but then it would need to have locktime set";"";"";
"455741312273219595";"jl777c#5810";"18-Nov-19 10:59 AM";"in the event it doesnt get broadcast within an hour, it will expire";"";"";
"455741312273219595";"jl777c#5810";"18-Nov-19 10:59 AM";"i guess that is not a very common occurance, so if you take into account failed withdraws due to expiration (ie. even if properly signed, if it takes too long, it wont be valid) then we can indeed combine the withdraw with claiming";"";"";
"424224648889106444";"Mihailo#5902";"18-Nov-19 11:00 AM";"And if we need to have locktime set it needs to be at least 1 hour?";"";"";
"455741312273219595";"jl777c#5810";"18-Nov-19 11:01 AM";"what do you mean ""at least 1 hour""";"";"";
"424224648889106444";"Mihailo#5902";"18-Nov-19 11:01 AM";"On how much locktime needs to be set?";"";"";
"455741312273219595";"jl777c#5810";"18-Nov-19 11:01 AM";"locktime must be > mediantimepast, which is about 10 minutes ago";"";"";
"455741312273219595";"jl777c#5810";"18-Nov-19 11:01 AM";"it cant be in the future";"";"";
"455741312273219595";"jl777c#5810";"18-Nov-19 11:01 AM";"so there is a 10 minutes of valid values";"";"";
"424224648889106444";"Mihailo#5902";"18-Nov-19 11:02 AM";"Hmmm, than I'm confused what locktime represents";"";"";
"455741312273219595";"jl777c#5810";"18-Nov-19 11:02 AM";"but, there is an additional check in KMD that prevents locktime more than an hour old";"";"";
"455741312273219595";"jl777c#5810";"18-Nov-19 11:02 AM";"just imagine locktime to mean ""now"", approximately";"";"";
"455741312273219595";"jl777c#5810";"18-Nov-19 11:03 AM";"cant set it too far back in time, and cant set it in the future";"";"";
"424224648889106444";"Mihailo#5902";"18-Nov-19 11:03 AM";"I thought locktime indicates the earliest time or earliest block when that transaction may be added to the block chain.";"";"";
"455741312273219595";"jl777c#5810";"18-Nov-19 11:03 AM";"yes";"";"";
"455741312273219595";"jl777c#5810";"18-Nov-19 11:03 AM";"the specific check is against the median time past, so the time of 9 blocks ago";"";"";
"455741312273219595";"jl777c#5810";"18-Nov-19 11:04 AM";"KMD had to add a restriction of ""no more than one hour old"" to prevent back dating a tx to gain rewards";"";"";
"424224648889106444";"Mihailo#5902";"18-Nov-19 11:05 AM";"Ok, so if we set locktime to now we have approx. 9 blocks for tx to enter and then it expires?";"";"";
"455741312273219595";"jl777c#5810";"18-Nov-19 11:05 AM";"if you set it to now, it will be valid for an hour";"";"";
"455741312273219595";"jl777c#5810";"18-Nov-19 11:07 AM";"but depending on the miner that sets the blocktime, it might not be accepted (if it ends up being after the miners blocktime), so setting it to the recent past is the safest and still gives 50+ minutes to confirm";"";"";
"424224648889106444";"Mihailo#5902";"18-Nov-19 11:10 AM";"I don't get the calc but never mind. So in order to KISS, we can expire a withdraw after an hour or so to make the invalid withdraws expire and also the valid ones if they didn't finished in hour it means someting is wrong. And this way we can also use claiming rewards as a part of withdraw. BTW, the chains that uses gateways (any variant) should need to have notarization as without it regardless of this limitation it will be bad UX to wait for 100 confs before it can sign it and broadcast it.";"";"";
"455741312273219595";"jl777c#5810";"18-Nov-19 11:31 AM";"correct";"";"";
"412323938782150658";"SHossain#0007";"19-Nov-19 01:34 PM";"@gcharang channel topic updated!";"";"👍 (2)";
"423176312354635779";"gcharang#6833";"19-Nov-19 01:36 PM";"The Pegs Antara modules is a mechanism for creating a decentralized stable coin, pegged to any asset like fiat currency, stock, crypto that has a reliable price source 
Intro + RPC: <https://docs.komodoplatform.com/basic-docs/antara/antara-api/pegs.html>
User tutorial: <https://docs.komodoplatform.com/basic-docs/antara/antara-tutorials/pegs-module-user-tutorial.html>
Peg Creator tutorial: <https://docs.komodoplatform.com/basic-docs/antara/antara-tutorials/pegs-module-creator-tutorial.html>

Testing and Feedback are welcome!";"";"";
"423176312354635779";"gcharang#6833";"19-Nov-19 01:36 PM";"Pinned a message.";"";"";
"455741312273219595";"jl777c#5810";"19-Nov-19 01:37 PM";"@Mihailo plz review the docs for accuracy";"";"";
"424224648889106444";"Mihailo#5902";"19-Nov-19 01:57 PM";"Ok, np.";"";"";
"424224648889106444";"Mihailo#5902";"20-Nov-19 10:15 AM";"@gcharang I have read the documents, here are my remarks.
Intro:
- ""To prevent their deposit from being liquidated, the user can either return some of the USDK coins or deposit more tokenized KMD to maintain a good debt ratio.""  -> user must either cover whole debt or deposit more KMD, there is no partial return
- In Pegs Anatar Module Flow, I would add a step where user deposits external crypto into tokens

User tutorial:
- Add the part between KMD deposit and gateway deposit: You must wait for the block where the KMD tx is mined to be submitted to oracle. This can be checkd using oraclessamples call to fetch for exmaple last 5 data entries and check if the height is more or equal to the heigth of the KMD block where the tx is.

Craetor tutorial:
- The synthetic price won't work as it is refering to KMD and the external chain used is KMDTEST. Basically everything must match: external coin name, name in synthetic, token name and oracle name!";"";"👍 (1)";
"424224648889106444";"Mihailo#5902";"20-Nov-19 10:45 AM";"@jl777c One more thing regarding locktime. As users that are depositing use z_sendmany to send to deposit address, I think locktime isn't set there. So we must initially spend the utxo to set locktime and then it can stay for accumulating reward?
This is all ofc for KMD chain only, as others don't have rewards...";"";"";
"455741312273219595";"jl777c#5810";"20-Nov-19 10:54 AM";"i had thought z_sendmany set locktime. can people use sendmany?";"";"";
"424224648889106444";"Mihailo#5902";"20-Nov-19 11:02 AM";"Ha, you are correct. Locktime is set in z_sendmany. 
Yes, we have used z_sendmany as deposit tx in all tutorials from the start. I don't know why that was but I inherited it when I start working on gateways.";"";"";
"455741312273219595";"jl777c#5810";"20-Nov-19 11:04 AM";"probably because z_sendmany can specify a source address";"";"";
"424224648889106444";"Mihailo#5902";"20-Nov-19 11:04 AM";"Yes, I remebered now.";"";"";
"424224648889106444";"Mihailo#5902";"20-Nov-19 04:37 PM";"@jl777c I have one dilema. When you make the withdraw and it is broadcasted on external chain, than that utxo won't show in listunspent until tx is mined. Currently I have posted deposit address balance to oracle by using listunspent. On my test chain I had just one utxo so when withdraw is broadcasted I don't have any more utxo so the balance is 0. My question is, should I check the mempool also to see if there are some vouts that goes to deposit address? (it might catch also deposit tx and count those for balance too)";"";"";
"455741312273219595";"jl777c#5810";"20-Nov-19 04:38 PM";"in non-consensus code, you can scan mempool for balance calcs";"";"";
"424224648889106444";"Mihailo#5902";"20-Nov-19 04:40 PM";"This is basically check in oraclefeed. And it will post it to oracle along with block data. And then in rpc and validation the balance will be checked from oracle to see if the withdraw tx can be created for given amount";"";"";
"455741312273219595";"jl777c#5810";"20-Nov-19 04:54 PM";"ok, yes, use the mempool info. you are doing a majority test, so it should match in most of the nodes";"";"";
"455741312273219595";"jl777c#5810";"20-Nov-19 04:55 PM";"maybe make the oracle have confirmed and uncomfirmed balance?";"";"";
"455741312273219595";"jl777c#5810";"20-Nov-19 04:55 PM";"that way, a discrepancy in the mempool info can be somehow accounted for";"";"";
"412323938782150658";"SHossain#0007";"29-Nov-19 02:55 PM";"We have new MBTCTEST chain for those who are testing. Please delete old komodo source dir, data dir. Clone fresh, compile as per the guide and start the KMD & MBTCTEST chain. You should be able to make multiple withdraws, but they will be processed serialized (one by one). The withdraw should complete fast as after withdraw tx is confrimed it will be signed and broadcasted immediatelly. So you can check on your KMD node with `getunconfirmedbalance` to see it before the block is mined!
Initial Guide: https://gist.github.com/himu007/5b61ebb330ee46c4c1f7518d34e30d42
Break the system if you can with your testing power.";"";"";
"504735704543395853";"mrlynch#5735";"29-Nov-19 03:02 PM";"gimme a few and i'll jump on it as well";"";"👌 (1)";
"412323938782150658";"SHossain#0007";"29-Nov-19 03:07 PM";"the new `bindtxid` on MBTCTEST chain is `564027c872ee30a82aa9ce7b2f6a5041669d4b63ea9d86d7253c4b773fce22ab`. easily identifiable from the chain start param where it appears as `-earlytxid`";"";"";
"412323938782150658";"SHossain#0007";"29-Nov-19 03:14 PM";"@CHMEX please update the explorer with fresh clone of komodo and with fresh data dir as per the guide above when you get some time. `git pull` will not work.";"";"";
"412323938782150658";"SHossain#0007";"29-Nov-19 03:28 PM";"@Mihailo my KMD deposit tx has 20 confirms, but, can't get it imported into MBTCTEST. getting this error
```
{
  ""result"": ""error"",
  ""error"": ""couldnt find merkleroot for ht.1639501 KMD oracle.40e2959f8063a3ff52fadfecf17cd0a393aa075a1091518d438bb5cbc72ad9e8 m.0 vs n.2""
}
```
are your systems online?";"";"";
"424224648889106444";"Mihailo#5902";"29-Nov-19 03:46 PM";"They should be, let me check.";"";"";
"424224648889106444";"Mihailo#5902";"29-Nov-19 03:49 PM";"On one node KMD is not running, on the other oraclefeed is not running. I'll check it out, but can't do it now as some virus is breaking me and I don't feel well. I'll let you know when I fix it.";"";"";
"412323938782150658";"SHossain#0007";"29-Nov-19 03:49 PM";"thanks";"";"";
"412323938782150658";"SHossain#0007";"29-Nov-19 03:49 PM";"i'll wait";"";"";
"412323938782150658";"SHossain#0007";"29-Nov-19 03:50 PM";"i suspected oraclefeed wasn't working";"";"";
"420119978138664961";"CHMEX#0686";"29-Nov-19 06:53 PM";"@SHossain  updated and synced";"";"";
"412323938782150658";"SHossain#0007";"29-Nov-19 06:55 PM";"thank you very much 👍";"";"";
"424224648889106444";"Mihailo#5902";"30-Nov-19 08:04 AM";"It seems there is a memory leak on oraclefeed, so I'll have to figure it out where it is.";"";"";
"424224648889106444";"Mihailo#5902";"30-Nov-19 09:03 AM";"Found it and fixed it. I think nodes will be running fine now.";"";"";
"412323938782150658";"SHossain#0007";"30-Nov-19 03:32 PM";"The last deposit i've done yesterday, still can't import it";"";"";
"412323938782150658";"SHossain#0007";"30-Nov-19 04:48 PM";"new deposits are working fine";"";"";
"455741312273219595";"jl777c#5810";"30-Nov-19 04:49 PM";"yes, we dont have support for recovering missed deposits (yet)";"";"";
"455741312273219595";"jl777c#5810";"30-Nov-19 04:49 PM";"when we do, there is already a missed deposit that should be found";"";"";
"412323938782150658";"SHossain#0007";"30-Nov-19 04:50 PM";"it's fine for now. the multisig account has those deposits. so, withdrawing wouldn't be an issue as we have more funds in there 🙂";"";"";
