AuthorID;Author;Date;Content;Attachments;Reactions;
"365233211556757505";"FabØ#8941";"30-Jun-19 02:58 PM";"Have a daily reporting";"";"";
"347922216429813760";"grewalsatinder#9653";"30-Jun-19 02:58 PM";"I leave all such things to some dedicated person 😄";"";"";
"365233211556757505";"FabØ#8941";"30-Jun-19 02:58 PM";"We need to find potential alpha and beta testers outside our ecosystem";"";"";
"347922216429813760";"grewalsatinder#9653";"30-Jun-19 02:58 PM";"I am also busy with my other work and dev stuff 🙂";"";"";
"365233211556757505";"FabØ#8941";"30-Jun-19 02:58 PM";"Entities that have a ton of customers";"";"";
"365233211556757505";"FabØ#8941";"30-Jun-19 02:59 PM";"Because we are looking for growth";"";"";
"365233211556757505";"FabØ#8941";"30-Jun-19 02:59 PM";"And KPI";"";"";
"347922216429813760";"grewalsatinder#9653";"30-Jun-19 02:59 PM";"right, I guess you can have a word with @hyperDEX";"";"";
"365233211556757505";"FabØ#8941";"30-Jun-19 03:00 PM";"Could we commit to figure it this part in the next 48h everyone? 😃";"";"";
"347922216429813760";"grewalsatinder#9653";"30-Jun-19 03:00 PM";"he's already making good progress with such community projects, and I'm very sure he'll also be very glad to have some financial support for this good cause 🙂";"";"";
"365233211556757505";"FabØ#8941";"30-Jun-19 03:00 PM";"It is our job to do so";"";"";
"488192961109164062";"Tierno#3327";"30-Jun-19 03:00 PM";"Thanks for the new nspv feature @jl777c that’s a great addition to the ecosystem. Would love to see it in motion and as @FabØ said, I’d love to help with the go to market strategy and other  minor but important tasks (financial analysis, reporting etc)";"";"";
"365233211556757505";"FabØ#8941";"30-Jun-19 03:00 PM";"@jl777c is busy an egg pop up now we need to take care of it";"";"";
"347922216429813760";"grewalsatinder#9653";"30-Jun-19 03:01 PM";"also @Bitcoin Benny from RedFox 🙂";"";"";
"365233211556757505";"FabØ#8941";"30-Jun-19 03:01 PM";"Yep we work closely with him as you may saw 😉";"";"";
"455741312273219595";"jl777c#5810";"30-Jun-19 03:02 PM";"we just need a dedicated SPV wallet dev and i can make sure he understands what needs to be done";"";"";
"347922216429813760";"grewalsatinder#9653";"30-Jun-19 03:02 PM";"sorry, I don't recognise your username and benny together. might have either mixed up or something or didn't know. I just know you from this channel as VC 😛";"";"";
"455741312273219595";"jl777c#5810";"30-Jun-19 03:02 PM";"or maybe one for the core and another for the GUI side";"";"";
"365233211556757505";"FabØ#8941";"30-Jun-19 03:02 PM";"K";"";"";
"347922216429813760";"grewalsatinder#9653";"30-Jun-19 03:03 PM";"once core is there, I'm very sure there'll be many GUI side projects pop up";"";"";
"347922216429813760";"grewalsatinder#9653";"30-Jun-19 03:03 PM";"I myself want to use this core for a project if it's there";"";"";
"455741312273219595";"jl777c#5810";"30-Jun-19 03:03 PM";"true. the core should be able to be used by many different gui";"";"";
"365233211556757505";"FabØ#8941";"30-Jun-19 03:03 PM";"```sorry, I don't recognise your username and benny together. might have either mixed up or something or didn't know. I just know you from this channel as VC :stuck_out_tongue:``` benny and I worked on a JV Zaddex.io";"";"";
"347922216429813760";"grewalsatinder#9653";"30-Jun-19 03:03 PM";"to my opinion the core must be the utmost priority";"";"";
"365233211556757505";"FabØ#8941";"30-Jun-19 03:04 PM";"we also help on redfox";"";"";
"347922216429813760";"grewalsatinder#9653";"30-Jun-19 03:04 PM";"@FabØ thanks for clearing mate. Glad to know! 😃";"";"";
"365233211556757505";"FabØ#8941";"30-Jun-19 03:06 PM";"could someone create an nSPV channel please";"";"";
"455741312273219595";"jl777c#5810";"30-Jun-19 03:07 PM";"#dev-nspv";"";"";
"365233211556757505";"FabØ#8941";"30-Jun-19 03:07 PM";"tks JL";"";"";
"347922216429813760";"grewalsatinder#9653";"30-Jun-19 03:09 PM";"thanks James! 😃";"";"";
"456226577798135808";"Deleted User#0000";"30-Jun-19 03:16 PM";"@FabØ  for Barterlly s part we ll figure out tomorrow or in the following week :)";"";"";
"456226577798135808";"Deleted User#0000";"30-Jun-19 03:17 PM";"am in the middle of a global rewrite to allow even more coins to be added way faster";"";"";
"365233211556757505";"FabØ#8941";"30-Jun-19 03:46 PM";"```for Barterlly s part we ll figure out tomorrow or in the following week :)
am in the middle of a global rewrite to allow even more coins to be added way faster``` I have your back mate as we talked";"";"";
"365233211556757505";"FabØ#8941";"30-Jun-19 03:46 PM";"looking for our call tomorrow 😃";"";"😽 (1)";
"406179072922746882";"polycryptoblog#1173";"02-Jul-19 05:55 PM";"@FabØ   Any idea of the legal  requirements for asset backed coins";"";"";
"365233211556757505";"FabØ#8941";"02-Jul-19 09:27 PM";"Hello @polycryptoblog old friend how are you doing, it is been a long time";"";"";
"365233211556757505";"FabØ#8941";"02-Jul-19 09:28 PM";"asset back loans depend on which countries";"";"";
"365233211556757505";"FabØ#8941";"02-Jul-19 09:28 PM";"we worked on it, so we have few ideas 😉";"";"";
"365233211556757505";"FabØ#8941";"02-Jul-19 09:28 PM";"ksb.money";"";"";
"406179072922746882";"polycryptoblog#1173";"06-Jul-19 04:14 AM";"@FabØ    Yes it has been awhile,  been just grinding away.  I believe I have found a way to create a asset backed stablecoin that doesn’t require much legally.  I believe it can help a lot of the areas we need to improve in,  I wrote a little bit about it in the jl777 channel.  I’ll copypaste it over here.";"";"";
"406179072922746882";"polycryptoblog#1173";"06-Jul-19 04:14 AM";"“I have in mind using these tokens to represent warehouse receipts used to claim stored goods, specifically standardized commodities but it can and will be expanded to other goods as well.  If these tokens can be atomic swapped with coins like I described above ,  this can effectively solve liquidity issue with Atomicdex, as well as other benefits , in the form many additional chains added to the ecosystem to accommodate other interests ( a different chain with its own tokens for each country or city or warehouse location for instance ) .  Beyond stablecoins(warehouse receipts ),  many chains ( fees to Komodo ),  liquidity ( more things for KMD to trade against )  it provides the ecosystem with a form of “good” money ( Gresham law reference )  which can siphon from even other coins and their liquidity.”";"";"";
"406179072922746882";"polycryptoblog#1173";"06-Jul-19 05:08 AM";"I would like to discuss this with you and @ca333 @noashh#2802  @Bitcoin Benny  @jl777c and others.  I believe this could be a unicorn project.  However it is well beyond the scope of just one person,  there are some things technologically that need done ( and need done regardless of this project ) ,  on the business/legal end and physical end as well,  let alone if the parties involved wish to do a fundraising offering.   From my deep delve into the UCC and federal and state regulations over the last few days ,  it does not appear there are any legal quagmires like other types of stablecoins .  Being not a currency itself but rather a document of title and is not a security  as it is not an investment contract ( passes Howey) ,  it’s not algorithmically based as it is backed by collateral .  I am seeking out legal counsel on this .";"";"";
"308146361508036618";"Lumbi#8378";"06-Jul-19 11:48 AM";"we'd be willing to work with @polycryptoblog along these lines and incorporate into the LUMBER brand, but there isn't much point in discussing if the budget is pegged too low as well as a good understanding of regulatory/legal risk and the costs of maintaining a legal team.

Another venture I'd be willing to be a part of is ""Project Marine Iguana""; i.e  establish a self-sustaining cryptomining farm using windpower on the island of Malta. The mined crypto could be distributed to coin hodlers and/or fiat reserves could be built up by reselling the electricity locally while building longterm strategic relationships in the region.";"";"";
"365233211556757505";"FabØ#8941";"06-Jul-19 01:29 PM";"@polycryptoblog this is an interesting blurb";"";"";
"365233211556757505";"FabØ#8941";"06-Jul-19 01:29 PM";"Would like to discuss this in more depth";"";"";
"397372307154403329";"yorklab#7270";"06-Jul-19 02:46 PM";"@Lumbi Perhaps not exactly what you are talking about, but for large scale miners in the US this seems like the place to do it. I think they can handle up to 78,000 rigs.

https://www.accesswire.com/544632/Integrated-Ventures-Signs-A-Multi-Year-Hosting-And-Marketing-Agreement-With-PetaWatt-Properties-LLC";"";"";
"308146361508036618";"Lumbi#8378";"06-Jul-19 07:21 PM";"@yorklab there are some similarities. it is amazing how efficient some of these generators have become. how cool would it be to have a virtual 'shareholders' meeting every 30 days to decide what alts to mine and putting it to a vote; or how much excess electricity was sold off for fiat dividends, etc. 😃";"";"♻ (2)";
"451085331370999818";"SadykovT#2123";"07-Jul-19 09:37 AM";"@Lumbi  Your coin nobody needs it ( IMHO ). Nobody mine it. Explorer has been down for several days. There are no buy orders on the exchange. There are some real achievements you can publish ?";"";"";
"451085331370999818";"SadykovT#2123";"07-Jul-19 10:01 AM";"@Deleted User  I'll fix it. But I will still think so until I see some results.";"";"";
"308146361508036618";"Lumbi#8378";"08-Jul-19 07:37 AM";"@SadykovT a new pool should be coming online around the 15th of july. https://lmbr.mcmpool.eu/ is operational. network activity can be tracked here https://explorer2.lumberscout.io/. Digital Price isn't the most active exchange, but there has been some activity https://digitalprice.io/order?url=lumber-btc . All in all perhaps not much compared to BTC, but where was BTC in 2009? 😉   @Deleted User  we are in the process of re-writing the app to use cryptoconditions. The original app used centralized servers that were too costly to maintain for the time being.";"";"";
"451085331370999818";"SadykovT#2123";"09-Jul-19 06:48 AM";"https://explorer2.lumberscout.io/.   not working :-))))  Last block  Sun, 07 Jul 2019 09:00:31 GMT";"";"";
"308146361508036618";"Lumbi#8378";"09-Jul-19 08:58 AM";"reindexed: https://explorer2.lumberscout.io/ 😉";"";"";
"451085331370999818";"SadykovT#2123";"09-Jul-19 09:24 AM";"👍";"";"";
"406179072922746882";"polycryptoblog#1173";"13-Jul-19 06:06 AM";"@FabØ  check dm";"";"✅ (1)";
"516673246008180777";"skitout#8659";"13-Aug-19 06:47 PM";"Hej ! I been thinking about an idea, and as VC would be users, I post it here for feedback

Especially in early phases of projects, there is sometime a bit of a chicken and egg problem when it comes to funding. That is where “Conditional Automatic Funding” (CAF) could kick in. Investors put some money on the table and verifiable objectives are set. The project automatically gets the money if it delivers, otherwise investors automatically get their money back.

Investors derisk their investment while scooping project earlier. The project boosts its credibility, feel secure and focus on what’s matter: delivering. It could be used for “classic” startup funding (e.g. with SAFE) or for crypto projects.

Seems to me (a non tech guy) a MVP based on Komodo, would be relatively “easy” to develop, possibly with a centralized oracle at first (like EY or PWC).

This would also get early stage projects and investors to connect with the Komodo ecosystem: that could make a lot of sense on a marketing perspective.";"";"";
"579257018737754132";"Sully#3164";"18-Oct-19 10:15 AM";"Funny, this is one of the reasons I am here. @skitout. 

I have an Automated Donation Engine, (ADE) that does what you were speaking about, and has a governance model.";"";"";
"516673246008180777";"skitout#8659";"18-Oct-19 03:03 PM";"@Sully Interesting ! Where can we find more info about Automated Donation Engine ?";"";"";
"579257018737754132";"Sully#3164";"19-Oct-19 10:11 AM";"Will be published this week. Finalizing website. Also publishing WP for the decentralized application that will be utilizing it.";"";"";
"516673246008180777";"skitout#8659";"19-Oct-19 01:54 PM";"cool ! let me know when it will be out 🙂";"";"";
"579257018737754132";"Sully#3164";"08-Nov-19 02:35 AM";"@skitout. If you feel like checking it out, the ADE whitepaper is published to a placeholder website. There is also a WP for the project we are developing the ADE for, (CoolADE). Please go to fractaldynamics.io to see them.";"";"";
"516673246008180777";"skitout#8659";"09-Nov-19 05:52 PM";"@Sully thx ! will check it !";"";"";
