AuthorID;Author;Date;Content;Attachments;Reactions;
"396621210760380418";"Razzler04#2552";"08-Dec-19 03:02 AM";"hello there what is the best way to move all my data files to another location for my Komodo QT client to access?";"";"";
"232679450301431808";"blackjok3r#3181";"08-Dec-19 05:55 AM";"Wont need pos64staker with the new daemon... or shoudlnt... Just setgenerate true 0 and leave it...";"";"";
"630328355589193738";"Pikku Myy#6259";"08-Dec-19 06:17 PM";"Hello guys!";"";"👋 (2)";
"636471835642429450";"Arno#3334";"08-Dec-19 06:54 PM";"Is anyone well familiar with the Agama Wallet? There are a few things I really struggle with:
1. After setting up a wallet and restarting the app, on the welcome screen there is no option to log into the created and saved wallet. Instead, the app assumes you want to start from scratch and asks you to select/activate a coin to create a new wallet or to import a seed, both of which I don't want.
2. Why is the DEX coin not in the initial list even though it is available only later when you add other coins to an existing wallet?
3. When setting up a wallet that only consists of the DEX coin and you only hold DEX on that address, after logging in you don't see the DEX coin listed, instead you see KMD with 0 balance listed. Then you have to add the DEX coin again to enable it. This is something you definitely do not want to repeat after every login.
4. On the welcome screen, when I select ""Pirate Chain"", a red error box appears immediately at the right bottom saying something like ""Komodod Zcash params are missing or incomplete: ..."", even thought I haven't even started. Furthermore, I'm asked to choose between three non self-explanatory ""Zcash params keys"" before you can go on.
Even though the wallet seems quite hyped and recommended, I see some serious UX flaws and shortcomings.";"";"";
"465223258803798026";"LeshAft9#0083";"08-Dec-19 07:09 PM";"with latest updated Ledger Nano S firmware and KMD app it fails to claim the reward using the Ledger KMD Reward Claim website with Brave browser. It gets all the way through the process and after approving transaction, after a long pause the webiste shows ""Error Failed to sign with Ledger device: U2F DEVICE_INELIGIBLE"" and the app on the ledger device becomes frozen (can't exit) and you have to unplug it";"";"";
"454786445702463507";"𝙊𝙞𝙣𝙠#3612";"08-Dec-19 07:37 PM";"@Arno See my reply in Verus Discord";"";"";
"636471835642429450";"Arno#3334";"08-Dec-19 07:38 PM";"ok";"";"👍 (1)";
