AuthorID;Author;Date;Content;Attachments;Reactions;
"396617299378962432";"Lanii#8302";"04-Aug-19 06:23 PM";"well";"";"";
"396617299378962432";"Lanii#8302";"04-Aug-19 06:24 PM";"even if its not ignored on all time frames";"";"";
"396617299378962432";"Lanii#8302";"04-Aug-19 06:24 PM";"Which one are you gonna listen to";"";"";
"396617299378962432";"Lanii#8302";"04-Aug-19 06:24 PM";"the 20 MA";"";"";
"407145234007588865";"nocturnal#2177";"04-Aug-19 06:24 PM";"out of curiosity which TA metric combinations do you like? @Lanii";"";"";
"396617299378962432";"Lanii#8302";"04-Aug-19 06:24 PM";"the 29?";"";"";
"396617299378962432";"Lanii#8302";"04-Aug-19 06:24 PM";"30 MA, 40, 50, 200?, 500?";"";"";
"396617299378962432";"Lanii#8302";"04-Aug-19 06:24 PM";"15 ema, 20 ema";"";"";
"396617299378962432";"Lanii#8302";"04-Aug-19 06:24 PM";"Do you see my point?";"";"";
"347110333762109452";"dan.#2473";"04-Aug-19 06:24 PM";"The one that looks like a puzzle piece fits 😂";"";"";
"347110333762109452";"dan.#2473";"04-Aug-19 06:24 PM";"Yes";"";"";
"396617299378962432";"Lanii#8302";"04-Aug-19 06:24 PM";"I trade market structure only";"";"";
"347110333762109452";"dan.#2473";"04-Aug-19 06:24 PM";"I agree";"";"";
"396617299378962432";"Lanii#8302";"04-Aug-19 06:24 PM";"pure price action";"";"";
"407145234007588865";"nocturnal#2177";"04-Aug-19 06:25 PM";"in what sense?";"";"";
"396617299378962432";"Lanii#8302";"04-Aug-19 06:25 PM";"example";"";"";
"396617299378962432";"Lanii#8302";"04-Aug-19 06:25 PM";"What levels do we need to hold and gain";"";"";
"396617299378962432";"Lanii#8302";"04-Aug-19 06:25 PM";"to move up";"";"";
"396617299378962432";"Lanii#8302";"04-Aug-19 06:25 PM";"what levels/zones do we need to fail to hold";"";"";
"396617299378962432";"Lanii#8302";"04-Aug-19 06:25 PM";"/lose";"";"";
"396617299378962432";"Lanii#8302";"04-Aug-19 06:25 PM";"to go down";"";"";
"407145234007588865";"nocturnal#2177";"04-Aug-19 06:25 PM";"sure, thats what i do too";"";"";
"407145234007588865";"nocturnal#2177";"04-Aug-19 06:26 PM";"although pro traders do use TA combinations as aids";"";"";
"407145234007588865";"nocturnal#2177";"04-Aug-19 06:26 PM";"not as rukes";"";"";
"407145234007588865";"nocturnal#2177";"04-Aug-19 06:26 PM";"rules";"";"";
"407145234007588865";"nocturnal#2177";"04-Aug-19 06:26 PM";"typically";"";"";
"396617299378962432";"Lanii#8302";"04-Aug-19 06:26 PM";"tbh the only people that I've ever seen make decent money is with market structure";"";"";
"396617299378962432";"Lanii#8302";"04-Aug-19 06:26 PM";"Obviously there is never such thing as 100% sucess rate";"";"";
"396617299378962432";"Lanii#8302";"04-Aug-19 06:26 PM";"prob not even 90%";"";"";
"407145234007588865";"nocturnal#2177";"04-Aug-19 06:26 PM";"yeah that is the main thing for sure, but they also tend to look for confluence";"";"";
"396617299378962432";"Lanii#8302";"04-Aug-19 06:26 PM";"But at least I have some rules that I use that prevents me from getting destroyed if Im wrong";"";"";
"407145234007588865";"nocturnal#2177";"04-Aug-19 06:26 PM";"as reassurance";"";"";
"396617299378962432";"Lanii#8302";"04-Aug-19 06:27 PM";"yes";"";"";
"396617299378962432";"Lanii#8302";"04-Aug-19 06:27 PM";"I posted a chart here a couple of days ago";"";"";
"396617299378962432";"Lanii#8302";"04-Aug-19 06:27 PM";"Imma try to find it";"";"";
"396617299378962432";"Lanii#8302";"04-Aug-19 06:28 PM";"https://www.tradingview.com/x/qebo3lUR/";"";"";
"396617299378962432";"Lanii#8302";"04-Aug-19 06:28 PM";"this is how I trade basically";"";"";
"456226577798135808";"Deleted User#0000";"04-Aug-19 06:28 PM";"@blackjok3r https://youtu.be/D0W1v0kOELA";"";"3040_kingpeepo (1)";
"396617299378962432";"Lanii#8302";"04-Aug-19 06:28 PM";"the green box is the start of the move that took us to new local low";"";"";
"396617299378962432";"Lanii#8302";"04-Aug-19 06:29 PM";"hence its an important level to break to keep going up";"";"";
"232679450301431808";"blackjok3r#3181";"04-Aug-19 06:29 PM";"My friend used to play that 😃";"";"";
"396617299378962432";"Lanii#8302";"04-Aug-19 06:29 PM";"we are basically there atm";"";"";
"407145234007588865";"nocturnal#2177";"04-Aug-19 06:30 PM";"yeah thats what i do as well, its less pie in the sky than metrics";"";"";
"407145234007588865";"nocturnal#2177";"04-Aug-19 06:30 PM";"but i think its good to check some them as well";"";"";
"407145234007588865";"nocturnal#2177";"04-Aug-19 06:30 PM";"but im only a hobby trader";"";"";
"396617299378962432";"Lanii#8302";"04-Aug-19 06:30 PM";"yeh everyone has their own style";"";"";
"396617299378962432";"Lanii#8302";"04-Aug-19 06:30 PM";"if it works for you, keep doing it";"";"";
"396617299378962432";"Lanii#8302";"04-Aug-19 06:30 PM";"anyway";"";"";
"396617299378962432";"Lanii#8302";"04-Aug-19 06:30 PM";"https://www.tradingview.com/x/3RC8dTDb/";"";"";
"396617299378962432";"Lanii#8302";"04-Aug-19 06:30 PM";"Same thing with kmd";"";"";
"396617299378962432";"Lanii#8302";"04-Aug-19 06:31 PM";"I sold a bit at the green box";"";"";
"396617299378962432";"Lanii#8302";"04-Aug-19 06:31 PM";"You can see on the daily there is a small green candle";"";"";
"396617299378962432";"Lanii#8302";"04-Aug-19 06:31 PM";"That one took us to new lows";"";"";
"396617299378962432";"Lanii#8302";"04-Aug-19 06:31 PM";"hence its now a resistence";"";"";
"396617299378962432";"Lanii#8302";"04-Aug-19 06:31 PM";"and it worked out";"";"";
"396617299378962432";"Lanii#8302";"04-Aug-19 06:32 PM";"btw this was 1 day or so before Antara release";"";"";
"407145234007588865";"nocturnal#2177";"04-Aug-19 06:33 PM";"one reason metrics have some wieght (the only reason?) is because lots of traders look at them and buy/sell in response so they become a self fulfilling prophecy";"";"";
"407145234007588865";"nocturnal#2177";"04-Aug-19 06:33 PM";"and bots in particular";"";"💯 (1)";
"396617299378962432";"Lanii#8302";"04-Aug-19 06:33 PM";"Only bothered with the fact wether it works or not";"";"";
"396617299378962432";"Lanii#8302";"04-Aug-19 06:33 PM";"Is it making you money or no 😃";"";"";
"396617299378962432";"Lanii#8302";"04-Aug-19 06:34 PM";"preferbly btc and alts moon and die over and over in cycles";"";"";
"396617299378962432";"Lanii#8302";"04-Aug-19 06:34 PM";"That way you can always reacumulate";"";"";
"407145234007588865";"nocturnal#2177";"04-Aug-19 06:35 PM";"what im saying is, if the RSI (for example) says hugely overbought a proportion of traders/bots will def sell";"";"";
"456226577798135808";"Deleted User#0000";"04-Aug-19 06:35 PM";"you ll see the patterns you want to happen 👌";"";"";
"456226577798135808";"Deleted User#0000";"04-Aug-19 06:35 PM";"or fear ^^";"";"";
"396617299378962432";"Lanii#8302";"04-Aug-19 06:35 PM";"patterns are a meme :troll_lol:";"";"";
"396617299378962432";"Lanii#8302";"04-Aug-19 06:35 PM";"youd make more money longing every head and shoulder then shorting it on btc";"";"";
"396617299378962432";"Lanii#8302";"04-Aug-19 06:35 PM";"since start of 2019";"";"";
"301766691992371210";"Markus#5464";"04-Aug-19 06:36 PM";"13.5k is first problem for kmd";"";"";
"301766691992371210";"Markus#5464";"04-Aug-19 06:36 PM";"that resistance is now huge";"";"";
"396617299378962432";"Lanii#8302";"04-Aug-19 06:37 PM";"just look at all the wick";"";"";
"396617299378962432";"Lanii#8302";"04-Aug-19 06:37 PM";"wicks";"";"";
"396617299378962432";"Lanii#8302";"04-Aug-19 06:37 PM";"done around 13.5";"";"";
"396617299378962432";"Lanii#8302";"04-Aug-19 06:37 PM";"apparently somebody was off loading big time there";"";"";
"301766691992371210";"Markus#5464";"04-Aug-19 06:39 PM";"https://www.tradingview.com/x/fNt48q91/";"";"";
"396617299378962432";"Lanii#8302";"04-Aug-19 06:40 PM";"that weekly rejection";"";"";
"396617299378962432";"Lanii#8302";"04-Aug-19 06:40 PM";"huurts";"";"";
"301766691992371210";"Markus#5464";"04-Aug-19 06:41 PM";"Yes its not very pretty 😂";"";"";
"396617299378962432";"Lanii#8302";"04-Aug-19 06:41 PM";"Im waiting for todays close and tomorrows for confirmation";"";"";
"396617299378962432";"Lanii#8302";"04-Aug-19 06:42 PM";"If we dont get above 10k";"";"";
"396617299378962432";"Lanii#8302";"04-Aug-19 06:42 PM";"Im thinking 700-800 inc";"";"";
"301766691992371210";"Markus#5464";"04-Aug-19 06:42 PM";"no";"";"😩 (1)";
"301766691992371210";"Markus#5464";"04-Aug-19 06:42 PM";"we lose even usd value now so not stable coin xD";"";"";
"301766691992371210";"Markus#5464";"04-Aug-19 06:43 PM";"before ppl were defending that we doing well in usd value";"";"";
"301766691992371210";"Markus#5464";"04-Aug-19 06:43 PM";"well not anymore";"";"";
"301766691992371210";"Markus#5464";"04-Aug-19 06:43 PM";"well arrr took rekt to a whole new lvl";"";"";
"301766691992371210";"Markus#5464";"04-Aug-19 06:44 PM";":troll_lol:";"";"";
"197010673602002945";"Bernz - Selling LABS#9130";"04-Aug-19 06:44 PM";"I thought my Arrr buy at .13 was a steal, the market has proven yet again that I have no fucking clue what is going on";"";"";
"197010673602002945";"Bernz - Selling LABS#9130";"04-Aug-19 06:45 PM";"Still believe there will be a KMD/ARRR flippening, fundamentals of ARRR too stronk plus kmd moving at a snails pace";"";"";
"197010673602002945";"Bernz - Selling LABS#9130";"04-Aug-19 06:47 PM";"Might only be short term, but I'll be there to take advantage of it";"";"";
"347110333762109452";"dan.#2473";"04-Aug-19 06:48 PM";"My mama always said take gains while ya can";"";"";
"301766691992371210";"Markus#5464";"04-Aug-19 06:49 PM";"https://i.redd.it/1t7aalbn0rd11.jpg";"";"🤣 (2),😆 (2),😂 (2)";
"408251982885945344";"actionslacks#4072";"04-Aug-19 06:52 PM";"arrr started dumping after all of the encryption news.";"";"";
"408251982885945344";"actionslacks#4072";"04-Aug-19 06:54 PM";"yeah i guess eyerything is getting it rn";"";"";
"466679763491225600";"joe2x4#5987";"04-Aug-19 07:05 PM";"🍿 one of our biggest whales jl777 said month or two ago that price was going back to $1. Jl777 trade bot master wishes for KMD to stay out of top 20 so as to stay under the radar. Assumably so as kmd has time to establish itself as unstoppable power house. Then and only then will the whale allow price to hit $150. 🍿 Sit back, relax, drink that shit, smoke that shit, and enjoy the ride for your enjoyment.";"";"😂 (3),rum (3),troll_hardcore (3),abusedsmily (1)";
"511105857015119873";"mrtzmp3#2896";"04-Aug-19 07:57 PM";"Thx jl777 ! :-)";"";"";
"398864863067373568";"CoinKing88#1540";"04-Aug-19 08:08 PM";"🕵 in JL we trust 🕵";"";"";
"407446899302596610";"umitkara48#6464";"04-Aug-19 08:19 PM";"Allah belasını versin ne diyim";"";"";
"407446899302596610";"umitkara48#6464";"04-Aug-19 08:19 PM";"Lanet olsun hepsine nereden  bulaştım";"";"";
"143629520971366400";"hastrup#8742";"04-Aug-19 08:21 PM";"Det sagde hun også igår";"";"";
