AuthorID;Author;Date;Content;Attachments;Reactions;
"249256116150730753";"PHBA2061#2530";"05-Apr-19 09:30 AM";"current price is still about 15% above IEO price, but they're not happy because it's not x2 or x3 like Binance IEO";"";"";
"508277543498022923";"Crabby Paddy#6239";"05-Apr-19 09:30 AM";"https://www.reddit.com/r/VeriBlock/comments/b9o943/70m_veriblock_vbk_811m_purchased_at_initial/?st=JU3VCPP7&sh=681a3a6a";"";"";
"508277543498022923";"Crabby Paddy#6239";"05-Apr-19 09:31 AM";"Wtf is this hahahhaa";"";"";
"433975968919584769";"Post#7345";"05-Apr-19 09:32 AM";"They ban people in their discord, make telegram read only, no announcement from them for the listing and miners sit on their havy bags. Will be fun 😄";"";"";
"433975968919584769";"Post#7345";"05-Apr-19 09:33 AM";"All i said: im supporting KMD - oh well ,)";"";"Komodo (1)";
"424272322216591371";"crumb#2550";"05-Apr-19 09:44 AM";"reading VBK discord gives a pretty good idea about the general mindset in crypto space";"";"";
"424272322216591371";"crumb#2550";"05-Apr-19 09:45 AM";"all about the benjamins, and FAST :abusedsmily:";"";"";
"405380797537976320";"Cryptoon#3362";"05-Apr-19 09:45 AM";"what will happen when the 700million vbk mined from the testnet hit the market later today...";"";"";
"405380797537976320";"Cryptoon#3362";"05-Apr-19 09:45 AM";"I'll stay with kmd tyvm";"";"";
"433975968919584769";"Post#7345";"05-Apr-19 09:46 AM";"nah its ""only"" 50 mill which gets unlocked";"";"";
"365714438864633856";"dukeleto#7326";"05-Apr-19 09:51 AM";"VBK main chat is like watching a memory hole, lots gets typed, lots gets deleted. Lots of angry miners being censored";"";"";
"365714438864633856";"dukeleto#7326";"05-Apr-19 09:52 AM";"imagine burning BTC trying to run broken VBK code that doesn't even work. That is a bitter pill.";"";"";
"433975968919584769";"Post#7345";"05-Apr-19 09:57 AM";"that would be a good tweet ,)";"";"";
"424272322216591371";"crumb#2550";"05-Apr-19 09:59 AM";"i feel sorry for the guys who write how revolutionary this VBK tech is and how it will benefit the whole crypto space 😦";"";"";
"424272322216591371";"crumb#2550";"05-Apr-19 09:59 AM";"clueless...";"";"";
"249256116150730753";"PHBA2061#2530";"05-Apr-19 10:02 AM";"this guy ? https://twitter.com/anambroid , it's funny that he refers himself as a *Shitcoin bagsimalist* 😂";"";"";
"354615658148790275";"sφldat#8733";"05-Apr-19 10:09 AM";"$vbk is at its ieo price now, soon below";"";"";
"249256116150730753";"PHBA2061#2530";"05-Apr-19 10:13 AM";"*imagine how do those vietnamese people feel right now*";"";"";
"354615658148790275";"sφldat#8733";"05-Apr-19 10:16 AM";"it is often the poor people who will be mistreated in this case..";"";"";
"405380797537976320";"Cryptoon#3362";"05-Apr-19 10:21 AM";"I saw people saying in their chat that miners were selling OTC at 500-1000 sats...";"";"";
"405380797537976320";"Cryptoon#3362";"05-Apr-19 10:21 AM";"Brutal";"";"";
"354615658148790275";"sφldat#8733";"05-Apr-19 10:21 AM";"a hard blow for IEO buyers";"";"";
"354615658148790275";"sφldat#8733";"05-Apr-19 10:24 AM";"They lock the VBK wallet to force people to become hodlers? 
https://i.imgur.com/jxVlzZc.png";"";"";
"249256116150730753";"PHBA2061#2530";"05-Apr-19 10:37 AM";"before bittrex opened vbk trading, there are people even offered otc buying for 2x IEO price 😂";"";"";
"403400248879218690";"Hollowman9000#3344";"05-Apr-19 10:48 AM";"Vietnamese click-farm monkeys didn’t get moon";"";"";
"403400248879218690";"Hollowman9000#3344";"05-Apr-19 10:48 AM";"https://media.tenor.com/images/ae04dee32731ff8c272a058af3724177/tenor.gif";"";"😂 (2)";
"242635006516658197";"jorian#4555";"05-Apr-19 11:32 AM";"we should add VBK to barterdex :abusedsmily:";"";"shexy (1),yassinkomodo (2)";
"403400248879218690";"Hollowman9000#3344";"05-Apr-19 11:39 AM";"Closed source, is that a hinderance?";"";"";
"242635006516658197";"jorian#4555";"05-Apr-19 11:40 AM";"it's probably not compatible";"";"";
"242635006516658197";"jorian#4555";"05-Apr-19 11:40 AM";"unless someone adds support in barterdex";"";"";
"456690797505544202";"ch6ris#5240";"05-Apr-19 11:41 AM";"is that VeriBlock ? I'm just hearing about this now.";"";"";
"242635006516658197";"jorian#4555";"05-Apr-19 11:42 AM";"you must've been living under a rock the past couple of days";"";"👽 (1),😆 (1)";
"405011811511828481";"Alright#0419";"05-Apr-19 11:50 AM";"Don't worry, didn't miss anything important";"";"";
"240544146320916480";"CryptoNinjaa#5350";"05-Apr-19 11:51 AM";"Wonder what happens when ppl get fed up of spending more than they are recieving?";"";"";
"405011811511828481";"Alright#0419";"05-Apr-19 11:51 AM";"https://jochen-hoenicke.de/queue/#0,24h";"";"";
"405011811511828481";"Alright#0419";"05-Apr-19 11:51 AM";"this^";"";"";
"240544146320916480";"CryptoNinjaa#5350";"05-Apr-19 11:51 AM";"I saw 72k yesterday";"";"";
"240544146320916480";"CryptoNinjaa#5350";"05-Apr-19 11:51 AM";"🤣🤣🤣";"";"";
"240544146320916480";"CryptoNinjaa#5350";"05-Apr-19 11:52 AM";"So hows that 51% prevention going when ppl stop submitting the data";"";"";
"240544146320916480";"CryptoNinjaa#5350";"05-Apr-19 11:52 AM";"Zero incentive to write";"";"";
"405011811511828481";"Alright#0419";"05-Apr-19 11:52 AM";"early detection, not prevention";"";"👆🏼 (1),✔ (1)";
"240544146320916480";"CryptoNinjaa#5350";"05-Apr-19 11:53 AM";"Im being a bit sarcy 😀";"";"";
"405380797537976320";"Cryptoon#3362";"05-Apr-19 11:53 AM";"trading below ieo price for a while";"";"";
"240544146320916480";"CryptoNinjaa#5350";"05-Apr-19 11:54 AM";"Tbh good 🤣 should teach a few ppl a few lessons.";"";"";
"405380797537976320";"Cryptoon#3362";"05-Apr-19 11:54 AM";"Well I dont like people losing money when they had the best intentions and got manipulated into buying something like this";"";"";
"405380797537976320";"Cryptoon#3362";"05-Apr-19 11:55 AM";"But I guess dyor is still in order so...";"";"";
"240544146320916480";"CryptoNinjaa#5350";"05-Apr-19 11:55 AM";"Experience is not free imo. You have to lose to learn. Or atleast thats my view on my past trading experiences 🤣";"";"";
"240544146320916480";"CryptoNinjaa#5350";"05-Apr-19 11:56 AM";"It is only D1 of trading so it could come back up once its bottomed. Maybe worth a punt below ieo if poss";"";"";
"405380797537976320";"Cryptoon#3362";"05-Apr-19 11:58 AM";"I feel bad for the guy in the chat claiming he had already mined 3-4BTC worth of that shit";"";"";
"405380797537976320";"Cryptoon#3362";"05-Apr-19 11:58 AM";"eagerly waiting for more btc to arrive from exchanges because it had to go up today";"";"";
"405380797537976320";"Cryptoon#3362";"05-Apr-19 11:58 AM";"etc etc";"";"";
"240544146320916480";"CryptoNinjaa#5350";"05-Apr-19 11:59 AM";"Risk / Reward";"";"";
"240544146320916480";"CryptoNinjaa#5350";"05-Apr-19 11:59 AM";"What was the ieo price 2.5k?";"";"";
"405380797537976320";"Cryptoon#3362";"05-Apr-19 11:59 AM";"2450sats";"";"";
"240544146320916480";"CryptoNinjaa#5350";"05-Apr-19 11:59 AM";"Thanks";"";"";
"240544146320916480";"CryptoNinjaa#5350";"05-Apr-19 12:00 PM";"A day or 2 around these prices and we might see some frustration dumps.";"";"";
"405011811511828481";"Alright#0419";"05-Apr-19 12:00 PM";"be aware that deposits aren't opened yet";"";"";
"171359889921146880";"BlackJesus#6161";"05-Apr-19 12:00 PM";"You guys should upvoted my Reddit post. There a link in talk-offtopic";"";"";
"405011811511828481";"Alright#0419";"05-Apr-19 12:00 PM";"likely people looking to dump";"";"";
"240544146320916480";"CryptoNinjaa#5350";"05-Apr-19 12:01 PM";"Savage";"";"";
"240544146320916480";"CryptoNinjaa#5350";"05-Apr-19 12:01 PM";"Good old bittrex chart wont even load on my lappy 🤣";"";"";
"405380797537976320";"Cryptoon#3362";"05-Apr-19 12:06 PM";"Yeah once early testnet miners can deposit";"";"";
"405380797537976320";"Cryptoon#3362";"05-Apr-19 12:06 PM";"they will be racing to dump and lock in some profits...";"";"";
"240544146320916480";"CryptoNinjaa#5350";"05-Apr-19 12:07 PM";"They got 2x so they can go down more for sure";"";"";
"249256116150730753";"PHBA2061#2530";"05-Apr-19 12:09 PM";"probably people are afraid of being dumped on, because of that twitter video, fyi the vietnamese group in that video has managed to buy about $220000 worth of VBK";"";"";
"240544146320916480";"CryptoNinjaa#5350";"05-Apr-19 12:11 PM";"Crazy";"";"";
"347720505530515456";"Cye_BigDaddy#9201";"05-Apr-19 12:38 PM";"@PHBA2061  probably they already sold 😄";"";"";
"301766691992371210";"Markus#5464";"05-Apr-19 01:34 PM";"2220 vbk";"";"";
"301766691992371210";"Markus#5464";"05-Apr-19 01:34 PM";"dumping xD";"";"";
"324632286366793729";"Keppie#5156";"05-Apr-19 01:38 PM";"Lets guide the dumpers to KMD";"";"";
"405380797537976320";"Cryptoon#3362";"05-Apr-19 01:39 PM";"I wouldnt publicly start dancing on their graves";"";"";
"405380797537976320";"Cryptoon#3362";"05-Apr-19 01:39 PM";"people lost money";"";"";
"405380797537976320";"Cryptoon#3362";"05-Apr-19 01:40 PM";"bad form to jump in like that now";"";"";
"301766691992371210";"Markus#5464";"05-Apr-19 01:40 PM";"ye ofc";"";"";
"405380797537976320";"Cryptoon#3362";"05-Apr-19 01:44 PM";"3 hours till deposits enabled...";"";"";
"405380797537976320";"Cryptoon#3362";"05-Apr-19 01:44 PM";"It all could be one big scheme to get people to dump at first and then buy everything back and pump shit";"";"";
"324632286366793729";"Keppie#5156";"05-Apr-19 01:46 PM";"Compare it to all the Binance launch pads";"";"";
"324632286366793729";"Keppie#5156";"05-Apr-19 01:46 PM";"They all start like this";"";"";
"249256116150730753";"PHBA2061#2530";"05-Apr-19 01:46 PM";"yeah, it might get pumped tomorrow though, we'll never know";"";"";
"324632286366793729";"Keppie#5156";"05-Apr-19 01:46 PM";"One big pump soon & bleed afterwards";"";"";
"249256116150730753";"PHBA2061#2530";"05-Apr-19 01:48 PM";"I know a IEO get dumped at half the IEO price at listing, then pumped to  7x  IEO price.";"";"";
"232989893918195722";"Alexfrog#1338";"05-Apr-19 01:48 PM";"Veriblock's system of spamming the btc network with 512 times as many BTC transactions as Komodo needs is going to result in btc transactions costing $100 again, at which point Veriblock will die because its insanely expensive to use. 😄";"";"";
"405011811511828481";"Alright#0419";"05-Apr-19 01:49 PM";"ZEN accomplishes basically the same thing without BTC being involved at all";"";"";
"405011811511828481";"Alright#0419";"05-Apr-19 01:50 PM";"forces forks to be mined publicly";"";"";
"249256116150730753";"PHBA2061#2530";"05-Apr-19 01:54 PM";"Zencash  right ?";"";"";
"405011811511828481";"Alright#0419";"05-Apr-19 01:55 PM";"yes";"";"";
"405011811511828481";"Alright#0419";"05-Apr-19 01:56 PM";"Although ZEN actually prevents attacking forks from reorging the network";"";"";
"405011811511828481";"Alright#0419";"05-Apr-19 01:56 PM";"from what I understand about VBK, it does not";"";"";
"388092138208100356";"Buddz1993#5380";"05-Apr-19 01:56 PM";"so how are people buying into that sh**?";"";"";
"388092138208100356";"Buddz1993#5380";"05-Apr-19 01:56 PM";"srsly it blows my mind.";"";"";
"301766691992371210";"Markus#5464";"05-Apr-19 01:56 PM";"hype nothing else";"";"";
"388092138208100356";"Buddz1993#5380";"05-Apr-19 01:56 PM";"hype of losing their money";"";"";
"249256116150730753";"PHBA2061#2530";"05-Apr-19 01:56 PM";"because of the #IEO label ...";"";"";
"388092138208100356";"Buddz1993#5380";"05-Apr-19 01:57 PM";"another bitconnect scheme";"";"";
"388092138208100356";"Buddz1993#5380";"05-Apr-19 01:57 PM";"10% makes money the other 90% get rkted.";"";"";
"249256116150730753";"PHBA2061#2530";"05-Apr-19 01:57 PM";"it's still too soon to jump into conclusion";"";"";
"388092138208100356";"Buddz1993#5380";"05-Apr-19 01:57 PM";"well from the looks off it";"";"";
"388092138208100356";"Buddz1993#5380";"05-Apr-19 01:58 PM";"it shows that its not adding any value to the ecosystem.";"";"";
"388092138208100356";"Buddz1993#5380";"05-Apr-19 01:58 PM";"its basically replicating what others have done but in a more expensive way";"";"";
"249256116150730753";"PHBA2061#2530";"05-Apr-19 01:58 PM";"people get rekt because of their greediness, it's not necessary Veriblock's fault";"";"";
