AuthorID;Author;Date;Content;Attachments;Reactions;
"342751827068059650";"Tek#5253";"05-Jun-19 02:58 AM";"or something";"";"";
"342751827068059650";"Tek#5253";"05-Jun-19 02:58 AM";"but it has to do with the lite wallet and SPV. electrum servers";"";"";
"342751827068059650";"Tek#5253";"05-Jun-19 02:58 AM";"a lot of time electrum servers have been hacked";"";"";
"342751827068059650";"Tek#5253";"05-Jun-19 02:59 AM";"so possibly seed phrasese entered in agama wallet lately have been unsecurely stored on electrum servers";"";"";
"342751827068059650";"Tek#5253";"05-Jun-19 02:59 AM";"or something like that";"";"";
"408251982885945344";"actionslacks#4072";"05-Jun-19 02:59 AM";"fucking eth gets hacked for tens of millions once a month";"";"";
"342751827068059650";"Tek#5253";"05-Jun-19 03:00 AM";"ETH didn't get hacked.";"";"";
"367790733501136899";"Vertigo#0439";"05-Jun-19 03:00 AM";"Plain text in Google docs?";"";"";
"342751827068059650";"Tek#5253";"05-Jun-19 03:00 AM";"I mean ETH got hacked a few times";"";"";
"342751827068059650";"Tek#5253";"05-Jun-19 03:00 AM";"but not for millons a month.";"";"";
"232989893918195722";"Alexfrog#1338";"05-Jun-19 03:00 AM";"ETH got hacked for real once when the DAO happened";"";"";
"342751827068059650";"Tek#5253";"05-Jun-19 03:00 AM";"^ yeah that was a real hackening";"";"";
"342751827068059650";"Tek#5253";"05-Jun-19 03:01 AM";"tfw its getting light, ive been up all night";"";"";
"342751827068059650";"Tek#5253";"05-Jun-19 03:01 AM";"and my kmd fundus are not yet confirmed";"";"";
"367790733501136899";"Vertigo#0439";"05-Jun-19 03:01 AM";"But not kmd for f sakes we are the delayed proof of work security Sherman tank";"";"";
"408251982885945344";"actionslacks#4072";"05-Jun-19 03:01 AM";"or the guy that orphaned a bunch with a smart contract error";"";"";
"367790733501136899";"Vertigo#0439";"05-Jun-19 03:02 AM";"Was that ETH or EOS?";"";"";
"408251982885945344";"actionslacks#4072";"05-Jun-19 03:02 AM";"it was eth. eos is it's own dumpster fire";"";"";
"398189630182260746";"Alecandro#1179";"05-Jun-19 03:04 AM";"Well we are going back up now, everyone calm down 😃";"";"";
"408251982885945344";"actionslacks#4072";"05-Jun-19 03:04 AM";"we'll see what happened. It's hard to make judgements based on what we know now, which is nothing.";"";"";
"459065480511225878";"ryman112#0068";"05-Jun-19 03:04 AM";"Well someone broke the news on reddit 11min ago";"";"";
"403400248879218690";"Hollowman9000#3344";"05-Jun-19 03:06 AM";"What a pain in the dick";"";"";
"403400248879218690";"Hollowman9000#3344";"05-Jun-19 03:07 AM";"Does ocean use the same block storage location as agama?";"";"";
"403400248879218690";"Hollowman9000#3344";"05-Jun-19 03:07 AM";"Need to know where to dump the bootstrap";"";"";
"420119978138664961";"CHMEX#0686";"05-Jun-19 03:08 AM";"yes same storage location";"";"";
"420119978138664961";"CHMEX#0686";"05-Jun-19 03:10 AM";"C:\Users\USERNAME\AppData\Roaming\Komodo\BEER
on windows
.komodo/BEER
on unix";"";"";
"342751827068059650";"Tek#5253";"05-Jun-19 03:10 AM";"I think that CSW has trading bots on a lot of big caps alts";"";"";
"342751827068059650";"Tek#5253";"05-Jun-19 03:10 AM";"that try to trade the price down";"";"";
"342751827068059650";"Tek#5253";"05-Jun-19 03:10 AM";"this action on BCH is just weird";"";"";
"342751827068059650";"Tek#5253";"05-Jun-19 03:11 AM";"some 100 btc sell order pops up and pushes down. the moment there's a decently sized counter off at the buy side it quickly dissapears";"";"";
"342751827068059650";"Tek#5253";"05-Jun-19 03:13 AM";"lmao the 0k bch buyer just bought 1000 BCH from that bot";"";"";
"342751827068059650";"Tek#5253";"05-Jun-19 03:13 AM";"7k*";"";"";
"408251982885945344";"actionslacks#4072";"05-Jun-19 03:13 AM";"watch kmd moon now.";"";"";
"342751827068059650";"Tek#5253";"05-Jun-19 03:13 AM";"is it mooning?";"";"";
"342751827068059650";"Tek#5253";"05-Jun-19 03:13 AM";"im watching BCH shit bout to happen";"";"";
"232989893918195722";"Alexfrog#1338";"05-Jun-19 03:13 AM";"i swapped half kmd for bch";"";"";
"232989893918195722";"Alexfrog#1338";"05-Jun-19 03:13 AM";"gonna swap the rest in like 30 more confirms";"";"";
"342751827068059650";"Tek#5253";"05-Jun-19 03:13 AM";"you already have confirmed???";"";"";
"408251982885945344";"actionslacks#4072";"05-Jun-19 03:14 AM";"it's not dumping yet";"";"";
"342751827068059650";"Tek#5253";"05-Jun-19 03:14 AM";"i still need60 more confirmations";"";"";
"232989893918195722";"Alexfrog#1338";"05-Jun-19 03:15 AM";"no one trusts kmd anymore, so of course theyre swappign it for arr";"";"";
"342751827068059650";"Tek#5253";"05-Jun-19 03:15 AM";"@webworker01 how exactly is KMD developed? is the entire pipeline on amazon?";"";"";
"335726849869217797";"차미숙#8912";"05-Jun-19 03:16 AM";"Chill man hacking news in crypto is like daily thing";"";"";
"335726849869217797";"차미숙#8912";"05-Jun-19 03:17 AM";"I have seen so many";"";"";
"408251982885945344";"actionslacks#4072";"05-Jun-19 03:17 AM";"it's not a hack yet as far as we know, just a vulnerability";"";"";
"402210705476026368";"bishop#9773";"05-Jun-19 03:17 AM";"No one knows anything, we're all speculating";"";"";
"335726849869217797";"차미숙#8912";"05-Jun-19 03:18 AM";"All we know is satoshi is a drug boss";"";"";
"398189630182260746";"Alecandro#1179";"05-Jun-19 03:18 AM";"Yea exactly. Was very urgent, but could just be the teams effort to help keep a vulnerability turning into something worse";"";"";
"342751827068059650";"Tek#5253";"05-Jun-19 03:18 AM";"so you don't know what a pipeline is?";"";"";
"342751827068059650";"Tek#5253";"05-Jun-19 03:18 AM";"holy shit man";"";"";
"342751827068059650";"Tek#5253";"05-Jun-19 03:18 AM";"> muh great tech";"";"";
"342751827068059650";"Tek#5253";"05-Jun-19 03:19 AM";"im trying to figure out how KMD develops. since you boast about ""Muh we so decentralized"" the only optoin I could think of to work together on this effectively is building a pipeline on amazon.";"";"";
"422858760898215937";"siu - Chainmakers#3920";"05-Jun-19 03:19 AM";"is there any report of stolen funds?";"";"";
"365714438864633856";"dukeleto#7326";"05-Jun-19 03:19 AM";"none that I have heard";"";"";
"402210705476026368";"bishop#9773";"05-Jun-19 03:19 AM";"@Tek  have you been on github?";"";"";
"342751827068059650";"Tek#5253";"05-Jun-19 03:20 AM";"what a fucking retarded question";"";"";
"342751827068059650";"Tek#5253";"05-Jun-19 03:20 AM";"fuck off";"";"";
"402210705476026368";"bishop#9773";"05-Jun-19 03:20 AM";"well, if you did, you would see how development is structured";"";"";
"365714438864633856";"dukeleto#7326";"05-Jun-19 03:20 AM";"@Tek i develop with a fun tool invented in the 1960's when people were on LSD, it's called `vi`";"";"😋 (1)";
"342751827068059650";"Tek#5253";"05-Jun-19 03:20 AM";"No I am an ex devops engineer";"";"";
"365714438864633856";"dukeleto#7326";"05-Jun-19 03:20 AM";"oh shizzle!";"";"";
"342751827068059650";"Tek#5253";"05-Jun-19 03:20 AM";"but if you don't even know what a pipeline is";"";"";
"365714438864633856";"dukeleto#7326";"05-Jun-19 03:20 AM";"@Tek we use mostly bare metal but there are no rules for notaries";"";"";
"342751827068059650";"Tek#5253";"05-Jun-19 03:20 AM";"as notaary operatir";"";"";
"365714438864633856";"dukeleto#7326";"05-Jun-19 03:21 AM";"There are no rules for notaries, but most use bare metal";"";"";
"342751827068059650";"Tek#5253";"05-Jun-19 03:21 AM";"I didn't have to switch carreers I just quit my job";"";"";
"365714438864633856";"dukeleto#7326";"05-Jun-19 03:21 AM";"some use $5 DO droplets";"";"";
"342751827068059650";"Tek#5253";"05-Jun-19 03:21 AM";"but you don't have a pipeline?";"";"";
"365714438864633856";"dukeleto#7326";"05-Jun-19 03:21 AM";"@Tek that word has many definitions across industries";"";"";
"342751827068059650";"Tek#5253";"05-Jun-19 03:21 AM";"lke. automatic deploy testing";"";"";
"365714438864633856";"dukeleto#7326";"05-Jun-19 03:21 AM";"what exactly do you mean";"";"";
"365714438864633856";"dukeleto#7326";"05-Jun-19 03:21 AM";"ah, ok";"";"";
"342751827068059650";"Tek#5253";"05-Jun-19 03:21 AM";"complete pipeline";"";"";
"365714438864633856";"dukeleto#7326";"05-Jun-19 03:21 AM";"yes, we have Travis CI";"";"";
"365714438864633856";"dukeleto#7326";"05-Jun-19 03:22 AM";"we don't have Continuous Deployment";"";"";
"365714438864633856";"dukeleto#7326";"05-Jun-19 03:22 AM";"we have Continuous Integration and builds, tho";"";"";
"342751827068059650";"Tek#5253";"05-Jun-19 03:22 AM";"oh ok";"";"";
"365714438864633856";"dukeleto#7326";"05-Jun-19 03:22 AM";"CD in blockchain world is like dancing on knives";"";"";
"342751827068059650";"Tek#5253";"05-Jun-19 03:22 AM";"yes";"";"";
"365714438864633856";"dukeleto#7326";"05-Jun-19 03:22 AM";"lulz";"";"";
"365714438864633856";"dukeleto#7326";"05-Jun-19 03:23 AM";"it could be that when our tests pass all KMD servers are auto-updated, that is CD";"";"";
"365714438864633856";"dukeleto#7326";"05-Jun-19 03:23 AM";"and it's also very scary";"";"";
"342751827068059650";"Tek#5253";"05-Jun-19 03:23 AM";"obviously you just deploy to testnet autoamtically";"";"";
"342751827068059650";"Tek#5253";"05-Jun-19 03:23 AM";"then you share the binaries with the actual network";"";"";
"365714438864633856";"dukeleto#7326";"05-Jun-19 03:23 AM";"testnets are for coins that can't make coins effortlessly, in KMD world we make test chains";"";"";
"335726849869217797";"차미숙#8912";"05-Jun-19 03:23 AM";"Why is kmd is not dropping";"";"";
"365714438864633856";"dukeleto#7326";"05-Jun-19 03:23 AM";"@차미숙 because nobody can figure out their wallets yet";"";"";
"402210705476026368";"bishop#9773";"05-Jun-19 03:23 AM";"probably confirms";"";"";
"335726849869217797";"차미숙#8912";"05-Jun-19 03:23 AM";"Can you guys dump to 1 satoshi";"";"";
"335726849869217797";"차미숙#8912";"05-Jun-19 03:24 AM";"I can buy";"";"";
"408251982885945344";"actionslacks#4072";"05-Jun-19 03:24 AM";"because nothing is real in crypto world";"";"";
"365714438864633856";"dukeleto#7326";"05-Jun-19 03:24 AM";"I see it dumped 1k sat, but that isn't much when it's over 20k";"";"";
"402210705476026368";"bishop#9773";"05-Jun-19 03:24 AM";"FICTIONAL CHARACTERS";"";"";
"398189630182260746";"Alecandro#1179";"05-Jun-19 03:24 AM";"Yea maybe not everyone is trying to sell haha. A lot of people probably just want to move their coins";"";"";
"398189630182260746";"Alecandro#1179";"05-Jun-19 03:24 AM";"Out of Agama to be safe";"";"";
"335726849869217797";"차미숙#8912";"05-Jun-19 03:25 AM";"Wtb kmd at 1sat";"";"";
"335726849869217797";"차미숙#8912";"05-Jun-19 03:25 AM";"Any sellers here";"";"";
"365714438864633856";"dukeleto#7326";"05-Jun-19 03:25 AM";"PROTIP: Use this to find all your coins on various AC's: https://dexstats.info/assetviewer.php";"";"";
"342751827068059650";"Tek#5253";"05-Jun-19 03:25 AM";"I do think you can do automatic deployment too.";"";"";
"342751827068059650";"Tek#5253";"05-Jun-19 03:25 AM";"but you will have to deliver playbooks or whatnot to your nodes";"";"";
