AuthorID;Author;Date;Content;Attachments;Reactions;
"242635006516658197";"jorian#4555";"18-Jun-19 09:10 AM";"whitepaper of la libra";"";"";
"242635006516658197";"jorian#4555";"18-Jun-19 09:10 AM";"https://libra.org/en-US/wp-content/uploads/sites/23/2019/06/LibraWhitePaper_en_US.pdf";"";"";
"242635006516658197";"jorian#4555";"18-Jun-19 09:11 AM";"`The Libra Reserve`";"";"";
"405380797537976320";"Cryptoon#3362";"18-Jun-19 09:12 AM";"Move over FED";"";"";
"324632286366793729";"Keppie#5156";"18-Jun-19 09:12 AM";"• Technology and marketplaces: Booking Holdings, eBay, Facebook/Calibra, Farfetch, Lyft,
Mercado Pago, Spotify AB, Uber Technologies, Inc.";"";"";
"242635006516658197";"jorian#4555";"18-Jun-19 09:12 AM";"and for the more technical minded, the technical paper: https://developers.libra.org/docs/assets/papers/the-libra-blockchain.pdf";"";"";
"405380797537976320";"Cryptoon#3362";"18-Jun-19 09:12 AM";"The Zuck is here to assume world dominance";"";"";
"405380797537976320";"Cryptoon#3362";"18-Jun-19 09:12 AM";"What is it based on? Need to be able to sustain sick tx/s probably?";"";"";
"324632286366793729";"Keppie#5156";"18-Jun-19 09:13 AM";"Blockchain: Anchorage, Bison Trails, Coinbase, Inc., Xapo Holdings Limited";"";"";
"324632286366793729";"Keppie#5156";"18-Jun-19 09:13 AM";"Conebase boys; I KNEW IT";"";"";
"242635006516658197";"jorian#4555";"18-Jun-19 09:17 AM";"``` we aspire to make the LibraBlockchain fully permissionless. To do this, we plan to gradually transition to aproof-of-stake[47]system```";"";"";
"242635006516658197";"jorian#4555";"18-Jun-19 09:18 AM";"get your moon ready";"";"";
"508277543498022923";"Crabby Paddy#6239";"18-Jun-19 09:23 AM";"😮";"";"";
"508277543498022923";"Crabby Paddy#6239";"18-Jun-19 09:25 AM";"Will new coins be backed by currency too? Or how will pos work with it I wonder";"";"";
"342751827068059650";"Tek#5253";"18-Jun-19 09:25 AM";"why do they name it libra";"";"";
"508277543498022923";"Crabby Paddy#6239";"18-Jun-19 09:25 AM";"pads";"";"";
"508277543498022923";"Crabby Paddy#6239";"18-Jun-19 09:26 AM";"https://tenor.com/view/bleeding-anus-period-gif-4916421";"";"";
"342751827068059650";"Tek#5253";"18-Jun-19 09:27 AM";"it doesn't look so good for kmd";"";"";
"342751827068059650";"Tek#5253";"18-Jun-19 09:27 AM";"tripple bottom maybe";"";"";
"242635006516658197";"jorian#4555";"18-Jun-19 09:31 AM";"cardboard floor, will smash right through. 10k imminent";"";"";
"242635006516658197";"jorian#4555";"18-Jun-19 09:31 AM";"once binance enables deposits again, the dumpening will start";"";"";
"242635006516658197";"jorian#4555";"18-Jun-19 09:31 AM";"libra: freedom";"";"";
"242635006516658197";"jorian#4555";"18-Jun-19 09:32 AM";"just like the feds allow you to be free";"";"";
"508277543498022923";"Crabby Paddy#6239";"18-Jun-19 09:33 AM";"@jorian is kmd short term really looking that bleak ☹️";"";"";
"455741312273219595";"jl777c#5810";"18-Jun-19 09:33 AM";"BTC dominance rising, 57.2%, KMD rank at 48, higher than before the hack. everyone is expecting a big dump when KMD is enabled at exchanges, but there isnt much evidence to support that, as bittrex and upbit are open and their price is very close to binance";"";"";
"242635006516658197";"jorian#4555";"18-Jun-19 09:33 AM";"i was just saying random shit. i have no idea what will happen";"";"3040_suspepe (2)";
"455741312273219595";"jl777c#5810";"18-Jun-19 09:34 AM";"and i think all along huobi and/or hitbtc were open, so there was at least some connection of price to ""reality""";"";"";
"508277543498022923";"Crabby Paddy#6239";"18-Jun-19 09:34 AM";"Just a friendly reminder Zaddex.io is also open";"";"";
"508277543498022923";"Crabby Paddy#6239";"18-Jun-19 09:34 AM";"😄✌";"";"shexy (1)";
"455741312273219595";"jl777c#5810";"18-Jun-19 09:34 AM";"it might be a ""buy the news, sell the event"" sort of thing in reverse";"";"";
"508277543498022923";"Crabby Paddy#6239";"18-Jun-19 09:34 AM";"Did someone say kmd margin trading";"";"";
"508277543498022923";"Crabby Paddy#6239";"18-Jun-19 09:35 AM";"👀";"";"";
"455741312273219595";"jl777c#5810";"18-Jun-19 09:36 AM";"the most likely result will be that you wont really be able to tell when the exchanges reopen";"";"";
"455741312273219595";"jl777c#5810";"18-Jun-19 09:36 AM";"the primary driver of price seems to be the BTC dominance";"";"";
"242635006516658197";"jorian#4555";"18-Jun-19 09:37 AM";"BTC is king";"";"";
"454786445702463507";"𝙊𝙞𝙣𝙠#3612";"18-Jun-19 09:37 AM";"For how long... The king is dead, long live the king!";"";"";
"455741312273219595";"jl777c#5810";"18-Jun-19 09:42 AM";"does anybody know the meaning of the FATF proposal where all exchanges (and other?) must include KYC info with every transfer?";"";"";
"455741312273219595";"jl777c#5810";"18-Jun-19 09:43 AM";"what about user withdraw and deposit? if the user makes a withdraw, will they send the KYC info to the user? and then does the user have to attach KYC info to each deposit? if not, then instead of withdraw from exchange to another exchange, couldnt users simply withdraw to their wallet and then deposit? it all seems like applying regulations for trains onto cars";"";"";
"455741312273219595";"jl777c#5810";"18-Jun-19 09:45 AM";"and they arent really going to attach the KYC info directly to each tx as there is no room. maybe all withdraws will get an opreturn with a hash to the KYC data?";"";"";
"406179072922746882";"polycryptoblog#1173";"18-Jun-19 09:45 AM";"June 21st it gets released";"";"";
"448777271701143562";"smk762 -  dracocanis ominator#7640";"18-Jun-19 09:46 AM";"Godfather wants to know about every deal that happens on his block, so the correct tribute due can be collected.";"";"";
"455741312273219595";"jl777c#5810";"18-Jun-19 09:46 AM";"i guess it would be all regulated entities, so this would not really affect people with their own wallets";"";"";
"406179072922746882";"polycryptoblog#1173";"18-Jun-19 09:46 AM";"It seems more just guidance for nation states to make laws than laws themselves";"";"";
"455741312273219595";"jl777c#5810";"18-Jun-19 09:47 AM";"which means it will just make life difficult for the average user and not provide any barrier to advanced users. i guess it will catch the dumb criminals but not do anything about the smart ones that get 99% of the stolen funds";"";"";
"242635006516658197";"jorian#4555";"18-Jun-19 09:47 AM";"what else is new";"";"";
"455741312273219595";"jl777c#5810";"18-Jun-19 09:49 AM";"there is some celebrity scandal happening";"";"troll_king (1)";
"448777271701143562";"smk762 -  dracocanis ominator#7640";"18-Jun-19 09:50 AM";"You have to offer social media logins at some customs terminals. Maybe soon we need to offer facebook logins to get bank acount.";"";"";
"448777271701143562";"smk762 -  dracocanis ominator#7640";"18-Jun-19 09:50 AM";"*if you dont have an account, one will be created for you*";"";"";
"405380797537976320";"Cryptoon#3362";"18-Jun-19 09:53 AM";"tbh, everything libra is trying to achieve/prove within a year, can already be done by kmd/verus tech today.";"";"💯 (4)";
"406179072922746882";"polycryptoblog#1173";"18-Jun-19 09:54 AM";"It might not be much of a change from how they are handling it now.  Bloomberg article says it could be similar to this , https://www.fincen.gov/sites/default/files/2019-05/FinCEN%20CVC%20Guidance%20FINAL.pdf";"";"";
"406179072922746882";"polycryptoblog#1173";"18-Jun-19 09:56 AM";"ttal order itself or must be transmitted separately.55
Unhosted wallets are software hosted on a person’s computer, phone, or other device that allow the person to store and conduct transactions in CVC. Unhosted wallets do not require an additional third party to conduct transactions. In the case of unhosted, single-signature wallets, (a) the value (by definition) is the property of the owner and is stored in a wallet, while (b) the owner interacts with the payment system directly and has total independent control over the value. In so far as the person conducting a transaction through the unhosted wallet is doing so to purchase goods or services on the user’s own behalf, they are not a money transmitter.";"";"";
"406179072922746882";"polycryptoblog#1173";"18-Jun-19 09:57 AM";"If the multiple-signature wallet provider restricts its role to creating un-hosted wallets that require adding a second authorization key to the wallet owner’s private key in order to validate and complete transactions, the provider is not a money transmitter because it does not accept and transmit value.56 On the other hand, if the person combines the services of a multiple-signature wallet provider and a hosted wallet provider, that person will then qualify as a money transmitter. Likewise,
if the value is represented as an entry in the accounts of the provider, the owner does not interact with the payment system directly, or the provider maintains
total independent control of the value, the provider will also qualify as a money transmitter, regardless of the label the person applies to itself or its activities.";"";"";
"406179072922746882";"polycryptoblog#1173";"18-Jun-19 09:58 AM";"Looks like Proxy Token DEXs are money transmitters @jl777c";"";"";
"406179072922746882";"polycryptoblog#1173";"18-Jun-19 10:00 AM";"Score one for Atomic Swaps";"";"";
"455741312273219595";"jl777c#5810";"18-Jun-19 10:00 AM";"atomic swaps will dominate";"";"";
"455741312273219595";"jl777c#5810";"18-Jun-19 10:02 AM";"it is unclear if a large multisig makes all the multisig participants money transmitters. that seems silly";"";"";
"455741312273219595";"jl777c#5810";"18-Jun-19 10:03 AM";"so it could be that multisig proxy token DEX are ok";"";"";
"455741312273219595";"jl777c#5810";"18-Jun-19 10:03 AM";"the language around multisig is a bit confusing in that document.";"";"";
"455741312273219595";"jl777c#5810";"18-Jun-19 10:03 AM";"of course, the pure cross chain atomic swap is a nice safe harbor exemption, specifically mentioned";"";"💯 (3)";
"459844460625526824";"hyperDEX#6586";"18-Jun-19 10:07 AM";"Now it brings up another question, does wallets like wasabi that does coin join = money transmitters lol";"";"";
"455741312273219595";"jl777c#5810";"18-Jun-19 10:08 AM";"i wouldnt think so as it is non-custodial";"";"";
"406179072922746882";"polycryptoblog#1173";"18-Jun-19 10:08 AM";"I think masternodes based instantsend like dash will have an issue";"";"";
"455741312273219595";"jl777c#5810";"18-Jun-19 10:08 AM";"that was the main theme of those money transmitter doc";"";"";
"455741312273219595";"jl777c#5810";"18-Jun-19 10:08 AM";"if you never are able to spend the funds, then likely you are not a money transmitter";"";"";
"459844460625526824";"hyperDEX#6586";"18-Jun-19 10:08 AM";"Ah ok makes sense";"";"";
"455741312273219595";"jl777c#5810";"18-Jun-19 10:08 AM";"but the multisig aspect is a bit contradictory as a multisig signer cant spend the funds";"";"";
"455741312273219595";"jl777c#5810";"18-Jun-19 10:09 AM";"maybe they just analzed 2 of 2 and 2of3 multisig, which are the most common";"";"";
"406179072922746882";"polycryptoblog#1173";"18-Jun-19 10:09 AM";"I think it’s the provider maintaining control of the value that’s the issue";"";"";
"455741312273219595";"jl777c#5810";"18-Jun-19 10:09 AM";"but a 7 of 13 type of multisig, no single signer can reasonably be said to be in possession of the funds and if you never had possession of something, howe can you transmit it?";"";"";
"406179072922746882";"polycryptoblog#1173";"18-Jun-19 10:10 AM";"Example: 7/13 collude to steal the real coins and leave users with worthless proxies";"";"";
"455741312273219595";"jl777c#5810";"18-Jun-19 10:10 AM";"ok, but that is theft, not money transmission";"";"";
"455741312273219595";"jl777c#5810";"18-Jun-19 10:11 AM";"it requires a conspiracy among 7 independent parties";"";"";
"406179072922746882";"polycryptoblog#1173";"18-Jun-19 10:12 AM";"It’s the fact they have control of the value of the proxy token.";"";"";
"342751827068059650";"Tek#5253";"18-Jun-19 10:12 AM";"ROGER VER REPLIED TO MY THREAD ON REDDIT";"";"";
"342751827068059650";"Tek#5253";"18-Jun-19 10:12 AM";"BITCOOOOOOOON JESUS";"";"";
"459844460625526824";"hyperDEX#6586";"18-Jun-19 10:13 AM";"well what if they rebrand to instead of a dex, it is just a p2p platform, to swap useless btcB for BTC? Basically a p2p between the site and a user?";"";"";
"459844460625526824";"hyperDEX#6586";"18-Jun-19 10:14 AM";"There is no multisig, hopefully some cold storage and basically becomes a manual OTC desk, where they support proxy assets";"";"";
"455741312273219595";"jl777c#5810";"18-Jun-19 10:14 AM";"if the user is able to trigger a withdraw automatically, then it seems the user has control of their funds";"";"";
"459844460625526824";"hyperDEX#6586";"18-Jun-19 10:14 AM";"@Tek what did he say? He stopped replying to my emails after the whole BTC/BCH split";"";"";
"342751827068059650";"Tek#5253";"18-Jun-19 10:15 AM";"https://www.reddit.com/r/btc/comments/c205j6/bch_whalebro_edition/";"";"";
"342751827068059650";"Tek#5253";"18-Jun-19 10:15 AM";"level 1
MemoryDealers
Roger Ver - Bitcoin Entrepreneur - Bitcoin.com
1 point
·
22 minutes ago
1,471 BTC / 32,264 BCH buy wall is interesting if true.";"";"";
"406179072922746882";"polycryptoblog#1173";"18-Jun-19 10:16 AM";"It’s proxies themselves that are the problem ,  there is an issuer.";"";"";
"342751827068059650";"Tek#5253";"18-Jun-19 10:16 AM";"I did it bois. ive been in contact with the buttcoin jesus himself";"";"";
"406179072922746882";"polycryptoblog#1173";"18-Jun-19 10:16 AM";"Lol";"";"";
"459844460625526824";"hyperDEX#6586";"18-Jun-19 10:16 AM";"@polycryptoblog what if the user is the issuer? 😄";"";"";
"342751827068059650";"Tek#5253";"18-Jun-19 10:16 AM";"soon i'll be ordering the most high quality self made explosives";"";"";
"342751827068059650";"Tek#5253";"18-Jun-19 10:16 AM";"no issue at all";"";"";
"342751827068059650";"Tek#5253";"18-Jun-19 10:16 AM";"I'm gonna do it bois";"";"";
"342751827068059650";"Tek#5253";"18-Jun-19 10:17 AM";"im gonnablow up a mosque";"";"";
"459844460625526824";"hyperDEX#6586";"18-Jun-19 10:17 AM";"Deposit BTC get BTC12424463 proxy token";"";"";
"342751827068059650";"Tek#5253";"18-Jun-19 10:17 AM";"lets go";"";"";
"459844460625526824";"hyperDEX#6586";"18-Jun-19 10:17 AM";"So basically the user is creating their own proxy token on the network";"";"";
"455741312273219595";"jl777c#5810";"18-Jun-19 10:17 AM";"who would trust that use to not spend the BTC";"";"";
"459844460625526824";"hyperDEX#6586";"18-Jun-19 10:18 AM";"The BTC is deposited into the site to create the jl777BTC";"";"";
"342751827068059650";"Tek#5253";"18-Jun-19 10:18 AM";"@jl777c i put some orders at 14k too incase the kmd price capitulates without whalebro support";"";"";
"301766691992371210";"Markus#5464";"18-Jun-19 10:18 AM";"Binance making a BTC pegged token";"";"";
"301766691992371210";"Markus#5464";"18-Jun-19 10:18 AM";"https://www.binance.com/en/blog/347360878904684544/Introducing-BitcoinPegged-Token-on-Binance-Chain";"";"";
"301766691992371210";"Markus#5464";"18-Jun-19 10:22 AM";"We encourage project teams to follow this approach and issue pegged token of their own coins on Binance Chain. For coins already listed on Binance.com, we will try our best (no guarantee) to facilitate a pegged/native pair.";"";"";
"440969153227259914";"jansako#3330";"18-Jun-19 10:25 AM";"Sounds just like a proxy-token. there are a dime a dozen of those 'DEX's...";"";"";
"301766691992371210";"Markus#5464";"18-Jun-19 10:26 AM";"sounds like binance chain is similar to omni, pegged tokens";"";"";
