AuthorID;Author;Date;Content;Attachments;Reactions;
"459262405885820928";"Malti#3948";"22-Jun-19 08:32 AM";"And then that would be the fault of Linux?";"";"";
"458020336806395917";"coingirl87#6489";"22-Jun-19 08:32 AM";"Yes...but it was a big fail to komodo...because marketing make announces of big partnership";"";"";
"458020336806395917";"coingirl87#6489";"22-Jun-19 08:32 AM";"That is what is in peoples head";"";"";
"455741312273219595";"jl777c#5810";"22-Jun-19 08:33 AM";"i think by the end of this year, nobody will feel that kmd marketing is a fail";"";"";
"459262405885820928";"Malti#3948";"22-Jun-19 08:33 AM";"Indeed";"";"";
"459262405885820928";"Malti#3948";"22-Jun-19 08:33 AM";"Go check evolve.komodoplatform.com";"";"";
"459262405885820928";"Malti#3948";"22-Jun-19 08:33 AM";"Check developers.komodoplatform.com";"";"";
"458020336806395917";"coingirl87#6489";"22-Jun-19 08:34 AM";"Its pitty that komodo is not willing to reflect bad actions in marketing";"";"";
"459262405885820928";"Malti#3948";"22-Jun-19 08:34 AM";"Techies love developers.komodo.....
Normies will love evolve";"";"";
"455741312273219595";"jl777c#5810";"22-Jun-19 08:34 AM";"what would you have me do?";"";"";
"458020336806395917";"coingirl87#6489";"22-Jun-19 08:34 AM";"Like i say before";"";"";
"458020336806395917";"coingirl87#6489";"22-Jun-19 08:34 AM";"I am still waiting for team meeting video if zurich";"";"";
"459262405885820928";"Malti#3948";"22-Jun-19 08:35 AM";"It’s one partnership gone bad";"";"";
"458020336806395917";"coingirl87#6489";"22-Jun-19 08:35 AM";"There was also a big announcement in 2018 or 2017";"";"";
"459262405885820928";"Malti#3948";"22-Jun-19 08:35 AM";"Who gives a crap about a French bank anyway";"";"";
"459262405885820928";"Malti#3948";"22-Jun-19 08:35 AM";"These consortia are built around new tech";"";"";
"458020336806395917";"coingirl87#6489";"22-Jun-19 08:35 AM";"Thats only one example";"";"";
"455741312273219595";"jl777c#5810";"22-Jun-19 08:35 AM";"so if we can dig up the zurich video, then all will be well?";"";"";
"459262405885820928";"Malti#3948";"22-Jun-19 08:35 AM";"Nothing else";"";"";
"455741312273219595";"jl777c#5810";"22-Jun-19 08:35 AM";"i dont see how that changes much of anything";"";"";
"458020336806395917";"coingirl87#6489";"22-Jun-19 08:36 AM";"No jl777 but...you make an announcement and than nothing happened";"";"";
"458020336806395917";"coingirl87#6489";"22-Jun-19 08:36 AM";"I dont care about the video";"";"";
"458020336806395917";"coingirl87#6489";"22-Jun-19 08:36 AM";"Its only a video";"";"";
"455741312273219595";"jl777c#5810";"22-Jun-19 08:36 AM";"we announced about dico tech, dico tech released";"";"";
"459262405885820928";"Malti#3948";"22-Jun-19 08:36 AM";"How were the early days of the internet? Remember dialing up the connection? This was a tech focused community. And then came the ‘normies’";"";"";
"458020336806395917";"coingirl87#6489";"22-Jun-19 08:36 AM";"But i care about the word of marketing";"";"";
"455741312273219595";"jl777c#5810";"22-Jun-19 08:36 AM";"then please feedback the evolve antara campaign!";"";"";
"455741312273219595";"jl777c#5810";"22-Jun-19 08:37 AM";"let us look forward";"";"";
"458020336806395917";"coingirl87#6489";"22-Jun-19 08:37 AM";"And when the word is not true than its not good";"";"";
"455741312273219595";"jl777c#5810";"22-Jun-19 08:37 AM";"we admit in the past, it was not as good as it should have been";"";"";
"455741312273219595";"jl777c#5810";"22-Jun-19 08:37 AM";"well, a lot of people keep asking us to hype (as in stuff that is not true to pump the price)";"";"";
"459262405885820928";"Malti#3948";"22-Jun-19 08:37 AM";"Are you planning to use the kmd ecosystem @coingirl87 or do you just want your bags pumped?";"";"";
"566502769381343242";"Duck Tape#9059";"22-Jun-19 08:37 AM";"The point is, the price of Komodo is going down too much and we need someone are something to blame. If it goes up again, everyone will stop complaining. I will stop complaining.";"";"";
"455741312273219595";"jl777c#5810";"22-Jun-19 08:38 AM";"yes, BTC dominance getting to 60% (highest mark in recent years) that has nothing to do with the price of all alts going down";"";"";
"455741312273219595";"jl777c#5810";"22-Jun-19 08:38 AM";"just wait for the second half of this year";"";"";
"455741312273219595";"jl777c#5810";"22-Jun-19 08:38 AM";"i cannot divulge any details";"";"";
"455741312273219595";"jl777c#5810";"22-Jun-19 08:38 AM";"but i am buying KMD";"";"";
"459262405885820928";"Malti#3948";"22-Jun-19 08:39 AM";"I’m trying to convince devs to move from hyperledger to kmd because of the opportunities it will bring. Therefore marketing aimed at them (which it will be) is 10000000x more value able than some banner at CMC to pump the price";"";"";
"458020336806395917";"coingirl87#6489";"22-Jun-19 08:39 AM";"I will use the ecosystem but like a said yesterday...the only buyers st the moment are the supernet team";"";"";
"458020336806395917";"coingirl87#6489";"22-Jun-19 08:39 AM";"The bags increase from 6 million to 10 million in last weeks";"";"";
"458020336806395917";"coingirl87#6489";"22-Jun-19 08:39 AM";"That was the whale";"";"";
"458020336806395917";"coingirl87#6489";"22-Jun-19 08:39 AM";"No other oeople buy kmd...maybe some small fishes";"";"";
"459262405885820928";"Malti#3948";"22-Jun-19 08:39 AM";"I don’t believe supernet team buys on CEX";"";"";
"455741312273219595";"jl777c#5810";"22-Jun-19 08:39 AM";"I did manage to do OTC deals";"";"";
"458020336806395917";"coingirl87#6489";"22-Jun-19 08:39 AM";"Thats why we need marketing";"";"";
"455741312273219595";"jl777c#5810";"22-Jun-19 08:40 AM";"likely some of them used cex";"";"";
"459262405885820928";"Malti#3948";"22-Jun-19 08:40 AM";"But you’re talking coin buying marketing";"";"";
"342751827068059650";"Tek#5253";"22-Jun-19 08:40 AM";"@jl777c bruh why r you buying kmd";"";"";
"342751827068059650";"Tek#5253";"22-Jun-19 08:40 AM";"you already have over a million of them";"";"";
"342751827068059650";"Tek#5253";"22-Jun-19 08:40 AM";"if not 10 mil in your fund";"";"";
"455741312273219595";"jl777c#5810";"22-Jun-19 08:40 AM";"i have a lot less now...";"";"";
"342751827068059650";"Tek#5253";"22-Jun-19 08:40 AM";"leave some for us plebs";"";"";
"342751827068059650";"Tek#5253";"22-Jun-19 08:40 AM";"😛";"";"";
"342751827068059650";"Tek#5253";"22-Jun-19 08:41 AM";"KMD is gonna be the investment of my life";"";"";
"342751827068059650";"Tek#5253";"22-Jun-19 08:41 AM";"I hope";"";"";
"455741312273219595";"jl777c#5810";"22-Jun-19 08:41 AM";"its time will come after BTC peaks in this bull market";"";"";
"455741312273219595";"jl777c#5810";"22-Jun-19 08:41 AM";"like all the alts";"";"";
"455741312273219595";"jl777c#5810";"22-Jun-19 08:41 AM";"and the days when BTC dominance peaks is when altcoin prices are lowest";"";"";
"455741312273219595";"jl777c#5810";"22-Jun-19 08:41 AM";"and i like to do OTC deals during these times";"";"";
"342751827068059650";"Tek#5253";"22-Jun-19 08:41 AM";"I understand you dont like to market to traders. but you should market to exchanges.";"";"";
"342751827068059650";"Tek#5253";"22-Jun-19 08:42 AM";"having pairs is important";"";"";
"455741312273219595";"jl777c#5810";"22-Jun-19 08:42 AM";"you mean pay them big giant fees?";"";"";
"342751827068059650";"Tek#5253";"22-Jun-19 08:42 AM";"Personally I would pay some of them.";"";"";
"342751827068059650";"Tek#5253";"22-Jun-19 08:42 AM";"its worth it";"";"";
"458020336806395917";"coingirl87#6489";"22-Jun-19 08:42 AM";"So when you like otc deals....maybe kmd should implement otc feature";"";"";
"455741312273219595";"jl777c#5810";"22-Jun-19 08:42 AM";"ok, send me the BTC and I will use it to pay for listings";"";"";
"459262405885820928";"Malti#3948";"22-Jun-19 08:42 AM";"BTC massive bull atm
Alt season coming
KMD sell pressure almost dry
Antara/evolve launching 15th of July 

This can’t get any better";"";"";
"342751827068059650";"Tek#5253";"22-Jun-19 08:42 AM";"you should do like a big kmd holder voting round and just pay a listing fee with your interestes";"";"";
"455741312273219595";"jl777c#5810";"22-Jun-19 08:43 AM";"i am pretty unique, i think many people trust me enough to send first";"";"";
"458020336806395917";"coingirl87#6489";"22-Jun-19 08:43 AM";"Yes...pay feees...thats marketing";"";"";
"458020336806395917";"coingirl87#6489";"22-Jun-19 08:43 AM";"Marketing needs money";"";"";
"459262405885820928";"Malti#3948";"22-Jun-19 08:43 AM";"Lol but what listings do we need?";"";"";
"459262405885820928";"Malti#3948";"22-Jun-19 08:43 AM";"DEX is coming";"";"";
"459262405885820928";"Malti#3948";"22-Jun-19 08:43 AM";"Fuck CEX";"";"";
"342751827068059650";"Tek#5253";"22-Jun-19 08:43 AM";"also true.";"";"";
"455741312273219595";"jl777c#5810";"22-Jun-19 08:43 AM";"true atomicDEX is indeed around the corner";"";"👌 (2)";
"459262405885820928";"Malti#3948";"22-Jun-19 08:43 AM";"@coingirl87 nobody stops you from setting up a fund and paying exchanges yourself";"";"";
"342751827068059650";"Tek#5253";"22-Jun-19 08:43 AM";"then I suppose the plan is to go all in on marketing the dex";"";"";
"455741312273219595";"jl777c#5810";"22-Jun-19 08:43 AM";"i cant believe they made it work so reliable between two phones";"";"";
"455741312273219595";"jl777c#5810";"22-Jun-19 08:44 AM";"some networking voodoo";"";"";
"459262405885820928";"Malti#3948";"22-Jun-19 08:44 AM";"Now you are making sense imo @Tek";"";"";
"342751827068059650";"Tek#5253";"22-Jun-19 08:44 AM";"I would still however, pay some of the bigger CEX a fee for listing.";"";"";
"342751827068059650";"Tek#5253";"22-Jun-19 08:44 AM";"but thats just me";"";"";
"458020336806395917";"coingirl87#6489";"22-Jun-19 08:44 AM";"I hope mm2  will be better than mm1... it should be easier than buying coins on binance";"";"";
"459262405885820928";"Malti#3948";"22-Jun-19 08:44 AM";"Pulling users to the DEX will be super important";"";"";
"342751827068059650";"Tek#5253";"22-Jun-19 08:44 AM";"never bet on one pony.";"";"";
"455741312273219595";"jl777c#5810";"22-Jun-19 08:44 AM";"mm2 is much better than mm1";"";"";
"459262405885820928";"Malti#3948";"22-Jun-19 08:45 AM";"But regulation is promoting DEX hehe";"";"";
"455741312273219595";"jl777c#5810";"22-Jun-19 08:45 AM";"there still needs to be two sides for a trade, but we are working on getting the liquidity available";"";"";
"458020336806395917";"coingirl87#6489";"22-Jun-19 08:45 AM";"Abd how you will marketing our dex?";"";"";
"455741312273219595";"jl777c#5810";"22-Jun-19 08:45 AM";"me?";"";"";
"459262405885820928";"Malti#3948";"22-Jun-19 08:45 AM";"Are you guys checking Keyrock? @jl777c";"";"";
"459262405885820928";"Malti#3948";"22-Jun-19 08:45 AM";"They are some kind of liquidity provider. Don’t know if they have DEX Tech tho";"";"";
"566502769381343242";"Duck Tape#9059";"22-Jun-19 08:46 AM";"Will Resistance Dex not be more popular than Atomicdex? There is some serious competition, or not?";"";"";
"458020336806395917";"coingirl87#6489";"22-Jun-19 08:46 AM";"So guys...sorry for my complainings...i believe in jl777 words...so i will try to be positive in future....hope you are right";"";"";
"455741312273219595";"jl777c#5810";"22-Jun-19 08:47 AM";"no idea about resistance dex, they started by being based on mm1";"";"";
"455741312273219595";"jl777c#5810";"22-Jun-19 08:47 AM";"but for trading, the competition is all the CEX";"";"";
"347922216429813760";"grewalsatinder#9653";"22-Jun-19 08:47 AM";"The marketing atomicDEX as I understand will be much greater with word of mouth as I see it's working success rate of atomic swaps over mobile";"";"";
"459262405885820928";"Malti#3948";"22-Jun-19 08:47 AM";"CEX trading is 90% desktop";"";"";
"342751827068059650";"Tek#5253";"22-Jun-19 08:47 AM";"bull news for the alt market is coming up";"";"";
