AuthorID,Author,Date,Content,Attachments,Reactions
"444090517286944768","Helio#1948","11-Dec-19 08:34 AM","Hi guys, im looking to having a lengthy coversation with an official developer within the community about abilities and limits of the platform could someone DM me with official credentials. Thanks","",""
"455741312273219595","jl777c#5810","11-Dec-19 09:04 AM","you can DM me","","👆 (2)"
"396621210760380418","Razzler04#2552","11-Dec-19 10:46 AM","hello there what is the best way to move all my data files to another location for my Komodo QT client to access?","",""
"396621210760380418","Razzler04#2552","11-Dec-19 10:47 AM","I can","",""
"396621210760380418","Razzler04#2552","11-Dec-19 10:48 AM","I can't and don't want 20 G plus worth of data on my windows local user profile, want to move it elsewhere","",""
"231533083818590211","Oszy#5734","11-Dec-19 10:57 AM","you can move it anywhere, but then you have to start with -datadir=PATH parameter","",""
"423176312354635779","gcharang#6833","11-Dec-19 10:59 AM","@Razzler04 what oszy said 
<https://support.komodoplatform.com/support/solutions/articles/29000030462-starting-the-komodooceanqt-wallet-with-command-line-parameters-in-windows>
the article has instructions on how to start the wallet with command line parameters","",""
"423176312354635779","gcharang#6833","11-Dec-19 11:01 AM","if the new location was ""D:\komodo-data"",
the parameter to add would be: `-datadir=D:\komodo-data`","",""
