AuthorID;Author;Date;Content;Attachments;Reactions;
"407145234007588865";"nocturnal#2177";"14-May-19 07:11 AM";"buster benton. yes";"";"";
"407145234007588865";"nocturnal#2177";"14-May-19 07:12 AM";"glorious nice one";"";"";
"407145234007588865";"nocturnal#2177";"14-May-19 07:12 AM";"@Lumbi";"";"";
"430818734530101248";"KomodoWorld#8282";"14-May-19 07:16 AM";"the new VBK wp is here: https://mirror1.veriblock.org/Proof-of-Proof_and_VeriBlock_Blockchain_Protocol_Consensus_Algorithm_and_Economic_Incentivization_v1.0.pdf";"";"";
"405380797537976320";"Cryptoon#3362";"14-May-19 07:21 AM";"Lol 76 pages";"";"";
"405380797537976320";"Cryptoon#3362";"14-May-19 07:21 AM";"*let’s just make it extra long so nobody actually reads it*";"";"";
"407145234007588865";"nocturnal#2177";"14-May-19 07:26 AM";"https://cryptoguidepro.com/best-undervalued-chinese-cryptocurrencies/";"";"";
"407145234007588865";"nocturnal#2177";"14-May-19 07:26 AM";"these use cases were cool";"";"";
"407145234007588865";"nocturnal#2177";"14-May-19 07:46 AM";"good time to buy alts";"";"";
"474019343727067147";"designer#4893";"14-May-19 09:08 AM";"So far, gold has been the only way for an individual to protect his or her wealth against a country run by irresponsible elites. But as seen in the case of the United States, if the state confiscated gold, the individual's assets were forced to be helplessly exposed to the country's tyranny. What's encouraging is that the alternative to gold has emerged since 2009. A neutral one that is as scarce as gold and does not belong to a particular subject. However, compared to gold, it is not easy for the state to confiscate unilaterally, it is easier to convey values across borders, and it enhances an individual's economic independence. This is the right definition of bitcoin, called digital gold.";"";"";
"474019343727067147";"designer#4893";"14-May-19 09:12 AM";"The World Gold Association's denunciation of bitcoin is like the radio association's degrading of TV and the wagon association's cutting down on cars. An error made by the World Gold Association is that it overlooked the fact that Bitcoin has only been in the world for 10 years. Comparing bitcoin to gold at the same time is like comparing the physical abilities of a newborn and a healthy adult. Now, the problem with bitcoin is that most of the time, gold has suffered the same in the past, which can be overcome enough over time. Of course, it is hard to say that bitcoin completely replaces gold in a short period of time. However, if bitcoin slowly builds trust as digital gold, the role of gold, which is used for financial purposes, is gradually transferred to bitcoin.

Given that Bitcoin is slowly evolving into digital gold, it is necessary to seriously think about the possibility of Bitcoin taking over the role it played in the gold standard.";"";"👌 (1)";
"242635006516658197";"jorian#4555";"14-May-19 11:13 AM";"A question I've been asking myself lately : is it worth it?";"https://cdn.discordapp.com/attachments/429676186583564288/577815863437164554/image0.jpg";"😂 (1)";
"242635006516658197";"jorian#4555";"14-May-19 11:15 AM";"A CS degree course flat out teaching from Khan academy";"";"🤣 (1)";
"303794669945618442";"PTYX#6840";"14-May-19 12:50 PM";"Gold has 0 merchant adoption.";"";"";
"303794669945618442";"PTYX#6840";"14-May-19 12:50 PM";"And Bitcoin is becoming a settlement layer underneath financial services";"";"";
"303794669945618442";"PTYX#6840";"14-May-19 12:51 PM";"Btc will win out in the long haul. In fact, before they take the gold out of the ground they are 90-95% sure of the amount of gold underneath. You could easily tokenize that and remove the need to destroy the earth. If you own the digital representation of the gold, you have a stake of the gold in the ground.";"";"";
"455741312273219595";"jl777c#5810";"14-May-19 01:10 PM";"gold confiscations limit its usefulness as store of value, always it is made illegal and confiscated when the nationstate needs to boost revenues";"";"";
"455741312273219595";"jl777c#5810";"14-May-19 01:10 PM";"anyway, only the rich and criminals would have gold, so the masses would certainly vote for any such confiscations";"";"";
"455741312273219595";"jl777c#5810";"14-May-19 01:10 PM";"privacy is the key";"";"";
"407145234007588865";"nocturnal#2177";"14-May-19 01:16 PM";"i dont think privacy matters until cash has disappeared";"";"";
"455741312273219595";"jl777c#5810";"14-May-19 01:17 PM";"then it matters already";"";"";
"455741312273219595";"jl777c#5810";"14-May-19 01:17 PM";"cash is not legal tender for many things already";"";"";
"407145234007588865";"nocturnal#2177";"14-May-19 01:17 PM";"average joe not too fussed about privacy, they can just pay cash if they want it off thebooks";"";"";
"455741312273219595";"jl777c#5810";"14-May-19 01:17 PM";"active efforts to ban usage of cash globally";"";"";
"407145234007588865";"nocturnal#2177";"14-May-19 01:17 PM";"were not there yet";"";"";
"407145234007588865";"nocturnal#2177";"14-May-19 01:17 PM";"but heading that way for sure";"";"";
"455741312273219595";"jl777c#5810";"14-May-19 01:18 PM";"try to rent a car with cash";"";"💯 (1)";
"455741312273219595";"jl777c#5810";"14-May-19 01:18 PM";"buy a car";"";"";
"455741312273219595";"jl777c#5810";"14-May-19 01:18 PM";"buy a house";"";"";
"407145234007588865";"nocturnal#2177";"14-May-19 01:18 PM";"yes but you dont need privacy for that because its not illegal";"";"";
"455741312273219595";"jl777c#5810";"14-May-19 01:18 PM";"buy wifi service at the airport";"";"";
"407145234007588865";"nocturnal#2177";"14-May-19 01:18 PM";"you buy weed with cash";"";"";
"407145234007588865";"nocturnal#2177";"14-May-19 01:18 PM";"(in uk were its illegal)";"";"";
"407145234007588865";"nocturnal#2177";"14-May-19 01:18 PM";"etc";"";"🌲 (1)";
"455741312273219595";"jl777c#5810";"14-May-19 01:18 PM";"you believe you only need privacy for things that are illegal???";"";"";
"407145234007588865";"nocturnal#2177";"14-May-19 01:19 PM";"personally yes";"";"";
"407145234007588865";"nocturnal#2177";"14-May-19 01:19 PM";"idont care if anyone knows i bought a car";"";"";
"455741312273219595";"jl777c#5810";"14-May-19 01:19 PM";"just wait till them make what used to be legal, illegal";"";"";
"407145234007588865";"nocturnal#2177";"14-May-19 01:19 PM";"i have no reason to hide it";"";"";
"455741312273219595";"jl777c#5810";"14-May-19 01:19 PM";"what if the car has illegal carbon footprint?";"";"";
"407145234007588865";"nocturnal#2177";"14-May-19 01:19 PM";"youve just used my illegal argument....";"";"";
"455741312273219595";"jl777c#5810";"14-May-19 01:19 PM";"now you are stuck with authorities know you are a future criminal";"";"";
"407145234007588865";"nocturnal#2177";"14-May-19 01:20 PM";"so you need it if its .... illegal";"";"";
"455741312273219595";"jl777c#5810";"14-May-19 01:20 PM";"you missed my point that legality is always changing, to the benefit of the big govt";"";"";
"455741312273219595";"jl777c#5810";"14-May-19 01:20 PM";"so it isnt illegal now";"";"☝ (1)";
"407145234007588865";"nocturnal#2177";"14-May-19 01:20 PM";"i think you overestimate average joes need for privacy at the moment. just my opinion 😃";"";"";
"455741312273219595";"jl777c#5810";"14-May-19 01:20 PM";"but yet it is very needed to be private to protect from changes in laws";"";"";
"455741312273219595";"jl777c#5810";"14-May-19 01:20 PM";"just the top 1% to 10% needs to care";"";"";
"455741312273219595";"jl777c#5810";"14-May-19 01:20 PM";"they control vast majority of wealth anyway";"";"";
"407145234007588865";"nocturnal#2177";"14-May-19 01:21 PM";"yes, for elites privacy very important";"";"";
"455741312273219595";"jl777c#5810";"14-May-19 01:21 PM";"sheeple need not worry";"";"";
"407145234007588865";"nocturnal#2177";"14-May-19 01:21 PM";"talking about average joe";"";"";
"455741312273219595";"jl777c#5810";"14-May-19 01:21 PM";"average joe with negative net worth, probably doesnt need much privacy";"";"";
"455741312273219595";"jl777c#5810";"14-May-19 01:21 PM";"until they do";"";"";
"407145234007588865";"nocturnal#2177";"14-May-19 01:21 PM";"yes";"";"";
"407145234007588865";"nocturnal#2177";"14-May-19 01:21 PM";"we're not there yet, average joe use cash";"";"";
"407145234007588865";"nocturnal#2177";"14-May-19 01:22 PM";"and will for for a while longer";"";"";
"455741312273219595";"jl777c#5810";"14-May-19 01:22 PM";"making posts on the internet that is objectionable to somebody is now illegal in some countries";"";"💯 (1)";
"455741312273219595";"jl777c#5810";"14-May-19 01:22 PM";"so posting on instagram could get you into jail";"";"💯 (1)";
"407145234007588865";"nocturnal#2177";"14-May-19 01:22 PM";"yes but most people have nothing big to hide";"";"";
"407145234007588865";"nocturnal#2177";"14-May-19 01:22 PM";"so they dont care";"";"";
"455741312273219595";"jl777c#5810";"14-May-19 01:22 PM";"until they do";"";"";
"455741312273219595";"jl777c#5810";"14-May-19 01:22 PM";"just wait";"";"";
"455741312273219595";"jl777c#5810";"14-May-19 01:22 PM";"as nationstates run out of money, they will need to confiscate";"";"";
"455741312273219595";"jl777c#5810";"14-May-19 01:22 PM";"but that isnt very popular";"";"";
"455741312273219595";"jl777c#5810";"14-May-19 01:23 PM";"so they will criminalize normal activies and levy fines";"";"";
"407145234007588865";"nocturnal#2177";"14-May-19 01:23 PM";"hey yes we are agreeing";"";"";
"407145234007588865";"nocturnal#2177";"14-May-19 01:23 PM";"im saying were not there yet, and you are saying we are not there yet....";"";"";
"455741312273219595";"jl777c#5810";"14-May-19 01:23 PM";"eventually everything is subject to confiscation";"";"";
"455741312273219595";"jl777c#5810";"14-May-19 01:23 PM";"depends on what country you are in";"";"";
"455741312273219595";"jl777c#5810";"14-May-19 01:23 PM";"some are already there";"";"";
"407145234007588865";"nocturnal#2177";"14-May-19 01:24 PM";"?? 😃";"";"";
"407145234007588865";"nocturnal#2177";"14-May-19 01:25 PM";"nah";"";"";
"407145234007588865";"nocturnal#2177";"14-May-19 01:25 PM";"go on";"";"";
"407145234007588865";"nocturnal#2177";"14-May-19 01:25 PM";"no";"";"";
"407145234007588865";"nocturnal#2177";"14-May-19 01:25 PM";"almost never";"";"";
"407145234007588865";"nocturnal#2177";"14-May-19 01:26 PM";"apart from email";"";"";
"407145234007588865";"nocturnal#2177";"14-May-19 01:26 PM";"so what is the boiling frog in a sentence?";"";"";
"350115686023954432";"Dr.Terminus#3269";"14-May-19 01:26 PM";"obliviously accepting slow death";"";"";
"350115686023954432";"Dr.Terminus#3269";"14-May-19 01:27 PM";"frog will allow itself to boil to death IRL";"";"";
"350115686023954432";"Dr.Terminus#3269";"14-May-19 01:27 PM";"if you put frog in hot water it jumps out right away";"";"";
"350115686023954432";"Dr.Terminus#3269";"14-May-19 01:27 PM";"but put it in cool water and slowly raise temp to boil. frog will sit and stay and die";"";"";
"407145234007588865";"nocturnal#2177";"14-May-19 01:27 PM";"i understand";"";"";
"407145234007588865";"nocturnal#2177";"14-May-19 01:28 PM";"i decided a few years back to become part of the problem, instead of a victim";"";"";
"407145234007588865";"nocturnal#2177";"14-May-19 01:28 PM";"having seen my parents haha";"";"";
"407145234007588865";"nocturnal#2177";"14-May-19 01:28 PM";"and what principles get you ....";"";"";
"407145234007588865";"nocturnal#2177";"14-May-19 01:28 PM";"sad but true";"";"";
"407145234007588865";"nocturnal#2177";"14-May-19 01:29 PM";"crypto has greater iinequality of wealth than fiat";"";"";
"419964976397156352";"cipi#4502";"14-May-19 01:29 PM";"😃";"https://cdn.discordapp.com/attachments/429676186583564288/577850029306544129/10733899_681837365276828_1949900654256912748_o-860x484.jpg";"";
"407145234007588865";"nocturnal#2177";"14-May-19 01:29 PM";"you dont find that problematic?";"";"";
"407145234007588865";"nocturnal#2177";"14-May-19 01:30 PM";"do you find inequality of wealth in fiat problematic?";"";"";
"407145234007588865";"nocturnal#2177";"14-May-19 01:31 PM";"@cipi I was saying for most people its not top of there priorites. just saying";"";"";
"455741312273219595";"jl777c#5810";"14-May-19 01:31 PM";"what proof is there that crypto has more inequality of wealth?";"";"";
"407145234007588865";"nocturnal#2177";"14-May-19 01:31 PM";"i dont have proof to hand, i am judging that from a couple of articles i have read mostly about bitcoin holdings";"";"";
"455741312273219595";"jl777c#5810";"14-May-19 01:31 PM";"i dont agree with that for the sole reason that many in crypto did not require any wealth to begin with, yet to be able to generate wealth";"";"";
"455741312273219595";"jl777c#5810";"14-May-19 01:32 PM";"in the fiat world, without money it is very hard to make money and nearly impossible to make big money";"";"";
"407145234007588865";"nocturnal#2177";"14-May-19 01:32 PM";"crypto is EXACTLY the same";"";"";
"455741312273219595";"jl777c#5810";"14-May-19 01:32 PM";"no";"";"";
"407145234007588865";"nocturnal#2177";"14-May-19 01:32 PM";"in that respect";"";"";
"407145234007588865";"nocturnal#2177";"14-May-19 01:32 PM";"certainly is";"";"";
