AuthorID;Author;Date;Content;Attachments;Reactions;
"297701509066391552";"Caglio#3337";"07-Aug-19 02:16 PM";"Fuck ethereum";"";"";
"297701509066391552";"Caglio#3337";"07-Aug-19 02:16 PM";"and fuck their projects that are easily top 100";"";"";
"297701509066391552";"Caglio#3337";"07-Aug-19 02:16 PM";"we have equalizer";"";"";
"388092138208100356";"Buddz1993#5380";"07-Aug-19 02:16 PM";"I think most important is .";"";"";
"297701509066391552";"Caglio#3337";"07-Aug-19 02:16 PM";"we will build homes in zimbabwe";"";"";
"388092138208100356";"Buddz1993#5380";"07-Aug-19 02:16 PM";"dont put all your eggs in one basket";"";"";
"249256116150730753";"PHBA2061#2530";"07-Aug-19 02:16 PM";"invest != speculate";"";"";
"297701509066391552";"Caglio#3337";"07-Aug-19 02:17 PM";"you will neeed 180 milions of euqalizer";"";"";
"301766691992371210";"Markus#5464";"07-Aug-19 02:17 PM";"@Buddz1993 what u mean ""also have dpos"", kmd is not dpos lol";"";"";
"297701509066391552";"Caglio#3337";"07-Aug-19 02:17 PM";"SLEEPING DRAGON WILL AWAKE";"";"";
"297701509066391552";"Caglio#3337";"07-Aug-19 02:17 PM";"GRAAAR GRAAAR";"";"";
"388092138208100356";"Buddz1993#5380";"07-Aug-19 02:17 PM";"@Markus  PHBA2061Today at 3:13 PM
on consensus level, I believe both Tezos & Lisk have DPoS , instead of PoW";"";"";
"388092138208100356";"Buddz1993#5380";"07-Aug-19 02:17 PM";"I said that ARK also have DPOS";"";"";
"388092138208100356";"Buddz1993#5380";"07-Aug-19 02:17 PM";"I know what KMD has lol";"";"";
"388092138208100356";"Buddz1993#5380";"07-Aug-19 02:18 PM";"I mean I should do since I have been here for god knows how long 😃";"";"";
"458020336806395917";"coingirl87#6489";"07-Aug-19 02:18 PM";"Yeah but thats not the reason for good performance";"";"";
"297701509066391552";"Caglio#3337";"07-Aug-19 02:18 PM";"Coin girl, buy more kmd";"";"";
"297701509066391552";"Caglio#3337";"07-Aug-19 02:18 PM";"Good stable investment";"";"";
"297701509066391552";"Caglio#3337";"07-Aug-19 02:18 PM";"Top 10 coin easily";"";"";
"453853521847255052";"altcoinist#1501";"07-Aug-19 02:19 PM";"It's simple there are more sellers than buyers and no demand";"";"";
"388092138208100356";"Buddz1993#5380";"07-Aug-19 02:19 PM";"yep and the bots push the price down";"";"";
"388092138208100356";"Buddz1993#5380";"07-Aug-19 02:19 PM";"like no one cares about KMD.";"";"";
"301766691992371210";"Markus#5464";"07-Aug-19 02:19 PM";"fine we heard it for 2 weeks now that kmd dump";"";"";
"301766691992371210";"Markus#5464";"07-Aug-19 02:19 PM";"are we gonna continue same talk forever?";"";"";
"301766691992371210";"Markus#5464";"07-Aug-19 02:19 PM";"im sure we know by now";"";"";
"297701509066391552";"Caglio#3337";"07-Aug-19 02:19 PM";"Do you really ?";"";"";
"297701509066391552";"Caglio#3337";"07-Aug-19 02:20 PM";"Or you think we are having a support on 7032 ?";"";"";
"301766691992371210";"Markus#5464";"07-Aug-19 02:20 PM";"idc where support is....i will be buying when ppl sell and panic";"";"";
"297701509066391552";"Caglio#3337";"07-Aug-19 02:20 PM";"True, this is not a good moment to buy yet";"";"";
"297701509066391552";"Caglio#3337";"07-Aug-19 02:20 PM";"obviously even you know we are going lower";"";"";
"458020336806395917";"coingirl87#6489";"07-Aug-19 02:20 PM";"I only want to know why tezos and lisk not dump because they are not better than kmd";"";"";
"301766691992371210";"Markus#5464";"07-Aug-19 02:20 PM";"but ppl clearly started to panic considering we dropped from 10k to 7k quite fast";"";"";
"453853521847255052";"altcoinist#1501";"07-Aug-19 02:21 PM";"What are we gonna do today? Same thing every day complaining about the kmd marketing and price!";"";"";
"297701509066391552";"Caglio#3337";"07-Aug-19 02:21 PM";"I know what are we not gonna do today";"";"";
"297701509066391552";"Caglio#3337";"07-Aug-19 02:21 PM";"Buy more shitcoin";"";"";
"395317330340610059";"debaas#3337";"07-Aug-19 02:21 PM";"there was a 3 month period where people have bought KMD between 60-90 cents. so more dumps could still happen";"";"";
"388092138208100356";"Buddz1993#5380";"07-Aug-19 02:21 PM";"yep.";"";"";
"297701509066391552";"Caglio#3337";"07-Aug-19 02:21 PM";"We are going back to that";"";"";
"297701509066391552";"Caglio#3337";"07-Aug-19 02:21 PM";"we started with 0.50";"";"";
"297701509066391552";"Caglio#3337";"07-Aug-19 02:21 PM";"we are going down to 0.40";"";"";
"297701509066391552";"Caglio#3337";"07-Aug-19 02:22 PM";"next time when bear market happens";"";"";
"458020336806395917";"coingirl87#6489";"07-Aug-19 02:22 PM";"We have to analyze why there is no demand for kmd and react";"";"😂 (1)";
"297701509066391552";"Caglio#3337";"07-Aug-19 02:22 PM";"we are capitulating";"";"";
"297701509066391552";"Caglio#3337";"07-Aug-19 02:22 PM";"sleeping dragon that never woke up";"";"";
"395317330340610059";"debaas#3337";"07-Aug-19 02:22 PM";"Caglio: remind me to never invite you to any parties";"";"";
"395317330340610059";"debaas#3337";"07-Aug-19 02:22 PM";"negative nancy 😛";"";"";
"453853521847255052";"altcoinist#1501";"07-Aug-19 02:22 PM";"@coingirl87 lack of new investors";"";"";
"297701509066391552";"Caglio#3337";"07-Aug-19 02:22 PM";"well if oyu invite me to party";"";"";
"297701509066391552";"Caglio#3337";"07-Aug-19 02:22 PM";"I will make sure its fun if you dont know how to do it properly 😃";"";"";
"297701509066391552";"Caglio#3337";"07-Aug-19 02:23 PM";"In the end it will be amazing if komodo is just a scam";"";"";
"297701509066391552";"Caglio#3337";"07-Aug-19 02:23 PM";"No marketing, cos we have nothing to market about";"";"";
"453853521847255052";"altcoinist#1501";"07-Aug-19 02:23 PM";"or somone deliberately dumps kmd to create panic 🤔";"";"";
"297701509066391552";"Caglio#3337";"07-Aug-19 02:24 PM";"the best thing that happened here was 1) agama hack";"";"";
"297701509066391552";"Caglio#3337";"07-Aug-19 02:24 PM";"where we got hacked by devs, and money is made back";"";"";
"297701509066391552";"Caglio#3337";"07-Aug-19 02:24 PM";"2nd ) that fake chick on twitter";"";"";
"297701509066391552";"Caglio#3337";"07-Aug-19 02:24 PM";"that worked for apple or something";"";"";
"297701509066391552";"Caglio#3337";"07-Aug-19 02:24 PM";"All promises, since monaize went to dust";"";"";
"297701509066391552";"Caglio#3337";"07-Aug-19 02:25 PM";"Marketing, and rebranding... pure joke";"";"";
"249256116150730753";"PHBA2061#2530";"07-Aug-19 02:25 PM";"marketing != shilling";"";"";
"453853521847255052";"altcoinist#1501";"07-Aug-19 02:26 PM";"shilling =awareness";"";"";
"388092138208100356";"Buddz1993#5380";"07-Aug-19 02:26 PM";"Caglio you have a point .";"";"";
"388092138208100356";"Buddz1993#5380";"07-Aug-19 02:26 PM";"and you have made it";"";"";
"249256116150730753";"PHBA2061#2530";"07-Aug-19 02:26 PM";"there are companies who are interested in Antara, that's the proof of marketing";"";"";
"301766691992371210";"Markus#5464";"07-Aug-19 02:26 PM";"https://gyazo.com/dcc664cada1e34e34320a139dbb02d5a";"";"";
"388092138208100356";"Buddz1993#5380";"07-Aug-19 02:26 PM";"I have heard about the meat industry";"";"";
"301766691992371210";"Markus#5464";"07-Aug-19 02:26 PM";"i mean we did better then XRP :troll_king:";"";"";
"347110333762109452";"dan.#2473";"07-Aug-19 02:27 PM";"@PHBA2061 who?";"";"";
"408251982885945344";"actionslacks#4072";"07-Aug-19 02:27 PM";"tezos has wall st investors. lisk was not going to be unavailable thru binance post usa shutdown but there are rumors that they will be on binance's usa replacement exchange.";"";"";
"453853521847255052";"altcoinist#1501";"07-Aug-19 02:27 PM";"At least XRP stayed at top 3:troll_king:";"";"";
"249256116150730753";"PHBA2061#2530";"07-Aug-19 02:27 PM";"idk, it's under NDA as the team said, supposed it is true";"";"";
"301766691992371210";"Markus#5464";"07-Aug-19 02:28 PM";"@altcoinist cause no dumpers, 85% of supply held by XRP team";"";"";
"301766691992371210";"Markus#5464";"07-Aug-19 02:29 PM";"rest being hodlers hoping for moon";"";"";
"347110333762109452";"dan.#2473";"07-Aug-19 02:30 PM";"crazy how well litecoin is holding up";"";"";
"408251982885945344";"actionslacks#4072";"07-Aug-19 02:30 PM";"everyone else is getting epicly rekt too. picking on kmd is just personal malice";"";"";
"297701509066391552";"Caglio#3337";"07-Aug-19 02:30 PM";"@dan. its a good coin, however people shit on it, it has marketing and use, unlike many others";"";"";
"301766691992371210";"Markus#5464";"07-Aug-19 02:30 PM";"boys";"";"";
"301766691992371210";"Markus#5464";"07-Aug-19 02:30 PM";"wait for it";"";"";
"301766691992371210";"Markus#5464";"07-Aug-19 02:30 PM";"i got news";"";"";
"301766691992371210";"Markus#5464";"07-Aug-19 02:31 PM";"1 sec";"";"";
"408251982885945344";"actionslacks#4072";"07-Aug-19 02:31 PM";"sausage";"";"";
"347110333762109452";"dan.#2473";"07-Aug-19 02:32 PM";"@Caglio i suppose it might have to do with network effect just like bitcoin, when btc fees get insane litecoin tends to be used";"";"";
"301766691992371210";"Markus#5464";"07-Aug-19 02:33 PM";"so this is how top alts and kmd added to compare performance since btc started to rally this year";"";"";
"301766691992371210";"Markus#5464";"07-Aug-19 02:34 PM";"https://gyazo.com/f57cae5b894045b787d06b1572082073";"";"";
"301766691992371210";"Markus#5464";"07-Aug-19 02:34 PM";"all alts started to get rekt during same time frame";"";"";
"301766691992371210";"Markus#5464";"07-Aug-19 02:34 PM";"https://gyazo.com/d7905523de664e3ae3e07f3e1b5b81ee";"";"";
"301766691992371210";"Markus#5464";"07-Aug-19 02:34 PM";"this is the chart";"";"";
"301766691992371210";"Markus#5464";"07-Aug-19 02:35 PM";"so its not kmd itself";"";"";
"301766691992371210";"Markus#5464";"07-Aug-19 02:35 PM";"chill 😄";"";"";
"589198378680975371";"Flint#6435";"07-Aug-19 02:37 PM";"all this news and partnership does not affect the price! while the market is easy to manipulate while capitalization and trading volumes are low!";"";"";
"398864863067373568";"CoinKing88#1540";"07-Aug-19 02:37 PM";"@Markus thanks for those graphs, puts it all in perspective";"";"";
"458020336806395917";"coingirl87#6489";"07-Aug-19 02:37 PM";"But kmd is top 5 of loosers although they have amazing tech...how this is possible? We came from rank 40 of cmc";"";"";
"301766691992371210";"Markus#5464";"07-Aug-19 02:37 PM";"we will go back when alts start to recover";"";"";
"589198378680975371";"Flint#6435";"07-Aug-19 02:39 PM";"people are scared away from investments by the fact that their asset can lose 60% in a month! that's enough for them! and as the price movement shows - there are very few true holders - mostly weak hands in the hope of flying to the moon - no more! but they easily get rid of in a panic everything that shows such a red picture on the chart!!!";"";"";
"301766691992371210";"Markus#5464";"07-Aug-19 02:39 PM";"if u believe in kmd start loading up";"";"";
"301766691992371210";"Markus#5464";"07-Aug-19 02:40 PM";"buy now and then not all at once";"";"";
"301766691992371210";"Markus#5464";"07-Aug-19 02:40 PM";"this is a clear sign that something will happen sooner or later";"";"";
"301766691992371210";"Markus#5464";"07-Aug-19 02:40 PM";"if all alts get rekt";"";"";
"301766691992371210";"Markus#5464";"07-Aug-19 02:40 PM";"its just matter of time when it changes";"";"";
"589198378680975371";"Flint#6435";"07-Aug-19 02:41 PM";"and what is the reason for the recovery of altcoins? why do investors with big money suddenly want to invest in altcoins instead of bitcoin?";"";"";
"301766691992371210";"Markus#5464";"07-Aug-19 02:41 PM";"cause their profits with btc are limited";"";"";
