AuthorID;Author;Date;Content;Attachments;Reactions;
"405380797537976320";"Cryptoon#3362";"23-Nov-18 04:29 PM";"So what if people expecting a drop already sold, so who will be selling to make a drop happen?";"";"👍 (4)";
"242635006516658197";"jorian#4555";"23-Nov-18 04:30 PM";"🤷";"";"";
"377468542406098949";"Cassius#9158";"23-Nov-18 04:31 PM";"Yep. The trick is figuring out what 'everyone' thinks";"";"";
"405380797537976320";"Cryptoon#3362";"23-Nov-18 04:31 PM";"https://www.tradingview.com/x/lPtnv8if/";"";"";
"242635006516658197";"jorian#4555";"23-Nov-18 04:35 PM";"you could almost make a bot that buys and sells at bollinger borders";"";"";
"405380797537976320";"Cryptoon#3362";"23-Nov-18 04:45 PM";"indeed";"";"";
"219144762203176961";"Bittersweet#9376";"23-Nov-18 04:59 PM";"Almost";"";"";
"219144762203176961";"Bittersweet#9376";"23-Nov-18 04:59 PM";"Because if you did, you'd be broke";"";"";
"219144762203176961";"Bittersweet#9376";"23-Nov-18 05:00 PM";"👀";"";"";
"249256116150730753";"PHBA2061#2530";"23-Nov-18 05:14 PM";"exactly what I think as well,  the whales almost always do the opposite way of what the majority expect";"";"👍 (1)";
"345992331276713984";"Acura#2748";"23-Nov-18 05:36 PM";"WTS DEX & Bots";"";"";
"292419036929720331";"Reel Em In#1495";"23-Nov-18 05:59 PM";"seems arrr volume has drastically slowed down on dp. anyone know whats up with the  big increase on hush volume on dp?";"";"";
"474206298427097099";"ComputerGenie 👴🏼📢#7004";"23-Nov-18 06:49 PM";"`anyone know whats up with the big increase on hush volume on dp?`
because someone's finally willing to buy it?";"";"";
"405380797537976320";"Cryptoon#3362";"23-Nov-18 07:06 PM";"Thin orderbook and a couple of buys?";"";"";
"430818734530101248";"KomodoWorld#8282";"23-Nov-18 07:17 PM";"https://twitter.com/officialmcafee/status/938938539282190337";"";"🤦 (3),😂 (2),🍿 (2),abusedsmily (4)";
"249256116150730753";"PHBA2061#2530";"23-Nov-18 07:58 PM";"I wonder if he will eat his d*ck if btc doesn't  reach $500K by 2020";"";"";
"474206298427097099";"ComputerGenie 👴🏼📢#7004";"23-Nov-18 08:02 PM";"`simply have not understood the new mathematics`
hmmmm
`$4,098 > $16,600.00` I wonder if my utilities companies will accept that math when I write my checks this month....";"";"";
"430818734530101248";"KomodoWorld#8282";"23-Nov-18 08:03 PM";"@PHBA2061 he could be quite happy even in that case https://twitter.com/officialmcafee/status/976165863085756416";"";"😆 (2)";
"427867553784922113";"FishyGuts#5085";"23-Nov-18 09:55 PM";"*""It's mathematically impossible for me to lose this bet.""*";"";"";
"427867553784922113";"FishyGuts#5085";"23-Nov-18 09:56 PM";"Just like bubbles are mathematically impossible?";"";"";
"367790733501136899";"Vertigo#0439";"23-Nov-18 10:03 PM";"I bought BTC yesterday.";"";"";
"367790733501136899";"Vertigo#0439";"23-Nov-18 10:03 PM";"Took 25 minutes for first confirmation.";"";"";
"459065480511225878";"ryman112#0068";"23-Nov-18 10:19 PM";"Question.....So since BTC is incredibly slow at transactions and the volume is super high on sells does that mean we are seeing everything in a delay like really bad lag?  Such as if somebody bought a shit ton during this dip and it hasnt been confirmed due to the lag if you will?";"";"";
"459065480511225878";"ryman112#0068";"23-Nov-18 10:22 PM";"I guess what Im asking is if its so slow and buys are waiting so long for confirmation when the price actually goes up due to those buys we see it hours after they were executed correct?";"";"";
"249256116150730753";"PHBA2061#2530";"23-Nov-18 10:30 PM";"@ryman112  no, trading on exchanges are off chain transactions, and off chain transactions are way faster than on chain";"";"";
"249256116150730753";"PHBA2061#2530";"23-Nov-18 10:30 PM";"for example binance engine can execute 1.4M TPS";"";"";
"459065480511225878";"ryman112#0068";"23-Nov-18 10:36 PM";"Cool thanks didn't know that";"";"";
"249256116150730753";"PHBA2061#2530";"23-Nov-18 10:44 PM";"but if trading are done in a decentralized  manner, peer-to-peer, then your assumption may become true";"";"";
"405380797537976320";"Cryptoon#3362";"23-Nov-18 10:52 PM";"!kmdtip rain 1";"";"";
"499325474128920597";"KMD TipBot#0077";"23-Nov-18 10:52 PM";"@FishyGuts @Zanzarismo @[TPUX] Djith Wattignies @Muffy_SuperGosu @Lyriiia @⚔ bountyXhunter ⚔ @Resistor @walkerisduder @CMaurice @Quevedo @لارني الرماد @CryptoEnthusiast @ruelatayde @smk762 -  dracocanis ominator @Forward Web @sharkman1027 @blub @Exolith @KOmodo @Deleted User @zyzz @PHBA2061 @Mihailo @LoPhatMelk @Andersen @𝖈𝖄𝖙𝖗𝖎𝖃 @CryptAiz @Deleted User @Reel Em In @Deleted User @Deleted User @Multtari @The Big Wan @Lumi [UTC+2] @oldstyle @qriptau @slipersty @Jeffrey @Viking Raider @The Crow @lancelott @linkara6669 @7seas0311 @akibebi @steadydee @sajala1 @Deleted User @naezith @nago75jp @j4ys0n @sbugs12 @Macro-Pool.com @andy2761 @heguli97 @CiPhEr @CG฿ @ComputerGenie 👴🏼📢 @Anubis @OkDuck @polycryptoblog @TheMiningPool @javadth @LordTricky @beybietron @Deleted User @HacKeZ @! ariewayq ! The Real Human @SABlockblox @Deleted User @markiks @Proof Of Review @fd @alexander @Thabuzzmaker @Brhoes @carlosanjuan45 @Grenwolde @mozzx @jl777c @Alfie @Skeets @Shingo Murata @bpkdasbaum @BlockTech @koko1 @revben @blessy @blockzilla @Cryptoprenuer @jahras";"";"🚀 (1)";
"499325474128920597";"KMD TipBot#0077";"23-Nov-18 10:52 PM";"@CryptoTony @FearandGreed @Deleted User @Decker @StopFeedinPlease AKA CJCrypt @Darken-san @Shadowalker @V9k @CoraX @Hermes @Dr Debt @Sir Parzival @TLMTroublemaker @PikkonMG @jacko @kmdkrazy @kopykat @For The Record @Sri @sorin90 @crumb @CryptoSpaced @Mr.Cryptodude @Deleted User @Lazydayz137 @Deleted User @Rada @Trade_The_Doji @Yeppers @p0ntifex_m4ximus @Rob @DerLauch @Sugaku @K I @ItsFlashtime @Deleted User @bswilmington @Endeby @TimC @Deleted User @manata @The CryptoCoin Man @athenamoon @Hanz Mark @Bianca_NL @ken.raphael @Trystaero @blockplus.dev @Babsoft @BlackJesus @jjimmyss @Karl @yorktronic @weblinx @Patziggy @sanrlisa @gars50 @Max_M @arnrunas @selevanus (Rob) @Deleted User @malandante @cars @CrisF @CryptoRot @Cy_Baer @KSanJuan @samurai6 @bishop @SHossain @꧁ ۩۞۩ ªßðº ⁿ¹ ۩۞۩꧂ @deathsgrip @cathar @CraigCandleChrist @crypto_blaze @Brendyn @BTC-BTC-BTC @bonedaddy @KillahJon @mokopo @MinerX.312 @saltyminer @ChamoLapik @REX @Ardberg @Mark-SmartCash @Nagol @katrina_lenz @Igor @c2k @ratskydat";"";"";
"499325474128920597";"KMD TipBot#0077";"23-Nov-18 10:52 PM";"@renuzit @1karl_rich1982 @Steve10 @SunabNaverith @Godballz @KA0SPHAZE 🇦🇺 @bowienetter⚡ @B.B. @kekoa @acven @Naranor @riddler18k @CryptoFoxGaming @mehrdadb30 @Umaru @SadykovT @poseidon @Deltazulu @REKT Queen @NIcu @m3rt1x @venne @0dar @duka511 @henk @nille @!👽▂▅▆▇ Thorth ▇▆▅▂👽 @pa1n @zman117 @jherbhardt @Syms @gotzi_ne @Mörökölli (Boogeyman) @Mutte @adriendarki @CryptoDroid @Leandro @stock999 @Oberst @MissVi @GermanKryptoGuru @JVA @D2D privacyalternatives.com @CheeseBaby @Gaz @Richy @LtLunatic @Roman_P @SwimedDragon @Seeth @MrHades978 @MantisShrimp @*PopS* @📢Alex📢 @MoldyLunchbox @Show @Mauro @Novo @KOSIUS @halkuon @Daniel @Psipherious @karmakazi @Ⴚᴌ̽̽̽ᴉᴛᴄʜ͓͓͓Xⷯᴘⷵʟøⷯɪᴛ̲̲̲я @JimD @BurgerBaron @DastardlyDan @Crizia @CrankyBits @stonemountain @TRÜFFLEPIG @Petrus @abiky @Gustav-Erwin @Pillowcat/Trythis/Hydrapon @Neftegrad @pclind @Mckmuze @TheGemologist @DeMoNloK @J1m @sclear @jun @raspal @dpse007 @am";"";"";
"499325474128920597";"KMD TipBot#0077";"23-Nov-18 10:52 PM";"";"";"👍🏽 (1)";
"405380797537976320";"Cryptoon#3362";"23-Nov-18 10:52 PM";"PSA: enjoy thanksgiving and feel free to dump your vrsc into my buy orders thank you!";"";"";
"412482228359266328";"CrisF#3405";"23-Nov-18 10:54 PM";"Thanks, and happy Thanksgiving 🦃";"";"";
"445047999249514497";"lancelott#6785";"23-Nov-18 10:54 PM";"@Cryptoon thanks";"";"";
"456967885584203787";"Steve10#5203";"23-Nov-18 10:59 PM";"@Cryptoon#3362 thank you!";"";"";
"367790733501136899";"Vertigo#0439";"24-Nov-18 01:21 AM";"Hey what is the scariest day for a fish?";"";"";
"367790733501136899";"Vertigo#0439";"24-Nov-18 01:24 AM";"Nobody?";"";"";
"367790733501136899";"Vertigo#0439";"24-Nov-18 01:24 AM";"Fry-day.";"";"";
"367790733501136899";"Vertigo#0439";"24-Nov-18 01:24 AM";":parrot:";"";"🤡 (1),trollface (1)";
"429101104480124929";"jspook16#3059";"24-Nov-18 02:14 AM";"Is this the Black Friday that everyone talks about. Crypto on the cents";"";"💯 (1)";
"408251982885945344";"actionslacks#4072";"24-Nov-18 02:45 AM";"It may be the real deal. Crypto prices will be a drop in the bucket compared to what could happen.";"";"👆 (1)";
"232679450301431808";"blackjok3r#3181";"24-Nov-18 02:50 AM";"Might be crazy... But I think i am going to place a bunch of buy orders on BCH SV....";"";"";
"232679450301431808";"blackjok3r#3181";"24-Nov-18 02:57 AM";"Damn it ... its already mooned";"";"";
"232679450301431808";"blackjok3r#3181";"24-Nov-18 02:57 AM";"up 50% in 24H 😡";"";"";
"232679450301431808";"blackjok3r#3181";"24-Nov-18 02:58 AM";"highest volume BTC pair on binance";"";"";
"232679450301431808";"blackjok3r#3181";"24-Nov-18 02:59 AM";"I guess when I went to sleep thinking that I should do just that, I should ahve done it and not slept.. stupid crypto never sleeping.";"";"";
"232679450301431808";"blackjok3r#3181";"24-Nov-18 03:12 AM";"Faketoshi might be some crazy nut... but I think possibly SV is the better chain at this point 🤣";"";"";
"414128958326571008";"Hermes#6934";"24-Nov-18 04:08 AM";"what's his plan?";"";"";
"232679450301431808";"blackjok3r#3181";"24-Nov-18 04:21 AM";"https://www.youtube.com/watch?v=9YG8gqBd3Mg";"";"";
"232679450301431808";"blackjok3r#3181";"24-Nov-18 04:22 AM";"came accross that yesterday... guy makes solid points ... they want a solid referance implementation that never changes... unlike BTC core which removes and adds RPC calls constantly how ever they like breaking every existing application built  on it.";"";"";
"232679450301431808";"blackjok3r#3181";"24-Nov-18 04:22 AM";"and they also make very valid points that the block need to be about 600MB worth of transactions, so mining stays at eh same profit levels at the next halving";"";"";
"232679450301431808";"blackjok3r#3181";"24-Nov-18 04:23 AM";"otherwise miners stop mining the chain due to less profits";"";"";
"232679450301431808";"blackjok3r#3181";"24-Nov-18 04:24 AM";"so 2 years to get enough transactions to fill 600MB blocks ... and we can bearly fill a 128mb block with current transactions, even trying to spam the crap out of it...";"";"";
"474206298427097099";"ComputerGenie 👴🏼📢#7004";"24-Nov-18 05:44 AM";"`so mining stays at eh same profit levels at the next halving
otherwise miners stop mining the chain due to less profits`
That's really only a valid point for the length of time it takes to reach 2 diff cycles past any sizable exodus";"";"";
"474206298427097099";"ComputerGenie 👴🏼📢#7004";"24-Nov-18 05:44 AM";"after that it's moot";"";"";
"403585751171989507";"LocoMB#8593";"24-Nov-18 07:21 AM";"here is some background for HODLers:
https://www.zerohedge.com/news/2018-11-23/assassination-bitcoin
things are getting interesting!";"";"";
"455741312273219595";"jl777c#5810";"24-Nov-18 07:25 AM";"the three months of no volatility definitely seemed like a large scale manipulation. bitcoin just doesnt sit still for so long";"";"";
"347922216429813760";"grewalsatinder#9653";"24-Nov-18 07:36 AM";"any skeptic thoughts on btc hitting 3k in coming week(s) ?";"";"";
"455741312273219595";"jl777c#5810";"24-Nov-18 07:36 AM";"if it is the fiat forces doing the manipulation, anything can happen";"";"";
"347922216429813760";"grewalsatinder#9653";"24-Nov-18 07:36 AM";"or how low it can be expected to go?";"";"";
"455741312273219595";"jl777c#5810";"24-Nov-18 07:37 AM";"when you can print however many USD you need to manipulate the market, it seems it can go on for a long time";"";"";
"347922216429813760";"grewalsatinder#9653";"24-Nov-18 07:37 AM";"a quick look on bitcoinwisdom chart makes me think it is indeed manipulation.
3 months of sideways, then down, about 5 days of sideways and then down, and now about 4 days of sideways so far";"";"";
"455741312273219595";"jl777c#5810";"24-Nov-18 07:37 AM";"the regulatory attacks and financial attacks that are coordinated, do not seem to be a coincidence";"";"";
"347922216429813760";"grewalsatinder#9653";"24-Nov-18 07:38 AM";"agree";"";"";
"347922216429813760";"grewalsatinder#9653";"24-Nov-18 07:38 AM";"and it is affecting kmd price too, like it's affecting any other alternate currency.....";"";"";
"455741312273219595";"jl777c#5810";"24-Nov-18 07:40 AM";"yes, stomp on BTC, stomp on all of crypto";"";"";
"455741312273219595";"jl777c#5810";"24-Nov-18 07:43 AM";"but it could just be wall street. i think this all started around futures expiration";"";"";
"455741312273219595";"jl777c#5810";"24-Nov-18 07:43 AM";"and this could just be a way to buy a lot more BTC at a discount";"";"";
"425038173853319178";"nille#9011";"24-Nov-18 08:45 AM";"thanks";"";"";
"396289172249247746";"And1_89#6578";"24-Nov-18 10:39 AM";"Bittrex  KMD Deposits and withdrawals are temporarily offline. Wallet Offline";"";"";
"377468542406098949";"Cassius#9158";"24-Nov-18 12:43 PM";"I would say it's a case of not letting a good crisis go to waste. Opportunity knocks for the contrarian with the long view, i.e. most financial institutions and smart money";"";"";
"345992331276713984";"Acura#2748";"24-Nov-18 12:54 PM";"WTS DEX/BOTS for KMD or Pirate";"";"";
"405380797537976320";"Cryptoon#3362";"24-Nov-18 01:24 PM";"https://twitter.com/calvinayre/status/1065876603165687810?s=21";"";"";
"405380797537976320";"Cryptoon#3362";"24-Nov-18 01:24 PM";"This guy...";"";"";
"232679450301431808";"blackjok3r#3181";"24-Nov-18 01:38 PM";"hes kind of right ...";"";"";
"232679450301431808";"blackjok3r#3181";"24-Nov-18 01:38 PM";"the way this is going is not good for everyone";"";"";
"232679450301431808";"blackjok3r#3181";"24-Nov-18 01:38 PM";"nChain spent a shit load of money";"";"";
"232679450301431808";"blackjok3r#3181";"24-Nov-18 01:39 PM";"they want 4GB blocks or larger ... BCHSV is mean to host everything";"";"";
"232679450301431808";"blackjok3r#3181";"24-Nov-18 01:40 PM";"with a stable protocol that allows devs to use it without random changes like the removal of `getinfo`";"";"";
"303794669945618442";"PTYX#6840";"24-Nov-18 01:55 PM";"Are you pro BCHSV @blackjok3r ?";"";"";
"232679450301431808";"blackjok3r#3181";"24-Nov-18 01:59 PM";"not 100% sure man";"";"";
"232679450301431808";"blackjok3r#3181";"24-Nov-18 01:59 PM";"dont know enough about it";"";"";
"232679450301431808";"blackjok3r#3181";"24-Nov-18 02:00 PM";"but they raise some good points";"";"";
"232679450301431808";"blackjok3r#3181";"24-Nov-18 02:00 PM";"the video i posted above was interesting to say the least ... that guy made a fair bit of sense";"";"";
"232679450301431808";"blackjok3r#3181";"24-Nov-18 02:00 PM";"I am for certain not pro BTC core 😉";"";"";
"232679450301431808";"blackjok3r#3181";"24-Nov-18 02:01 PM";"with @ComputerGenie 👴🏼📢  there";"";"";
"405011811511828481";"Alright#0419";"24-Nov-18 02:04 PM";"I'm not specifically pro-SV, but after seeing what ABC did in latest release, SV is more attractive than ABC";"";"👌 (1)";
"474206298427097099";"ComputerGenie 👴🏼📢#7004";"24-Nov-18 02:04 PM";"we've passed the point were I'm not even ""not pro BTC core"", I'm flat out *anti-BTC*";"";"";
"405011811511828481";"Alright#0419";"24-Nov-18 02:05 PM";"ABC now has no concept of longest chain";"";"";
"405011811511828481";"Alright#0419";"24-Nov-18 02:05 PM";"only ""which chain bitcoin.com says is real""";"";"";
"232679450301431808";"blackjok3r#3181";"24-Nov-18 02:05 PM";"that is bad... very bad";"";"";
"232679450301431808";"blackjok3r#3181";"24-Nov-18 02:05 PM";"at least notary nodes are a distrubuted consensus";"";"";
"405011811511828481";"Alright#0419";"24-Nov-18 02:06 PM";"yes if you can imagine KMD having a single notary node";"";"";
"405011811511828481";"Alright#0419";"24-Nov-18 02:06 PM";"that's what they are doing";"";"";
"474206298427097099";"ComputerGenie 👴🏼📢#7004";"24-Nov-18 02:07 PM";"`ABC now has no concept of longest chain
only ""which chain bitcoin.com says is real""`
That's not really any different than how BTC will function forevermore";"";"";
"232679450301431808";"blackjok3r#3181";"24-Nov-18 02:07 PM";"that might be the entire point";"";"";
"232679450301431808";"blackjok3r#3181";"24-Nov-18 02:07 PM";"BTC was liek that since and even before segwit";"";"";
"232679450301431808";"blackjok3r#3181";"24-Nov-18 02:07 PM";"SV is the only chain giving miners power";"";"";
