AuthorID;Author;Date;Content;Attachments;Reactions;
"342751827068059650";"Tek#5253";"21-May-19 10:59 PM";"right thats  what I read";"";"";
"342751827068059650";"Tek#5253";"21-May-19 10:59 PM";"KMD : Evolution
DASH: Evolution";"";"";
"342751827068059650";"Tek#5253";"21-May-19 10:59 PM";"tfw";"";"";
"342751827068059650";"Tek#5253";"21-May-19 11:00 PM";"ok so soon";"";"";
"342751827068059650";"Tek#5253";"21-May-19 11:00 PM";"so basically these are the last cheap KMD coins before the marketing team makes it moon again";"";"💯 (2)";
"403400248879218690";"Hollowman9000#3344";"21-May-19 11:20 PM";"Brown towels are reportedly out of stock from several large vendors in preparation";"";"😂 (5)";
"264236295432175616";"Gordon Komodo#7477";"21-May-19 11:23 PM";"Costco only has black and blue left :troll:";"";"";
"429101104480124929";"jspook16#3059";"22-May-19 02:58 AM";"Shoulda got more pirate...";"";"";
"403400248879218690";"Hollowman9000#3344";"22-May-19 03:21 AM";"It’s stalled at the moment";"";"";
"403400248879218690";"Hollowman9000#3344";"22-May-19 03:21 AM";"Choice is yours";"";"";
"403400248879218690";"Hollowman9000#3344";"22-May-19 03:21 AM";"Decent chunk at 1286";"";"";
"403400248879218690";"Hollowman9000#3344";"22-May-19 03:21 AM";"DP";"";"";
"403400248879218690";"Hollowman9000#3344";"22-May-19 03:22 AM";"@jspook16";"";"";
"459065480511225878";"ryman112#0068";"22-May-19 05:28 AM";"Marketing lol";"";"";
"219144762203176961";"Bittersweet#9376";"22-May-19 05:42 AM";"@Tek disappointed by your little talk yesterday ☹";"";"";
"459262405885820928";"Malti#3948";"22-May-19 06:18 AM";"As a belgian i can understand (to a point) where tek is coming from, however I see it as a responsibility to myself to go to work and not rely on benefits even though I dread being in an office from 9-7.";"";"";
"242635006516658197";"jorian#4555";"22-May-19 06:24 AM";"had to scroll back to see what kind of profiteur tek is 😄";"";"";
"405380797537976320";"Cryptoon#3362";"22-May-19 06:25 AM";"I just hate that I have to pay for that kind of shit that profit from the system. But in truth if such a thing is possible then the system is flawed";"";"";
"405380797537976320";"Cryptoon#3362";"22-May-19 06:25 AM";"Haha idd";"";"";
"242635006516658197";"jorian#4555";"22-May-19 06:25 AM";"same happens in NL though, the hard working paying for those lazy feks";"";"";
"405380797537976320";"Cryptoon#3362";"22-May-19 06:25 AM";"And it’s a lot worse in brussels/ the southern side of the country";"";"";
"405380797537976320";"Cryptoon#3362";"22-May-19 06:26 AM";"25% unemployment in brussels etc";"";"";
"242635006516658197";"jorian#4555";"22-May-19 06:26 AM";"southern side of belgium are french right?";"";"";
"405380797537976320";"Cryptoon#3362";"22-May-19 06:26 AM";"Yeah";"";"";
"242635006516658197";"jorian#4555";"22-May-19 06:26 AM";"that explains lol";"";"";
"242635006516658197";"jorian#4555";"22-May-19 06:26 AM";"those are really lazy lol";"";"";
"405380797537976320";"Cryptoon#3362";"22-May-19 06:26 AM";"Some are I guess";"";"";
"405380797537976320";"Cryptoon#3362";"22-May-19 06:26 AM";"Some mean well and are fed up as well";"";"";
"405380797537976320";"Cryptoon#3362";"22-May-19 06:27 AM";"But the problem is when some are exploiting the system, that doesnt really motivate others to go out and work hard when they see that others are just taking advantage";"";"";
"405380797537976320";"Cryptoon#3362";"22-May-19 06:27 AM";"So it’s a system that enforces itself";"";"";
"405380797537976320";"Cryptoon#3362";"22-May-19 06:28 AM";"Like Tek says, ‘if others are doing it why shouldnt I do it?’";"";"";
"455741312273219595";"jl777c#5810";"22-May-19 06:28 AM";"like a mining system where the ones with the lowest hashrate gets the block";"";"";
"455741312273219595";"jl777c#5810";"22-May-19 06:28 AM";"seems a bit backwards";"";"";
"455741312273219595";"jl777c#5810";"22-May-19 06:29 AM";"but as automation takes over more and more jobs, some solution is needed for the unemployable, which will become the majority of people";"";"";
"242635006516658197";"jorian#4555";"22-May-19 06:31 AM";"unemployable implies that you can't work. Tek seems fit to work";"";"";
"242635006516658197";"jorian#4555";"22-May-19 06:31 AM";"just chooses not to";"";"";
"405380797537976320";"Cryptoon#3362";"22-May-19 06:31 AM";"i think with more automation, the entertainment industry will become a main growth driver";"";"";
"242635006516658197";"jorian#4555";"22-May-19 06:31 AM";"Europe also faces the fact that in 20 years 30% of the population will be too old to work (unemployable) and the younger generation will need to find a way to pay for their pension";"";"";
"455741312273219595";"jl777c#5810";"22-May-19 06:31 AM";"but how will people pay for the entertainment?";"";"";
"405380797537976320";"Cryptoon#3362";"22-May-19 06:32 AM";"Work in entertainment!";"";"";
"455741312273219595";"jl777c#5810";"22-May-19 06:32 AM";"when most all office jobs are totally automated...";"";"";
"455741312273219595";"jl777c#5810";"22-May-19 06:32 AM";"and physical labor is also automated...";"";"";
"455741312273219595";"jl777c#5810";"22-May-19 06:33 AM";"unless you are creating the automation, there are not so many jobs. not sure how good robots would be at being a chef, so maybe restaurants are safe for a bit longer";"";"";
"455741312273219595";"jl777c#5810";"22-May-19 06:33 AM";"there will be people that in all past generations would be very productive people, but cant compete against the automation.";"";"";
"219144762203176961";"Bittersweet#9376";"22-May-19 06:34 AM";"Tek is my Ahmed";"";"";
"219144762203176961";"Bittersweet#9376";"22-May-19 06:35 AM";"I'll just put it like that";"";"";
"459262405885820928";"Malti#3948";"22-May-19 06:35 AM";"being a barber seems to be a safe choice tbh. Wouldn't want a robot to shave me (aka be with a sharp knife in the face/neck area) lol";"";"";
"219144762203176961";"Bittersweet#9376";"22-May-19 06:35 AM";"The system has its flaws but that's a fact";"";"";
"219144762203176961";"Bittersweet#9376";"22-May-19 06:36 AM";"Also no reward is a bit of an exaggeration";"";"";
"219144762203176961";"Bittersweet#9376";"22-May-19 06:36 AM";"You can expect 100% salary increase in 10-15 years";"";"";
"219144762203176961";"Bittersweet#9376";"22-May-19 06:36 AM";"Not much but more than the 0 he gets";"";"";
"219144762203176961";"Bittersweet#9376";"22-May-19 06:37 AM";"That's true everywhere in Belgium when you play your cards half right...";"";"";
"459262405885820928";"Malti#3948";"22-May-19 06:38 AM";"but again, you have to be able to do your job for 10-15 years, for a 'measly' double in wage";"";"";
"219144762203176961";"Bittersweet#9376";"22-May-19 06:39 AM";"Sure just saying 0 isn't exactly a good goal either";"";"";
"459262405885820928";"Malti#3948";"22-May-19 06:39 AM";"and with 'being able to', i mean trying not to go mad";"";"";
"459262405885820928";"Malti#3948";"22-May-19 06:39 AM";"office politics, annoying colleagues, shitty bosses...";"";"";
"219144762203176961";"Bittersweet#9376";"22-May-19 06:40 AM";"Also Belgian SS allows you to quit your job and keep an income while starting your own business/activity";"";"";
"459262405885820928";"Malti#3948";"22-May-19 06:40 AM";"the amount of times I fantasized of just standing up and walking out of there, you can't imagine";"";"";
"459262405885820928";"Malti#3948";"22-May-19 06:40 AM";"@Bittersweet I don't know about that? you gotta be fired to get on benefits";"";"";
"459262405885820928";"Malti#3948";"22-May-19 06:41 AM";"if you quit yourself there is a 6 month waiting period before you can get beneftis";"";"";
"219144762203176961";"Bittersweet#9376";"22-May-19 06:43 AM";"I've once arranged with my employer to be released and that's how I started my company in BE";"";"";
"219144762203176961";"Bittersweet#9376";"22-May-19 06:43 AM";"Not entirely sure of how common it is";"";"";
"459262405885820928";"Malti#3948";"22-May-19 06:43 AM";"That’s a good employer";"";"";
"219144762203176961";"Bittersweet#9376";"22-May-19 06:44 AM";"Now I work in LU and manage said company";"";"";
"219144762203176961";"Bittersweet#9376";"22-May-19 06:44 AM";"Without it I wouldn't have been able to";"";"";
"459262405885820928";"Malti#3948";"22-May-19 06:44 AM";"What are your activities if I may ask?";"";"";
"219144762203176961";"Bittersweet#9376";"22-May-19 06:44 AM";"It and insurance";"";"";
"219144762203176961";"Bittersweet#9376";"22-May-19 06:45 AM";"My point is that it's not that balcj and white especially in BE where there is so much ""interpretation"" of the system";"";"";
"219144762203176961";"Bittersweet#9376";"22-May-19 06:45 AM";"I'm not paying taxes for ahmed and a nigga";"";"";
"219144762203176961";"Bittersweet#9376";"22-May-19 06:45 AM";"Like Tek said so elegantly";"";"";
"219144762203176961";"Bittersweet#9376";"22-May-19 06:47 AM";"That's another debate altogether, say what you want but immigration is the only short term median population age controller";"";"";
"219144762203176961";"Bittersweet#9376";"22-May-19 06:47 AM";"So I don't worry about that";"";"";
"219144762203176961";"Bittersweet#9376";"22-May-19 06:47 AM";"When I compare Sweden/Germany with Japan";"";"";
"219144762203176961";"Bittersweet#9376";"22-May-19 06:48 AM";"Welcome to KMD trading chat folks";"";"";
"219144762203176961";"Bittersweet#9376";"22-May-19 06:50 AM";"When hollow comes in gun slinging and commie hating it will get more entertaining";"";"😂 (2)";
"405380797537976320";"Cryptoon#3362";"22-May-19 06:54 AM";"@Bittersweet dont forget the subsidies and tax cuts for every single thing in Belgium";"";"";
"405380797537976320";"Cryptoon#3362";"22-May-19 06:54 AM";"if you are good you can game the system and take advantage of most of them";"";"";
"405380797537976320";"Cryptoon#3362";"22-May-19 06:54 AM";"while a lot of people/companies dont put in the time and effort and just pay the full amount of taxes";"";"";
"405380797537976320";"Cryptoon#3362";"22-May-19 06:54 AM";"so the benefits go to the lucky few";"";"";
"405380797537976320";"Cryptoon#3362";"22-May-19 06:55 AM";"better off just making the system easier, cutting out all the exeptions and lowering taxes for everyone";"";"";
"219144762203176961";"Bittersweet#9376";"22-May-19 06:55 AM";"Yes that one I'm on the fence over 😅";"";"";
"405380797537976320";"Cryptoon#3362";"22-May-19 06:55 AM";"might cut down on administration while you are at it";"";"";
"405380797537976320";"Cryptoon#3362";"22-May-19 06:55 AM";"no more exeptions, no people that have to make sure it's done 'right'";"";"";
"405380797537976320";"Cryptoon#3362";"22-May-19 06:56 AM";"At this rate I'm pretty sure the country will be bankrupt in 10 years anyway so whatever";"";"";
"405380797537976320";"Cryptoon#3362";"22-May-19 06:56 AM";"Also pretty sure my generation will not get any type of pension whatever, so better make sure I accumulate enough to take care of myself when the time comes";"";"";
"455741312273219595";"jl777c#5810";"22-May-19 06:57 AM";"all the fiat countries are inflating at roughly the same rate and fiddling inflation numbers to pretend they arent";"";"";
"455741312273219595";"jl777c#5810";"22-May-19 06:57 AM";"so the standard of living goes down across the board, slowly";"";"";
"455741312273219595";"jl777c#5810";"22-May-19 06:57 AM";"boiling the frog";"";"";
"455741312273219595";"jl777c#5810";"22-May-19 06:57 AM";"few notice";"";"";
"405380797537976320";"Cryptoon#3362";"22-May-19 06:57 AM";"not just inflation, national debt in belgium is already at 104% of the national product, and increasing 2% each year...";"";"";
"405380797537976320";"Cryptoon#3362";"22-May-19 06:57 AM";"I mean wtf";"";"";
"219144762203176961";"Bittersweet#9376";"22-May-19 06:58 AM";"Safe to say we will work until 75 at least";"";"";
"455741312273219595";"jl777c#5810";"22-May-19 06:58 AM";"they copy the USSA. just print more money";"";"";
"219144762203176961";"Bittersweet#9376";"22-May-19 06:58 AM";"So they better cure aging";"";"";
"455741312273219595";"jl777c#5810";"22-May-19 06:58 AM";"dont forget to fiddle the inflation numbers so people dont panic";"";"";
"405380797537976320";"Cryptoon#3362";"22-May-19 06:58 AM";"Any company that has 220billion in income every year (like Belgium has) and where they cant even make a profit, would fire the entire management and board of directors";"";"💯 (1)";
"219144762203176961";"Bittersweet#9376";"22-May-19 06:58 AM";"Yes @jl777c no question about that";"";"";
"219144762203176961";"Bittersweet#9376";"22-May-19 06:58 AM";"Still gotta live in this system somewhat though";"";"";
"219144762203176961";"Bittersweet#9376";"22-May-19 06:59 AM";"Not going to be a leech because shit will hit the fan";"";"";
"405380797537976320";"Cryptoon#3362";"22-May-19 06:59 AM";"If Tek's hero Kristof Calvo becomes prime minister I'm selling my company and moving to komodo island tbh";"";"PeepoThink (1)";
