AuthorID;Author;Date;Content;Attachments;Reactions;
"459262405885820928";"Malti#3948";"05-Jul-19 08:23 AM";"if it's a KMD article, just post title and say 'go look it up'";"";"";
"459262405885820928";"Malti#3948";"05-Jul-19 08:23 AM";"if it's a GRIN/BEAM article we post direct link and upvote like crazy so it gets deleted for brigading";"";"";
"459262405885820928";"Malti#3948";"05-Jul-19 08:23 AM";"https://tenor.com/view/troll-gif-4494686";"";"";
"405380797537976320";"Cryptoon#3362";"05-Jul-19 08:24 AM";"nah";"";"";
"459262405885820928";"Malti#3948";"05-Jul-19 08:25 AM";"i think we can agree on no more direct links to KMD articles to make sure 'brigading' doesn't happen";"";"";
"459844460625526824";"hyperDEX#6586";"05-Jul-19 08:40 AM";"should have bought doge 😄";"";"";
"459262405885820928";"Malti#3948";"05-Jul-19 08:41 AM";"imagine what a binance listing could do to Pirate 😉";"";"";
"242635006516658197";"jorian#4555";"05-Jul-19 08:53 AM";"guys what is brigading";"";"";
"232989893918195722";"Alexfrog#1338";"05-Jul-19 08:53 AM";"why try to build tech, when you could just be a coin about a dog meme?";"";"";
"242635006516658197";"jorian#4555";"05-Jul-19 08:53 AM";"why is reddit being childish";"";"";
"242635006516658197";"jorian#4555";"05-Jul-19 08:54 AM";"i see";"";"";
"242635006516658197";"jorian#4555";"05-Jul-19 08:54 AM";"@siu - Chainmakers was it you linking and asking for upvotes? 😠";"";"";
"232989893918195722";"Alexfrog#1338";"05-Jul-19 08:54 AM";"any time you have people following a link into reddit and upvoting something, youll get it banned and your reddit account banned too";"";"";
"242635006516658197";"jorian#4555";"05-Jul-19 08:54 AM";"ok, it did smell a bit of shilling";"";"";
"459844460625526824";"hyperDEX#6586";"05-Jul-19 08:55 AM";"Cant we repost and people search for it?";"";"";
"242635006516658197";"jorian#4555";"05-Jul-19 08:55 AM";"someone ought to write a good blog about why a truly decentralized mobile exchange is so important";"";"";
"242635006516658197";"jorian#4555";"05-Jul-19 08:55 AM";"with the links to SEC guidance etc";"";"";
"242635006516658197";"jorian#4555";"05-Jul-19 08:55 AM";"and then post it there";"";"";
"242635006516658197";"jorian#4555";"05-Jul-19 08:55 AM";"too late now, momentum over";"";"";
"242635006516658197";"jorian#4555";"05-Jul-19 08:55 AM";"on that matter, i didn't yet receive an invitation to test";"";"";
"459844460625526824";"hyperDEX#6586";"05-Jul-19 08:58 AM";"Someone could be you";"";"";
"242635006516658197";"jorian#4555";"05-Jul-19 08:58 AM";"i'm a nobody";"";"";
"242635006516658197";"jorian#4555";"05-Jul-19 08:58 AM";"waiting for kmd marketing team to write something cool";"";"";
"459844460625526824";"hyperDEX#6586";"05-Jul-19 08:58 AM";"If everyone has the same feeling nothing will get done";"";"";
"242635006516658197";"jorian#4555";"05-Jul-19 08:59 AM";":troll:";"";"";
"242635006516658197";"jorian#4555";"05-Jul-19 08:59 AM";"true";"";"";
"459844460625526824";"hyperDEX#6586";"05-Jul-19 08:59 AM";"Nobody can become a somebody";"";"";
"459844460625526824";"hyperDEX#6586";"05-Jul-19 09:01 AM";"Understand the problem, seek out someone that has the solution.";"";"";
"459844460625526824";"hyperDEX#6586";"05-Jul-19 09:02 AM";"We are all waiting for the mythical marketing team to do something";"";"";
"459844460625526824";"hyperDEX#6586";"05-Jul-19 09:02 AM";"Why not take the initiative  and do it outselves";"";"";
"242635006516658197";"jorian#4555";"05-Jul-19 09:02 AM";"well they hired a freaking marketing bureau, why would some guy do it better? 😛";"";"";
"459844460625526824";"hyperDEX#6586";"05-Jul-19 09:03 AM";"Why would you leave your bank balance up to someone else?";"";"";
"459844460625526824";"hyperDEX#6586";"05-Jul-19 09:04 AM";"Community marketing is as good if not better than a professionals in this space.";"";"";
"459844460625526824";"hyperDEX#6586";"05-Jul-19 09:04 AM";"What we lack in professionalism, we make up in numbers and passion";"";"";
"242635006516658197";"jorian#4555";"05-Jul-19 09:05 AM";"community marketing fails when there is a select group in that same community that is getting paid for the thing i would be doing for free";"";"";
"459844460625526824";"hyperDEX#6586";"05-Jul-19 09:05 AM";"So it is fine to sit back and let our fate be controlled by a marketing team, or we take responsibility for our investments and give it the best chance it has to get out there";"";"";
"459844460625526824";"hyperDEX#6586";"05-Jul-19 09:06 AM";"That is a very self defeating way of looking at it. I wont help increase my net worth because someone is being paid to help increase my net worth?";"";"";
"459844460625526824";"hyperDEX#6586";"05-Jul-19 09:06 AM";"Why not both do it and increase it 2x?";"";"";
"459844460625526824";"hyperDEX#6586";"05-Jul-19 09:08 AM";"This goes to the heart of the problem, if you feel like you should be paid to market a tech/coin, why are you in the coin in question?";"";"";
"440969153227259914";"jansako#3330";"05-Jul-19 09:09 AM";"the last one I disagree...";"";"";
"440969153227259914";"jansako#3330";"05-Jul-19 09:09 AM";"you work you get paid for it";"";"";
"459844460625526824";"hyperDEX#6586";"05-Jul-19 09:10 AM";"Let's just sit around doing nothing and wait for marketing....";"";"";
"440969153227259914";"jansako#3330";"05-Jul-19 09:10 AM";"you can't make someone do stuff for free. the other thing is that if they don;t they should not complain either...";"";"";
"459844460625526824";"hyperDEX#6586";"05-Jul-19 09:10 AM";"Well that is my point, if you do nothing you have nothing to complain about 😄";"";"";
"242635006516658197";"jorian#4555";"05-Jul-19 09:11 AM";"i market through different ways. the komodo team hired a marketing bureau to help them, i will not stand in their way. a coordinated marketing effort is (should be) better than random messages from random community members";"";"";
"440969153227259914";"jansako#3330";"05-Jul-19 09:11 AM";"unless you offered to do it paid and were rejected... :troll:";"";"";
"459844460625526824";"hyperDEX#6586";"05-Jul-19 09:11 AM";"Also not to shoot your point down about not being paid, really if you are a NN you are getting paid and it is especially contradictory when you have a for profit business built off the tech....yet you dont promote the tech lol";"";"";
"440969153227259914";"jansako#3330";"05-Jul-19 09:11 AM";"more marketing is better though, for sure.";"";"";
"459844460625526824";"hyperDEX#6586";"05-Jul-19 09:12 AM";"@jorian sure  but is there any rules set down by the Komodo CEO about not promoting in a certain way?";"";"";
"242635006516658197";"jorian#4555";"05-Jul-19 09:13 AM";"hehe rules 😄";"";"";
"440969153227259914";"jansako#3330";"05-Jul-19 09:13 AM";"I thought if you have an NN, you are getting paid to run an NN and not marketing campaigns... unless that was promised during  the election campaign";"";"";
"459844460625526824";"hyperDEX#6586";"05-Jul-19 09:13 AM";"Does @Hollowman9000 get told off for not posting on twitter because his messages goes against the  Komodo HR policy?";"";"";
"308146361508036618";"Lumbi#8378";"05-Jul-19 09:13 AM";"binance hits an all time low?  https://imgur.com/a/GzkbHo9";"";"";
"459844460625526824";"hyperDEX#6586";"05-Jul-19 09:14 AM";"I am not saying he has to do marketing, but being a NN you should believe in the tech / project to promote it.";"";"";
"459844460625526824";"hyperDEX#6586";"05-Jul-19 09:14 AM";"What is the point of saying im not getting paid so i wont do it";"";"";
"242635006516658197";"jorian#4555";"05-Jul-19 09:14 AM";"i'm saying there are people getting paid to do a job, and i'm not. so why would i then do the job";"";"";
"242635006516658197";"jorian#4555";"05-Jul-19 09:14 AM";"it doesn't make any sense";"";"";
"242635006516658197";"jorian#4555";"05-Jul-19 09:15 AM";"i trust brownsheet productions";"";"";
"459844460625526824";"hyperDEX#6586";"05-Jul-19 09:15 AM";"You are making the point someone should do it, this someone would need to be paid by the team for them to do it.";"";"";
"440969153227259914";"jansako#3330";"05-Jul-19 09:15 AM";"this is normal progression from a community project to a commercial/enterprise one";"";"";
"440969153227259914";"jansako#3330";"05-Jul-19 09:15 AM";"are we there yet? not sure...";"";"";
"459844460625526824";"hyperDEX#6586";"05-Jul-19 09:16 AM";"@jansako this comes down to this mentality that someone else will do it, they may or may not but why would you take the chance with your funds?";"";"";
"440969153227259914";"jansako#3330";"05-Jul-19 09:17 AM";"sure, but he may have other conflicting demands for his time";"";"";
"459844460625526824";"hyperDEX#6586";"05-Jul-19 09:17 AM";"Why would you as someone that is part of the community/project that has a interest in the price/utility going up, not do everything you can to help the team achieve it?";"";"";
"440969153227259914";"jansako#3330";"05-Jul-19 09:17 AM";"matter of priorities";"";"";
"459844460625526824";"hyperDEX#6586";"05-Jul-19 09:17 AM";"This is not about jorian, it is about the community in general";"";"";
"459844460625526824";"hyperDEX#6586";"05-Jul-19 09:18 AM";"Does anyone think i am a dev? Yet somehow we have hyperDEX and the ledger app.";"";"";
"440969153227259914";"jansako#3330";"05-Jul-19 09:18 AM";"same argument though. If one can do it but won't, it reflects on that person.";"";"";
"459844460625526824";"hyperDEX#6586";"05-Jul-19 09:18 AM";"If i did not want to solve problems that i had with the tech who will?";"";"";
"242635006516658197";"jorian#4555";"05-Jul-19 09:18 AM";"you would be interfering with what the team's plans are. i think the matter boils down to komodo corporate vs komodo community. too much overlap there to have a healthy community wanting to do things for free when there is a team that is getting paid to do the same";"";"";
"459844460625526824";"hyperDEX#6586";"05-Jul-19 09:18 AM";"What is the teams plan?";"";"";
"459844460625526824";"hyperDEX#6586";"05-Jul-19 09:18 AM";"I dont know what that is";"";"";
"242635006516658197";"jorian#4555";"05-Jul-19 09:18 AM";"marketing plan";"";"";
"242635006516658197";"jorian#4555";"05-Jul-19 09:18 AM";"they hired a bureau";"";"";
"459844460625526824";"hyperDEX#6586";"05-Jul-19 09:19 AM";"So what?";"";"";
"308146361508036618";"Lumbi#8378";"05-Jul-19 09:19 AM";"trolls abound -- also in group dynamics there is a strategy to bring others down to elevate themselves";"";"";
"459844460625526824";"hyperDEX#6586";"05-Jul-19 09:19 AM";"Do they control you?";"";"";
"242635006516658197";"jorian#4555";"05-Jul-19 09:19 AM";"re-read what i just wrote above";"";"";
"459844460625526824";"hyperDEX#6586";"05-Jul-19 09:19 AM";"Does james set down the rule no one can do any marketing?";"";"";
"459844460625526824";"hyperDEX#6586";"05-Jul-19 09:19 AM";"I did";"";"";
"440969153227259914";"jansako#3330";"05-Jul-19 09:19 AM";"JL is all about do whatever, nobody stops yuou";"";"";
"459844460625526824";"hyperDEX#6586";"05-Jul-19 09:19 AM";"You want to get paid for something";"";"";
"308146361508036618";"Lumbi#8378";"05-Jul-19 09:19 AM";"I call it the 'fallacy of respectability or professionalism'";"";"";
"459844460625526824";"hyperDEX#6586";"05-Jul-19 09:20 AM";"fallacy of someone else will get shit done";"";"";
"440969153227259914";"jansako#3330";"05-Jul-19 09:20 AM";"😃 for sure";"";"";
"440969153227259914";"jansako#3330";"05-Jul-19 09:21 AM";"All I am saying that is it every person's choice to go the extra mile or not. We can justify both why we do it and why we don't.";"";"";
"459844460625526824";"hyperDEX#6586";"05-Jul-19 09:21 AM";"If people will only do something if they get paid, their motivation is to get paid.";"";"";
"459844460625526824";"hyperDEX#6586";"05-Jul-19 09:22 AM";"Let's just leave it at that. Indirect and long term rewards means nothing.";"";"";
"459844460625526824";"hyperDEX#6586";"05-Jul-19 09:22 AM";"More utility that means more clients for them means nothing";"";"";
"440969153227259914";"jansako#3330";"05-Jul-19 09:22 AM";"Sure, but that reflects on them and where they re in their life.";"";"";
"459844460625526824";"hyperDEX#6586";"05-Jul-19 09:22 AM";"KMD worth more via their NN means nothing";"";"";
"459844460625526824";"hyperDEX#6586";"05-Jul-19 09:22 AM";"No it reflects a short term ME ME mentality";"";"";
"440969153227259914";"jansako#3330";"05-Jul-19 09:23 AM";"now you are going extreme a bit.. I am done.";"";"";
"448774465036484608";"cascrypto#8206";"05-Jul-19 09:23 AM";"getting hyped up I see";"";"";
"459844460625526824";"hyperDEX#6586";"05-Jul-19 09:23 AM";"Let's just wait for James and the marketing team to solve all of our problems in life. All good, waiting for my lambos";"";"";
"440969153227259914";"jansako#3330";"05-Jul-19 09:24 AM";"come on, it is not <------------ all the way here or -------------------------------> all the way there...";"";"";
"232679450301431808";"blackjok3r#3181";"05-Jul-19 09:26 AM";"Did most of my work for free in bear to create as much value as possible, not sure if we succeeded or not but it was a lot of work.";"";"";
"459844460625526824";"hyperDEX#6586";"05-Jul-19 09:26 AM";"@blackjok3r but there were paid coders....";"";"";
"459844460625526824";"hyperDEX#6586";"05-Jul-19 09:26 AM";"Why code when there are people getting paid to do the same thing 😛";"";"";
"459844460625526824";"hyperDEX#6586";"05-Jul-19 09:26 AM";"Oh wait.....you hold KMD and you want its value to go up.....";"";"";
