AuthorID;Author;Date;Content;Attachments;Reactions;
"396753788150611968";"B. Gültekin Çetiner#0626";"27-May-19 08:29 AM";"1. Yes. Settlement is actually cheque redemption at the date which is decided during issuance.
2. It is a real business even in Millennium edition (Version 1). Suppose I issue a credit of 600 MCL. When the first endorser (which is also holder) gets the baton, I buy goods and services for the amount of 600 MCL. But it does not leave my Wallet until redemption date. Furthermore, it is boosted so I get full power of staking. It is fully collateralized. At any stage, the zero defaulting occurs. However, as you discovered, the Version 1 is more miner friendly.
3. Yes, The millennium edition is simplified. The article explains the paper based analog chain Version of existing cultural system but Version 2 is a complete solution to nonredemption problem and other problems in paper version. 
4. In all versions, it works best with transfer of goods and services. But I admit that the Version 1.0 is more miner friendly since anyone can create to accounts and issue credit to himself/herself to use boosted staking. However, we want to spread Version 1 among community for exchange of real goods and services.";"";"";
"507209916449292303";"dimxy#2587";"27-May-19 09:11 AM";"Great! Thank you.
Now it is much more clearer to me";"";"";
"507209916449292303";"dimxy#2587";"27-May-19 09:15 AM";"So the first task is to correct the settlement to provide equal distribution of debt payment between the issuers?";"";"";
"455741312273219595";"jl777c#5810";"27-May-19 09:15 AM";"yes, and also managing the changing lock amounts as creditloop is getting bigger";"";"";
"455741312273219595";"jl777c#5810";"27-May-19 09:16 AM";"not sure the most efficient way. moving all funds into and out of credit loop locked addresses might be too much overhead";"";"";
"455741312273219595";"jl777c#5810";"27-May-19 09:16 AM";"alternative is to track who owes how much, but it becomes hard to enforce the locked nature";"";"";
"455741312273219595";"jl777c#5810";"27-May-19 09:17 AM";"and there are two levels of locked funds, one is the normal locked where it can only be used for staking or creditloops";"";"";
"455741312273219595";"jl777c#5810";"27-May-19 09:17 AM";"then when it is in a creditloop, its staking power increases 3x";"";"";
"455741312273219595";"jl777c#5810";"27-May-19 09:17 AM";"the was to implement that is to change just one function deep in the staking code, that is solved how to do, so just ask when you are doing that part";"";"👌 (1)";
"455741312273219595";"jl777c#5810";"27-May-19 09:18 AM";"also current code has some definite bugs with settlement as that was coded before there was any clear idea of how exactly to make settlements";"";"";
"507209916449292303";"dimxy#2587";"27-May-19 09:35 AM";"Yes, it is what I actually was going to ask: now as I can see the marmara cc does not check if sufficient funds are locked by the issuer.
And probably it should not because it would be like the first issuer would already have the full amount backed.
From the other hand if we do not check this we could not say the credit is 100% backed.";"";"";
"455741312273219595";"jl777c#5810";"27-May-19 09:37 AM";"yes, these are the issues that need to be solved";"";"";
"455741312273219595";"jl777c#5810";"27-May-19 09:37 AM";"with efficient methods";"";"";
"396753788150611968";"B. Gültekin Çetiner#0626";"27-May-19 10:11 AM";"We will have the third layer, i.e. the blockchain fund in Version 1.0, too. It might be used to clear the dusts with transfer fees. We should not stop transfers for small fees in credit loop operations.";"";"";
"396753788150611968";"B. Gültekin Çetiner#0626";"27-May-19 10:16 AM";"@dimxy You are right. Currently it does not check if sufficient funds are locked by issuer. This is because We did not have in mind millennium features where we have collateralization. This feature might be useful in Version 2 as well since We have new improvements with community layer.";"";"👌 (1)";
"396753788150611968";"B. Gültekin Çetiner#0626";"27-May-19 10:57 AM";"The formula for risk share is same for all steps. It is Credit/(N-1). If there are 2 nodes in credit loop, the first is issuer and the second is holder. The issuer's 600 is locked in boosted. If there are 3 nodes, then 1st is issuer, the 2nd is endorser and 3rd is holder. So the credit risk is divided b/w issuer and endorser as 300. The issuer gets 300 back as normal coin while ensorser's 300 is locked first and then boosted when batonapproval happens. At each step, there is 100% collateralization.";"";"";
"396753788150611968";"B. Gültekin Çetiner#0626";"27-May-19 10:58 AM";"All previous nodes are responsible against the holder at the end date of credit loop.";"";"";
