AuthorID;Author;Date;Content;Attachments;Reactions;
"395274075985018880";"Regnar#6164";"31-Jul-18 01:41 PM";"https://twitter.com/Regnar__/status/1024068494130851840

135 votes and counting.";"";"Komodo (5)";
"393151421501014016";"infotech-al#5583";"31-Jul-18 05:21 PM";"Just tried to download CRED app from Apple Store @benohanlon its a no-go 🤔";"";"";
"430818734530101248";"KomodoWorld#8282";"31-Jul-18 07:17 PM";"@infotech-al reading further I found it launches tomorrow in 4 US states. The PR was not completely clear on this";"";"👍 (2)";
"395274075985018880";"Regnar#6164";"31-Jul-18 07:24 PM";"Yea on the site it has the states it's available in, soft roll out is expected tbh. Even Robinhood is doing it.";"";"";
"452374492283404288";"passcombo.com 🏴☠🍋#0622";"31-Jul-18 09:50 PM";"do we have somewhere official link to atomic explorer ? couldnt find on komodoplatform.com";"";"";
"401778286134296586";"Kay Gee#2313";"31-Jul-18 10:21 PM";"@Mylo one of my circle mentioned a tweet from this week of a KMD credit card. Had a lot of traction over here. In terms of simplicity (making the tech easy to adopt and easy to use), that was massive. Copy should sell brand, CTAs should hit and highlight deliverables.";"";"";
"395274075985018880";"Regnar#6164";"31-Jul-18 11:00 PM";"@passcombo.com 🏴☠🍋 https://kmdexplorer.io/";"";"";
"395274075985018880";"Regnar#6164";"31-Jul-18 11:03 PM";"@Kay Gee I assume you mean this one? https://peer2.krd/home/";"";"";
"395274075985018880";"Regnar#6164";"31-Jul-18 11:18 PM";"Hey everyone here's the results of my Poll";"";"";
"395274075985018880";"Regnar#6164";"31-Jul-18 11:19 PM";"https://twitter.com/Regnar__/status/1024068494130851840";"";"";
"371114647052615681";"Mylo#8306";"01-Aug-18 12:41 AM";"atomicexplorer.com ?

Not official.  Yes, good point.  These are things that marketing and the agency have on the table.  There is a some unity required, and 1 or 2 community sites will 99.9% be voted to receive some branding love as well as better resource linking.

""We are all involved in the education aspect, it's part of our social contract to leave something for other people to learn from"" (paraphrased badly) was what was said to me in the first meeting.  This is another part we are working on, a ""learn more"" area for traders and developers.

peer2krd and notary involvement with the world/community/side-projects as well.  There are non-english speaking forums where out of all popular equihash coins, kmd is the lowest mentioned.

Has anyone used this peer2krd?  Has anyone ordered?   @Virginia (Peer2Group) how many batches/customers can you guys support - i read in one channel the first batch of cards is out and waiting for next batch - which EU countries etc.  need more info.  Can you work with community #komodo-team - i had a quick look at kmd twitter and a message was retweeted once or twice in mid July.  Do you want more ppl to sign up, can you work with this channel first for feedback and i'll see what our writing resources are like for an update.  we recently wrote about a partnership with gonetcoins which has a service in canada entering the US with reloads available in many stores via virtual ATM.

@Regnar nice twitter poll 😃  thanks for getting the info, it is quite interesting.

@Kay Gee sell brand to who? 

I'd like to re-visit the twitter poll concept.";"";"";
"371114647052615681";"Mylo#8306";"01-Aug-18 12:41 AM";"Anyhow, I've got some dev work to do.  My first exposure to smart contracts was to test a blockchain enforced contract for a faucet.  This is in alpha testing, history is in #cc-general channel.  https://github.com/imylomylo/KMD-CC-Token-Test-Guide/tree/master/rpc/faucet

Unfortunately i ran into a conflict with a docker image for testing contracts.  Docker is a technology where you can basically ""press play"" and you have a service.  It needs some further work but makes the dev-experience for non-system (e.g. front end) & other tech users quite easy to get involved.  https://github.com/imylomylo/docker-komodod is the start, it needs some docs and maybe a simple dev front end so community can get involved during alpha phase.

There is also lightning network testing being done with a side project, which integrates with smart contracts - hopefully include community too!!";"";"🆒 (3)";
"371114647052615681";"Mylo#8306";"01-Aug-18 12:45 AM";"One last thing, digitalprice.io CEX has a KMD base pair.  They are a small exchange, but if you could sign up and put an order up that will be good.";"";"";
"371114647052615681";"Mylo#8306";"01-Aug-18 01:24 AM";"@Komodo-Bot where is the whitepaper?";"";"";
"371114647052615681";"Mylo#8306";"01-Aug-18 01:53 AM";"Can we all revisit this board this week and give feedback/requests so on the Monday marketing next week we can discuss:  https://trello.com/b/xCc8hngf/public-komodo-marketing-board|";"";"";
"371114647052615681";"Mylo#8306";"01-Aug-18 01:53 AM";"";"https://cdn.discordapp.com/attachments/448496811271782416/474031899141079050/Screen_Shot_2018-08-01_at_11.53.09_am.png";"";
"371114647052615681";"Mylo#8306";"01-Aug-18 01:54 AM";"Add questions / requests / ideas so we can discuss on Monday meeting.";"";"";
"401778286134296586";"Kay Gee#2313";"01-Aug-18 06:19 AM";"@Mylo sorry, I’ve worked in advertising for years and I fall back to default positions. Imo copy should always sell the brand to the reader, all readers- that’s why there is copy.  Surely that is why there is a website, right? To inform and involve KMD users and to grow the KMD user base? Selling the brand just means explaining why KMD over ETH, for example.

On each page, in each block of text, you want to trigger an emotional response - whether that is pathos or desire is largely irrelevant, but the stronger the emotion evoked, the greater the likelihood you will create a behavioral change. What I was clumsily saying is that short copy can sell the big picture concepts (simplicity, security, flexibility, etc.) but the CTAs don’t just have to be “[we’re the brand/platform/ for you]” as there are deliverables which in and of themselves are seemingly creating hype - without any context.

Anyways, I’m sure you know this and I’m just riffing because of excitement: for once, this is a project I’m invested in (quite literally) rather than one I’m being paid to care about. 

There may also be an element of advanced procrastination at play 😉";"";"";
"403137719049519106";"Audo#5667";"01-Aug-18 06:20 AM";"https://twitter.com/KomodoPioneers/status/1024539702924378112";"";"";
"403137719049519106";"Audo#5667";"01-Aug-18 06:20 AM";"Big thanks to @ejuliano @Alright @Mylo 👍";"";"";
"371114647052615681";"Mylo#8306";"01-Aug-18 08:22 AM";"Yeeeeewwwww!

@Kay Gee i'm a dev by trade, but worked with more bad marketers than good, so only know enough to be dangerous.  evoking emotions that's advertiser's craft, but yeah marketers (the good and bad) make a living on those emotions.   CTAs and _all_ the copy are being updated - there was a message testing post on reddit in the past few days and we're working with an agency to unlock what we have already, where we'll be in jan 2019 with the new tech, which is super engaging - interoperable, simple to make apps on with a very rich feature set.";"";"";
"458232283250556930";"Virginia (Peer2Group)#1459";"01-Aug-18 09:18 AM";"Hi @Mylo Mylo, 

First of all, I want to thank you for the support.
This 1st batch was 100 cards. For the moment, the cards are only eligible for legal EU residents, that is, citizens who are legally living in a european country which belong to Eurozone.

Your proposal sounds very good! I'm going to contact you by another channel, for more details. Thanks!";"";"";
"452374492283404288";"passcombo.com 🏴☠🍋#0622";"01-Aug-18 09:49 AM";"@Virginia (Peer2Group) @Mylo  is that also possible to add topup of other KMD platform coins like Hush, BTCH or Chips? I saw currently it's BTC and KMD, which is good enough, but possibility of other coins (not assets) would be good? I also didn't see more detailes on the page (from where the price it taken and how much % the provider takes. Also good to display team members details (linkein?) for more trust then just anon page. Then I think KMD card could compete with other popular ??";"";"";
"452374492283404288";"passcombo.com 🏴☠🍋#0622";"01-Aug-18 09:51 AM";"Actually to topup also other popular coins like LTC/ETH/XMR/Dash could be good from marketing perspective - other communities may like to have it.";"";"";
"452374492283404288";"passcombo.com 🏴☠🍋#0622";"01-Aug-18 09:58 AM";"also for better marketing if pre-ann correctly (widely) after doing above adjustment some time limit could be made to subscribe for ""free card"" and after that period cards could be like 10$ or so (or lower % charge margin for early birds) ? Thanks to this hurry-up effect more people could join this quickly and could be more viral...";"";"";
"452374492283404288";"passcombo.com 🏴☠🍋#0622";"01-Aug-18 09:59 AM";"For example the charge could be 1% for early birds and 3-5% afterwards (not sure what is it now, but should compete with Monaco and TenX)";"";"";
"452374492283404288";"passcombo.com 🏴☠🍋#0622";"01-Aug-18 10:00 AM";"And also calculate the cost of card production per unit - later it might be charged that amount.";"";"";
"456226577798135808";"Deleted User#0000";"01-Aug-18 10:11 AM";"Dubai Looks to Disrupt its Entire Legal System with ‘Court of the Blockchain’
https://www.ccn.com/dubai-looks-to-disrupt-its-entire-legal-system-with-court-of-the-blockchain/";"";"";
"430818734530101248";"KomodoWorld#8282";"01-Aug-18 01:25 PM";"ah no I'm still banned from r/cryptocurrency, in the new ui I see the button and only when I try to post it says I can't";"";"";
"452374492283404288";"passcombo.com 🏴☠🍋#0622";"01-Aug-18 01:56 PM";"decentralized forum is needed :p";"";"";
"457001023928795136";"kimmel (Pungo.io)#2275";"01-Aug-18 02:01 PM";"@passcombo.com 🏴☠🍋 thanks for the great suggestions and ideas. This is just a  1st step phase thats why 100 cards. Of course we can accept many other cryptos, but as you see we are already sold out the cards in about 4 days and have quite a big waiting list. We will work on it during next months and I don't discard a 2nd, bigger batch in september";"";"";
"452374492283404288";"passcombo.com 🏴☠🍋#0622";"01-Aug-18 02:10 PM";"so this is also maybe a reason to have these cards paid sth - to hire more people as there is probably some manual work involved in the process ? question if you got already a business model to make a proper pricelist or overall action plan. If there is so many people waiting seems idea is great and might be worth investing more time, people, money.";"";"";
"452374492283404288";"passcombo.com 🏴☠🍋#0622";"01-Aug-18 02:27 PM";"For the reason of not wasting time/human resources /(sending cards to people who will never use it) I would suggest to revert the process a bit: 1. user registration and KMD+BTC address creation  (if not registered - lowest priority) 2. user optional payment - just anything between 0 and 10 KMD (for sorting out priority list + having money to pay additional people helping with faster cards creation 3. preparing and sending batches according priority list 4. iterate 😃";"";"";
"264236295432175616";"Gordon Komodo#7477";"01-Aug-18 03:11 PM";"there is a huge demand for working card for sure. https://medium.com/minecoin-blog/minexpay-report-week-4-reaching-new-highs-a0a6d236e54e";"";"";
"430818734530101248";"KomodoWorld#8282";"01-Aug-18 03:22 PM";"there's a new interesting reddit sub: https://www.reddit.com/r/cryptodevs/comments/93pmmf/cc_devs_are_welcomed_to_work_on_komodo_kmd/ I made the post reusing a tweet by grewalsatinder";"";"";
"422858760898215937";"siu - Chainmakers#3920";"01-Aug-18 03:40 PM";"why it is removed? https://www.reddit.com/r/cryptodevs/comments/93pmmf/cc_devs_are_welcomed_to_work_on_komodo_kmd/";"";"";
"430818734530101248";"KomodoWorld#8282";"01-Aug-18 03:44 PM";"mmm if I look with incognito browser the post is not visible";"";"";
"264236295432175616";"Gordon Komodo#7477";"01-Aug-18 03:50 PM";"i was about to upvote , but it is removed";"";"";
"430818734530101248";"KomodoWorld#8282";"01-Aug-18 04:15 PM";"I contacted the mod";"";"";
"430818734530101248";"KomodoWorld#8282";"01-Aug-18 04:15 PM";"it's a new account";"";"";
"452374492283404288";"passcombo.com 🏴☠🍋#0622";"01-Aug-18 04:52 PM";"@Gordon Komodo  thx for sharing. Personally I treat card-coins (created only on purpose of the card) as scams or ponzi. No need to create new coin just for card purpose. You can use existing once -> does not make any sense to create a new one -> shady thing.";"";"";
"452374492283404288";"passcombo.com 🏴☠🍋#0622";"01-Aug-18 04:59 PM";"The exception could be if the card-coin is revenue based (you buy shares of company) or sth, but I believe mostly purpose is to create new coin, hype it with the purpose of card (like there was no other possibility without?) and dump it later sucking money from ""lucky investors"" 😃";"";"";
"452374492283404288";"passcombo.com 🏴☠🍋#0622";"01-Aug-18 05:01 PM";"Actually making revenue coin for perr2group card could be interesting - get money for bigger marketing of the card and promise  some % of charged fees in the future. But a decent plan and market knowledge needed  before starting.";"";"";
"264236295432175616";"Gordon Komodo#7477";"01-Aug-18 05:16 PM";"I posted the article just to show that there is huge demand for cards. I think it is because people are so used to it.";"";"";
"454956929446313984";"drvasco#0805";"01-Aug-18 08:01 PM";"Vote in KOMODO  . If you sign up for this exchange get 20 coins and vote in Komodo to be listed, the top 10 will be part of the list of p trade coins: https://oodltrack.com/tracker.php?affid=5089&l=0";"";"";
"415903995547090956";"Daniel CP#2020";"02-Aug-18 03:28 AM";"New post!";"";"";
"415903995547090956";"Daniel CP#2020";"02-Aug-18 03:28 AM";"https://komodoplatform.com/komodo-takes-two-big-steps-towards-mass-adoption/";"";"👍 (12),👏 (3),Komodo (12)";
"464378807420452865";"Seko#7408";"02-Aug-18 06:23 AM";"I placed an article on coin-hero.de:
https://coin-hero.de/komodo-ein-coin-kmd-der-besitzer-mit-51-zinsen-pro-jahr-belohnt/";"";"👌 (1),Komodo (3)";
"430818734530101248";"KomodoWorld#8282";"02-Aug-18 06:30 AM";"it was the fault of the shortlinks, the bots don't like them. Now it's visible: https://www.reddit.com/r/cryptodevs/comments/93wu1g/cc_developers_are_welcomed_to_work_on/";"";"";
"405380797537976320";"Cryptoon#3362";"02-Aug-18 08:25 AM";"Someone is asking if it's paid or not, which I assume it is bounty-wise? @KomodoWorld";"";"";
"458232283250556930";"Virginia (Peer2Group)#1459";"02-Aug-18 08:56 AM";"@passcombo.com 🏴☠🍋  actually Peer2krd  is just the beginning of what's to come. Stay tuned, we will bring you more exciting news soon 😉";"";"Komodo (3)";
"430818734530101248";"KomodoWorld#8282";"02-Aug-18 09:08 AM";"@Cryptoon answered 👌";"";"";
"456226577798135808";"Deleted User#0000";"02-Aug-18 09:10 AM";"I think someone should make an explain like im 5 for komodos tech";"";"";
"456226577798135808";"Deleted User#0000";"02-Aug-18 09:11 AM";"The recent posts (5 pillars) helped a lot of people understand, but theres still the 80% who don't really know much beyond ""blockchain is a ledger or something"" and don't understand things unless its put into legit baby sentences for them 😂";"";"👍 (2)";
"430818734530101248";"KomodoWorld#8282";"02-Aug-18 09:13 AM";"not a bad idea at all";"";"";
"456226577798135808";"Deleted User#0000";"02-Aug-18 09:13 AM";"I think go less into detail into exactly how it works (the ones who already know a bit about tech/work for blockchain etc will do their own research and ask questions) but the general public mostly don't care much for that side of things";"";"";
"456226577798135808";"Deleted User#0000";"02-Aug-18 09:14 AM";"its hard to see how we could explain things much simpler than theyre already put I think LOL but thats partly due to already understanding or being around komodo for so long, just as a test I showed the articles to some of my friends who are the average casual investor";"";"";
"456226577798135808";"Deleted User#0000";"02-Aug-18 09:15 AM";"and they didnt understand as much as I thought they wouldve";"";"";
"456226577798135808";"Deleted User#0000";"02-Aug-18 09:15 AM";"though im not sure if targetting that audience/wider public is something that komodo is aiming to achieve at the moment";"";"";
"232679450301431808";"blackjok3r#3181";"02-Aug-18 10:19 AM";"I was telling my mate about the scaling test... Hes like why is a million transactions important thats just a number, I dont care.";"";"";
"232679450301431808";"blackjok3r#3181";"02-Aug-18 10:20 AM";"He said specifically we need to say why it benefits him, and why should he care about it. He wasn;t being rude, he just said that sthe only why you will make people care about it.";"";"";
"232679450301431808";"blackjok3r#3181";"02-Aug-18 10:21 AM";"1 million transactions per second, btw:
1) Its cheaper for you to use the platform than any other
2) Increases your security  and anonymity as there are so many TX's its almost impossible to trace a single one. 
3) its more reliable for your use and wont fail when too busy";"";"";
"395274075985018880";"Regnar#6164";"02-Aug-18 11:31 AM";"4) it's not 1M tx/s for Komodo Platform that is shared among all chains built on it. Every chain is capable of that scaling, and even scaling tx/s greater than Komodo itself. (Might just be a point to make)
5) Tx/s don't just mean individual people buying things. They can mean messages sent, things like tweets, products communicating with each other, buying and selling to one another, automated micro transactions. which allows for scaling of any type of product or service imaginable.";"";"";
"395274075985018880";"Regnar#6164";"02-Aug-18 11:40 AM";"I read something, think it was on XRP tbh, but they talked about autonomous cars/uber communicating with one another and send micro transactions to allow cars to tip one another to move through traffic faster. Or the conversation with Richard Gendal Brown in which the famous quote comes, ""on the blockchain, nobody knows you're a fridge"". I think when we get out of the mindset that a transaction is a person walking into a store and swiping a card to buy something, and instead we realize the world of microtransactions, of instant, automated transactions by people, and automated transactions by machines. we realize that the even with half a century that VISA has had to build infrastructure clearly isn't effective enough to handle these types of transactions. hell, VISA crashed in Europe two months ago, failing to do exactly what it was designed to do, individual human transactions.";"";"";
"456226577798135808";"Deleted User#0000";"02-Aug-18 11:41 AM";"I are a fridge ❄";"";"";
"395274075985018880";"Regnar#6164";"02-Aug-18 11:41 AM";"or we realize that things like email, twitter, text messaging, or any form of communication COULD (not saying they all should) exist on a chain, or form of chain, it's easier to understand that the 1M tx/s milestone, while arbitrary in scale, is important as a benchmark to competitors.";"";"";
"456226577798135808";"Deleted User#0000";"02-Aug-18 11:42 AM";"Not looking forward to that future hahahhaha id rather spend money on a turbo than to tip other drivers on the blockchain 😂😂😂 makes me wonder what the worlds gonna look like when im in my 30 40s";"";"";
"395274075985018880";"Regnar#6164";"02-Aug-18 11:43 AM";"If we said 7.4B transactions a second we could say it's important because every person on earth could transact at once every second. or however many fridges there are, cars, etc. it's easy to see how even the 1M mark could be overshadowed haha";"";"";
"395274075985018880";"Regnar#6164";"02-Aug-18 11:43 AM";"also";"";"";
"395274075985018880";"Regnar#6164";"02-Aug-18 11:43 AM";"On the blockchain nobody knows that you're a doge.";"";"";
"456226577798135808";"Deleted User#0000";"02-Aug-18 11:44 AM";"But the blockchain knows 🤔 inb4 church of blockchain";"";"";
"456226577798135808";"Deleted User#0000";"02-Aug-18 11:44 AM";"Mark my words some lunatics gonna start a blockchain cult within the next few years";"";"";
"395274075985018880";"Regnar#6164";"02-Aug-18 11:51 AM";"Already did. Check reddit haha";"";"";
"347922216429813760";"grewalsatinder#9653";"02-Aug-18 12:00 PM";"https://twitter.com/satindergrewal/status/1024988120897351681";"";"";
"456226577798135808";"Deleted User#0000";"02-Aug-18 12:01 PM";"🤦";"";"";
"371114647052615681";"Mylo#8306";"02-Aug-18 01:44 PM";"nice one satinder";"";"";
"371114647052615681";"Mylo#8306";"02-Aug-18 01:50 PM";"@Regnar yeah humans aren't going to be doing the most transactions.  we're moving from a time where people paid for software, to people & machines paying for services - it's the original IBM SaaS vision from 20 years ago - and now these services (and devices that use these services) have to pay themselves to be maintainable by humans and other machines.
the economy now involves ""robots"".  they create value, and now that value is programmable.  they're pseudo-autonomous - and nobody wants to pay for software to run these machines.  my 2c";"";"";
"395274075985018880";"Regnar#6164";"02-Aug-18 01:53 PM";"Yea, ""transaction"" is in people's minds as a human transaction for goods, either on Amazon, in a store, or with someone else, and though IOT and robots buying/selling/transacting has been known about for decades, it seems most people don't see it on the horizon.";"";"";
"395274075985018880";"Regnar#6164";"02-Aug-18 01:56 PM";"Just looking at VISA infrastructure, or traditional banking infrastructure and the use of ACH systems to clear transactions at T+3 its laughable to think that they will be able to handle these micro transactions, or non human transactions (transactions of monetary value, or even information)";"";"";
"395274075985018880";"Regnar#6164";"02-Aug-18 01:59 PM";"The problem I see for us is, internet, coding, and even blockchain is like clay for bricks. it's difficult to show the builder they can build a house from this clay. But if we turn that clay into bricks, move our product/service one step down the line, it's much easier to show them they can build a house of bricks. So we either need to take that step ourselves and develop these bricks for use, or we need to find others who are willing to turn our clay to bricks and then sell it themselves.";"";"";
"395274075985018880";"Regnar#6164";"02-Aug-18 02:00 PM";"Not a perfect example obviously";"";"";
"395274075985018880";"Regnar#6164";"02-Aug-18 02:11 PM";"So I guess by this analogy it is up to us to identify the markets that each Komodo product or service is designed for, either as of now, or planned in the future.";"";"";
"395274075985018880";"Regnar#6164";"02-Aug-18 02:12 PM";"ie. selling bricks to builder, or selling clay to brick maker";"";"";
"395274075985018880";"Regnar#6164";"02-Aug-18 02:21 PM";"@Mylo are you typing?";"";"";
"371114647052615681";"Mylo#8306";"02-Aug-18 02:21 PM";"it's spot on.  kmd does a lot of things first.  we're a small focussed team.  and you're right, we don't know all the potential markets for our tech.   for one group, it's empowering - for another a convenience.  in one culture it's accepted in another it needs to work a different way.  we are all pioneers.  the other blockchain groups too.

the server for the ""community news site"" has been provisioned - probably be a few days til it's testable.

does it say i'm typing the whole time?  i'm doing a cpl things at once";"";"";
"395274075985018880";"Regnar#6164";"02-Aug-18 02:22 PM";"yea haha it did";"";"";
"371114647052615681";"Mylo#8306";"02-Aug-18 02:23 PM";"ok weird.  i'm using franz app which holds discord in webview along with slack, whatsapp etc.";"";"";
"395274075985018880";"Regnar#6164";"02-Aug-18 02:26 PM";"yea no worries.";"";"";
"395274075985018880";"Regnar#6164";"02-Aug-18 02:28 PM";"It would be worthwhile to get a list of Komodo capabilities, features, or functions, so we can see which are clay and which are bricks. Also which aren't ""products"" yet but could be, and which ones are products that have limited use cases and would be better bundled with others.";"";"";
"430818734530101248";"KomodoWorld#8282";"02-Aug-18 03:26 PM";"https://twitter.com/HerrVonBraun/status/1025025158854193152";"";"👏 (7)";
"235143047053180949";"Steve Lee#1967";"02-Aug-18 09:50 PM";"@Regnar  we're working on something like that";"";"👍 (2)";
"456842836218740749";"RAE#3178";"02-Aug-18 11:59 PM";"Sirin Labs are looking for a next-gen blockchain which can handle their daily FINNEY smart-phone payments. 
Komodo's ecosystem should be able to handle all those ... for now they're stuck using ETH but the CEO indicates they need to upgrade. 
Perhaps Komodo marketing team could try and make contact if they haven't already.";"";"👌 (10),👍 (5),Komodo (5)";
"235143047053180949";"Steve Lee#1967";"03-Aug-18 12:50 AM";"Thanks for the tip, i've reached out to Moshe.";"";"👍 (3)";
"395274075985018880";"Regnar#6164";"03-Aug-18 01:21 AM";"I also mentioned it to their devs, gave them your email @Steve Lee";"";"";
"264236295432175616";"Gordon Komodo#7477";"03-Aug-18 01:28 AM";"I have to say I am proud of  our marketing channel and teams!";"";"👏 (9),💯 (1)";
"235143047053180949";"Steve Lee#1967";"03-Aug-18 01:57 AM";"thanks @Regnar";"";"👍 (2)";
"395274075985018880";"Regnar#6164";"03-Aug-18 02:05 AM";"Figured you went high, I'll go low lol";"";"";
"235143047053180949";"Steve Lee#1967";"03-Aug-18 02:09 AM";"the good ole sandwich attack strategy 😉";"";"🍔 (3),😄 (5)";
