AuthorID,Author,Date,Content,Attachments,Reactions
"264236295432175616","Gordon Komodo#7477","12-Dec-19 03:00 AM","I am not a programmer,not sure if my idea is feasible what about instead of using sound,  use stopwatch, when the apps is running in the backgraound the stopwatch starts counting, then when the apps is active , stop the counting and so forth. That way no annoying sound maybe","","🤔 (1),👆 (1)"
"513702187415765012","vogelfreund88#4534","12-Dec-19 11:21 AM","Will kmdice integrated into AtomicDEX GUI in the near future?
Thx","",""
"567367687324565515","jkluwu0499#8218","12-Dec-19 11:26 AM","I would like to see Kmdice on AtomicDex too along with Chips","",""
"231533083818590211","Oszy#5734","12-Dec-19 11:31 AM","KMDice is not maintained, wondering why is anyone mining / trading it","",""
"567367687324565515","jkluwu0499#8218","12-Dec-19 11:51 AM","Is there any plan to fix it? I see there is huge potential on Kmdice. Its success would greatly show the potential of CC and scalability of Kmd's smartchain.

Btw, there wasnt any official announcement on kmdice, so I didnt know that there was issue and I personally invested on kmdice.","",""
"231533083818590211","Oszy#5734","12-Dec-19 11:53 AM","should really ask that in #kmdice","",""
"567367687324565515","jkluwu0499#8218","12-Dec-19 12:17 PM","Okay will do, thanks alot","",""
